id,created_at,text849835730515836928,2017-04-06 04:06:41,b'Hari ini kita kirimkan pesan agar pemerintah melindungi rakyat kecil dan para nelayan bisa sejahtera.\n.\nSelamat Har\xe2\x80\xa6 https://t.co/sdoNvOys03'
849773487983968256,2017-04-05 23:59:22,"b'Ini bukan soal Anies-Sandi, ini kerja kolosal ribuan orang, mari kita hantarkan perubahan untuk warga Jakarta.\xe2\x80\xa6 https://t.co/bn28RyQoZA'"
849596940081782785,2017-04-05 12:17:49,"b'Hari ini ekonomi Jakarta tumbuh, namun belum semuanya bisa merasakan.\n\nMaka perhatian utama kami adalah penumbuhan\xe2\x80\xa6 https://t.co/xMJRWrgQnD'"
849547189961580544,2017-04-05 09:00:08,b'Iseng-iseng sambil nunggu bus... :)\n\n#BerbedaBukanMasalah https://t.co/j4DowMzMo6'
849489742949490688,2017-04-05 05:11:52,b'Teman-teman mari bergabung dan satukan semangat untuk bersama melangkah maju.\nSaatnya kita peduli dan maju bersama\xe2\x80\xa6 https://t.co/TJPJpCJJ2c'
849414647119843329,2017-04-05 00:13:27,"b'Kebhinnekaan itu fakta, karena itu tidak usah diperjuangkan. Persatuan dalam kebhinnekaan, itulah yang harus diperj\xe2\x80\xa6 https://t.co/rScdSx2pXo'"
849229727613173760,2017-04-04 11:58:39,"b'Ayo semua warga Jakarta, ayo ayo #nyanyibersama...\xf0\x9f\x8e\xb6\n\nTerima kasih pada @Band\xe2\x80\x8b7warna untuk kreatifitasnya. :) \n\nhttps://t.co/pRMKP1oqxX'"
849187148733362178,2017-04-04 09:09:28,b'#TweetJahat kali ini agak gurih-gurih gimana gitu. :)\n.\n.\n.\n#tahubulat\n#digorengdadakan\n#OKOCE https://t.co/godx9BRhtw'
849153839189999616,2017-04-04 06:57:06,"b'Pria ini fotografer tim kami, kelelahan karena jadwal kampanye yang lumayan padat. Enggak tega mau bangunin dia... https://t.co/IpkcZ4LU1C'"
849058987567792128,2017-04-04 00:40:12,"b'Mahasiswa adalah stok pemimpin masa depan. Anda memiliki kesempatan mengembangkan diri ketika kuliah, mulailah seka\xe2\x80\xa6 https://t.co/JbfP8PN9bM'"
848871444633145346,2017-04-03 12:14:58,"b'Kalau teman-teman mampir di Cirebon, harus coba makan Nasi Lengko. :) https://t.co/4Xu9TzoYZQ'"
848825219032600577,2017-04-03 09:11:17,"b""Senangnya bisa 'ngobrol-ngobrol' dengan Relawan Anies-Sandi di Belanda semalam, terima kasih untuk dukungan dan doa\xe2\x80\xa6 https://t.co/FcL1Yu0FnJ"""
848762638989275136,2017-04-03 05:02:37,"b'Di balik gedung-gedung tinggi Jakarta, ada jasa warteg yang melayani para warga agar perut mereka tidak kosong saat\xe2\x80\xa6 https://t.co/6VN0ds7CCi'"
848681139845738498,2017-04-02 23:38:46,"b'Adik-adik, selamat menempuh Ujian Nasional! :) https://t.co/iTtZt3sfcV'"
848481768579584000,2017-04-02 10:26:32,b'Bahagianya tadi bisa makan siang bersama teman-teman di Kelapa Gading. :) https://t.co/BnfHwcRvnk'
848408070535299076,2017-04-02 05:33:41,b'Hari Minggu ngopi bareng teman-teman di Muara Karang... :) https://t.co/LwHlHKbZyX'
848369026610769920,2017-04-02 02:58:32,"b""Pagi ini jalan-jalan santai bersama warga di #CFD Kampung Tanah 80. Gerakan seperti ini perlu 'dijiplak' oleh selur\xe2\x80\xa6 https://t.co/gEiTjuOxNr"""
848105791672401920,2017-04-01 09:32:32,"b'Alhamdulillah, bersyukur atas dukungan Koalisi Buruh Jakarta. Insya Allah mulai 19 April, #KerjaBersama utk maju ko\xe2\x80\xa6 https://t.co/FNVmq0rBBS'"
848038738298945536,2017-04-01 05:06:05,"b'Jalan-jalan ke mana akhir pekan ini?\n\nAda tujuh tujuan wisata Jakarta tersembunyi di bawah ini, ada yang bisa\xe2\x80\xa6 https://t.co/d8MYybsI5W'"
847736641699553280,2017-03-31 09:05:40,"b'Coba cari 5 perbedaan pada gambar di bawah ini sambil nunggu ojek, kalau susah boleh minta bantuan tukang ojeknya.\xe2\x80\xa6 https://t.co/Kjso0QYAEG'"
847695880509468674,2017-03-31 06:23:41,"b'Ketika bersilaturahim dengan @Gus_Sholah, saya dan Bang @sandiuno berdiskusi banyak mengenai pentingnya pendidikan.\xe2\x80\xa6 https://t.co/4fRxHRZ3yP'"
847627887494651909,2017-03-31 01:53:31,b'Alhamdulilah pagi ini berkesempatan hadir di Pengajian Kliwonan @HabibluthfiYahy di Pekalongan. Selalu mencerahkan\xe2\x80\xa6 https://t.co/lBX3D9ZVB6'
847417903250931712,2017-03-30 11:59:07,b'Mengapa teman-teman memilih Anies-Sandi? :) https://t.co/tplrmZryoe'
847365995568087040,2017-03-30 08:32:51,b'Teman-teman akan nonton film Indonesia apa di Hari Film Nasional ini? :)\n\n#HFN2017 https://t.co/Nu3tYnt2Bb'
847312880600965125,2017-03-30 05:01:47,b'Selamat Hari Film Nasional!\nMari #MerayakanKeberagamanIndonesia dengan nonton film Indonesia di bioskop terdekat...\xe2\x80\xa6 https://t.co/EmJnYNrV3Z'
847258917230989314,2017-03-30 01:27:21,b'Teman-teman di sini ada yang berangkat sekolah/ kerja menggunakan angkutan umum? Biasanya berapa kali pindah angkut\xe2\x80\xa6 https://t.co/FtH50ijL64'
847059344311037953,2017-03-29 12:14:19,b'Apresiasi pada Mata Najwa utk kesempatan bertukar gagasan kmrn. Semoga bisa disikapi dgn dewasa dan membuat demokra\xe2\x80\xa6 https://t.co/3mqXxvA1q9'
847013992857927681,2017-03-29 09:14:07,"b'Di Jakarta saat ini, sepertiga anak usia SMA putus sekolah. \n#KJPPlus beri kesempatan agar anak-anak ini juga bisa\xe2\x80\xa6 https://t.co/TnOtAEf9xs'"
846948861675483137,2017-03-29 04:55:18,"b'Cari makan yuk...\n\nDi bawah ini ada lima makanan/ minuman khas Jakarta, ada yg bisa #carikata tersebut sebelum jam\xe2\x80\xa6 https://t.co/OrJyWq2DRv'"
846892352274776064,2017-03-29 01:10:45,"b'Pak @Basuki_btp dan Saya itu mau apa sih? Mau kerja bangun Jakarta.\n\nApa pun ujungnya nanti, kita semua akan bekerj\xe2\x80\xa6 https://t.co/1cSlZL9stT'"
846692804315168768,2017-03-28 11:57:49,b'Lagi bosan dengan hiruk pikuk pilkada?\n\nCoba cari lima perbedaan gambar di bawah ini... :)\n\n#BerbedaBukanMasalah https://t.co/Pwcv9qV2Ay'
846666187836579841,2017-03-28 10:12:04,"b'Kebhinnekaan itu fakta, mari jaga kebhinnekaan adalah dengan memastikan pendidikan yang berkualitas! https://t.co/UFWrs5py0o'"
846590167708151808,2017-03-28 05:09:59,"b'Sayang sekali yang bantu baca #tweetjahat ini, bro @chmadMunawar belum bisa gabung grup IBLIS... Ada yang berminat?\xe2\x80\xa6 https://t.co/bEGK6xafJx'"
846500264425115649,2017-03-27 23:12:44,b'Bagi teman-teman yang merayakan:\n\nSelamat Hari Raya Nyepi Tahun Baru Saka 1939. Selamat menjalani Catur Brata.\xe2\x80\xa6 https://t.co/5x47hA6s64'
846288917137534976,2017-03-27 09:12:55,"b'Lawan debat adalah teman berpikir, mari beradu gagasan. :) https://t.co/vAUdCtJJU2'"
846286601328123904,2017-03-27 09:03:43,"b'RT @JktMajuBersama: Teman2 bs cek kebenaran berita ttg #AniesSandi di https://t.co/dZjpfY5RSb dan https://t.co/x5ZojdKHHZ, jadi ga kemakan\xe2\x80\xa6'"
846227282800758785,2017-03-27 05:08:01,"b'Hakuna matata!\n\nJangan kuatir, mari pastikan kebahagiaan masa depan anak-anak kita, melalui pendidikan gratis, tunt\xe2\x80\xa6 https://t.co/fCetjPNw4f'"
846168259405660160,2017-03-27 01:13:28,"b'Tidak hanya #KJPPlus, kualitas pendidikan di Jakarta harus ditingkatkan melalui sekolah, guru, dan kepala sekolah. https://t.co/Jkz3RtZB5h'"
845971038814978048,2017-03-26 12:09:47,"b'Teman-teman pasti sudah tahu dong apa saja program unggulan Anies-Sandi. \nDi bawah ini ada lima, ada yg bisa temuka\xe2\x80\xa6 https://t.co/JO8ruScDAN'"
845839632298213376,2017-03-26 03:27:37,"b'Mari #nontonbersama Raising A Leader, Hari Minggu, 26 Maret di @Metro_TV jam 16.30. https://t.co/lFjnRgOFlV'"
845610097657073664,2017-03-25 12:15:32,"b'Di mana pun teman-teman malam ini, yuk matikan semua peralatan listrik selama 1 jam, ikut gerakan semesta selamatka\xe2\x80\xa6 https://t.co/QGe0u3bHa0'"
845563296623190016,2017-03-25 09:09:34,b'Penyegaran linimasa dulu... :) https://t.co/b608O8mpWB'
845495602582503429,2017-03-25 04:40:34,b'Pilihlah jalan yang mendaki karena itu akan menghantarkan kita pada puncak-puncak baru. https://t.co/UqiG3mgSt5'
845244531083653120,2017-03-24 12:02:54,"b'Ketemu foto lama, siapa ya yang paling mirip saya? :) https://t.co/1JEZI522lJ'"
845204031521767424,2017-03-24 09:21:58,b'Salah satu pilar utama demokrasi adalah pers.\nTerima kasih sudah mengawal pilkada di Jakarta selama ini. \nTetap kri\xe2\x80\xa6 https://t.co/TzXzRoaXlN'
845161550960779264,2017-03-24 06:33:10,b'RT @sandiuno: Silahturahmi bersama PWI. Mereka sepakat utk mengawal demokrasi Pilkada DKI Jakarta agar berjalan jujur &amp; adil.\n#SalamBersama\xe2\x80\xa6'
845132053599334402,2017-03-24 04:35:58,"b'Pilkada ini seperti ujian keikhlasan, ketika dipuji jangan terbang, dicaci juga jangan tumbang. #JumatBerkah https://t.co/zqiGtzTgSI'"
845083537199943680,2017-03-24 01:23:10,"b'Kepemimpinan yang baik bukan butuh seorang Superman, tapi sebuah Supertim. Saya bangga bisa #MajuBersama Bang\xe2\x80\xa6 https://t.co/8Y2mCnzin0'"
844975273032335361,2017-03-23 18:12:58,"b'Innalillahi wa inna ilaihi rajiun. Selamat jalan Bung Ahmad Taufik, jurnalis @tempodotco, pejuang kebebasan pers. Semoga husnul khotimah.'"
844885542575620096,2017-03-23 12:16:25,"b'Mau ada #tweetjahat dibacakan tiap hari? \nYang mau silakan RT.\n\nKalau rakyat menghendaki, mungkin bisa diatur, ya B\xe2\x80\xa6 https://t.co/Ky9ywqqKBc'"
844836966646497280,2017-03-23 09:03:23,"b'Hari ini banyak sekali warga Jakarta yang cuma bisa menonton kemajuan kota, tanpa kebahagiaan. \nDengan #OKOCE kita\xe2\x80\xa6 https://t.co/L1DhlUKNw1'"
844773293857005568,2017-03-23 04:50:23,"b'Kemarin jalan-jalan ke Fresh Market - PIK, hampir enggak bisa pulang saya... :) https://t.co/RWCYrRqFLE'"
844736872572043265,2017-03-23 02:25:39,"b'Teman-teman, pastikan selalu sedia payung dan sendal jepit andalan sebelum hujan. :) https://t.co/5HbHXa9YZG'"
844525773432090624,2017-03-22 12:26:49,"b'Diuji oleh @sarseh, merangkai kata sesuka hati dari gambar-gambar acak. :) https://t.co/RvLPtrD4wj'"
844474957446856704,2017-03-22 09:04:54,b'Geli-geli gimana gitu... :) https://t.co/LdHu0RAvcT'
844430155384807424,2017-03-22 06:06:52,b'Dari mana air yang Anda minum dan gunakan untuk mandi sehari-hari? \n#worldwaterday https://t.co/pY1w7WzqBR'
844156862794686467,2017-03-21 12:00:54,"b'Bersilaturahim dgn KH. Sholahuddin Wahid, beliau berpesan agar tetap menjaga persatuan selama Pilkada Jakarta berla\xe2\x80\xa6 https://t.co/nOyZlKVbYB'"
844135514072535040,2017-03-21 10:36:04,"b'Yang Terampas dan Yang Putus - Chairil Anwar, 1949\n\nSelamat Hari Puisi Sedunia! https://t.co/4xCBrbnmEo'"
844113301889998848,2017-03-21 09:07:48,b'Teman-teman ada yang suka nonton film?\n\nMari #NontonBersama!\n\nhttps://t.co/4zKv4Z1kU7 https://t.co/NJ9XEVLqfa'
844063348983455744,2017-03-21 05:49:18,"b'Dapat lego lucu ini dari teman-teman relawan, nantikan petualangan blusukan mereka... :) \n#LegoAnies #LegoSandi\xe2\x80\xa6 https://t.co/7KYjgXQuVT'"
843993120660316160,2017-03-21 01:10:15,b'#PagiPagi memang paling enak sarapan @SuburBur... :)  \n#tweetjahat https://t.co/i6kHCoYtoK'
843796545342386176,2017-03-20 12:09:08,b'Siang tadi nongkrong bareng Bang @sandiuno untuk syuting #tweetjahat. Kira-kira tweet mana yang akan dibaca kali in\xe2\x80\xa6 https://t.co/ttWp2mHpZK'
843748782567186432,2017-03-20 08:59:20,b'Sebulan Menuju 19 April 2017 https://t.co/mZJNyRyDOA via @JktMajuBersama https://t.co/WcibKdFnGi'
843688760059469824,2017-03-20 05:00:50,"b'""...yang kaya makin kaya, yang miskin makin miskin."" itu cuma ada di lagunya Rhoma Irama atau memang kenyataan? https://t.co/TDxLEoDXvZ'"
843635278023602177,2017-03-20 01:28:18,"b'Negara tak bisa atur pikiran, tapi bisa atur cara mengekspresikannya. \nItulah pentingnya bisa berdialog dengan pand\xe2\x80\xa6 https://t.co/utSHXyVM4a'"
843393747056394240,2017-03-19 09:28:33,"b'Pasar bukan hanya tempat bertransaksi, tapi juga berinteraksi. Dari interaksi ada kepercayaan, inilah yg harus dimi\xe2\x80\xa6 https://t.co/z5TYAxCRlA'"
843333536828469252,2017-03-19 05:29:18,b'Terima kasih atas deklarasi dukungan Partai Amanat Nasional - PAN Jakarta.\nKami akan menjalankan amanat ini sebaik-\xe2\x80\xa6 https://t.co/cM9GpO9Jyc'
843282985734479872,2017-03-19 02:08:25,b'...Naik delman istimewa ku duduk di muka\nKu duduk samping pak kusir yang sedang bekerja... \nApa rutinitas\xe2\x80\xa6 https://t.co/57PQpHRaDn'
843101916695478275,2017-03-18 14:08:55,b'Mari #MajuBersama! :) https://t.co/Yff7MMFrkP'
842983999345647616,2017-03-18 06:20:21,"b'Bahagia bersama teman-teman di Jatipulo, Palmerah. :) https://t.co/pIgy1zgerQ'"
842938955787988992,2017-03-18 03:21:22,"b'Jakarta begitu kaya akan seni dan budaya, teman-teman nanti bisa ekspresikan di Festival Rakyat Jakarta.\xe2\x80\xa6 https://t.co/pmmqCshYTl'"
842710845662490624,2017-03-17 12:14:57,b'Jakarta bukan saja kota untuk berbagai warga mencari kehidupan tapi juga tempat tradisi kebudayaan dan sejarah yang\xe2\x80\xa6 https://t.co/JFiY4AwA33'
842641058525724672,2017-03-17 07:37:38,"b'Apresiasi sebesar-besarnya pada teman-teman perawat, mereka adalah garda terdepan dalam pelayanan kesehatan. \nSelam\xe2\x80\xa6 https://t.co/1VznebauBt'"
842591209075879936,2017-03-17 04:19:33,b'Menjadi Gubernur Jakarta itu berarti menjadi pemimpin utk semuanya. \nSeorang pemimpin harus bisa berdialog dengan s\xe2\x80\xa6 https://t.co/WdUT9In3ZD'
842538483696582656,2017-03-17 00:50:02,"b'Gagasan #DPNol bertujuan agar rakyat Jakarta bisa punya rumah sendiri, tidak menyewa seumur hidup. \nMau?\xe2\x80\xa6 https://t.co/PNOe4yrtq7'"
842315651859410944,2017-03-16 10:04:35,b'Malam ini istri saya @feryfarhati akan ngobrol-ngobrol dengan @Rosianna766Hi di @KompasTV https://t.co/i4U2O2u6YX'
842297426606088192,2017-03-16 08:52:10,"b'Bahagia bersama teman-teman di Tanah Merah, Koja. :) https://t.co/Kd022iLgHl'"
842236784968847360,2017-03-16 04:51:12,"b'Jika ingin membangun manusianya maka kita harus menghadirkan pendidikan yang tidak hanya gratis, tapi tuntas dan be\xe2\x80\xa6 https://t.co/5PjcoaA2c2'"
842183591538774016,2017-03-16 01:19:49,"b'Innalillahi wa inna ilaihi rajiun. Semoga Alm. KH Hasyim Muzadi diampuni segala khilafnya, diterima segala amalnya, ditempatkan di sisi-Nya.'"
842164666818211840,2017-03-16 00:04:37,"b'Selamat pagi teman-teman, apa rutinitas pagimu sebelum berangkat kerja/ sekolah? :) https://t.co/afUGVEWsGk'"
841985925458542594,2017-03-15 12:14:22,"b'Semua warga Jakarta punya kesempatan sama untuk sejahtera.\nTermasuk Anda, mari maju bersama melalui #OKOCE -&gt;\xe2\x80\xa6 https://t.co/y6Tr0nbK00'"
841935538273816576,2017-03-15 08:54:09,"b'#BuatLo yang masih suka menyebar kampanye hitam dan berita fitnah... berhentilah, mari kita ciptakan Pilkada damai.\xe2\x80\xa6 https://t.co/2mrFEF3OBE'"
841876386063228928,2017-03-15 04:59:06,b'Orang tua garda terdepan pendidikan anak. Pendidikan berawal dari rumah dan anak pun menghabiskan lebih banyak wakt\xe2\x80\xa6 https://t.co/irKV0I9f7W'
841821818000355330,2017-03-15 01:22:16,b'Dengan meningkatkan manfaat dan memperluas penerima KJP warga Jakarta akan bisa mendapatkan akses pendidikan yang l\xe2\x80\xa6 https://t.co/4WHOerkfoM'
841621897540386822,2017-03-14 12:07:51,"b'Bayangkan bila ada kompetisi olahraga sepanjang tahun, antar kelurahan-kecamatan, teman-teman mau ikutan? :)\xe2\x80\xa6 https://t.co/Am1xXFYHhs'"
841580400086470656,2017-03-14 09:22:57,"b'Transportasi massal Jakarta harus seperti pembuluh darah, moda terkecilnya, angkot harus terintegrasi dengan jaring\xe2\x80\xa6 https://t.co/Q7Mkjv63NJ'"
841510908597690368,2017-03-14 04:46:49,"b'Syukurlah, saya dianggap masih awet muda... :)\n#tweetjahat https://t.co/WWeiNmODcW'"
841453754201210881,2017-03-14 00:59:43,"b'Salah satu pertanyaan yang sering ditanyakan oleh warga, ""Apakah KJS/ KJP akan hilang jika gubernurnya ganti?""\nIni\xe2\x80\xa6 https://t.co/x1gXql6uKm'"
841259145856598017,2017-03-13 12:06:24,b'RT @KompasTV: Apa strategi @aniesbaswedan utk hadapi Pilkada DKI putaran dua? Temukan jawabannya di #AniesDiSatuMeja LIVE 20.00 WIB https:/\xe2\x80\xa6'
841211365595389952,2017-03-13 08:56:33,b'RT @tvOneNews: Diskusi Santai Bareng Bang @aniesbaswedan &amp; @sandiuno Bersama @karniilyas dan Redaksi @tvOneNews  https://t.co/y0wNh6go5V'
841151672751611905,2017-03-13 04:59:21,"b'Bung Hatta mengatakan di tahun 30-an, setiap pemimpin adalah pendidik. Setiap pendidik adalah pemimpin. Karena itu\xe2\x80\xa6 https://t.co/UajlF7QwJJ'"
841092154122412032,2017-03-13 01:02:50,b'Teman-teman biasanya berangkat kerja naik apa? \nKendaraan pribadi atau kendaraan umum? \nMengapa pilih naik itu? https://t.co/SKF3RxJBjD'
840855931789303808,2017-03-12 09:24:11,"b'Jika pembangunan di tingkat warga dilakukan, maka interaksi antar warga akan hidup dan permasalahan di kampung bisa\xe2\x80\xa6 https://t.co/cz6C9sFeYb'"
840790998800257024,2017-03-12 05:06:09,b'Hari Minggu enaknya jalan-jalan ke mana ya? :) https://t.co/a2tX0E7Lfc'
840510275254022145,2017-03-11 10:30:40,b'Mari kita jaga Pilkada Damai dan bebas ancaman. https://t.co/7uJV3PeqF2'
840427112267837440,2017-03-11 05:00:12,"b'Dikipasin oleh ratusan warga Semanan - Jakarta Barat, sejuk betul! :) https://t.co/4QbVa5dQP9'"
840170147943874561,2017-03-10 11:59:07,"b'Lawan debat adalah teman berpikir, mari beradu gagasan! :) https://t.co/FvtoeNnLW2'"
840081125460459522,2017-03-10 06:05:22,"b'Pilkada ini bukan soal menang atau kalah, kita masuki pesta demokrasi ini dengan bermartabat. Jalankan dengan sumbe\xe2\x80\xa6 https://t.co/GFHCrOErzp'"
840042627919560704,2017-03-10 03:32:24,"b'RT @pandji: Semua pertanyaan &amp; jawaban tadi, bisa elo baca lengkap di https://t.co/EjDUSgNqJa #DPnol'"
839999981578678272,2017-03-10 00:42:56,"b'Pilkada ini seperti main sepakbola, kita fokus saja pada bolanya jangan fokus pada nendang kaki lawan. https://t.co/p9ZegoGaLh'"
839812505014718466,2017-03-09 12:17:58,"b'Anak muda ini Ivan Gemuri - karena kecelakaan, syarafnya terganggu. Meski diberi tantangan, tetap berkarya. Masya A\xe2\x80\xa6 https://t.co/9clRAZssrc'"
839764153216589824,2017-03-09 09:05:50,b'Wage Rudolf Supratman perjuangkan persatuan melalui Indonesia Raya. \nMari kita lanjutkan semangatnya!\xe2\x80\xa6 https://t.co/kL4e8BupDE'
839709135549538304,2017-03-09 05:27:13,b'@MAHENDRA_GNW bagus betul! \xf0\x9f\x91\x8c\xf0\x9f\x8f\xbf'
839707654062657537,2017-03-09 05:21:20,b'Teman-teman biasanya makan siang apa nih? :) https://t.co/f4FSb0j1HT'
839627271950381057,2017-03-09 00:01:55,b'Selamat Hari Musik Nasional! \xf0\x9f\x8e\xb6\n.\nApa musik kesukaan teman-teman? :) https://t.co/EUq2hBbVbg'
839440014232604672,2017-03-08 11:37:50,b'Ada lebih dari 30.000 Warteg di Jakarta dan semuanya wirausaha. \n#OKOCE memastikan mereka mudah usahanya dan mening\xe2\x80\xa6 https://t.co/sGyK51QrLX'
839400353212710913,2017-03-08 09:00:14,"b'Hari ini kita memperingati Hari Perempuan Internasional, sudahkah kantor-kantor di Jakarta ramah perempuan?\xe2\x80\xa6 https://t.co/U1UOVOWSBz'"
839336430887325696,2017-03-08 04:46:13,b'Pilar dari sebuah bangsa itu ada pada perempuan. \nSelamat Hari Perempuan Sedunia!\n#PerempuanOkOce https://t.co/A97dJTgsIE'
839286071531692032,2017-03-08 01:26:07,"b'Filosofi memuliakan perempuan adalah kerja bersama, suasananya gerakan pemberdayaan masyarakat dan perempuan.\xe2\x80\xa6 https://t.co/i1Xrk9mNgk'"
839093462934806528,2017-03-07 12:40:45,"b'Program-program yg sudah berjalan seperti KJP, KJS dan PPSU pasti dilanjutkan, bahkan dikembangkan manfaatnya.\n.\n.\xe2\x80\xa6 https://t.co/3JSeWDZzL2'"
839049379587612672,2017-03-07 09:45:35,"b'Perempuan asal katanya empu, artinya orang bijak, orang yg mengajarkan kebijaksanaan. Kami berikhitiar utk memuliak\xe2\x80\xa6 https://t.co/OLSPsD90em'"
838975131997224960,2017-03-07 04:50:33,"b'Ziarah ke makam kakek A.R. Baswedan, Bung Hatta dan Bang Ali Sadikin. \nMari kita teruskan ikhtiar mereka untuk mewu\xe2\x80\xa6 https://t.co/p2ivvnjbgs'"
838910081756442624,2017-03-07 00:32:04,"b'Mas @jokoanwar, saya kasih tebakan balik ya... :)\n\n#tweetjahat https://t.co/RemWe8kPYn'"
838740845297741825,2017-03-06 13:19:35,b'Mau cerita sedikit kisah di balik pencalonan saya sebagai Cagub DKI Jakarta... :) https://t.co/SoKA7DGBpF'
838705235056963585,2017-03-06 10:58:05,b'Selamat Ulang Tahun #TEMPO46tahun!\nSemoga dalam semangat #beraniberubah tetap menjadi referensi yg enak dibaca dan perlu. :)'
838676420582760449,2017-03-06 09:03:35,b'Menghadiri Rakornas Partai Keadilan Sejahtera 2017: Kokoh Berkhidmat untuk Rakyat. #PKSRakornas2017 https://t.co/k7b8s8MfxE'
838619465491193856,2017-03-06 05:17:16,"b'Setahun lalu tak mengira kami akan maju bersama @PKSejahtera &amp; @Gerindra. Allah Maha Berencana, kita hanya jalankan\xe2\x80\xa6 https://t.co/0yt4xPvWmZ'"
838564322557087745,2017-03-06 01:38:08,"b'#SemangatPagi teman-teman, Jakarta harus kembali meneruskan catatan sejarah panjangnya, menjadi kota masa depan bag\xe2\x80\xa6 https://t.co/ioxnVCxX7Y'"
838317704008220672,2017-03-05 09:18:10,b'Teman-teman suka ikut car free day di hari minggu?\nHarusnya bisa jawab pertanyaan TTS dari @C_lontong kali ini :)\xe2\x80\xa6 https://t.co/XpDe1Galtb'
838206773999722496,2017-03-05 01:57:22,"b'Hari ini bertepatan dengan hari lahir Alm. H. Benyamin Sueb, 5 Maret 1939.\nTeman-teman paling suka film Bang Ben yg\xe2\x80\xa6 https://t.co/EWs8TqQhcf'"
838048949965500417,2017-03-04 15:30:14,"b'Siap menjalani proses putaran kedua Pilkada DKI Jakarta. \nTujuan kita tidak berubah, tujuan kita adalah untuk warga\xe2\x80\xa6 https://t.co/SbKZVeYdrD'"
837925821859815424,2017-03-04 07:20:58,"b'Jadi pemimpin itu berpihak dulu, ada keberpihakan, dari keberpihakan baru dibuat mekanisme dan aturannya. https://t.co/5kVuR8CcBy'"
837850352984563712,2017-03-04 02:21:05,"b'Selamat berakhir pekan, teman-teman! :)\n\nKredit foto: @kompascom/ Kristianto Purnomo https://t.co/hRz02zNCcb'"
837596580257521664,2017-03-03 09:32:41,"b'Hari Jumat, hujan... biasanya macet. \nKalau ada #OKOTRIP yg terintegrasi dan murah, teman-teman mau coba? :) https://t.co/ToOR1Rdq6f'"
837550679287726082,2017-03-03 06:30:17,"b'Anak muda saat ini sangat tersambung dengan dunia digital, melek teknologi dan semangat #entrepeneur yg luar biasa,\xe2\x80\xa6 https://t.co/PQSyZBojhw'"
837513120801153024,2017-03-03 04:01:02,b'Jangan ngaku orang Jakarta kalau belum pernah ke monumen ini... :)\n\nvia @WIB_NET https://t.co/exB1DK93Rj'
837480571097927680,2017-03-03 01:51:42,"b'Bersilaturahim ke tetangga Jakarta, Jawa Barat.\n\nHatur Nuhun Kang @aheryawan , Insya Allah komunikasi baik ini akan\xe2\x80\xa6 https://t.co/VR186HwA1s'"
837274640242266113,2017-03-02 12:13:24,"b'Jakarta ini sangat Bhinneka, bayangkan bila ada festival kebudayaan setiap pekan yang mewakili tiap daerah di Indon\xe2\x80\xa6 https://t.co/Dayp2zLrgZ'"
837199845672640512,2017-03-02 07:16:12,"b'60% pelaku usaha kecil dan menengah adalah perempuan, program Ok Oce pun mendukungnya melalui Kredit Usaha Perempua\xe2\x80\xa6 https://t.co/9IjsTfPGRR'"
837150674513076224,2017-03-02 04:00:48,"b'Apakah #OkOce jawaban untuk semua masalah? \nBelum tentu, tapi melalui #OkOce semua warga mendapat kesempatan untuk\xe2\x80\xa6 https://t.co/SF2vtxFfbr'"
837113257374568449,2017-03-02 01:32:08,"b'Kenapa Anies-Sandi tegas menolak reklamasi teluk Jakarta?\n\nIni soal keberpihakan, negara menimbun laut, menambah da\xe2\x80\xa6 https://t.co/UMqVwbMr6p'"
836881416071823360,2017-03-01 10:10:52,b'Ada yg pengantin baru seperti pasangan relawan Jafar-Firda? \nAtau ada yg berencana menikah dlm waktu dekat?\nRencana\xe2\x80\xa6 https://t.co/HJSdSBruz0'
836841497991471107,2017-03-01 07:32:15,"b'Pertanyaan TTS @C_lontong di @WIB_NET\xe2\x80\x8b ternyata susah betul, seorang mantan Mendikbud saja salah terus jawabnya. :(\xe2\x80\xa6 https://t.co/CTLqpBbZiw'"
836805353425760258,2017-03-01 05:08:38,"b'Teman-teman jangan lupa makan siang ya... :)\n\nTansu ini kalau malam ramai, lebih dari sekedar kuliner, tapi utk war\xe2\x80\xa6 https://t.co/t6PM50raot'"
836758807132852224,2017-03-01 02:03:40,"b'Semangat program ini untuk membantu warga memiliki rumah.\n\nTugas pemimpin mencari solusi, agar semua warganya bisa\xe2\x80\xa6 https://t.co/kHUq0ODrwO'"
836515373943922688,2017-02-28 09:56:21,b'@Graha_Adhitya mohon bersabar ini ujian :)'
836501372467986432,2017-02-28 09:00:43,b'Apa iya muka saya makin tengil @Graha_Adhitya? bukannya makin mirip @tomhanks? \xf0\x9f\xa4\x94\n#tweetjahat https://t.co/XVCDBBdUr3'
836467357102977024,2017-02-28 06:45:33,b'Menengok Djoeang AniesSandi Hidayatullah Syatirih Al-Jakartaty. Insya Allah menjadi anak yang membawa manfaat dan m\xe2\x80\xa6 https://t.co/MWYWtxz8Ls'
836435641390915584,2017-02-28 04:39:31,b'Gantengan mana? :) https://t.co/2rxI7HKRrm'
836392011783532544,2017-02-28 01:46:09,b'Teman-teman ada yang tahu asal usul peci? :) https://t.co/CJ2Oee6c04'
836182366104137729,2017-02-27 11:53:06,b'Begitu banyak inspirasi dan harapan yg ditemui sepanjang perjalanan ini terus meyakinkan kami utk melunasi janji ba\xe2\x80\xa6 https://t.co/ugsgZsZpiK'
836143162569568256,2017-02-27 09:17:19,b'Apa hobi teman-teman?\nKalau saya hobinya kliping... maklum dulu belum ada sosmed... :) https://t.co/V7Pw19qB0i'
836075769600200704,2017-02-27 04:49:31,"b'Pagi ini live streaming dari Los Angeles, bukan nonton #Oscars, tapi ngobrol dgn teman-teman di perantauan, mereka\xe2\x80\xa6 https://t.co/a8KG7v9Yhh'"
836019554476122112,2017-02-27 01:06:08,"b'Para pendiri Republik ini adalah guru, pendidik. Republik ini dibangun dengan ide, dengan gagasan, bukan sekedar so\xe2\x80\xa6 https://t.co/FJ90lJLqPV'"
835741606137364480,2017-02-26 06:41:40,b'RT @fahiraidris: 24. Mas @aniesbaswedan &amp; Bang @sandiuno menyambut positif dan mengucapkan terima kasih atas dukungan yang diberikan #BangJ\xe2\x80\xa6'
835719574129524736,2017-02-26 05:14:08,"b'Turut bahagia utk kelahiran Djoeang AniesSandi Hidayatulloh Syatirih Al Jakartaty, anak pertama Erwin dan Rinny, re\xe2\x80\xa6 https://t.co/Rjdgf5iiue'"
835357143901470720,2017-02-25 05:13:57,b'Berdua jadi juri lomba tumpeng .... nyicipin belasan tumpeng ... sampai baru liat tumpengnya udah langsung kenyang\xe2\x80\xa6 https://t.co/Op7ZahgHac'
