id,created_at,text
1154290966485856257,2019-07-25 07:23:06,b'Tips Hidup Sehat tanpa Narkoba https://t.co/AeASpwFmEk'
1154280901624209409,2019-07-25 06:43:07,b'Suka Makanan Pedas? Awas Ancaman Demensia https://t.co/nZnc7JojtU'
1154197851338989568,2019-07-25 01:13:06,"b'Usai Bersepeda ke Bali, Nirina Zubir Tak Mau Lepas dari Anak https://t.co/taotGrLvZ9'"
1154191060328828928,2019-07-25 00:46:07,"b'Batik Modern Megawati saat Bertemu Prabowo, Ini Reaksi Netizen https://t.co/qGLncsQqJ5'"
1154159349008257025,2019-07-24 22:40:06,"b'Olahraga Bisa Bantu Cegah Migrain, tapi https://t.co/TMabYPpTHo'"
1154043211125444609,2019-07-24 14:58:37,b'Pilihan Makanan Paling Tepat Sebagai Teman Minum Teh https://t.co/iKJAbTAhqQ'
1154037299308449793,2019-07-24 14:35:07,"b'Pentingnya Literasi Media Sosial pada Orang Tua, Ini Tujuannya https://t.co/0kMyPtYBZ8'"
1154011883394883585,2019-07-24 12:54:08,"b'3 Tips Cara Buat Teh Terbaik di Rumah, Ini Kata Ahli https://t.co/6PqjYZ1VL8'"
1154011880509194241,2019-07-24 12:54:07,"b'Jadi Korban Body Shaming, Maudy Ayunda Ajak Netizen Diskusi https://t.co/BnBKgZO2q7'"
1154008857330343936,2019-07-24 12:42:06,"b'Bingung Memilih Jenis Teh untuk Diminum, Cocokkan dengan Makanan https://t.co/juVU8etfIL'"
1153981180456210434,2019-07-24 10:52:08,"b'Waspadai Penyakit Jantung Bawaan pada Bayi, Simak Cirinya https://t.co/1f2B1PO9Ng'"
1153981178489139201,2019-07-24 10:52:07,"b'Memilih Cinta, Orang Pertimbangkan Selera Musik dan Olahraga https://t.co/1EiOvKwuSR'"
1153976143831109633,2019-07-24 10:32:07,b'Yang harus Diperhatikan Orang Tua ketika Anak Sikat Gigi https://t.co/Z3SVE2Jffg'
1153949718197624835,2019-07-24 08:47:06,"b'Cuci Pakaian Baru Anda Sebelum Digunakan, Kalau Tidak... https://t.co/ukoT2dpVN6'"
1153947202282086400,2019-07-24 08:37:06,"b'Bayi Demam saat Gigi Tumbuh, Atasi dengan Cara Berikut https://t.co/lMqeO2CVbF'"
1153919017716867073,2019-07-24 06:45:07,b'5 Tips Mudah Menyulap Ruangan Sempit Menjadi Lebih Luas https://t.co/9lbDe0i6N1'
1153919014936043520,2019-07-24 06:45:06,"b'Hari Anak Nasional, Yuk Tingkatkan Interkasi Orang Tua dan Anak https://t.co/GtoHhSPDHf'"
1153918010471546881,2019-07-24 06:41:07,"b'Kata Pakar, Sikat Gigi yang Benar Cukup 2 Menit https://t.co/LBpP9JAK3x'"
1153887435668856835,2019-07-24 04:39:37,"b'Minimalis, Song Hye Kyo Lebih Suka Gaya Sederhana https://t.co/erz3Xo3Av3'"
1153885672169566209,2019-07-24 04:32:37,"b'Sekolah Dasar, Puncak Anak Kembangkan Bakat dan Keterampilan https://t.co/WPWNTFTaJx'"
1153856609602326528,2019-07-24 02:37:08,"b'Penyebab Perkawinan Anak, dari Ekonomi sampai Pemikiran Kuno https://t.co/b9hcpllhXl'"
1153856605655486464,2019-07-24 02:37:07,"b'Kiat Anak Berani di Hari Pertama Sekolah, Lakukan Persiapan Ini https://t.co/gex0ddo3QE'"
1153670381162520576,2019-07-23 14:17:07,"b'Awas Fluorosis pada Gigi, Apa Itu? https://t.co/4reIEMTQYJ'"
1153670379329638401,2019-07-23 14:17:07,"b'Demi Jadi Model, Nirina Zubir Rela Cabut 4 Gigi dalam Sehari https://t.co/eboAHLgarV'"
1153608344482881537,2019-07-23 10:10:36,b'Peran Besar Busana Ibu Negara dalam Promosikan Budaya Lokal https://t.co/u7fgPZCEvo'
1153608342389972992,2019-07-23 10:10:36,b'Manfaat Zumba untuk Anak dengan Gangguan Spektrum Autisme https://t.co/OMTbdW2Fcg'
1153577893055750145,2019-07-23 08:09:36,b'Kiat Selena Gomez Jaga Kesehatan Mental https://t.co/SpMD58xLjn'
1153577142698926080,2019-07-23 08:06:37,b'Konsumsi 7 Makanan Ini setelah Lari agar Tubuh Kembali Bugar https://t.co/SmWewU9XEp'
1153545807729049600,2019-07-23 06:02:07,b'Perlunya Pendampingan Orang Tua saat Anak Gunakan Ponsel https://t.co/zCxlbNLVjJ'
1153516364222455809,2019-07-23 04:05:07,"b'Bullying pada Anak Nunung, Ini Kata KPAI https://t.co/fmMdsQ9670'"
1153513592794144769,2019-07-23 03:54:06,b'Tanamkan Cinta Lingkungan pada Anak dengan Cara Berikut https://t.co/FY8KE5S5JJ'
1153485032004001793,2019-07-23 02:00:37,b'Tips Bepergian Lewat Darat dari Donna Agnesia https://t.co/dsNHTWI4rw'
1153458860541108225,2019-07-23 00:16:37,b'Mengenali Penyebab dan Gejala Radang Amandel pada Anak https://t.co/jCKbgMYMfZ'
1153332904501506051,2019-07-22 15:56:06,"b'Jauh dari Suami, Tasya Kamila Pentingkan Komunikasi https://t.co/kNtCEKgy7T'"
1153324222678126592,2019-07-22 15:21:37,b'6 Zodiak Ini Kerap Merasa Kesepian Meski di Tengah Banyak Orang https://t.co/n62KvVFbeL'
1153301696178577408,2019-07-22 13:52:06,b'Donna Agnesia Suka Mobil Berkabin Luas dan Tidak Rewel https://t.co/PVG0WAajVy'
1153295782163804162,2019-07-22 13:28:36,b'7 Keuntungan Punya Pasangan Beda Karakter https://t.co/NDb7wvcY2x'
1153295780574351360,2019-07-22 13:28:35,"b'Hentikan Kebiasaan Menunda Pekerjaan, Tiru Cara Meghan Markle https://t.co/CY3aA7sd4H'"
1153271499861573632,2019-07-22 11:52:06,"b'Tak Perlu Antibiotik, Atasi Infeksi Telinga Anak dengan Bawang https://t.co/apnSQcMTs7'"
1153265459480780801,2019-07-22 11:28:06,b'8 Ide Membuat Dapur Kesayangan Terlihat Lebih Unik https://t.co/iNDvsr2nG2'
1153240794569949184,2019-07-22 09:50:06,"b'Cerdas Memilih Obat Tradisional dan Kosmetik, Ini Saran BPOM https://t.co/QGr3s44fei'"
1153234385543606272,2019-07-22 09:24:38,b'Gaya Liburan Musim Panas Nia Ramadhani di Amerika https://t.co/5wLR0ToqwV'
1153234382418632704,2019-07-22 09:24:37,b'Camila Cabello Pernah Takut Bernyanyi di Depan Banyak Orang https://t.co/zKTM1aZUBa'
1153210346158432257,2019-07-22 07:49:06,b'Beda Pola Asuh pada Anak Balita dan Remaja https://t.co/0HN43kfTfW'
1153202800727191552,2019-07-22 07:19:07,b'6 Cara Memanfaatkan Minyak Kelapa untuk Samarkan Keriput https://t.co/4rUCuKgbmC'
1153179138481479680,2019-07-22 05:45:06,b'Song Hye Kyo pun Resmi Bercerai dari Song Joong Ki https://t.co/Fy7sIPc3tA'
1153170964726738944,2019-07-22 05:12:37,"b'Mitos Air Kelapa Menangkal Penuaan, Simak Faktanya https://t.co/Mp4FpKYxLw'"
1153165940374118403,2019-07-22 04:52:39,"b'Makan Pisang Bikin Mood Senang, Simak 6 Manfaat Lainnya https://t.co/mhlcHlYCwt'"
1153148686991384577,2019-07-22 03:44:06,b'Gaun Ikonik Jennifer Lopez Jadi Inspirasi untuk Sneakers https://t.co/avpgPK6589'
1153139506532380673,2019-07-22 03:07:37,b'Koleksi Terbaru Coast 2019 untuk Wanita Modern Masa Kini https://t.co/1goMuQBpq3'
1153118994427084800,2019-07-22 01:46:06,b'Natalie Portman Kenakan Gaun Dior di San Diego Comic Con 2019 https://t.co/e7cr3eNVAu'
1153107795442450434,2019-07-22 01:01:36,"b'Ibu Hamil dengan Mata Minus Bisa Melahirkan Normal, Asalkan https://t.co/VijMgAxNnP'"
1153089170950119426,2019-07-21 23:47:36,b'Pentingnya 4 Bulan Pertama Kehamilan untuk Cegah Stunting https://t.co/UemoXkXHk0'
1152964601836789760,2019-07-21 15:32:36,b'Punya Pacar 4 Zodiak Ini Jangan Harap Hal Romantis dari Dia https://t.co/s65OlFuefc'
1152931508979503104,2019-07-21 13:21:06,"b'Sedang Diet, Jangan Takut Makan Kuning Telur https://t.co/aAoYaeL8it'"
1152920943766827009,2019-07-21 12:39:07,b'4 Zodiak yang Egois dalam Hubungan https://t.co/2oNJIhpHwm'
1152902824172220420,2019-07-21 11:27:07,b'Pentingnya Wanita Mengerti Pengetahuan Dasar Otomotif https://t.co/XSa4hAEXSy'
1152890241050529792,2019-07-21 10:37:07,b'9 Cara Kreatif Membagi Interior Rumah Konsep Terbuka https://t.co/XowDSiJbci'
1152869851897028609,2019-07-21 09:16:06,"b'Khloe Kardashian Makeup Cuma 20 Menit, Fokusnya di Hidung https://t.co/yVAqmhPDwA'"
1152841415677730816,2019-07-21 07:23:06,"b'Mimpi Balikan dengan Mantan Pacar, Ada 3 Artinya https://t.co/tEZg58lJZT'"
1152828202542219266,2019-07-21 06:30:36,"b'Michelle Ziudith Me Time Merakit Gundam, Ada Manfaatnya https://t.co/W0MIwKBbHm'"
1152808699154423809,2019-07-21 05:13:06,b'Natalie Portman Berbagi Tips Kecantikan dan Kebugaran Tubuh https://t.co/RsXYYCzf6t'
1152796622717198336,2019-07-21 04:25:07,"b'Tanpa Pakai Aplikasi, 6 Kebiasaan Ini Pemicu Penuaan Dini https://t.co/902v6cMmKl'"
1152779757219508224,2019-07-21 03:18:06,b'5 Cara Alami Mengobati Amandel pada Anak https://t.co/SqaMYg2I0S'
1152747419177607170,2019-07-21 01:09:36,"b'Jerawat Batu dan Rosacea Gejalanya Mirip, Ini Cara Membedakannya https://t.co/GPOge6N0AK'"
1152733453068062720,2019-07-21 00:14:06,b'Cara Alami Mengatasi Nyeri Sendi pada Ibu Hamil https://t.co/qO4oje0TbY'
1152595545866661888,2019-07-20 15:06:06,b'3 Penyakit yang Harus Diwaspadai selama Kemarau https://t.co/ZVwsDVuNCS'
1152562959706554368,2019-07-20 12:56:37,b'Tips Mengelola Keuangan setelah Menikah https://t.co/HYYNCSVau1'
1152539927692759040,2019-07-20 11:25:06,"b'Perempuan Punya Banyak Peran, Penuh Tekanan, Lupa Bahagiakan Diri https://t.co/vxYTusNVWP'"
1152534646615244803,2019-07-20 11:04:07,"b'Teripang Ampuh Atasi Stunting, Sayang Konsumsinya Masih Minim https://t.co/6Sl6fdlKYb'"
1152514261853208577,2019-07-20 09:43:07,b'Anak Obesitas Harus Melakukan 3 Aktivitas Fisik Berikut https://t.co/WOoU4ccJ6L'
1152514260376834049,2019-07-20 09:43:07,b'Penanganan Psikolog untuk Anak Pelaku dan Korban Bullying https://t.co/n9C2d20awN'
1152502183356538880,2019-07-20 08:55:07,"b'Wanita Paruh Baya Ternyata Lebih Aktif di Ranjang, Benarkah? https://t.co/0GPcQlmu5Q'"
1152473992806064128,2019-07-20 07:03:06,b'Jadi Penyiar Radio Bantu Enno Lerian Rasakan Hidup yang Bermakna https://t.co/4mkUPQHo2E'
1152441404548763648,2019-07-20 04:53:36,b'Dokter Sarankan 3 Aktivitas Fisik buat Anak Obesitas https://t.co/cLSP3RAPHL'
1152420387537313792,2019-07-20 03:30:05,b'Cerita Poppy Sovia Melahirkan Caesar dan Kesulitan Urus Bayi https://t.co/2vVOmhh7Ll'
1152413469129314305,2019-07-20 03:02:36,b'Atasi Cegukan dengan Latihan Pernapasan https://t.co/jGqCxWX3I0'
1152389185971482624,2019-07-20 01:26:06,"b'Ayah - Ibu Obesitas Maka Anak Obesitas Juga, Mitos atau Fakta? https://t.co/AGxdlmDyCq'"
1152257951911931905,2019-07-19 16:44:38,"b'Istana Buckingham Cari Juru Masak, Ini Syarat dan Gajinya https://t.co/e2kXfQoCZS'"
1152229513184473090,2019-07-19 14:51:37,b'Ketika Cinta Laura Ungkap Kepedulian pada Perempuan dan Anak https://t.co/Qoqd22A4po'
1152225355744157697,2019-07-19 14:35:06,b'Kisah Harry Halim Merancang Busana Cardi B https://t.co/cZpBWXRPZt'
1152196546332516352,2019-07-19 12:40:38,"b'Memprihatinkan, Penderita Obesitas Lebih Tinggi dari Gizi Buruk https://t.co/c5Itd8kfNI'"
1152107955010990081,2019-07-19 06:48:36,b'Sissy Prescillia Sedih Tak Bisa Mengantar Anak ke Sekolah https://t.co/fxMG2mfUwf'
1152102295833739264,2019-07-19 06:26:07,"b'Mau Ikut Lomba Lari, Jangan Lupakan Langkah Pemulihan Setelahnya https://t.co/IqH3dRyjWO'"
1152070084359159810,2019-07-19 04:18:07,b'Luka Operasi Caesar Bikin Poppy Sovia Kesulitan Gendong Anak https://t.co/exVv08Limu'
1152008929653608448,2019-07-19 00:15:06,b'Sebab Wanita Harus Bisa Menempatkan Emosi dengan Baik https://t.co/VF6mt6wKWY'
1151891409521086464,2019-07-18 16:28:07,"b'Sempat Frustasi jadi Ibu, Ini Solusi Poppy Sovia https://t.co/H0ogJoFwgt'"
1151860204121677824,2019-07-18 14:24:07,"b'Waspada Orang Tua, Tipe Anak Ini Sering Dibully https://t.co/C9ip8szhqJ'"
1151860201672232963,2019-07-18 14:24:07,"b'Yuk, Daur Ulang Botol Produk Kecantikan dengan Cara Gampang Ini https://t.co/uG4I5lc0Pv'"
1151860197163274241,2019-07-18 14:24:06,b'Persiapkan Anak Hadapi Hari Pertama Sekolah dengan Cara Mudah Ini https://t.co/NqCoCeHK4h'
1151825220929409025,2019-07-18 12:05:07,"b'Anak Obesitas karena Keturunan, Mitos atau Fakta? https://t.co/xZZx5Gduw1'"
1151798547706073089,2019-07-18 10:19:07,b'Mau Ajak Balita ke Bioskop? Orang Tua Jangan Lupa Siapkan Hal Ini https://t.co/qptjtM6p5n'
1151798546321965056,2019-07-18 10:19:07,b'BKKBN Imbau Guru Berikan Pendidikan Kesehatan Reproduksi https://t.co/xNnpBJai2Z'
1151793005130469376,2019-07-18 09:57:06,"b'Melahirkan Lebih dari Dua Kali, Ketahui Risikonya https://t.co/qcDzc59Zvu'"
1151764819659202560,2019-07-18 08:05:06,b'Psikolog: Sikap Pelaku Bullying Terbentuk di Rumah https://t.co/5k80WrPyI4'
1151759037035212800,2019-07-18 07:42:07,b'Revlon Luncurkan PhotoReady Candid https://t.co/0b9BdQ0jTr'
1151759035634372608,2019-07-18 07:42:07,b'Mau Naik Haji? Periksa Kesehatan Ini Sebelum Berangkat https://t.co/4Zf8jOvf3T'
1151737642871955456,2019-07-18 06:17:06,"b""Desainer Harry Halim Rancang Busana untuk Cardi B dan Lil' Kim https://t.co/xoh3x161OG"""
1151736005931589632,2019-07-18 06:10:36,b'Merek Ini Ajak Masyarakat Daur Ulang Botol Produk Kecantikan https://t.co/d5c1s6HaKi'
1151706812569116672,2019-07-18 04:14:36,"b'Ada Film Lion King, Intip Dampak Balita Menonton di Bioskop https://t.co/R7a3luVVYS'"
1151703792645132289,2019-07-18 04:02:36,"b'Katarak Sebabkan Kebutaan, Jangan Takut Operasi https://t.co/pLKvuU1sNd'"
1151675482741436416,2019-07-18 02:10:06,"b'Ada Film Lion King, Bolehkah Anak Balita Nonton Bioskop? https://t.co/1lckJLbGWa'"
1151675480740810754,2019-07-18 02:10:06,b'Pengalaman Seram Steffi Zamora Syuting Uka-Uka The Movie https://t.co/eXNmloqbvo'
1151671203867709444,2019-07-18 01:53:06,b'Cari Produk Kecantikan Alami dengan Harga Terjangkau? Coba Ini https://t.co/YzkYMB74eo'
1151643143562915840,2019-07-18 00:01:36,"b'Nabila Syakieb Menyusui saat Hamil, Tak Ada Masalah https://t.co/oDH43R1TeU'"
1151520584750129152,2019-07-17 15:54:36,b'Jangan Makan 4 Bagian Ayam Berikut Demi Kesehatan https://t.co/W7sRiq9oPI'
1151518197029339136,2019-07-17 15:45:07,"b'Pelecehan Seksual Hanya Menimpa Perempuan Cuma Mitos, Faktanya... https://t.co/rrzNNXigcf'"
1151489763863453696,2019-07-17 13:52:08,b'Langkah yang Harus Diperhatikan kala Pakai Produk Perawatan Wajah https://t.co/x4OEprxQVs'
1151457042726453248,2019-07-17 11:42:06,b'Fenita Arie Berbagi 2 Tips Pernikahan Langgeng dan Adem https://t.co/3uBDZXqL9y'
1151427852811640832,2019-07-17 09:46:07,"b'Mengenal Tanda Lahir Bercak Mongol, Apakah Berbahaya? https://t.co/iKnXtqhOAN'"
1151427850982969346,2019-07-17 09:46:06,"b'Mengenal Batuk Rejan, Apa Gejala dan Bagaimana Mengatasinya https://t.co/4VysPv17vN'"
1151424829435727872,2019-07-17 09:34:06,b'Alasan Anak di Bawah Umur Tidak Boleh Suntik Filler https://t.co/hFQZuINmaG'
1151396519813111808,2019-07-17 07:41:36,"b'Niksen, Metode Paling Sederhana Melepas Stres Gratis Pula https://t.co/FWDXQVjcrl'"
1151351847266861056,2019-07-17 04:44:06,b'Fenita Arie Buka Rahasia Hindari Kulit Kusam saat Bepergian https://t.co/JHhOtE6HHF'
1151334487319388160,2019-07-17 03:35:07,b'Sebab Kulit Wajah Mudah Kendur dan Menua https://t.co/4o7VwkAZjX'
1151334485754961921,2019-07-17 03:35:06,b'Lady Gaga Pakai Anting Rinaldy Yunardi untuk Promosi Makeup https://t.co/BdoKCTIbBE'
1151334484551188481,2019-07-17 03:35:06,"b'Tak Tahu Pakem Kebaya, Simak Penjelasan Desainer Musa Widyatmodjo https://t.co/aMeh7pqZ5s'"
1151334483234136064,2019-07-17 03:35:06,b'Dokter Ingatkan Bahaya Suntik Filler pada Kondisi Tertentu https://t.co/OJYBqPdhx4'
1151331465256292353,2019-07-17 03:23:06,b'Alasan Fenita Arie Mulai Perawatan Antipenuaan dari Usia 25 Tahun https://t.co/VYCefqZy49'
1151148759696334848,2019-07-16 15:17:06,b'Fenita Arie - Arie Untung Cerita Rawannya 5 Tahun Pertama Nikah https://t.co/bnSdX3noy5'
1151084586908053507,2019-07-16 11:02:06,b'Stella McCartney - Adidas Bikin Koleksi Busana Ramah Lingkungan https://t.co/ItXOPcXr7D'
1151027333467258881,2019-07-16 07:14:36,b'Beyonce Pakai Gaun Emas di Premier Lion King https://t.co/yREzG7sUQC'
1150995000559194114,2019-07-16 05:06:07,b'Bulan Madu Mewah Sophie Turner di Maladewa https://t.co/aGaHkBwA9j'
1150992482177392641,2019-07-16 04:56:06,"b'Bosan Camilan dan Permen, Bingkisan Ulang Tahun Anak Ini Lebih OK https://t.co/WFWa4NcpGw'"
1150966811791253505,2019-07-16 03:14:06,b'Tips Bekali Anak di Era yang Kian Kompetitif https://t.co/RwXvUB5nr9'
1150748621823807488,2019-07-15 12:47:05,"b'Modal, Kendala Banyak Wanita yang Ingin Memulai Usaha https://t.co/FRDHwAcMUB'"
1150712144565981184,2019-07-15 10:22:09,"b'Anak Sekarang Miskin Budi Pekerti, Widyawati pun Prihatin https://t.co/6zvgDN2zxz'"
1150712143198560256,2019-07-15 10:22:08,"b'Ingin Kuliah di Kampus Idaman dengan Beasiswa, Coba Kiat Berikut https://t.co/pA29p9fjdu'"
1150712141218844672,2019-07-15 10:22:08,b'3 Gaya Hidup yang Bisa Memicu Keringat Berlebih https://t.co/ApS0ksaxoU'
1150687719825129472,2019-07-15 08:45:05,"b'Niksen, Metode Redakan Stres tanpa Melakukan Apapun https://t.co/G2FfTK75n2'"
1150681178904489984,2019-07-15 08:19:06,b'Kesalahan yang Sering Dilakukan Saat Pakai Deodoran https://t.co/SpTbMiqKIF'
1150659282674675712,2019-07-15 06:52:05,"b'Viral Ibu Menghitamkan Mata Anak saat Tidur, Bolehkah Berbohong? https://t.co/JrPixjh06N'"
1150626824289828864,2019-07-15 04:43:07,b'Gaya Meghan Markle saat Menghadiri Premier Lion King di London https://t.co/pDN0pzGICx'
1150617129403572226,2019-07-15 04:04:35,b'Pesan Lea Michele Mengenang 6 Tahun Meninggalnya Cory Monteith https://t.co/bRXeN0r13k'
1150594480858259456,2019-07-15 02:34:35,b'Pengaruh Usia dan Kesuksesan Program Bayi Tabung https://t.co/yRPOe0NKmG'
1150407501201862657,2019-07-14 14:11:36,"b'Suka Terbangun Tengah Malam, Manfaatkan dengan Melakukan Hal Ini https://t.co/GV2WeFtA9H'"
1150399571387752448,2019-07-14 13:40:05,b'Cara Kylie Jenner Mempromosikan Produk Perawatan Kulit Miliknya https://t.co/fup3dfLDtS'
1150367861866524672,2019-07-14 11:34:05,b'Rutin Berolahraga Bantu Turunkan Risiko Kanker Payudara https://t.co/Lt6BE8VQa4'
1150367860373385219,2019-07-14 11:34:05,"b'Bekas Hitam di Ketiak Sensitif, Simak Cara Menghindarinya https://t.co/4vH3zRodh9'"
1150346724747038721,2019-07-14 10:10:06,b'Momen Romantis Karen Vendela dan Boy William Sebelum Bertunangan https://t.co/mcicNXAphz'
1150336658249621504,2019-07-14 09:30:06,b'Busana Kontra Kate Middleton dan Meghan Markle di Final Wimbledon https://t.co/4BUZyUIx5t'
1150318287638503425,2019-07-14 08:17:06,b'Dokter Ingatkan Bahaya Lari Jarak Jauh tanpa Persiapan https://t.co/ll2HVvp3Y8'
1150285826749636608,2019-07-14 06:08:07,"b'Simona Halep, dari Operasi Payudara sampai Pengorbanan Keluarga https://t.co/VCuAo8cWow'"
1150275128179089408,2019-07-14 05:25:36,"b'Sederet Manfaat Es Batu buat Kesehatan, Tak Cuma Segarkan Minuman https://t.co/IGYWbnzUFS'"
1150257131506978816,2019-07-14 04:14:05,b'Pesan Positif Serena Williams untuk Semua Wanita https://t.co/ZNP9L6xqJK'
1150243040394539008,2019-07-14 03:18:05,b'Tips Berbusana dari Marsha Aruan buat Pemilik Tubuh Mungil https://t.co/B5Iq6NtGmJ'
1150224795277000705,2019-07-14 02:05:35,b'Kate Middleton-Meghan Markle Tampil Elegan di Final Wimbledon https://t.co/6RdW5s3lr5'
1150070404288958464,2019-07-13 15:52:06,b'3 Zodiak yang Butuh Waktu Jatuh Cinta Tapi Layak Ditunggu https://t.co/P9cd9edrJw'
1150056310278250499,2019-07-13 14:56:06,b'Kencan dengan 4 Zodiak Ini Selalu Bikin Senang https://t.co/NApLRhyqW6'
1150042093554769920,2019-07-13 13:59:36,"b'Ingatkan Anak Pakai Alas Kaki saat Bermain, untuk Cegah Cacingan https://t.co/Rx09xHb8ok'"
1150010004176400386,2019-07-13 11:52:05,b'Irina Shayk Ungkap Makna di Balik Nama Putrinya https://t.co/F7mDQIYiFE'
1149993394929717248,2019-07-13 10:46:05,b'8 Inspirasi Desain Interior Warna Pastel yang Kekinian https://t.co/gBovjid0Ev'
1149981817283284992,2019-07-13 10:00:05,b'Bintang Gossip Girl Mendesain Jumpsuit yang Nyaman untuk para Ibu https://t.co/xVxctvcGLP'
1149962441213693952,2019-07-13 08:43:05,b'3 Cara Memanfaatkan Oatmeal untuk Perawatan Kulit https://t.co/igXdkF9eHi'
1149917645996584960,2019-07-13 05:45:05,b'7 Jenis Sakit Punggung yang Tak Boleh Diabaikan https://t.co/ga5WH6nJW3'
1149900533823627264,2019-07-13 04:37:06,"b'Ibu Hamil Boleh Makan Durian Asal Dibatasi, Ini 5 Manfaatnya https://t.co/r6lit93SzE'"
1149889214609121280,2019-07-13 03:52:07,b'4 Konsep Desain Perhiasan Terbaru dari Sandra Dewi https://t.co/ye2BboFMEr'
1149870332351672320,2019-07-13 02:37:05,b'Tahun Ajaran Baru Ini 7 Tips Menjaga Kesehatan Anak di Sekolah https://t.co/LvP0a4ykBh'
1149856744350216193,2019-07-13 01:43:05,b'4 Ciri Miom yang Sering Dialami Wanita https://t.co/GGPhqFya2x'
1149715060048052225,2019-07-12 16:20:05,b'4 Zodiak Ini Tidak Romantis Tapi Bukan Berarti Tak Cinta https://t.co/7Rn6YMu9cq'
1149703488823148544,2019-07-12 15:34:06,b'7 Zodiak yang Bisa Diandalkan Saat Punya Masalah https://t.co/9q1GFDIuKh'
1149683737338081280,2019-07-12 14:15:37,b'Adele Rutin Olahraga Ingin Jadi Contoh Buat Putranya https://t.co/65A7nR3iN3'
1149683733366099968,2019-07-12 14:15:36,b'Terlalu Banyak Makan Karbohidrat Bikin Gemuk? Ini Penjelasannya https://t.co/egfzPmfw2P'
1149671020904628228,2019-07-12 13:25:05,"b'Parfum, Kandungan Produk Perawatan Kulit Pemicu Iritasi https://t.co/3EFIQ4GXNR'"
1149652530072154113,2019-07-12 12:11:37,b'Social Bella Gelar Beauty Run Pertama di Indonesia https://t.co/w2SYf4h4FD'
1149642208607272960,2019-07-12 11:30:36,b'Sebab Anak Harus Dibiasakan Bernapas lewat Hidung https://t.co/4UyWiuO2bu'
1149621962735382528,2019-07-12 10:10:09,"b'Kunci Sukses Makeup Artist Bubah Alfian, Pahami Zodiak Klien https://t.co/XYIf0DnoV4'"
1149621959497359360,2019-07-12 10:10:08,b'Tabir Surya dengan SPF Tinggi Belum Tentu Melindungi Kulit https://t.co/c98yXZUe7z'
1149621956473344003,2019-07-12 10:10:08,"b'Kencan Impian Irina Shayk, Cara Klasik dan Bawa Tanaman Tomat https://t.co/IEEsVw5h23'"
1149609870175248384,2019-07-12 09:22:06,"b'Resep Kudapan Unik untuk Keluarga, Omelet Mug https://t.co/4RMDBojUE4'"
1149590243160363015,2019-07-12 08:04:06,b'Sun Face Serum Tabir Surya Ringan untuk Pengguna Makeup https://t.co/ArEqC0X66S'
1149577907762679808,2019-07-12 07:15:05,"b'Bahaya Ibu Hamil Minum Obat Sembarangan, Bayi Lahir Cacat https://t.co/bo09mGUoYa'"
1149549474957516800,2019-07-12 05:22:07,b'Operasi Plastik dan Mengubah Wajah di Mata Tompi https://t.co/XSSt9ryDeW'
1149528461746159616,2019-07-12 03:58:37,b'Ciri Anak yang Rentan Mengalami Bullying di Sekolah https://t.co/AogTmB3ilA'
1149516755804385282,2019-07-12 03:12:06,b'Alasan Tomat dan Buncis Baik buat Kesehatan Jantung https://t.co/Z51SGcjDgD'
1149497129158627328,2019-07-12 01:54:06,b'Bahan Alami untuk Redakan Peradangan Akibat Infeksi Virus Herpes https://t.co/wg5nrQgwc1'
1149497127950622720,2019-07-12 01:54:06,b'Manfaat Prenatal Yoga Tak Hanya Memperlancar Persalinan https://t.co/wS6BnCVsjU'
1149488063510224896,2019-07-12 01:18:05,b'Inspirasi Natalie Portman Menggunakan Produk Kecantikan Alami https://t.co/ITPvlTgmwY'
1149455726080774144,2019-07-11 23:09:35,b'Sistem Imun Tubuh Rendah Lakukan 6 Langkah untuk Cegah Penyakit https://t.co/ZpG3phSR70'
1149366765131972608,2019-07-11 17:16:05,b'Persembahan Stella McCartney buat Penggemar The Beatles https://t.co/Pz2r6zzJ5A'
1149341605469360128,2019-07-11 15:36:07,b'3 Zodiak yang Paling Rentan Mengalami Stres https://t.co/IYTMRrh7db'
1149341601921024000,2019-07-11 15:36:06,b'Tidur Cukup dan Teratur dapat Mencegah Penyakit Metabolik https://t.co/wu5n1T5ViI'
1149333925623259136,2019-07-11 15:05:36,b'Manfaat Main Musik untuk Tumbuh Kembang Anak https://t.co/NmLUXVtusW'
1149310142552268800,2019-07-11 13:31:05,"b'Rutin Lari Tapi Perut Tetap Buncit, Ini 9 Kesalahannya https://t.co/WYqMMEDZvw'"
1149301588558667781,2019-07-11 12:57:06,b'Alasan Zendaya Jadi Inspirasi Gaya Asmara Abigail https://t.co/qf4Y4nrH6d'
1149278309257113601,2019-07-11 11:24:36,b'Victoria Beckham Ungkap Produk Merek Kecantikannya di Instagram https://t.co/1ptyRGpbeC'
1149273403909537792,2019-07-11 11:05:06,"b'Tren Operasi Plastik 2019, Permak Hidung Pakai Tulang Iga https://t.co/RcVFswJLRw'"
1149246600738291714,2019-07-11 09:18:36,b'Barack dan Michelle Obama Bahas Waktu Olahraga saat Konseling https://t.co/5FLiPrOB14'
1149241190883028992,2019-07-11 08:57:06,"b'Pakai Deodoran Lebih Baik Malam Hari, Ini Alasannya https://t.co/7Nj0Fua9gb'"
1149215020548423680,2019-07-11 07:13:06,b'Penyebab dan Gejala Blighted Ovum pada Kehamilan https://t.co/TqlG9Y9huj'
1149208348635439104,2019-07-11 06:46:36,b'Tingkatkan Daya Ingat Lansia dengan Olahraga https://t.co/tvsQ2XPlqr'
1149183182220062720,2019-07-11 05:06:36,"b'Batuk Berdahak Tak Kunjung Sembuh, Waspada Bronkiektasis https://t.co/jT4HD2VYbj'"
1149152106634289152,2019-07-11 03:03:07,"b'Musim Panas Bisa Bikin Kulit Berjerawat, Atasi dengan 10 Tips Ini https://t.co/Bm9DYdc9j6'"
1149152105380237312,2019-07-11 03:03:06,b'Beyonce-Blue Ivy Kompak Pakai Blazer di Premiere The Lion King https://t.co/lNT2SJKKVa'
1149120519825850368,2019-07-11 00:57:36,b'Tips Memilih Tas Sekolah yang Tepat untuk Anak https://t.co/fLHJgecgBt'
1148965373661728768,2019-07-10 14:41:06,b'4 Zodiak yang Mudah Jatuh Cinta dengan Sahabat Sendiri https://t.co/QhgOzOfjZx'
1148965371107409921,2019-07-10 14:41:05,b'7 Kesalahan yang Dilakukan Pasangan di Tahun Pertama Pernikahan https://t.co/jMIufNQOsw'
1148926622411530242,2019-07-10 12:07:07,b'Filosofi Perjalanan Bertujuan ala Zooey Deschanel https://t.co/bPIBtdSAUi'
1148903215481491457,2019-07-10 10:34:06,b'Serena Williams Merawat Kulit dengan Minyak Kelapa Setiap Malam https://t.co/pCaSi40cdG'
1148871879223992321,2019-07-10 08:29:35,b'Jessie J Jadi Vegan Demi Mengatasi Masalah Kesuburannya https://t.co/SM0VFAvSVk'
1148841557232984065,2019-07-10 06:29:06,b'Trik Makeup Pakai Bulu Mata Palsu dalam Hitungan Detik https://t.co/Cw4UPswoGd'
1148841555345567745,2019-07-10 06:29:05,"b""Model Victoria's Secret Ini Berjuang Melawan Anoreksia https://t.co/DMR1w4zhuf"""
1148810601449132032,2019-07-10 04:26:05,"b'Mimpi Hamil Saat Tak Rencanakan Kehamilan, Apa Artinya? https://t.co/cAcogQhg9R'"
1148778519394078720,2019-07-10 02:18:36,b'Penyakit Gondok dapat Diobati dengan Garam Yodium https://t.co/HlXjtffBf6'
1148746432129589249,2019-07-10 00:11:06,b'Penyakit Keturunan yang Menyebabkan Batuk pada Bayi https://t.co/kO5XmXZXAa'
1148622363530936321,2019-07-09 15:58:06,b'Bercinta saat Menstruasi Mungkinkah Bisa Hamil? https://t.co/L31HW1FwoZ'
1148591031266373633,2019-07-09 13:53:36,"b'Susah Tidur Malam Hari Belum Tentu Insomnia, Kenali Gejalanya https://t.co/h6zEmT8oLR'"
1148550008876048385,2019-07-09 11:10:35,b'Camila Cabello Terlihat Energik Tapi Jarang Olahraga https://t.co/DiaLUY3Xfk'
