id,created_at,text
1199923510807683072,2019-11-28 05:30:33,b'Michelle Obama dan dua putrinya kompak memakai gaun dan anting hoop di Hari Thanksgiving 2019. https://t.co/vpKHhhLLGa'
1199923509708779520,2019-11-28 05:30:32,b'Salah satu hal terpenting untuk ayah dalam mendongeng adalah jangan malu menirukan suara lucu atau seram tokoh di cerita. https://t.co/zlRF23c7RE'
1199893059414052864,2019-11-28 03:29:32,b'Bunga Jelitha Ibrani dan Syamsir Alam merancang pernikahan di luar ruangan pada Maret 2020. https://t.co/5NHeaYp26c'
1199893058369646592,2019-11-28 03:29:32,b'Three Days to Kill merupakan film thriller aksi Amerika Serikat yang dirilis pada 2014 silam. https://t.co/He4GxsDzlF'
1199893057144901633,2019-11-28 03:29:32,"b'Ciputra tak hanya pengusaha properti, tapi juga pendiri klub bulu tangkis PB Jaya Raya. https://t.co/ydJajkddZ0'"
1199869529561546753,2019-11-28 01:56:03,"b'Raih Penghargaan, Empat Perempuan Ini Mendobrak Stigma Peneliti https://t.co/fQrKHeksu6'"
1199861854190727168,2019-11-28 01:25:33,"b'Franka Franklin, istri Nadiem Makarim Menteri Pendidikan dan Kebudayaan Republik Indonesia mendongeng di depan anak-anak Sekolah Dasar (SD). https://t.co/VNYvKzipzS'"
1199861853146370048,2019-11-28 01:25:32,b'Koleksi desainer Hanna Khadija menampilkan busana muslim dewasa bertajuk Piece of Circus di Fashion Trend 2020. https://t.co/2dyA5l9rVA'
1199836942742900738,2019-11-27 23:46:33,b'Plank dan 3 Olahraga untuk Mengusir Lemak yang Bikin Perut Buncit https://t.co/Yu2VJN2g2X'
1199711109575368705,2019-11-27 15:26:32,b'6 Cara Simpel Menghilangkan Kerutan di Bawah Mata https://t.co/OJpkNnK05R'
1199707723295678470,2019-11-27 15:13:05,"b'Menurut penata rias Jeannie Vincent di Boston, Amerika Serikat menghapus lipstik matte bisa memakai pembersih berbasis minyak. https://t.co/ONd62YC23c'"
1199707720145747970,2019-11-27 15:13:04,b'Persiapan pernikahan Bunga Jelitha Ibrani dengan Syamsir Alam sudah 70 persen di tahap mengurus surat ke Kantor Urusan Agama (KUA). https://t.co/fhd6Jzmsig'
1199707717503336448,2019-11-27 15:13:04,b'8 dari 10 orang berpotensi kanker serviks dan tidak hanya menimpa orang yang seks bebas. https://t.co/ua8GSl5GQl'
1199707714974171137,2019-11-27 15:13:03,b'Penderita tekanan darah rendah disarankan menyantap makanan kaya kandungan vitamin B12. Apa saja itu? Simak rinciannya di ulasan ini. https://t.co/aYH3vqJY4k'
1199707712054935554,2019-11-27 15:13:02,b'Profesor BPPT ini suka bikin aksesori sendiri karena gelangnya sering putus. https://t.co/wu3uaSYGbv'
1199682794697322496,2019-11-27 13:34:01,"b'Ubah Nama Panggung, Ini Peruntungan Karier Agnez Mo Menurut Pakar https://t.co/VgU38C3cb3'"
1199677017781760000,2019-11-27 13:11:04,b'Rina Ciputra Sastrawinata berkisah selama hidupnya dididik ayahnya menjadi pengusaha properti. https://t.co/R3tFwGFfl7'
1199677015185477632,2019-11-27 13:11:03,"b'Saat mendongeng, ayah cenderung tidak suka membacakan cerita, lebih suka mengarang sembari bermain. Kalau ibu, bagaimana? Cek di ulasan ini. https://t.co/VAMr2GVb8l'"
1199677012807340032,2019-11-27 13:11:03,b'Eniya Listiani Dewi Profesor di Badan Pengkajian dan Penerapan Teknologi (BPPT) ini sedang belajar cara menjual lukisan di e-commerce. https://t.co/2nC6aBiVdP'
1199650590525022214,2019-11-27 11:26:03,"b'Ulang Tahun ke-23, Hailey Baldwin Dapat Jam Tangan Rp 2 Miliar https://t.co/9ZK2BNnz5M'"
1199646682905841666,2019-11-27 11:10:32,b'Para Perempuan Penerus Bisnis Ciputra https://t.co/wdPdM9hBhh'
1199646681765015552,2019-11-27 11:10:31,b'Salah satu cara Kim Kardashian menyeimbangkan waktu untuk keempat anaknya sekaligus berbisnis adalah mematuhi jadwal yang ada. https://t.co/wsfsPV4sOm'
1199529789113061382,2019-11-27 03:26:02,b'Joanna Alexandra mengungkapkan kehadiran suami Raditya Oloan saat ASI eksklusif berpengaruh besar kala masalah menerpa. https://t.co/a61D7KAYCT'
1199508022399160320,2019-11-27 01:59:32,"b'Diet dengan Makan LIma Kali dalam Sehari, Efektifkah? https://t.co/pVDe5ngRdw'"
1199504117200117760,2019-11-27 01:44:01,b'Margot Robbie dan Will Smith beradu akting sebagai penipu ulung di film Focus yang tayang perdana pada 2015 silam. https://t.co/6CNU5iulD1'
1199504116218621952,2019-11-27 01:44:01,b'Pole dance memadukan seni tari dan gerakan senam. https://t.co/d1eXZSVySO'
1199496442160672769,2019-11-27 01:13:32,b'Dongeng Si Kancil yang Baik Hati ala Franka Franklin https://t.co/FyY7c25MAR'
1199473925492629504,2019-11-26 23:44:03,"b'Nyeri payudara atau mastalgia adalah rasa tidak nyaman, sensitif, atau sakit pada bagian dada maupun di sekitar ketiak. https://t.co/mBB5KiNkvF'"
1199468262662131712,2019-11-26 23:21:33,b'Kristen Bell Manfaatkan Frozen 2 untuk Hentikan Pertengkaran Anak https://t.co/bMBJYuY7aN'
1199375144935813120,2019-11-26 17:11:32,"b'Gebetan Jarang Kirim Pesan Teks, Ini 5 Tanda Cintamu Tak Berbalas https://t.co/BJrUROHsMX'"
1199349227983212547,2019-11-26 15:28:33,"b'Pikiran zodiak Aquarius selalu ke mana-mana, meskipun mereka sedang berbicara dengan Anda. https://t.co/Y43HGqGsrb'"
1199349226703974400,2019-11-26 15:28:33,b'Pentingnya sama-sama kita mempelajari 7 safety plan ini untuk mencegah percobaan bunuh diri di lingkungan sekitar. https://t.co/askr0S73EX'
1199349225387020289,2019-11-26 15:28:32,b'Bunga Jelitha Ibrani sudah menjalani vaksin HPV dua tahun silam. https://t.co/kJ8I2xQqeZ'
1199342813361532928,2019-11-26 15:03:04,b'4 Ritual Pagi yang Bikin Anda Merasa Positif dan Bahagia https://t.co/viiHORJjMf'
1199318144289890309,2019-11-26 13:25:02,"b'Menurut Ayu Kartika Dewi, salah satu tugas staf khusus adalah ngide ke Presiden Jokowi. Apa maksudnya? Cek di ulasan berikut. https://t.co/lAUR6wUJ7V'"
1199314377649688583,2019-11-26 13:10:04,"b'Hidup Lebih Tenang, Kuncinya Komitmen Jauhi Pikiran Negatif https://t.co/qileSBet7v'"
1199286059269361664,2019-11-26 11:17:32,"b'Saat orang tua bekerja, upayakan ayah atau ibu tidak melewatkan momen spesial anak, sekalipun acara playdate. https://t.co/7Cl4cj0PWW'"
1199286058145288193,2019-11-26 11:17:32,b'High Heels Agnez Mo Dihiasi Kristal Harganya Rp 13 Juta https://t.co/DxvjgDHv37'
1199130659958091776,2019-11-26 01:00:02,b'Bolehkan Ibu Menyusui Minum Obat Flu? https://t.co/nmzv6pIRjv'
1199130158998802432,2019-11-26 00:58:03,"b'Agnez Mo lihai berganti style busana, tetapi tetap menonjolkan pribadinya. https://t.co/NmeSrAQlXB'"
1199130157035880449,2019-11-26 00:58:02,b'Nikita Willy dan 3 seleb ini kerap berbagi unggahan video saat olahraga pole dance di media sosial. https://t.co/log3fAyXV4'
1199007604841701377,2019-11-25 16:51:04,b'Jika anak laki-laki disunat saat baru lahir bisa sembuh dengan cepat dan lebih tahan terhadap stres. Mengapa? Cek alasan medisnya di sini. https://t.co/r0aY6TSXeK'
1199007601985347584,2019-11-25 16:51:03,"b'Untuk warna kulit yang lebih gelap, Anda dapat memilih lipstik warna intens seperti merah tua, anggur, beri, dan merah bata. https://t.co/ED7ZAOdsh2'"
1199005593727459328,2019-11-25 16:43:04,b'Selain Banyak Bergerak Bawang Putih Juga Ampuh Redakan Pegal Linu https://t.co/tFo7IPvM3G'
1198976392831987712,2019-11-25 14:47:02,"b'Sunat memperkecil peluang anak laki-laki terkena infeksi saluran kemih, terutama di satu tahun pertama usianya. https://t.co/MwLPbsHUCY'"
1198972994699161600,2019-11-25 14:33:32,b'Membuat Rencana Keamanan dapat Mencegah Bunuh Diri https://t.co/5zGZoEdwY0'
1198944559654301696,2019-11-25 12:40:32,b'Christina Aguilera memakai busana serba putih rancangan Jean Paul Gaultier https://t.co/iVHCnqAt0N'
1198944178916356096,2019-11-25 12:39:02,"b'Diet Golongan Darah B, Ini Jenis Makanan yang Boleh dan Dihindari https://t.co/EepOwLsD4G'"
1198923544496766976,2019-11-25 11:17:02,b'Agnez Mo dan 2 Seleb Pakai Gaun Cerah di American Music Awards https://t.co/I1X6DGpp0z'
1198914237311012864,2019-11-25 10:40:03,"b'Istri Ahok, Puput Nastiti Devi kerap meluangkan waktu dengan teman-teman perempuannya. https://t.co/UzKmulqtKm'"
1198914235448709122,2019-11-25 10:40:03,b'Hailey Baldwin berulang tahun pada 22 November 2019. https://t.co/7CW6v72W2x'
1198914233770971137,2019-11-25 10:40:02,b'Taylor Swift memikat dengan gaun hijau bermanik-manik potongan asimetris di American Music Awards 2019. https://t.co/8U8Ecu4TrP'
1198883654283350016,2019-11-25 08:38:32,"b'Ani Idrus Kelahiran Sawahlunto, Sumatera Bara, pada 25 November 1918 dan meninggal pada 9 Januari 1999. https://t.co/kL1fN7rIWd'"
1198852326691262464,2019-11-25 06:34:02,b'Mandi dengan air panas terlalu lama bisa menghilangkan minyak alami pelindung kulit. Simak tips lain untuk mencegah kulit kering. https://t.co/SnzxXrVZVD'
1198852325227450369,2019-11-25 06:34:02,"b'Minum kopi saat dehidrasi bisa membuat Anda semakin haus, sebabnya adalah kandungan kafein. https://t.co/pvCb9k0Fvc'"
1198820618755436544,2019-11-25 04:28:03,b'Happy Salma beserta suami Tjokorda Bagus Dwi Santana Kertayasa pentingkan jiwa seni untuk pribadi kedua anaknya di masa depan. Alasannya? https://t.co/DMrLsMWMMW'
1198820616675004416,2019-11-25 04:28:02,b'Pengaplikasian tabir surya setiap dua jam saat berada di luar ruangan menjadi rutinitas merawat kulit wajah. Langkah lainnya? Cek di ulasan berikut. https://t.co/51WHVTClsK'
1198788532191412227,2019-11-25 02:20:33,"b'Goo Hara ditemukan meninggal dunia oleh rekannya pada Minggu sore, 24 November 2019. https://t.co/mBKORnxAvP'"
1198788530937294849,2019-11-25 02:20:32,b'Hari Guru diperingati setiap tanggal 25 November. https://t.co/jCO7skZ7Y9'
1198788149079461888,2019-11-25 02:19:01,b'Alasan Kim Kardashian Warna Pakaian Dalam dengan Kantong Teh https://t.co/tHtbDJyLmC'
1198757829575770112,2019-11-25 00:18:33,"b'Ayu Kartika Dewi membangun Sabang Merauke bersama Aichiro Suryo, dan Dyah Widiastuti pada 2012. https://t.co/cuavSYXOlg'"
1198757828564926464,2019-11-25 00:18:32,b'Zee Zee Shahab dan Soraya Larasati bangun komunitas Perempuan Berlari (Peri). https://t.co/8bnu5vNBuM'
1198756070887346176,2019-11-25 00:11:33,"b'Goo Hara Hobi Menjahit, Ini Manfaatnya untuk Kesehatan Mental https://t.co/99OZ8sKE7J'"
1198635271635394560,2019-11-24 16:11:32,"b'Selain Olahraga, 7 Cara Ini Dapat Meredakan Stres https://t.co/TZZjvJfWlw'"
1198633765871865856,2019-11-24 16:05:33,b'Saat bertengkar Aries dan 5 zodiak ini mempertimbangkan memilih putus cinta selama musim liburan. https://t.co/zeT0NtS3uV'
1198602808905256962,2019-11-24 14:02:33,"b'Franka Franklin Tak Lepas dari Aksesori, Ini Favoritnya https://t.co/WI5u6NixQH'"
1198601922850111490,2019-11-24 13:59:02,"b'Franka Franklin memilih menutup rapat soal keluarga sesuai kesepakatan dengan suaminya, Nadiem Makarim. https://t.co/6VkrZaFXjE'"
1198574875754917891,2019-11-24 12:11:33,b'8 Desain Balkon yang Nyaman Buat Nongkrong di Rumah https://t.co/sqE7tqz4ok'
1198571227691880448,2019-11-24 11:57:03,b'Diet ketogenik mampu mengaktifkan satu sel pada paru-paru yang sebelumnya tidak terkait dengan respon sistem kekebalan tubuh terhadap influenza. https://t.co/hQgS8uOjoF'
1198571225041125376,2019-11-24 11:57:03,"b'Wonderful Indonesia Week atau WIW 2019 dihelat di Hotel Movenpick Jeddah, Arab Saudi, selama lima hari dari 15-19 November 2019. https://t.co/QMSSqVyfx0'"
1198542162444423168,2019-11-24 10:01:34,b'Nikita Willy dan 3 Selebriti Ini Olahraga Pole Dance https://t.co/w4Eu7SmGm1'
1198540527051788288,2019-11-24 09:55:04,"b'Tak sekadar goresan, menggambar juga bisa membantu lepaskan stres, seperti yang dilakukan aktris Sheila Dara. https://t.co/iDhFbKEWbz'"
1198540524010893313,2019-11-24 09:55:03,"b'Suami tidak tertekan ketika istri membantu pendapatan, tapi saat istri mulai mendominasi penghasilan rumah tangga, para suami merasa tidak aman. https://t.co/q0zjDxHOIg'"
1198510322820075520,2019-11-24 07:55:02,b'3 Kacamata Keren Suzy di Drama Vagabond https://t.co/vQnyHfI9oN'
1198508689159643141,2019-11-24 07:48:33,b'Drama Korea Vagabond yang dibintangi Suzy dan Lee Seung Gi telah berakhir pada 23 November 2019. https://t.co/PKkVCBXcfM'
1198508686672457728,2019-11-24 07:48:32,b'Olahraga pole dance yang digemari Nikita Willy diberi predikat It-Fitness Trend oleh Majalah Vogue. https://t.co/QKttxOg4qq'
1198476726625394689,2019-11-24 05:41:32,"b'Veronica Tan mencontohkan urusan paling sederhana yang dihadapi sebagian besar perempuan, khususnya yang sudah menikah. https://t.co/bBodkQ38ba'"
1198476725564215296,2019-11-24 05:41:32,"b""Pagelaran busana tahunan Victoria's Secret pertama kali digelar pada 1995 dan identik dengan supermodel kelas dunia. https://t.co/EjcfVdelSJ"""
1198476724280840193,2019-11-24 05:41:32,"b'Resep caramel frappucino ini hanya membutuhkan enam bahan yang ada di dapur dan kulkas kamu. Yuk, coba di akhir pekan ini. https://t.co/QXAMuKYwhW'"
1198476723106353152,2019-11-24 05:41:32,"b'Istri Ahok senang berbusana simpel, motif minimalis, dan warna-warna gelap. https://t.co/DM8lsYWcsW'"
1198450302694780928,2019-11-24 03:56:32,b'Jadi Relawan Bantu Temukan Makna Hidup dan Kesehatan Mental https://t.co/XTJPRrlEqW'
1198445905189322754,2019-11-24 03:39:04,b'Salah satu cara efektif untuk menghadirkan kemewahan di dapur modern adalah menambah aksen kayu. Selain itu? Simak tips di ulasan berikut. https://t.co/XbJHzXUIFQ'
1198445902723051520,2019-11-24 03:39:03,b'Bella Hadid tidak stabil secara emosional untuk sementara waktu ketika bekerja 14 jam sehari selama empat bulan berturut-turut saat 18 tahun. https://t.co/DAd4aH8OCo'
1198418338898006016,2019-11-24 01:49:32,"b'Goji Berry Buah Super, Ampuh Lawan Penuaan dan Jaga Berat Badan https://t.co/2K6Z7Oxf70'"
1198414816622170112,2019-11-24 01:35:32,"b'Sutradara Dua Garis Biru, Gina S. Noer ungkap menjadi sutradara ternyata lebih stres ketimbang saat mempersiapkan pernikahannya. https://t.co/EfS8mpHIxJ'"
1198414815561019393,2019-11-24 01:35:32,"b'Makanan yang direkomendasikan bagi penderita maag tidak hanya aman dikonsumsi, tapi juga bisa membunuh bakteri penyebab maag, yakni H. pylori. https://t.co/xtLblSGe2V'"
1198390284536532993,2019-11-23 23:58:03,"b'Punya Tekanan Darah Rendah Batasi Karbohidrat, Ini 5 Makanan Lain https://t.co/OAFxeDlEZ5'"
1198265204867387393,2019-11-23 15:41:02,b'Mengenal Akar Gobo dan Manfaatnya untuk Kesehatan https://t.co/wytw7M1xja'
1198259293662765056,2019-11-23 15:17:32,"b'Makanan yang kaya akan zat pemicu tidur tertentu seperti triptofan, melatonin, dan serotonin sangat baik untuk membantu anak Anda mudah terlelap. https://t.co/kYo4yMkxor'"
1198259291968290816,2019-11-23 15:17:32,"b'Pelembap sekaligus primer milik Victoria Beckham tidak hanya melembapkan, tapi juga membuat kulit lebih bercahaya. Apa saja bahannya? https://t.co/lACkwqmVSy'"
1198232614492000259,2019-11-23 13:31:32,b'5 Langkah Perawatan Kulit Anti Ribet untuk Anda yang Sibuk https://t.co/yVILfNkIJ4'
1198228342694010881,2019-11-23 13:14:33,"b'Saat menonton drama atau film secara maraton, sebaiknya bergerak setiap setengah jam. Mengapa? Berikut paparan ilmiah dari psikolog. https://t.co/9LGWIJocaz'"
1198228341553164290,2019-11-23 13:14:33,"b'Pelaku fashion muslim nasional harus mampu menangkap perubahan, berkreativitas, dan berinovasi. https://t.co/SQmwp4KmxM'"
1198203929038712832,2019-11-23 11:37:32,"b'Cerita Angkie Yudistia, Tunarungu yang Jadi Staf Khusus Presiden https://t.co/efK96c0GLL'"
1198197134694027264,2019-11-23 11:10:32,b'Zara JKT 48 sempat ragu main di film Dua Garis Biru karena ceritanya yang mengangkat isu sensitif. https://t.co/3HM61eCnWV'
1198197133662285824,2019-11-23 11:10:32,"b'Kamar mandi kotor sama dengan sanitasi buruk, bila berkepanjangan bisa menyebabkan stunting pada anak-anak. https://t.co/HoWehCmWjU'"
1198197132508876801,2019-11-23 11:10:32,b'Salah satu trik fashion yang dibagikan penata gaya Bimo Permadi adalah memakai celana pendek high waist untuk menciptakan efek kaki panjang. https://t.co/J4KqVvzt14'
1198171462198124544,2019-11-23 09:28:32,b'Peragaan Busana Istri Pejabat Sumsel di Pasar Tiban Anne Avantie https://t.co/2GJT8tEfGL'
1198165051347107840,2019-11-23 09:03:03,b'Nadiem Makarim dan Franka Franklin menikah pada 2014. https://t.co/IgqQ4xOlAj'
1198143026171764738,2019-11-23 07:35:32,b'5 Zodiak yang Tak Suka Mendengar Curhat Orang Lain https://t.co/mzVZ7LCSQg'
1198134222621302784,2019-11-23 07:00:33,"b'Happy Salma memiliki dua anak, Tjokorda Sri Kinandari Kerthyasa (4 tahun 7 bulan) dan Tjokorda Ngurah Rayidaru Kerthayasa (1 tahun 2 bulan) https://t.co/psv0WWoxMS'"
1198134219890778113,2019-11-23 07:00:32,b'Emma Sri Martini meraih gelar sarjana sarjana Teknik Informatika dari Institut Teknologi Bandung pada tahun 1993. https://t.co/A03SQUPgHH'
1198134217596530689,2019-11-23 07:00:32,"b'Ciri toilet bersih tidak berbau, tidak licin (pada lantai), tidak ada kerak atau noda kuning pada berbagai area toilet. https://t.co/RyoM8NXIUg'"
1198111066359648256,2019-11-23 05:28:32,b'Khawatir Anak Anda Mengalami Perundungan? Kenali Tanda-tandanya https://t.co/fKZsEK1TXD'
1198103640348577793,2019-11-23 04:59:02,b'Angkie Yudistia melalui Thisable Enterprise menyalurkan penyandang disabilitas ke berbagai bidang kerja sesuai kemampuan dan keterampilan mereka. https://t.co/32ey29g2rS'
1198103638498930689,2019-11-23 04:59:01,b'Kebosanan seringkali dapat membuat kehidupan rumah tangga menjadi tidak peduli satu sama lain. https://t.co/RjOBcIagF0'
1198092190695612417,2019-11-23 04:13:32,b'Salah satu syarat memilih furnitur bagi Anda yang sering berpindah-pindah rumah adalah furnitur portabel yang sifatnya ringan dan ringkas. https://t.co/C6bN0FphQn'
1198092189370212353,2019-11-23 04:13:32,b'Sandrina Malakiano berhijab sejak Desember 2005. https://t.co/ncn88beNgk'
1198079105897418752,2019-11-23 03:21:32,"b'Sabang Merauke, Cara Ayu Kartika Dewi Rawat Toleransi Indonesia https://t.co/3U8sgQNT9v'"
1198072440640823296,2019-11-23 02:55:03,"b'Tanda klasik kekurangan sayuran adalah kram otot, terutama usai berolahraga di luar ruangan. https://t.co/WZSe5lHrUv'"
1198072438740803584,2019-11-23 02:55:03,"b'Koleksi hijab dan busana yang dipamerkan Noor x Jenahara dilengkapi teknologi Nano Tech dan Air Tech. Penasaran? Yuk, simak di ulasan ini. https://t.co/1PRWzVfGl4'"
1198046519678521344,2019-11-23 01:12:03,b'Cara Kim Kardashian Menyeimbangkan Karier dengan Keluarga https://t.co/urjNnxCHQ5'
1198041105066938370,2019-11-23 00:50:32,"b'Sebuah penelitian bahkan mengungkap protein, kalsium, dan zat besi yang dikandung pada bayam merah lebih tinggi dari bayam hijau. https://t.co/f7mvrtK4XV'"
1198018838266167296,2019-11-22 23:22:03,"b'5 Jus Buah untuk Mengatasi Sembelit, Ada Lemon dan Pir https://t.co/D1Wss9RrRO'"
1197893389783420929,2019-11-22 15:03:34,"b'Tips Memilih Kacamata Sesuai Bentuk Wajah, Mana yang Tepat? https://t.co/RiPgvc9hcy'"
1197888099151253504,2019-11-22 14:42:33,"b'Istri Nadiem Makarim, Franka Franklin tak pernah setengah-setengah dalam melakukan sesuatu. https://t.co/fDC04NcdDd'"
1197888097863618561,2019-11-22 14:42:32,b'Pria juga ingin dihargai dan dipuji usaha maupun pekerjaannya. Cek cara lain membuat pasangan Anda merasa spesial. https://t.co/3B4FEIBY1V'
1197888096542420992,2019-11-22 14:42:32,b'Makeup artist Vinna Gracia pentingkan hidrasi dan eksfoliasi untuk merawat kulit wajah pengantin. Apa alasannya? https://t.co/JByuIp4G9y'
1197864943451656192,2019-11-22 13:10:32,"b'Mandy Moore Merasa Lebih Sehat di Usia 35 Tahun, Ini Rahasianya https://t.co/GqWK4B7mkf'"
1197856275834368001,2019-11-22 12:36:05,b'Tidak selalu menyalahkan orang lain bisa bantu karier cemerlang sekaligus ciri kecerdasan emosional. https://t.co/4pwbHbfdZY'
1197856273976315908,2019-11-22 12:36:05,b'Gempi dan Gading Marten pakai kaus yang kompak saat bertemu duo Honne di Jakarta pada Kamis 21 November 2019. https://t.co/d8IYFrpIcP'
1197856270885126145,2019-11-22 12:36:04,"b'Banyak sampel mi instan di dunia telah diuji positif mengandung banyak logam berat seperti timah, merkuri, arsenik, dan tembaga. https://t.co/D9kL5Ckn6R'"
1197856266523037696,2019-11-22 12:36:03,b'Franka Franklin paling sering pakai anting karena mudah pemakaiannya. https://t.co/rQPPdCesoM'
1197837509209645057,2019-11-22 11:21:31,"b""Rating Buruk, Victoria's Secret Batalkan Fashion Show Tahunan https://t.co/lKlVHSWcue"""
1197830344826707968,2019-11-22 10:53:03,b'Hasil riset Unilever baru-baru ini menunjukkan ada sekitar 100 juta kuman di dalam toilet. https://t.co/BXISilB1jL'
1197824805434621953,2019-11-22 10:31:02,b'Kamar mandi yang basah dan lembap bisa meningkatkan perkembangbiakan kuman dan bakteri di dalam sana. https://t.co/s9ecN2mc8x'
1197824802481795072,2019-11-22 10:31:02,"b'Ketidaktahuan Zaskia Adya Mecca tentang desain, cara membuat pola dan gambar sempat mengurungkan niatnya mengikuti fashion show. https://t.co/bhAxG5AbQB'"
1197824800959262720,2019-11-22 10:31:01,"b'Sempat menyalahkan kondisinya yang dinilai tak sempurrna, bermodalkan semangat Angkie Yudistia bangkit dan menerima keadaan. https://t.co/4TR2fm2qnZ'"
1197763525029969921,2019-11-22 06:27:32,b'Fashion pilihan Putri Tanjung selalu simpel dan kasual lewat warna ataupun outer. https://t.co/ueJeMNh4os'
1197731696646356992,2019-11-22 04:21:03,b'Menghentikan konsumsi daging dalam menu harian Anda dapat memicu risiko kekurangan zat besi. https://t.co/yR18k3tdwT'
1197710170375110656,2019-11-22 02:55:31,b'Dehidrasi? Hindari Minuman Energi dan Jus Buah Kemasan https://t.co/pGmrrKg07i'
1197700864351145984,2019-11-22 02:18:32,"b'Modest sporty tak hanya mementingkan bahan busana, tetapi juga potongan desain modis. Seperti apa, ya? Cek di ulasan berikut. https://t.co/hv2KYrRu1I'"
1197700863340376066,2019-11-22 02:18:32,"b'Dalam 15 menit pertama bangun tidur, 4 dari 5 orang memeriksa ponsel. https://t.co/Llfra8qIFj'"
1197677835055288320,2019-11-22 00:47:02,b'Staf Khusus Presiden Putri Tanjung Dididik Mandiri Sejak Kecil https://t.co/NLHXsN17AD'
1197667524814336001,2019-11-22 00:06:04,"b'Putri Tanjung menjadi yang termuda di antara staf khusus presiden lainnya. Kini, ia berusia 23 tahun. https://t.co/fNw6ONaNF7'"
1197557167085146113,2019-11-21 16:47:32,b'4 Zodiak Ini Tak Berhenti Mengirimkan Pesan Teks Buat Pacarnya https://t.co/bFDtUK7Oa9'
1197544959429115904,2019-11-21 15:59:02,"b'Bercinta usai persalinan caesar, jangan pilih posisi seks yang membuat perut istri tertekan. https://t.co/FeolwFs4RR'"
1197529868273115142,2019-11-21 14:59:04,b'Alyssa Soebandono pilih ramuan alami untuk menjaga tahan tubuh di musim pancaroba. https://t.co/2lhMvGTWJ8'
1197529862841475073,2019-11-21 14:59:02,b'Reckitt Benckiser (RB) Indonesia melalui merek kondomnya Durex membuat survei online kepada pasangan yang baru menikah di 5 kota besar di Indonesia. https://t.co/rDJZFF8whv'
1197528851716493314,2019-11-21 14:55:01,b'Ragam Outer Pilihan Angkie Yudistia Staf Khusus Presiden https://t.co/tFEAjraLAO'
1197513630083772416,2019-11-21 13:54:32,b'Putri Tanjung mengasah jiwa entrepreneurship sejak duduk di bangku Sekolah Menengah Atas (SMA) https://t.co/BeU1GUemWp'
1197495884323274754,2019-11-21 12:44:01,"b'Fashion Edgy Anna - Elsa di Frozen 2, Jubah Khusus dan Sepatu Es https://t.co/G7VCfZFGl7'"
1197483305639149568,2019-11-21 11:54:02,"b'Untuk masker, Marshanda tak memakai sheet mask yang sedang tren saat ini. https://t.co/MlO5vNyJ8t'"
1197475881943326721,2019-11-21 11:24:32,b'Panduan Diet Tanpa Nasi yang Bikin Berat Badan Cepat Turun https://t.co/sOdSpxKNqA'
1197452226807005184,2019-11-21 09:50:33,b'Pemilik Pisang Goreng Madu Bu Nanik ungkap pentingnya berhemat dan menabung dalam mengelola keuangan bisnis. https://t.co/a1xj8jsG2x'
1197452225250906112,2019-11-21 09:50:32,"b'Dalam diet K-Pop, segala asupan yang mengandung lemak dan gula tinggi tidak diperbolehkan. https://t.co/sCSMXvfSV0'"
1197420394954678272,2019-11-21 07:44:03,"b'Generasi milenial sangat mementingkan tujuan, jadi libatkan mereka ke dalam sesi pengambilan keputusan untuk memotivasi dan latihan leadership. https://t.co/FBtJqCuT72'"
1197420391389515776,2019-11-21 07:44:02,b'Tipe putra pertama Dian Sastro yang autisme lebih visual daripada audio. https://t.co/M50zs0hQAg'
1197388681641807872,2019-11-21 05:38:02,"b'Bahan dasar tempe bisa diolah menjadi beragam resep, mulai digoreng, dikukus, perkedel, sambal tempe hingga sayur tempe. https://t.co/u78OZW23lb'"
1197378112448655360,2019-11-21 04:56:02,b'Luna Maya berperan sebagai istri Christian Sugiono penulis novel horor di film Rumah Kentang: The Beginning. https://t.co/aUFAYXFcpv'
1197378110817107968,2019-11-21 04:56:02,"b'MUA Vinna Gracia pentingkan kesehatan kulit wajah saat mengganti produk makeup, bukan brand. https://t.co/cBIb00QUqR'"
1197356977707339776,2019-11-21 03:32:03,b'Salah satu kesalahan minum kopi adalah meminumnya setelah makan makanan pedas dan berminyak. Apa alasannya? Cek di ulasan ini. https://t.co/KffR3YVALv'
1197356974301515776,2019-11-21 03:32:03,b'Membaca buku atau menonton video tentang pertemanan anak dapat menjadi langkah yang baik untuk berbicara pada anak mengenai pertemanan. https://t.co/UJP63cClm2'
1197341748772556800,2019-11-21 02:31:33,b'Evan Rachel Wood Jadi Pengisi Suara Frozen 2 Berkat Doa Anak https://t.co/I6w5fDU9CO'
1197325390022184960,2019-11-21 01:26:32,b'Luna Maya berperan sebagai Sofie yang berprofesi ilustrator di film Rumah Kentang: The Beginning. https://t.co/96cJYFWL2B'
1197325388977864704,2019-11-21 01:26:32,b'Minuman berkarbonasi tidak dianjurkan sebelum olahraga karena dapat menyebabkan kram perut dan mual selama sesi latihan. https://t.co/iEnVpLbwxD'
1197309911983484928,2019-11-21 00:25:02,"b'Zee Zee Shahab Jadi Peri, Ajak Perempuan Lain yang Suka Lari https://t.co/0xj3IW9pbj'"
1197187610705195009,2019-11-20 16:19:03,b'Lelah Mengurus Anak dan 3 Faktor Penyebab Libido Wanita Menurun https://t.co/Xbf9xAUROb'
1197169611264782337,2019-11-20 15:07:32,b'Putri Tanjung mengaku pernah mengalami fase sangat tidak percaya diri serta tidak mengetahui kemampuan diri dan minatnya. https://t.co/XW1MbSDuWw'
1197155019675459584,2019-11-20 14:09:33,b'Dian Sastrowardoyo Dampingi Putranya yang Autisme Terapi Gambar https://t.co/wKXmLZJKFN'
