id,created_at,text
1166715065724092416,2019-08-28 14:12:02,b'Tren Lip Blushing Bikin Bibir Merona Alami dan Bervolume https://t.co/WPjAcZFFrt'
1166714062383661057,2019-08-28 14:08:03,b'Cara Gigi Hadid Merawat Kulit Wajah saat Pekan Mode https://t.co/aEIq5qCsJ1'
1166699213817729026,2019-08-28 13:09:03,"b'Jarang Merawat Kulit, Gigi Hadid Hanya Gunakan Produk dari Apotek https://t.co/pnN4GCcZpn'"
1166687382961184768,2019-08-28 12:22:02,"b'Kirim Pesan Pakai Emoji, Peluang Dapat Pacar Lebih Tinggi https://t.co/ETaQDE9R5A'"
1166682601421099009,2019-08-28 12:03:02,b'10 Ide Ciptakan Ruang Cuci Hemat Tempat dan Multifungsi di Rumah https://t.co/s33TwroiYh'
1166671402205761543,2019-08-28 11:18:32,"b'Olahraga Usai Melahirkan, Ada 7 Hal yang Perlu Diperhatikan Ibu https://t.co/4SCHPNUKzO'"
1166651272692264961,2019-08-28 09:58:33,b'Kiat Anak Dekat dengan Ayah yang Sibuk Bekerja di Luar Rumah https://t.co/lA1EGLkMV8'
1166620195252842496,2019-08-28 07:55:03,"b'Bayi Rewel saat Tumbuh Gigi, Lakukan 5 Hal Ini https://t.co/9eHX5qZ0Qn'"
1166620190605549568,2019-08-28 07:55:02,b'Perawatan Royal Boost Lindungi Kulit Wajah dari Sinar Biru Gawai https://t.co/h0fcSG1gUW'
1166589988374556672,2019-08-28 05:55:02,b'Kenali Tahapan dan Gejala Tumbuh Gigi Bayi https://t.co/yTIzTHKqCq'
1166558410990661633,2019-08-28 03:49:33,b'Hailey Bieber Sering Hapus Media Sosial demi Atasi Kecemasan https://t.co/lfaVBRy6oc'
1166558407656181768,2019-08-28 03:49:32,b'Merawat Rambut ala Margot Robbie di Once Upon a Time in Hollywood https://t.co/PTZ2aUUsVi'
1166534123256594433,2019-08-28 02:13:02,b'Blac Chyna Pakai Gaun Sama dengan Kylie Jenner saat Ulang Tahun https://t.co/Ye6YxsIpe6'
1166527459409313793,2019-08-28 01:46:34,"b'Tanda Obat Kedaluwarsa Kemasan Salep, Gel, dan Produk Injeksi https://t.co/BchJbkZ9pV'"
1166527457588961283,2019-08-28 01:46:33,b'Kunyit dan 6 Bahan Ini Cerahkan Kulit Siku Lutut yang Gelap https://t.co/UQbgvUKt0J'
1166527456083238912,2019-08-28 01:46:33,"b'Ciri-Ciri Obat Kedaluwarsa Mulai dari Warna, Bau hingga Rasa https://t.co/en0QYuneDP'"
1166502035472019457,2019-08-28 00:05:32,b'Makeup Ikonik Margot Robbie di Once Upon a Time in Hollywood https://t.co/GYUb7Br5C7'
1166496625545502720,2019-08-27 23:44:02,b'Trik Menghapus Maskara Waterproof Tanpa Membuat Bulu Mata Rontok https://t.co/K3CaexT2bS'
1166380363431571456,2019-08-27 16:02:03,b'5 Tanda Harus Melupakan Gebetan https://t.co/zjBsFqV7iD'
1166373066949050368,2019-08-27 15:33:03,b'Scorpio dan 2 Zodiak Ini Sering Terjerat Hubungan Cinta-Benci https://t.co/WT2ozYPV4E'
1166373063971106817,2019-08-27 15:33:03,b'Ciri-Ciri Bahasa Tubuh Teman Kencan Anda sedang Bosan https://t.co/WL8gw8EbVO'
1166347896993636352,2019-08-27 13:53:02,"b'6 Kepribadian Khas Virgo, Zodiaknya Luna Maya https://t.co/8cYycGug5P'"
1166341354298888192,2019-08-27 13:27:03,b'Watson Luncurkan Pink by Pure Beauty https://t.co/r0NFWI2LOa'
1166318829263175681,2019-08-27 11:57:32,b'Cegah Asam Lambung Naik dengan 5 Kebiasaan Ini https://t.co/ukNWOBTyUf'
1166310524994211840,2019-08-27 11:24:32,b'5 Selebriti dengan Fashion Terbaik di MTV VMA 2019 https://t.co/tx1aX4O9xQ'
1166309894514855936,2019-08-27 11:22:02,b'Curhat Riset Rinaldy Yunardi Merancang Aksesori Khas Indonesia https://t.co/EfDm3Isops'
1166180793892229120,2019-08-27 02:49:02,"b'Waspada, Anak Perempuan Lebih Rentan Terpapar Bahaya Media Sosial https://t.co/2mbzLV6N4a'"
1166180791908306944,2019-08-27 02:49:02,b'Luna Maya Tampil Kece dengan Fashion Transparan di Pesta Ultahnya https://t.co/UThRLnVoY1'
1166164820187480064,2019-08-27 01:45:34,b'Skim Solutionwear Nama Baru Merek Pakaian Dalam Kim Kardashian https://t.co/pbbTAVkMql'
1166149843732987904,2019-08-27 00:46:03,b'Ketahui Pil Kontrasepsi yang Aman bagi Ibu Menyusui dan ASI https://t.co/lvxZqw71My'
1166149842260783104,2019-08-27 00:46:03,"b'Rutinitas Kecantikan Sebelum Lari, Pilih Produk yang Ringan https://t.co/96bexV43PO'"
1166149840318783490,2019-08-27 00:46:02,b'Mau Hamil Lagi Usai Melahirkan? Pahami Waktu dan Aturan Ini https://t.co/sncfsP4wxh'
1166132477049458688,2019-08-26 23:37:02,b'Makeup Flawless Mutia Ayu di Hari Pernikahannya https://t.co/N0qAYctL0q'
1166119389927620608,2019-08-26 22:45:02,"b""Peserta Berdandan Sebelum Lari di Beauty Fit 'n Fab Run Bandung https://t.co/mfqduWEW6p"""
1166038736842309637,2019-08-26 17:24:33,"b'Rahim Ganda, Wanita Ini Melahirkan Bayi Kembar Beda 11 Minggu https://t.co/HKjBBKAKDK'"
1166009797331709952,2019-08-26 15:29:33,"b'Roti Goreng Telur Manis, Resep Praktis untuk Bekal Sekolah Anak https://t.co/tCPJw6aNcy'"
1165996836701687808,2019-08-26 14:38:03,b'4 Zodiak yang Senang Berdebat dengan Pasangan https://t.co/jPpi9LWmvS'
1165996831186153472,2019-08-26 14:38:02,b'5 Manfaat Buah Ceri dari Berat Badan sampai Mengatasi Jetlag https://t.co/kHvrCnlWk5'
1165977453182865408,2019-08-26 13:21:02,b'6 Hal yang Perlu Diketahui Sebelum Melakukan Filler Pipi https://t.co/7rMeoTCOc6'
1165966388806090753,2019-08-26 12:37:04,"b'Ciri Umum Orang Introvert, Sering Terlihat Bengong dan Menyendiri https://t.co/efzmSAdJe8'"
1165949269292933120,2019-08-26 11:29:02,"b'Rutinitas Kecantikan Camila Morrone, Kekasih Leonardo Di Caprio https://t.co/BhyjG06Mbs'"
1165935928080097280,2019-08-26 10:36:01,b'4 Cara Mengencangkan Kulit Kendur Usai Menurunkan Berat Badan https://t.co/WQvALzPYd8'
1165904475447414784,2019-08-26 08:31:03,"b'Aktivitas Padat Tak Sempat Bebenah Rumah, Simak 5 Tips Ini https://t.co/sRzsNMeI64'"
1165871884891635712,2019-08-26 06:21:32,"b'Setelah Lady Gaga, Selena Gomez Bakal Luncurkan Merek Kecantikan https://t.co/2u49T6IfZ9'"
1165841685877645312,2019-08-26 04:21:32,"b'Berhenti Konsumsi Gula, Siap-siap 5 Hal Bakal Terjadi pada Tubuh https://t.co/bSS6tN4m83'"
1165825073476853760,2019-08-26 03:15:32,"b'Kiat Awet Muda Jennifer Garner, Pilih Minum Teh daripada Anggur https://t.co/kDtUIfw89X'"
1165810604789002241,2019-08-26 02:18:02,b'Menambah Vitamin C untuk Kulit dari 5 Produk Perawatan Kulit Ini https://t.co/NQN6KNqCeP'
1165810603039940608,2019-08-26 02:18:02,b'Tips Aman Ibu Hamil Berhubungan di Trisemeter Ketiga https://t.co/2HzYKAcMJo'
1165784559385841664,2019-08-26 00:34:32,b'Ragam Fashion Blake Lively Selama Tiga Kehamilannya https://t.co/WTBJSoB2V5'
1165778769837096960,2019-08-26 00:11:32,"b'Ladies, Waspadai Efek Buruk Minum Kopi saat Perut Kosong https://t.co/GfcOzxHJQf'"
1165764296246054912,2019-08-25 23:14:01,b'Ibu Hamil Trisemster Ketiga Ketahui Perubahan dan Pantangannya https://t.co/kmOa4XRZTw'
1165623119660240896,2019-08-25 13:53:02,b'Angelina Jolie Menahan Tangis saat Antar Maddox Kuliah di Korsel https://t.co/YZK0G0cxvq'
1165610160074575872,2019-08-25 13:01:32,"b'Tips Berbisnis ala Prilly Latuconsina, Tak Harus Bermodal Besar https://t.co/014pEapeMd'"
1165590906432446465,2019-08-25 11:45:02,"b'Berbisnis Sambil Kuliah, Prilly Latuconsina: Jadi Lebih Mudah https://t.co/zPSyldkpbX'"
1165577323736748033,2019-08-25 10:51:04,"b""Menjajal Senam Kardio Pound Fit di Beauty Fit 'n Fab Run Bandung https://t.co/chJKWTsEmV"""
1165560205402202112,2019-08-25 09:43:02,"b'Rebranding Illy Wears, Prilly Latuconsina Siapkan Koleksi Baru https://t.co/ln0s0AsTxN'"
1165548877996363776,2019-08-25 08:58:02,"b'Tips Tetap Cantik saat Lari, Jangan Lupa Pelembap dan Tabir Surya https://t.co/TyDrXjf5VU'"
1165515915280011264,2019-08-25 06:47:03,b'Cara Bunga Jelitha Ibrani Bangkit dari Depresi karena Perundungan https://t.co/D7RVrUiWjf'
1165497415564050432,2019-08-25 05:33:32,"b'Gaya Punk Rock Emma Stone di Cruella, Prequel 101 Dalmatians https://t.co/NQP7Ce7Rc2'"
1165487099031609344,2019-08-25 04:52:32,b'Kuliner Nusantara Bhineka Bahari Dabu-dabu ala Chef APCA https://t.co/I8nVCyUU5H'
1165466210353369088,2019-08-25 03:29:32,"b'Tiga Terapi untuk Anak Autisme, dari Perilaku hingga Okupasi https://t.co/Qjx6irObhP'"
1165454508169650176,2019-08-25 02:43:02,b'Gaya Musim Panas Kate Middleton di Pesta Kebun hingga Wimbledon https://t.co/hDeULzE5dH'
1165422423610667008,2019-08-25 00:35:32,"b""Beauty Fit 'n Fab Run Bandung, Peserta Berdandan Sebelum Lari https://t.co/8zvg8J9jdh"""
1165311311984521216,2019-08-24 17:14:01,b'Pahami Taurus dan 3 Zodiak Ini yang Sulit Mengakui Kesalahannya https://t.co/zID8AGZuz7'
1165311310667476992,2019-08-24 17:14:01,b'Perawatan Gigi Berlubang Ada 5 Tahapannya https://t.co/ZQvFBN9BWZ'
1165297979466502146,2019-08-24 16:21:03,"b'Ragam Pilihan Buah untuk Ibu Hamil, Delima dan Pir di Antaranya https://t.co/n6mC0bjofC'"
1165279230466260992,2019-08-24 15:06:33,b'4 Langkah Memakai Foundation bagi Pemula https://t.co/34H43Tc6dh'
1165269667268587521,2019-08-24 14:28:32,"b'Jangan Berlebihan, Intip Jadwal Perawatan Wajah Sesuai Piramida https://t.co/LTosHH3Imw'"
1165248658557657088,2019-08-24 13:05:04,b'8 Rutinitas yang Wajib Dilakukan Agar Gigi Tetap Sehat https://t.co/mAlaHpsgug'
1165237581849563137,2019-08-24 12:21:03,"b'3 Zodiak yang Cocok jadi Pasangan Kencan Virgo, Anda Termasuk? https://t.co/sf42YMQ9ph'"
1165217707668541441,2019-08-24 11:02:04,b'Tiru 5 Langkah Ini Agar Menu Camilan Anak Bervariasi https://t.co/cUWX6BnAgU'
1165217702396354561,2019-08-24 11:02:03,"b'4 Kiat Kecantikan Ashley Graham, Tidak Fanatik Satu Merek https://t.co/JQ2tg7LH7k'"
1165204738314358785,2019-08-24 10:10:32,b'Kacamata Terasa Tidak Nyaman? Ini 4 Tips Sederhana Memperbaikinya https://t.co/ApdKbHFxt7'
1165186007760654336,2019-08-24 08:56:07,"b'4 Kiat Olahraga di Cuaca Panas, Jangan Malas Minum https://t.co/lgVG7EdaU1'"
1165186000752017408,2019-08-24 08:56:05,"b'Sedang Diet Tapi Mau Ngemil, Coba Resep Granola Homemade https://t.co/knjvWasy76'"
1165185997438504960,2019-08-24 08:56:04,b'13 Buah yang Baik untuk Kesehatan Ibu Hamil dan Janin https://t.co/8I2tjRrvtC'
1165176170519810049,2019-08-24 08:17:01,b'Cerita Dian Sastro tentang Anak Pertama yang Didiagnosis Autisme https://t.co/Rkurc9KRKx'
1165155290376855552,2019-08-24 06:54:03,b'Mau Dapur Lebih Rapi? Sortir Bumbu Instan dan 4 Benda Ini https://t.co/ZabTOwwNVe'
1165143965454090240,2019-08-24 06:09:03,"b'Alasan Tidak Mencuci Ayam Sebelum Dimasak, Bisa Sebarkan Bakteri https://t.co/rSZX8vhUTm'"
1165123327746166785,2019-08-24 04:47:02,b'Trik Jitu Memilih Maskara bagi Mata Sensitif https://t.co/OJZF5a8rSh'
1165123326093623297,2019-08-24 04:47:02,"b'Trik Agar Anak Tidak Tergantung pada Gawai, Orang Tua Jadi Contoh https://t.co/yLgCmlFkvn'"
1165111875945656320,2019-08-24 04:01:32,b'Tips Aplikasi Foundation Agar Terlihat Natural ala MUA Violette https://t.co/wp00wdbZyY'
1165091367225155584,2019-08-24 02:40:02,"b'Ragam Fashion Blazer Kim So Hyun, Pemeran Kim Jojo di Love Alarm https://t.co/1ft21eXJQ2'"
1165091365585162240,2019-08-24 02:40:02,b'9 Keuntungan Jalan Kaki Bisa Memperkuat Jantung sampai Tulang https://t.co/lsuoucTNDd'
1165083817247301632,2019-08-24 02:10:02,"b'Pamer Sepatu Baru Sepulang Liburan, Kylie Jenner Dikritik Netizen https://t.co/tun7vQuakI'"
1165061172325834753,2019-08-24 00:40:03,b'4 Kiat Membersihkan Stroller di Rumah https://t.co/aaPu8JNNcP'
1165061169058463746,2019-08-24 00:40:03,"b'4 Tips Olahraga Jalan Kaki bagi Pemula, Pilih Sepatu yang Tepat https://t.co/tYx0eckjBq'"
1165051353401421825,2019-08-24 00:01:02,"b'Demi Bayi Sehat, Ini 4 Vitamin dan Mineral Wajib bagi Ibu Hamil https://t.co/vBZg5dNtK3'"
1164960637388091392,2019-08-23 18:00:34,b'Scorpio dan 3 Zodiak yang Suka Bertengkar dengan Pasangan https://t.co/yGOVrphDG6'
1164937727260807168,2019-08-23 16:29:32,b'Libra dan 3 Zodiak Ini Senang Berbagi Perasaan kepada Pasangannya https://t.co/ICIKlgRGxL'
1164928424168706048,2019-08-23 15:52:34,"b'Suka Maraton Nonton Serial Televisi, Awas Binge Watching https://t.co/zonMTF1nhx'"
1164906152120877056,2019-08-23 14:24:04,b'Minum Teh Kamomil Bantu Ibu Baru Melahirkan Tidur Nyenyak https://t.co/qsbzxdxaoW'
1164906148899610625,2019-08-23 14:24:03,b'Tom Ford Perkenalkan Produk Perawatan Kulit Bahan Kafein https://t.co/wD5r13WoYM'
1164896082398072832,2019-08-23 13:44:03,b'Minum Kopi saat Perut Kosong Pagi Hari Pengaruhi Kesehatan Wanita https://t.co/ZVQMTp2yqE'
1164874442427645953,2019-08-23 12:18:04,b'Pertengkaran Suami Istri Bisa Dipicu 3 Perilaku Negatif Berikut https://t.co/qwFlOzCSgY'
1164874439349035008,2019-08-23 12:18:03,"b'5 Manfaat Tidur Teratur untuk Bayi dan Anak, Bisa Cegah Cedera https://t.co/YxOliDDYeg'"
1164867638025043968,2019-08-23 11:51:01,b'Tantangan Rinaldy Yunardi Menciptakan Aksesori Khas Indonesia https://t.co/VInJlxetq4'
1164855308763578368,2019-08-23 11:02:02,b'9 Tanda Kesehatan Mental Anda Terganggu dan Solusi Mengatasinya https://t.co/5bqFVzQmwX'
1164842728464633856,2019-08-23 10:12:02,b'Alasan Meghan Markle Mengagumi Salma Hayek https://t.co/BSSvmragcJ'
1164779810301730817,2019-08-23 06:02:01,b'Resep Udon Goreng Kari Thailand https://t.co/K4GonP1yNV'
1164779809039237121,2019-08-23 06:02:01,b'Trik Latihan Tidur untuk Anak Usia Usia Sekolah https://t.co/zrro5TW3oI'
1164747979627982850,2019-08-23 03:55:32,b'Mau Belanja Makeup? Patuhi 3 Rambu Berikut https://t.co/4vhv2hIQ9Z'
1164747977757347841,2019-08-23 03:55:32,b'Tips Pakai Foundation Tahan Lama ala Makeup Artist Meghan Markle https://t.co/y5bLZ9BINE'
1164717404858961921,2019-08-23 01:54:03,b'Cara Membedakan Warna Lendir Keputihan https://t.co/FYRGvFlq0n'
1164717402652696576,2019-08-23 01:54:02,b'Kenali Sebab Keputihan yang Terjadi Usai Masa Haid https://t.co/7Sxk1Ex2TV'
1164708341383192576,2019-08-23 01:18:02,b'Tangkal Penyakit dengan 9 Makanan Baik untuk Daya Tahan Tubuh https://t.co/dCQD7Sdf5w'
1164685570997547008,2019-08-22 23:47:33,b'Trik Membersihkan Talenan Plastik Tanpa Pemutih https://t.co/GsCIHbqMil'
1164685569466613760,2019-08-22 23:47:33,b'Sumber Makanan Kaya Serat serta Manfaatnya untuk Tubuh https://t.co/NhaZJyo62m'
1164561001162760202,2019-08-22 15:32:33,"b'Nyeri saat Bercinta dengan Pasangan, Perhatikan Alasan Berikut https://t.co/sbRUIJhEEk'"
1164560997505355776,2019-08-22 15:32:32,b'Yogurt Aman Dikonsumsi Ibu Hamil Asalkan Ada 4 Syarat Ini https://t.co/vLWpGr3zeQ'
1164560993466253312,2019-08-22 15:32:31,"b'Ibu Hamil, Yogurt Bermanfaat Atasi Hipertensi dan 5 Kondisi Ini https://t.co/MT4aEUrAw0'"
1164557351514324992,2019-08-22 15:18:03,"b'Nike Rilis Air Max 270 Edisi Khusus, Angkat Isu Kesehatan Mental https://t.co/QerMRqNimj'"
1164530554089271297,2019-08-22 13:31:34,b'Tities Sapoetra Perkenalkan Koleksi Pola Labirin di JFFF 2019 https://t.co/Ug7SsR9edi'
1164530546271125506,2019-08-22 13:31:32,b'Lurik Akik di JFFF 2019 Pamer Busana Modern Batik Lurik https://t.co/A33jB8egA3'
1164524756860751872,2019-08-22 13:08:32,b'Dukungan Sang Putra bagi Selma Blair yang Idap Multiple Sclerosis https://t.co/bZFHSNi9ba'
1164492927478816768,2019-08-22 11:02:03,b'Tips Bergaya Kekinian dengan Celana Jeans Ketat https://t.co/5NoFN7JShS'
1164480970088562693,2019-08-22 10:14:32,b'6 Langkah Berhenti Mengkonsumsi Gula Sehari-hari https://t.co/pFYvFNSkMc'
1164468513529982976,2019-08-22 09:25:03,b'Pentingnya Kehadiran Ayah untuk Mencegah Stunting Sejak Dini https://t.co/YzVyBWX8I7'
1164363696644096001,2019-08-22 02:28:32,b'Fashion Kekinian Sherly Annavita yang Berani Warna dan Layering https://t.co/eXRHnJxgJ9'
1164363694840545280,2019-08-22 02:28:32,b'Calon Ibu Ikuti Pola Makan Berikut untuk Kehamilan Sehat https://t.co/BHlLE8ibEC'
1164332244967677952,2019-08-22 00:23:34,b'Kuas Makeup Rutin Dibersihkan Demi 3 Alasan Ini https://t.co/Hg0Zb1Iob3'
1164332242400714752,2019-08-22 00:23:33,"b'5 Pilihan Makanan Penyubur Kehamilan, Ada Susu hingga Ikan https://t.co/5AACi11sge'"
1164206544449183744,2019-08-21 16:04:04,"b'Jangan Pernah Bohong 4 Hal Ini dengan Pasangan, Termasuk Mantan https://t.co/KJcVXc0tZb'"
1164206539936190464,2019-08-21 16:04:03,b'Leo Paling Cocok Menjalin Hubungan dengan 4 Zodiak Ini https://t.co/IiiIlDvnOD'
1164146145276227590,2019-08-21 12:04:04,b'Cara Membersihkan Noda Cokelat dari Pakaian Anak https://t.co/CnoQ1kcnJC'
1164146142759682048,2019-08-21 12:04:03,b'Trik Memakai Eyeshadow Tanpa Kuas Makeup https://t.co/9MOMx8oLsc'
1164114933866356737,2019-08-21 10:00:03,b'6 Langkah Pertolongan Pertama Atasi Luka Berdarah https://t.co/dbFr1Qhprm'
1164084478249037824,2019-08-21 07:59:01,b'Kain Tenun Balai Panjang Tampil Kedua Kalinya di Fashion Week https://t.co/1N3Qry7Skf'
1164064350195220480,2019-08-21 06:39:03,"b'Cerita di Balik Makeup Natural Meghan Markle, Pakai Aplikasi Ini https://t.co/QfJWVIXUi4'"
1164049128436879360,2019-08-21 05:38:33,b'4 Kiat agar Anak Suka Belajar Matematika Sejak Dini https://t.co/crf0H5H4I6'
1164049126016688129,2019-08-21 05:38:33,"b'8 Bahan Alami untuk Membersihkan Ginjal, Ada Lemon dan Kunyit https://t.co/Mur5XGmXxg'"
1164036169186725888,2019-08-21 04:47:04,"b'Orang Tua Harus Tahu, Ini Etika Mengajak Anak ke Taman Bermain https://t.co/iSaYEEcX05'"
1164017542530097152,2019-08-21 03:33:03,b'Cara Mencuci Sisir Rambut yang Benar Sesuai Bahannya https://t.co/a2YiC2jBnc'
1164017539233402880,2019-08-21 03:33:02,"b'Ragam Fashion Travelling Mutia Ayu, Ada Crop Top dan Topi Baret https://t.co/5R0vY0oJeF'"
1164004329004515328,2019-08-21 02:40:32,"b'Detail Gaun Pengantin Marzia Bisognin, Istri PewDiePie https://t.co/BzknXtEett'"
1163987218521706498,2019-08-21 01:32:33,b'Komplikasi Hipertensi Bisa Picu Gagal Ginjal dan 4 Penyakit Ini https://t.co/QsBEY7O8Aw'
1163987216827158528,2019-08-21 01:32:32,"b'Selain Jeruk, Vitamin C Bisa Diperoleh dari Lemon dan 16 Buah Ini https://t.co/HXkEVkfKtx'"
1163975643891032066,2019-08-21 00:46:33,b'Gaya Rambut Bun ala Stephanie Poetri https://t.co/NScaZbwRHL'
1163956132445999104,2019-08-20 23:29:01,b'Ketahui Ada Piramida Perawatan Kulit Wajah Agar Tidak Kebablasan https://t.co/PSWyly3xgB'
1163956131271602178,2019-08-20 23:29:01,b'Ketahui Manfaat Vitamin C dan Penuhi Jumlah Kebutuhan Hariannya https://t.co/0kcrbNTvPt'
1163849558733934593,2019-08-20 16:25:32,b'3 Zodiak yang Rentan Terlibat Love-Hate Relatioship https://t.co/Na14nJfVGD'
1163821123617738752,2019-08-20 14:32:33,b'Tas Troupe Coach Ada Desain Khusus untuk Milenial https://t.co/IO7NCx7suh'
1163798850705879042,2019-08-20 13:04:03,"b'Bersabarlah Punya Pasangan 5 Zodiak Ini, Mereka Sulit Dimengerti https://t.co/SI11TMKKtV'"
1163789414905966592,2019-08-20 12:26:33,b'Jintan dan 5 Makanan Ini Disarankan Dikonsumsi Setelah Melahirkan https://t.co/Ksj8NEL1sZ'
1163769024569675777,2019-08-20 11:05:31,b'6 Tanaman yang Ampuh Mengusir Nyamuk dari Rumah Anda https://t.co/Hp6yy1zejO'
1163767778660085760,2019-08-20 11:00:34,"b'Kencan dengan Suami, Kim Kardashian Tampil Tanpa Makeup https://t.co/4EYcmJjhmk'"
1163637286459756544,2019-08-20 02:22:03,"b'Sophie Turner-Taylor Swift Pakai Dress Sama, Netizen Beri Pujian https://t.co/2tBnhbCObb'"
1163604695866200064,2019-08-20 00:12:32,"b'Bibir Chrissy Teigen Bengkak karena Angioedema, Apa Itu? https://t.co/wQzEQhVOaz'"
1163503528536498177,2019-08-19 17:30:32,"b'Punya Pacar Leo dan 4 Zodiak ini, Hati-Hati Mereka Mudah Bosan https://t.co/a3omOhLGQi'"
1163482640093048833,2019-08-19 16:07:32,b'5 Tips Sederhana agar Anda Lebih Mudah Tidur Malam https://t.co/aPpJgmA8a3'
1163473204427415553,2019-08-19 15:30:02,"b'Parno Pasangan Selingkuh, Sebabnya Luka Masa Lalu dan 4 Hal Ini https://t.co/bGPJNFwT60'"
1163450428907855872,2019-08-19 13:59:32,b'8 Kiat Memenuhi Kebutuhan Air Putih agar Terhindar dari Dehidrasi https://t.co/YCCGGgiMOg'
1163421623233310726,2019-08-19 12:05:04,b'6 Trik Menggunakan Produk Makeup Sampai Tak Bersisa https://t.co/yr559OaWwz'
1163411422782488576,2019-08-19 11:24:32,b'Ragam Padu Padan Busana Kate Middleton dengan Sepatu Kasual https://t.co/U3TjDEz8T1'
1163411421050224640,2019-08-19 11:24:32,b'Kiat Menjawab Pertanyaan Klasik saat Wawancara Kerja https://t.co/jR8Tv9Afiy'
1163388898531147776,2019-08-19 09:55:02,b'Tiga Warna Pakaian yang Bisa Membuat Anda Tampak Lebih Muda https://t.co/qwsb2eoaR0'
1163380852060913665,2019-08-19 09:23:04,b'Ketahui 6 Aturan Ini Saat Membawa Anak ke Taman Bermain https://t.co/0rl8CB9ww4'
1163380849363918848,2019-08-19 09:23:03,b'Ragam Gaya Rambut Bentuk Bun Stephanie Poetri https://t.co/VnHsYVCrBb'
1163360464903892992,2019-08-19 08:02:03,"b'Karakter Berlawanan, 3 Pasang Zodiak Ini Bakal Sering Ribut https://t.co/nmv4boo2V6'"
1163349142577434624,2019-08-19 07:17:04,b'Konsumsi Makanan Manis Berlebihan Ikut Memicu Hipertensi https://t.co/SLMSu0NLKD'
1163327872699793409,2019-08-19 05:52:33,b'3 Cara Menolak Ajakan Kencan di Media Sosial https://t.co/4CY5gOKMXJ'
1163318434303660037,2019-08-19 05:15:02,b'Berikut Ini Contoh Makanan Asin dan Berlemak Pemicu Hipertensi https://t.co/O0yxJ8cUhs'
1163307612902846464,2019-08-19 04:32:02,b'Luna Maya Luncurkan Nama Beauty Diawali 12 Lip Cream https://t.co/TyFKJYUZGg'
1163307611011178496,2019-08-19 04:32:02,b'Aaliyah Massaid Mengaku Sempat Panik saat Jadi Paskibra di Air https://t.co/6rxjfJOwr1'
1163295785150111744,2019-08-19 03:45:02,b'9 Makanan yang Bikin Awet Muda selain Blueberry https://t.co/e0n842GPYC'
1163286234262728704,2019-08-19 03:07:05,b'Gaun Transparan Bulu-Bulu Priyanka Chopra di Ultah Joe Jonas https://t.co/vwtZS2mQyW'
1163286229275668480,2019-08-19 03:07:04,"b'Fashion Motif Bunga Mantan Ahn Jae Hyun, Goo Hye Sun https://t.co/IfkP1EFzaU'"
1163286224250925061,2019-08-19 03:07:03,b'Cara Victoria Beckham Mengajarkan Tabel Waktu kepada Harper https://t.co/6k6yQTYxtr'
1163267474537627648,2019-08-19 01:52:33,"b'Koleksi Lurik Akik di JFFF, Ada Jumpsuit Paduan Batik dan Lurik https://t.co/DgLL7ELTCU'"
1163254643092152321,2019-08-19 01:01:33,b'Hindari 7 Kesalahan Ini saat Beberes Rumah https://t.co/NdhonSn6Wp'
1163254641716416513,2019-08-19 01:01:33,"b'3 Cara Atasi Hiperhidrosis, Perbanyak Pakaian Katun https://t.co/RCzcuNyemt'"
1163254639636013056,2019-08-19 01:01:32,b'Cara Hapus Bekas Sol Sepatu di Lantai Rumah dengan Bola Tenis https://t.co/3PQ4s1HL7T'
1163250862510112768,2019-08-19 00:46:32,b'Stimulasi yang Tepat untuk Janin sesuai Usia Kehamilan https://t.co/O0ixvLOwsX'
1163234379990089728,2019-08-18 23:41:02,"b'Ashley Graham Pamer Tubuh Hamil dengan Strech Mark, Banjir Pujian https://t.co/2o2YNfsSkS'"
1163224440055840769,2019-08-18 23:01:32,"b'Kenali Penyebab Hiperhidrosis, Telapak Tangan Mudah Berkeringat https://t.co/R0oPyKW6iN'"
1163131705365897217,2019-08-18 16:53:03,b'Berteman dengan Taurus dan 2 Zodiak Ini Jangan Banyak Bergurau https://t.co/YUAdtLnUzT'
1163110821481705474,2019-08-18 15:30:04,"b'Sempat Dibully, Celine Dion Lebih Percaya Diri di Usia 51 Tahun https://t.co/ZbcKH3qgny'"
1163101252944666629,2019-08-18 14:52:02,"b'6 Sinyal Cinta Bertepuk Sebelah Tangan, Ada Rasa Ragu https://t.co/jfcxjxMrB8'"
1163082757313978368,2019-08-18 13:38:33,"b'Susi Pudjiastuti Pilih Bawa Minum Sendiri, Ogah Minum Air Kemasan https://t.co/ZyTaC2QDHJ'"
1163070420527882241,2019-08-18 12:49:31,b'Waspada Dampak Buruk Sharenting untuk Anak https://t.co/wyEcEQ5xbx'
1163050418747744256,2019-08-18 11:30:02,"b'Alasan Anda Harus Keramas Setelah Renang, Jangan Lupa Kondisioner https://t.co/wCeRaJ0DzY'"
1163039976826605568,2019-08-18 10:48:33,b'JFFF 2019 Helat Peragaan Busana di LRT Jakarta https://t.co/kv3pgLeXle'
1163039975593504768,2019-08-18 10:48:33,b'Kenali Apa Itu Polip Rahim serta 3 Cara mengatasinya https://t.co/VmX2he3miZ'
1163018462047817728,2019-08-18 09:23:03,b'Dokter: Garam dan Alkohol Mempercepat Munculnya Kantung Mata https://t.co/CMSnaqbAka'
1163009269899206656,2019-08-18 08:46:32,b'Samarkan Pori-Pori Kulit Wajah dengan Rangkaian Makeup Korea Ini https://t.co/5t2dIF4FjF'
1163009268276031489,2019-08-18 08:46:31,b'Siti Nurhaliza Luncurkan Simplysiti untuk Kulit Wanita Asia https://t.co/H2IbQXVFls'
1162990149770158081,2019-08-18 07:30:33,b'3 Tanda Dia Tidak Tertarik pada Anda di Kencan Pertama https://t.co/0qF464Df34'
1162977692582420482,2019-08-18 06:41:03,"b'Trik Jual Jamu ala Modern untuk Milenial, Inovasi Ada Susu Kelapa https://t.co/CskZeo5zyU'"
1162977689197670402,2019-08-18 06:41:02,b'Resep Selada Timun Telur yang Praktis dan Menyegarkan https://t.co/NRTSEszqI9'
1162957930334830592,2019-08-18 05:22:31,b'Kacamata Chrissy Teigen Diklaim Lindungi Mata dari Sinar Biru https://t.co/ziLJhm0uWW'
1162946106843529216,2019-08-18 04:35:33,"b'Hailey Bieber Si Bunglon Rambut, Yang Terbaru Bob Brunette https://t.co/bQKFZV3nWB'"
1162946105220292609,2019-08-18 04:35:32,b'Rahasia Makeup Flawless Segar Iriana Jokowi di HUT RI ke-74 https://t.co/nbXsmgwynV'
1162926227402788864,2019-08-18 03:16:33,b'Usia Tepat Menggunakan Retinol untuk Melawan Keriput https://t.co/HvA7VfasFy'
1162915783829155840,2019-08-18 02:35:03,b'Begini Pesan Makeup Kahiyang Ayu dan Selvi Ananda untuk HUT RI https://t.co/YT9lEoVvBI'
1162915781899739136,2019-08-18 02:35:02,"b'HUT RI ke-74, Aliya Rajasa Pilih Tampil Kasual dan Bersanggul https://t.co/vzKdxHsPgI'"
1162894516082233344,2019-08-18 01:10:32,b'Trik Tetap Modis dengan Fashion Berkelanjutan ala ESMOD https://t.co/AAbKDN4epY'
1162884956227395584,2019-08-18 00:32:33,b'Dana Pendidikan Perempuan 13 Gelar Akademik Ini sampai Rp 1 M https://t.co/9PI9gXSJso'
1162884954629402625,2019-08-18 00:32:33,b'Cegah Dehidrasi dengan Minum Air Putih di Pagi Hari dan 5 Hal Ini https://t.co/9aPCqJk4MV'
1162865949470384128,2019-08-17 23:17:02,b'Kiat Menjaga Kesehatan Kulit di Tengah Paparan Polusi Udara https://t.co/1zO6m5PpgW'
1162852994817220609,2019-08-17 22:25:33,"b'Bukan Cuma Saat Haus, Berikut 6 Waktu yang Tepat Minum Air Putih https://t.co/XK3KXcls4L'"
1162760258466410497,2019-08-17 16:17:03,b'Cinta Laura Paling Senang 2 Lomba Khas 17 Agustus https://t.co/Jjyr8KYuqU'
1162743774453231617,2019-08-17 15:11:33,"b'4 Zodiak Paling Dramatis, Suka Membesarkan Masalah Kecil https://t.co/Ktw96yvwzC'"
1162711945935347712,2019-08-17 13:05:04,b'Tities Sapoetra Bawa Pola Labirin dalam Koleksi Terbaru di JFFF https://t.co/p5LDcoa4er'
1162696970776924161,2019-08-17 12:05:34,b'8 Inspirasi Desain Kamar Tidur Anak dengan Kasur Twin https://t.co/NhvVdTh9Sn'
