id,created_at,text
1110913716655054848,2019-03-27 14:37:24,b'#FilmBioskopArctic yuk nonton #FilmBioskopArctic'
1110912561577226241,2019-03-27 14:32:49,b'#FilmBioskopArctic baru tau ternyata alurnya bagus banget'
1110912500784984065,2019-03-27 14:32:34,b'Setelah nonton #FilmBioskopArctic baru tau ternyata alurnya bagus banget'
948212420954095616,2018-01-02 15:20:32,b'Babak ini adalah kesempatan untuk para peserta untuk bisa tampil di Indonesian Idol. Semangat wujudkan mimpimu #GrabTakesYouThere #DekatDenganGrab #idolisback'
948212101440401410,2018-01-02 15:19:16,b'RT @kata2bijak: Pertarungan sesungguhnya sudah tiba di depan mata! Babak ini membuka kesempatan untuk para peserta untuk bisa tampil di Ind\xe2\x80\xa6'
947048736898785280,2017-12-30 10:16:28,"b'RT @Official_MNCTV: Buatlah sebuah kalimat dari kata-kata ini: GRAB, INDONESIAN IDOL, DEKAT. Yuk share jawaban kamu sebanyak-banyaknya pake\xe2\x80\xa6'"
946422843562106880,2017-12-28 16:49:24,"b""masih nih @GrabID mau kasih lo pulsa 100rb nih! Coba lo sebutin dulu nama alumni Idol yang berawalan 'R'. Pasti bisa dong? Yuk jawab pake hashtag #IndonesianIdol #GrabTakesYouThere #DekatDenganGrab https://t.co/lkSouDvZka"""
946352382052524032,2017-12-28 12:09:24,"b""Jangan Lupa @GrabID mau kasih lo pulsa 100rb nih! Coba lo sebutin dulu nama alumni Idol yang berawalan 'R'. Pasti bisa dong? Yuk jawab pake hashtag #IndonesianIdol #GrabTakesYouThere #DekatDenganGrab"""
945830401607528448,2017-12-27 01:35:15,b'memenangkan kebahagiaan dlm berbagai kondisi karena kita tak dapat merasakan kesedihan dan kebahagiaan dalam waktu yg sama #GrabTakesYouThere #DekatDenganGrab'
945652292669157378,2017-12-26 13:47:30,b'Stay Tune lagi malam ini Jam 9 WIB stand by nonton @IndonesianIdol agar tau siapa aja yang akan lolos lagi  #GrabTakesYouThere #DekatDenganGrab'
945325593201016832,2017-12-25 16:09:19,b'#indonesianidol selalu bikin baper #GrabTakesYouThere'
945309162979827718,2017-12-25 15:04:02,"b'ngga sabar nonton @IndonesianIdol malam ini. Karena habis liat promonya di Twitter, kayaknya makin seruuu.. #idolisback #GrabTakesYouThere'"
945305821402951680,2017-12-25 14:50:45,b'Wahh baper nih nonton Indonesian IDOL lagi #GrabTakesYouThere'
927130876827205632,2017-11-05 11:10:00,b'Wah lagu #ICbanana dibawa di @asiangames2018 oleh @idanicohen lohh'
927130874805661697,2017-11-05 11:10:00,b'lagu #ICbanana akan dinyanyikan di @asiangames2018 oleh @idanicohen ??'
923713155884187648,2017-10-27 00:49:12,b'RT @kata2bijak: PundiX inovasi produk blockchain memudahkan mendapatkan #bitcoin semudah membeli pulsa @zibin @kiki_cp \nhttps://t.co/iRDqa1\xe2\x80\xa6'
921064310633218050,2017-10-19 17:23:38,"b'indonesia ga kalah loh, movie yg realita dialamin dikalangan kita https://t.co/X9QdVjnWJN tentang #FilmErnestPrakasa , #Ucelebtalk gmn loe? https://t.co/SjA2KrqqPy'"
920949469465624576,2017-10-19 09:47:18,"b'Suka Film Ernest Prakarsa ? komen yuk di ucnews klik  https://t.co/Plm6xBci4U , gw baru aja koment disini juga'"
896925896401014784,2017-08-14 02:46:12,b'Dylan  Carr dan Ammar Zoni rebutan cewe nih! Siapa sih? https://t.co/JUydLeq2x5   #ArtisCinlok #UCelebTalks'
515061955942707200,2014-09-25 08:55:14,"b'Tiap hari di ruangan ber-AC? Agar tetap sehat, simak tips dari @SOPBUNTUTHENNY . Follow sekarang yuk!'"
514039042967891969,2014-09-22 13:10:32,"b'Agar tetap cantik saat bangun tidur, follow @SOPBUNTUTHENNY ! Akan diuraikan tipsnya lho!'"
509689203563982848,2014-09-10 13:05:50,b'ayo follow @SOPBUNTUTHENNY sesaat lg ada 7 Makanan agar Kulit Halus Bebas Jerawat.. skrg yah'
506387271273422848,2014-09-01 10:25:08,"b'Kenali penyebab bau mulut, karena bisa jadi karena penyakit. Simak informasinya di @SOPBUNTUTHENNY . Follow sekarang!'"
504937706087284737,2014-08-28 10:25:05,"b'Jika tubuh bisa menua sebelum waktuya, maka ini adalah makanan yg bisa membuatmu awet muda. Follow dan simak di @SOPBUNTUTHENNY sekarang!'"
502786071663755264,2014-08-22 11:55:15,b'Sering insomnia? Makanan ini bisa membuatmu mudah tidur dimalam hari lho. Coba deh simak dan follow @SOPBUNTUTHENNY sekarang!'
500209097435017216,2014-08-15 09:15:16,"b'Ada berbagai macam jus, tapi jus-jus ini adalah jus yg bermanfaat untuk kesehatan kulit. Coba simak di @SOPBUNTUTHENNY . Follow yuk!'"
499826539681579008,2014-08-14 07:55:08,b'Waduhh!! Ternyata ada 6 fakta mengejutkan ttg menangis! Mau tahu? Follow @SOPBUNTUTHENNY deh sekarang!'
498707925486272512,2014-08-11 05:50:09,"b'Hati2, tubuh bisa menua sebelum waktunya lho! Coba simak tanda penuaan yg akan diuraikan di @SOPBUNTUTHENNY . Kalian harus tahu ya, Follow!'"
497332661162364929,2014-08-07 10:45:21,b'DASYAT! Ternyata ada 7 manfaat buah anggur untuk kesehatan kita. Coba simak infonya di @SOPBUNTUTHENNY sekarang!'
496889664905949185,2014-08-06 05:25:02,"b'Agar otak kanan dan otak kiri seimbang, kamu harus simak dan follow @SOPBUNTUTHENNY , karena akan diuraikan tipsnya sekarang!'"
496587710422085632,2014-08-05 09:25:10,b'Fakta mengenai kebiasaan orang Jepang ini bisa kalian tiru lho! Apa saja? Coba follow @SOPBUNTUTHENNY sekarang juga!'
496246688307494913,2014-08-04 10:50:04,"b'Aktivitas setelah liburan membuatmu lelah? Coba deh simak di @SOPBUNTUTHENNY , akan diuraikan makanan lezat yg bisa meredakan lelah. Follow!'"
491871611503804417,2014-07-23 09:05:05,b'Ternyata ada fakta mengenai manfaat sarapan yg luar biasa. Coba simak di @SOPBUNTUTHENNY abis itu pasti kamu sarapan tiap pagi. Follow yuk!'
487179443983888384,2014-07-10 10:20:05,b'Mau tahu ttg manfaat konsumsi makanan pedas?? Simak deh di @SOPBUNTUTHENNY sekarang. Follow!'
484654096985907200,2014-07-03 11:05:15,"b'Untuk mendapatkan hidangan panggang yang lezat, ikuti 8 trik teknik yg akan diuraikan di @SOPBUNTUTHENNY . Follow yuk!'"
484199892223787008,2014-07-02 05:00:24,b'Di @SOPBUNTUTHENNY akan diuraikan ttg fakta unik makanan berlemak yg bisa bikin langsing. Penasaran? Yuk folllow skrg!'
481728572659621888,2014-06-25 09:20:16,"b'Mau tahu ttg makanan yg bisa turunkan kolesterol? Ini dia, di @SOPBUNTUTHENNY akan diuraikan. Simak deh!'"
480988718195834880,2014-06-23 08:20:21,"b'Kalau gak mau gigimu berlubang, simak deh di @TigerExpressID , akan diuraikan makanan pencegah gigi berlubang. Follow sekarang!'"
480979879576739840,2014-06-23 07:45:14,b'Tahukah kamu bahwa kentang bermanfaat untuk otak? Simak manfaat kentang lainnya di @SOPBUNTUTHENNY . Follow yuk!'
479919133422018560,2014-06-20 09:30:12,b'Kenapa sih makan sambil berdiri itu dilarang? Yuk simak informasinya di @SOPBUNTUTHENNY . Follow sekarang :)'
479913925639933952,2014-06-20 09:09:30,"b'Suka makan yogurt? Simak yuk manfaat yogurt di @SerbaFood , follow dulu ya!'"
479195634306936832,2014-06-18 09:35:16,"b'Hallo, Guys! Kapan sih waktu yg tepat buat makan? Ini dia akan diuraikan di @SOPBUNTUTHENNY . Follow yah!'"
478795184722161664,2014-06-17 07:04:02,b'Gak PD karena bau mulut? Yuk simak deh @TigerExpressID akan diuraikan solusinya. Follow yah!'
478770704960454656,2014-06-17 05:26:45,"b'Udah makan siang? Setelah kalian makan pedas, yuk simak jenis makanan yg bisa hilangkan rasa pedas. Follow @SOPBUNTUTHENNY skrg!'"
478439761947131904,2014-06-16 07:31:42,b'Mau tahu makanan yg bisa cegah rambut rontok? Yuk follow @TigerExpressID !'
478434309855252480,2014-06-16 07:10:03,b'Suka makan daging ayam? Ini dia manfaatnya akan diuraikan di @SOPBUNTUTHENNY . Follow dan simak deh!'
478427229039628288,2014-06-16 06:41:54,b'Mau tahu makanan yg bisa turunkan kadar kolesterol? Yuk follow @SerbaFood sekarang!'
477353625203638273,2014-06-13 07:35:47,"b'Follow @TigerExpressID , akan diuraikan cara terbaik membakar lemak ditubuh, sekarang juga!'"
477348468319465473,2014-06-13 07:15:18,b'Yuk cegah stroke dengan tips yang akan diuraikan di @SerbaFood . Follow dulu yah :)'
477342207116992512,2014-06-13 06:50:25,b'Follow @SOPBUNTUTHENNY  Akan diuraikan makanan yg bisa membantu sehatkan rambutmu! Sekarang!'
476965887854260224,2014-06-12 05:55:03,b'Mau rambut sehat? Yuk konsumsi makanan yg akan diuraikan di @TigerExpressID . Follow dulu yah!'
476958888466862080,2014-06-12 05:27:15,b'Makananmu sering mengandung lada hitam? Apa sih manfaatnya? Simak yuk di @SOPBUNTUTHENNY . Follow skrg!'
476955897550610432,2014-06-12 05:15:22,b'Ternyata tahu sangat bermanfaat lho guys! Ini dia manfaatnya akan diuraikan di @serbafood . Follow yuk!'
476595942469402624,2014-06-11 05:25:02,"b'WOWW!! Ternyata jamur dapat turunkan kolesterol lho! Yuk simak manfaat jamur di @SOPBUNTUTHENNY , follow yahh!'"
476590926295748608,2014-06-11 05:05:06,"b'Hallo Guys!! Simak yuk di @TigerExpressID , akan diuraikan 5 makanan sehat untuk wanita segala usia tuh. Follow yah!'"
476258679470448640,2014-06-10 07:04:52,b'Ingin buah hati lebih tinggi? Yuk simak @TigerExpressID . FOllow dulu yah'
476247548777476096,2014-06-10 06:20:38,"b'Sudah tahu belum kalau ada minuman yg bisa bersihkan tubuhmu dipagi hari? simak yuk di @SOPBUNTUTHENNY , biar kamu sehat. Follow skrg!'"
476227164338401281,2014-06-10 04:59:38,b'Hallo friends. Mau sehat? Yuk konsumsi makanan2 yang sebentar lagi akan diuraikan di @SerbaFood . Follow yah!'
475849823577735170,2014-06-09 04:00:13,b'Suka makan daging sapi? Ini dia di @SOPBUNTUTHENNY akan diuraikan cara aman mengkonsumsi daging sapi. Follow yah!'
474820495649820672,2014-06-06 07:50:02,"b'Agar otak lebih tajam dan fokus, ayo simak caranya di @SOPBUNTUTHENNY . Follow yah'"
474802915933429760,2014-06-06 06:40:11,"b'Jangan sampai mengalami penuaan dini yah, gimana caranya? Simak deh di @TigerExpressID . Follow skrg!'"
474765934335647745,2014-06-06 04:13:14,"b'Untuk mengatasi darah rendah, yuk coba simak di @SerbaFood , akan diuraikan makanan yg bisa turunkan darah rendah. Follow skrg!'"
474451827954814976,2014-06-05 07:25:05,b'Cegah kegemukan bagi wanita kantoran dengan tips yang akan diuraikan di @SerbaFood . Follow yuk!'
474443038925017088,2014-06-05 06:50:09,"b'WOWW!! Di @TigerExpressID akan diuraikan tentang ""Makan fast food sehat kok, asal......"" Follow dan simak yuk!'"
474425391290286080,2014-06-05 05:40:02,b'Wow!! Makanan ini bisa menambah tinggi badanmu lho! Simak yuk di @SOPBUNTUTHENNY . Follow skrg!'
473685536855826432,2014-06-03 04:40:07,b'Mau makanmalam tapi takut gemuk? Di @SOPBUNTUTHENNY akan diuraikan jenis makanan sehat yg direkomendasikan utk makan malam. Follow &amp; simak!'
473677979529510912,2014-06-03 04:10:05,"b'Yukk cegah kanker dengan makanan sehat yang akan diuraikan di @SerbaFood . Kamu harus tahu, makanya follow!'"
473643896376135681,2014-06-03 01:54:39,b'Selamat pagi :) ayo follow @SOPBUNTUTHENNY yuk untuk memperoleh info2 penting tentang makanan. Ditunggu ya!'
473340043923562496,2014-06-02 05:47:15,b'Suka minum jus? Ini dia berbagai jus yang ternyata sangat bermanfaat. Simak di @SerbaFood yuk! Follow!'
473329726460014593,2014-06-02 05:06:15,"b'Selain segar, ternyata buah semangka baik untuk kesehatan lho! Simak yuk manfaatnta di @TigerExpressID . Follow sekarang!'"
473292954971701249,2014-06-02 02:40:08,"b'Selamat pagi :) Bagi kamu pecinta daging, yuk simak di @SOPBUNTUTHENNY keuntungan menjadi pecinta daging. Follow yah!'"
472334155590926337,2014-05-30 11:10:12,b'Di @SOPBUNTUTHENNY sudah diuraikan hal apa saja yg harus kamu lakukan setelah makan daging. Jgn lupa follow dan simak. Pasti  bermanfaat :)'
472261165482278913,2014-05-30 06:20:10,b'Olah raga memang bkin sehat. Nahh di @SerbaFood akan diuraikan berbagai makanan yang wajib dikonsumsi setelah berolah raga! Follow yuk!'
472229673280503808,2014-05-30 04:15:02,b'Bakar lemak dengan makanan enak dan sehat yang akan diuraikan di @TigerExpressID . Simak yuk! Biar kita cantik dan sehat!'
471528835188805632,2014-05-28 05:50:09,b'Jiahhh!! Makanan pedas juga mempunyai banyak manfaat ternyata. Simak manfaatnya di @TigerExpressID . Follow skrg!'
471524968623534083,2014-05-28 05:34:47,b'Makanan apa saja sih yang bisa menjaga kesehatan dan menjaga pencernaan? Simak infonya di @SerbaFood . Follow yah!'
471520025279758337,2014-05-28 05:15:09,b'Setiap hari pasti lelah. Ini adalah makanan yg bisa menghilangkan rasa lelahmu. Simak di @SOPBUNTUTHENNY . Pasti bermanfaat. Follow yah!'
469734777533526016,2014-05-23 07:01:12,b'HATI-HATI!! Penuaan tubuh Anda bisa terjadi sebelum waktunya. Ini dia ciri-cirinya akan diuraikan di @TigerExpressID . Follow!'
469716356594548736,2014-05-23 05:48:00,"b'Ceker sering dipandang sebelah mata, ternyata punya khasiat HEBAT!! Simak deh di @SOPBUNTUTHENNY . Gak follow nyesel. Follow skrg!'"
469712426058137601,2014-05-23 05:32:23,b'Yuk simak manfaat unik dari rumput laut. Simak di @SnowBowldessert ! Follow yah'
469700761396740096,2014-05-23 04:46:02,b'Cegah penyakit kanker dengan air lemon! WOW!! Simak informasinya di @SerbaFood . Follow skrg juga!'
469420064257867776,2014-05-22 10:10:39,b'Di @SnowBowldessert sudah diuraikan 8 jenis teh yang sehat dan bermanfaat untuk tubuh. Kamu harus tahu! Follow yah'
469375903148285952,2014-05-22 07:15:10,"b'Semua tahu lengkuas, tapi belum semua tahu khasiat HEBATnya! Agar tahu, yuk follow @SerbaFood , akan diuraikan manfaat HEBAT dari lengkuas!'"
469367790894579712,2014-05-22 06:42:56,b'Saos tiram selain lezat jika ditambahkan pada masakan jg ternyata memiliki kandungan nutrisi. Simak informasinya di @TigerExpressID . Skrg!'
469343159655596032,2014-05-22 05:05:03,"b'Yukk simak cara yang benar untuk mengolah daging di @SOPBUNTUTHENNY . Simak yah, PENTING! Follow sekarang'"
469336901275897857,2014-05-22 04:40:11,b'Teh sangat baik untuk kesehatan. Kenali jenis-jenis teh dan lihat manfaatnya di @SnowBowldessert . Follow srkg!'
468994742140010496,2014-05-21 06:00:34,b'WOW!! Ini Manfaat luar biasa dari mengkonsumsi PUDING! Simak yuk di @SerbaFood . Follow sekarang!!'
468982029598863360,2014-05-21 05:10:03,b'Sudah cobain Tom Yam? Campuran pd masakan Tom Yam ternyata bermanfaat untuk kesehatan! Simak informasinya di @SnowBowldessert . Follow yuk!'
468972193599463426,2014-05-21 04:30:58,b'Suka campurin perasan jeruk nipis ke makanan/masakan? Ini dia manfaat jeruk nipis bagi kesehatan dan kecantikan! Simak di @SOPBUNTUTHENNY !'
468614638507425792,2014-05-20 04:50:10,b'Mau kulit putih dengan mudah? Makanan ini bisa membantu memutihkan kulitmu. Simak denh di @TigerExpressID . Follow yuk!'
468612123334287361,2014-05-20 04:40:11,b'Sering denger mitos ttg daging sapi yg bikin khawatir?? Nihh di @SOPBUNTUTHENNY akan diuraikan mitos&amp;faktanya. Kamu wajib tahu! Follow yah'
468597001232605184,2014-05-20 03:40:05,b'HATI-HATI! Kekurangan kalium bs berakibat kelumpuhan! Simak informasi ttg efek kekurangan kalium&amp;makanan yg mengandung kalium di @SerbaFood'
468589463665643520,2014-05-20 03:10:08,b'Friends!! Ternyata Yoghurt bisa mencegah serangan jantung lho! Simak yuk informasi lengkapnya di @SnowBowldessert . Follow skrg!'
468305113078304768,2014-05-19 08:20:14,"b'Jangan anggap sepele, sup mempunyai manfaat yg luar biasa. Di @SOPBUNTUTHENNY sudah diuraikan mengenai itu. follow dan simak yah!'"
468298549542006784,2014-05-19 07:54:09,b'Asekkkk.. Es krim ternyata mempunyai manfaat yg bagus lho. Simak yuk di @SnowBowldessert ! Follow skrg!'
468294338389483520,2014-05-19 07:37:25,b'Yang gak suka kacang panjang RUGI! Karena kacang panjang mempunyai kandungan gizi yg sangat banyak. Simak yuk di @TigerExpressID !'
468292629843947520,2014-05-19 07:30:38,"b'WOW!! Ini adalah manfaat hebat dari semangkuk sup. Kalian harus tahu ini. Simak di @SOPBUNTUTHENNY yuk, Follow skrg!'"
465761267471642625,2014-05-12 07:51:54,b'Hallo Friends. Banyak yg belum tahu kan kalau ketan hitam mempunyai banyak manfaat? Yuk simak manfaatnya di @SnowBowldessert . Follow yuk!'
465753249241636864,2014-05-12 07:20:02,b'Suka makanan yg mengandung kecap? Ini ternyata manfaatnya akan diuraikan di @TigerExpressID . Follow yahhh :)'
465743194240856064,2014-05-12 06:40:05,b'Ikan gurame dapat mencegah kulit kasar lho!! Simak faktanya di @SOPBUNTUTHENNY yuk. Follow skrg!'
464294947790016512,2014-05-08 06:45:16,b'Sop iga sapi adalah makanan yg sangat segar dan lezat. Selain itu banyak manfaat lho! Ini manfaatnya ada di @SOPBUNTUTHENNY follow yuk!'
464281070545141760,2014-05-08 05:50:07,"b'Lhoo, cuci muka yang salah juga bisa menimbulkan jerawat lho!! Simak informasi selanjutnya di @TigerExpressID yuk! Follow skrg!'"
464260559912046592,2014-05-08 04:28:37,"b'Minum dipagi hari memang sehat, tapi minuman apa saja sih yang baik dikonsumsi untuk pagi hari? Simak infonya di @sebafood ! Follow deh.'"
463961447027179520,2014-05-07 08:40:03,"b'Lama ruangan ber-AC memang tidak baik. tapiii, yuk simak tipsnya di @SerbaFood agar sehat walaupun di ruangan AC setiap harinya.'"
463943891377340416,2014-05-07 07:30:18,b'Gimana sih sejarahnya kok bisa ada SOP BUNTUT. Simak informasinya yuk di @SOPBUNTUTHENNY . Follow sekarang!'
463657061516333056,2014-05-06 12:30:32,b'Mau tahu rahasia hidup sehat dengan murah dan mudah? Kalian harus simak @SerbaFood karena sudah diuraikan tadi. Semoga bermanfaat :D'
463629281135194112,2014-05-06 10:40:09,b'Haiii sist n Bro.. Di @SnowBowldessert sudah diuraikan ttg makanan2 yg bisa membantu menambah tinggi bdanmu loh! Follow yuk!'
463591526954979329,2014-05-06 08:10:07,b'Stroke adalah penyakit yg sangat berbahaya. Yukk dicegah dengan cara yg akan diuraikan di @TigerExpressID . Follow yah!'
463586500249407488,2014-05-06 07:50:09,b'Mau hidup sehat namun mudah dan murah? Simak tipsnya di @SerbaFood ! Follow yuk!'
463578655667793920,2014-05-06 07:18:59,b'Mau tinggi badan bertambah? makanan ini bisa membatunya. Simak yuk di @SnowBowldessert ! Follow skrg!'
463576538378960896,2014-05-06 07:10:34,b'Hallo Guys.. Siapa yang suka sop buntut? Follow @SOPBUNTUTHENNY yuk!'
463266897623273472,2014-05-05 10:40:10,"b'Yang lg pulang kerja, yuk follow @SnowBowldessert . Karena sudah diuraikan 7 makanan yg bisa melancarkan sirkulasi darah! Smga bermanfaat :)'"
463211513978040320,2014-05-05 07:00:05,b'Darah berfungsi penting dalam tubuh. Nahh ternyata ada makanan yg bisa melancarkan sirkulasi darah loh! Simak yuk di @SnowBowldessert !'
462173442868260865,2014-05-02 10:15:10,b'Di @SnowBowldessert sudah diuraikan makanan yg bisa menurunkan kolesterol! Follow dan simak yah. Karena kolesterol itu berbahaya!!'
462121850852876288,2014-05-02 06:50:09,b'Kolesterol memicu penyakit jantung dan stroke. Di @SnowBowldessert akan diuraikan makanan yg bisa menurunkan kolesterol. Follow yah!!'
462106750116966400,2014-05-02 05:50:09,b'Setiap hari berada di ruangan AC? Ini efeknya akan diuraikan di @TigerExpressID . Follow yuk!'
462094277531951104,2014-05-02 05:00:35,b'Guysss.. Daging sapi ternyata bisa MEMPERPANJANG USIA lho. Simak fakta sehatnya di @SerbaFood . Follow skrg!'
461448787958194176,2014-04-30 10:15:39,b'Yang baru pulang kerja yuk follow @SnowBowldessert karena sudah diuraikan makanan yang bisa meredakan rasa lelahmu. Pasti bermanfaat! :)'
461402078255276032,2014-04-30 07:10:02,b'Hallo Ladiessss.. Makanan ini bisa bikin kamu cepet langsing nih.. Simak yuk di @SerbaFood . Follow yah^^'
461389538938851328,2014-04-30 06:20:12,b'Sering merasa lelah? Ini dia makanan yang ampuh meredakan rasa lelah akan diuraikan di @SnowBowldessert . Follow dan jangan ketinggalan ya!!'
461049816433590272,2014-04-29 07:50:16,b'Singkirkan batu ginjal berbahaya dengan makanan2 alami ini. Simak yuk @SnowBowldessert . Follow skrg!'
461030929012498432,2014-04-29 06:35:13,b'Suka dengerin musik? Ternyata ini fakta mengejutkan dari mendengarkan musik. Simak di @TigerExpressID yuk infonya. Follow sekarang!'
461012979874820096,2014-04-29 05:23:54,b'WOWWW!!! Ternyata makanan2 ini mampu bersihkan lever secara alami! Simak di @SerbaFood yuk! Jangan ketinggalan info sehat ini. Follow skrg!'
460684885465006080,2014-04-28 07:40:10,b'Ada yang gak suka makan kemangi? RUGI! karena kemangi mempunyai manfaat yg OKE banget. Simak di @SnowBowldessert skrg! Penting!!'
460664460412465152,2014-04-28 06:19:00,b'Makan gorengan itu enak. Tapi ini ternyata fakta dan bahaya kalau terlalu sering mengkonsumsi gorengan. Simak di @SerbaFood . Follow skrg!'
459281938181001216,2014-04-24 10:45:21,b'Sudah diuraikan di @SerbaFood tentang dauh pahit tapi manfaatnya luar biasa. Follow dan simak yah.. Pasti bermanfaat ^^'
459245013453770752,2014-04-24 08:18:38,b'Daun yang pahit ini ternyata dapat mencegah kanker dan darah tinggi! WOW!! Simak informasi selengkapnya di @SerbaFood . Follow skrg!'
458519415181828096,2014-04-22 08:15:22,"b'Friends, ternyata lidah biaya dapat memelihara kesehatan pencernaanmu lho! Simak informasi selanjutnya di @TigerExpressID follow skrg!'"
458509140810563584,2014-04-22 07:34:32,"b'Hallo guys, makanan ini dapat membuat gigi kuat dan sehat lho! Simak deh di @SnowBowldessert akan diuraikan fakta menariknya!'"
458487864473698304,2014-04-22 06:09:59,b'Mari turunkan berat badan dengan makanan enak ini :D simak di @SerbaFood . Follow yuk! Jangan sampai gak nyimak yah..'
458198803414523904,2014-04-21 11:01:22,b'Sudah diuraikan di @SerbaFood tentang tips makanan yg membuatmu sukses dalam belajar. Jangan lupa follow dan RT yah.. Semoga bermanfaat :)'
458153645205643264,2014-04-21 08:01:55,b'Hati-hati! Kebiasaan sepele yg sering kamu lakukan ini ternyata bisa membahayakan. Simak infonya di @TigerExpressID . Follow skrg!'
458143992493129728,2014-04-21 07:23:34,b'Buah melon ternyata cocok untuk kalian yg lagi diet :) Juga bisa mencegah kanker! Simak info selengkapnya di @SnowBowldessert . Follow skrg!'
458130240204992512,2014-04-21 06:28:55,"b'Guys, ada yang menarik nih! Akan diuraikan di @SerbaFood tentang tips makan yang bikin sukses saat ujian!! Jangan sampai gak follow ya! :)'"
456752812756848640,2014-04-17 11:15:31,b'Sudah diuraikan di @TigerExpressID tentang cara mencegah stoke pada wanita. Follow yah! Jangan sampai ketinggalan info penting ini!'
456660897008590848,2014-04-17 05:10:16,"b'Sistaaa, stroke pada wanita dapat dicegah dengan cara2 yg akan diuraikan di @TigerExpressID lho. Simak info penting ini yuk! Follow skrg!'"
456651174616129536,2014-04-17 04:31:38,b'Penderita maag? Kalian harus simak info di @SnowBowldessert . Akan diuraikan sayuran &amp; buah yg cocok untuk penderita maag. Follow sekarang!'
456635408151871488,2014-04-17 03:28:59,b'Suka makan daging? Hati-hati! Simak cara sehat makan daging di @SerbaFood ! Follow yuk!!!'
456334902246383616,2014-04-16 07:34:53,b'Suka minum jus? Ini dia jenis jus yang sangat bermanfaat untuk kesehatan. Follow @SnowBowldessert sekarang!'
456310080883789824,2014-04-16 05:56:15,b'Hallo Guys. Tahukah kamu kalau ternyata ada makanan2 sehat yang wajib dikonsumsi oleh laki-laki lho! Simak di @SerbaFood . Follow yuk!!!'
455988932199874560,2014-04-15 08:40:07,b'Sudah diuraikan 10 makanan yang membuatmu awet muda di @SerbaFood . Follow dan RT yah..'
455982317467860992,2014-04-15 08:13:50,b'Musim yang tidak menentu ini membuatmu batuk? Simak tips untuk meredakan batuk di @TigerExpressID . Follow yuk!'
455974674187694080,2014-04-15 07:43:28,b'Yang takut dengan kolesterol jahat follow @SnowBowldessert yuk! Akan diuraikan tentang makanan yg dapat menurunkan kolesterol. Follow skrg!'
455962595749810176,2014-04-15 06:55:28,b'WOOWW!! Makanan ini bisa membuatmu AWET MUDA! Apa saja sih? Simak di @SerbaFood yuk. Follow sekarang!!'
455588215928651776,2014-04-14 06:07:49,b'Mata minus menjadi penghalang? Simak @SnowBowldessert akan diuraikan cara mencegah mata minus! Follow yuk!'
455580016223744000,2014-04-14 05:35:14,b'Banyak yg tidak tahu kalau makanan-makanan ini dapat memutihkan gigimu. Uppsss!! Apa saja? Simak di @SerbaFood . Follow dan semak deh!'
454858998094000128,2014-04-12 05:50:10,b'Sudah diuraikan 10 cara menggemukkan badan di @SnowBowldessert . Follow dan Simak yahhh!'
454822815032967168,2014-04-12 03:26:23,"b'Yang mau gemukan, yuk intip tips di @SnowBowldessert . Follow skrg!'"
454539459665879040,2014-04-11 08:40:26,b'Sudah diuraikan cara menjaga kesehatan otak. Simak info penting ini di @serbafood. Jangan sampai ketinggalan follow ya!'
454535273586900993,2014-04-11 08:23:48,b'Jahe sebagai obat jerawat? WOWW!! Simak manfaat jahe di @TigerExpressID ! KEREN! Follow yuk..'
454526861079764992,2014-04-11 07:50:23,"b'Hati-hati, kegemukan bukan hanya dari makanan. Yuk simak faktor lain dari kegemukan di @SnowBowldessert !. Follow yuk!'"
454511910210506752,2014-04-11 06:50:58,"b'Tidak hanya tubuh luar, otak pun harus kita jaga kesehatannya. Gimana caranya? Simak di @SerbaFood yuk! Follow skrg!'"
454158960560701440,2014-04-10 07:28:28,b'Sering dengar kalau tertawa itu menyehatkan? Ini lho alasannya akan diuraikan di @TigerExpressID . Follow yuk!!'
454152881953067008,2014-04-10 07:04:19,b'Sayuran-sayuran ini harus kamu rebus sebelum mengkonsumsinya! Apa saja sih? Simak di @SerbaFood . Follow skrg!'
454142104428892161,2014-04-10 06:21:29,b'Suka ngemil tapi takut gemuk? Simak di @SnowBowldessert akan diuraikan kebiasaan ngemil yang tidak membuat gemuk. Follow segera!'
453444774776045568,2014-04-08 08:10:33,b'Sudah diuraikan di @snowbowldessert ttg manfaat makan pelan2 yg ternyata dpt mengurangi stres dan berat bdan. Jangan sampai gak tau ya ;)'
453439665954357248,2014-04-08 07:50:15,b'Jangan salah yah.. Ini cara yang BENAR menyeduh teh. Simak di @SerbaFood . Follow yuk! ;)'
453422431311765504,2014-04-08 06:41:46,b'Makan pelan-pelan ternyata dapat menurunkan berat badan.. WOW!! Yuk informasi selengkapnya di @snowbowldessert . Follow skrg!'
453065104830242816,2014-04-07 07:01:53,b'Sudah diuraikan waktu yang tepat untuk makan buah. Follow @snowbowldessert jangan sampai salah waktu ya!! :)'
453064133265477632,2014-04-07 06:58:01,b'Siapa bilang angkat beban dapat membuat wanita berotot?? Itu mitos. Fakta tentang Olahraga akan diuraikan di @TigerExpressID . Follow yuk!!'
453053414369656832,2014-04-07 06:15:25,b'Guys!! Seringkali pagi hari kalian tidak semangat?? Ini lho solusinya agar bahagia di pagi hari. Simak di @SerbaFood . Follow yuk!!'
