id,created_at,text
301979230084952064,2013-02-14 09:00:33,b'Mungkin ini namanya cinta ya? Saat kita ngikutin suara hati kita utk milih seseorang walaupun org itu tdk sesempurna yg lain- CatatanSiBoy'
301949017586282496,2013-02-14 07:00:30,"b'Mungkin badanku lemah, tapi cintaku kepadamu telah menguatkan seluruh jiwa ragaku - Love Story'"
301918838407196672,2013-02-14 05:00:35,"b""I'd rather do nothing and be happy, than do something I know I don't love. -What Happens in Vegas (2008)"""
301888580081569793,2013-02-14 03:00:20,"b""Life's too short to live the same day twice. -Monster-in-Law (2005)"""
301858492745125888,2013-02-14 01:00:47,"b""Good Morning and happy valentine's day"""
301722620221607938,2013-02-13 16:00:53,"b'I know I have a heart, because I feel it breaking. -The Wizard of Oz (1939)'"
301715082658852865,2013-02-13 15:30:55,b'Waiting for you is like waiting for rain in this drought... Hopeless and disappointing. -A Cinderella Story (2004)'
301707545033203712,2013-02-13 15:00:58,"b""When you're young everything feels like the end of the world... But its not, its just the beginning. -17 Again (2009)"""
301699924016394240,2013-02-13 14:30:41,"b""They say when you meet the love of your life, time stops, and that's true. -Big Fish (2003)"""
301692407878131713,2013-02-13 14:00:49,"b""Don't let what's past ruin your future -Scott Pilgrim vs. The World (2010)"""
301684799498752000,2013-02-13 13:30:35,"b""My closest relationship is with my Blackberry, Thank God it vibrates! -Valentine's Day (2010)"""
301677364700651522,2013-02-13 13:01:03,b'Lovers are just like buses. You just have to wait a little while until another one comes along. -A Single Man (2009)'
301669685462716416,2013-02-13 12:30:32,b'Music is a bridge between earth and heaven. -The Forbidden Kingdom (2008)'
301662170100412416,2013-02-13 12:00:40,"b'I will never stop trying. Because when you find the one... you never give up. -Crazy, Stupid, Love. (2011)'"
301647148355825665,2013-02-13 11:00:59,"b'It\xc2\x92s not about what it is, it\xc2\x92s about what it can become. -The Lorax (2012)'"
301632002724077568,2013-02-13 10:00:48,"b""In this life, it's not what you hope for, it's not what you deserve - it's what you take! -Magnolia (1999)"""
301624409289023489,2013-02-13 09:30:37,"b'Women have choices, and men have responsibilities. -Parenthood (1989)'"
301616817661673473,2013-02-13 09:00:27,b'Failure is not an option. -Cats &amp; Dogs (2001)'
301586659340849152,2013-02-13 07:00:37,"b""I don't know who you are... but I dream about you almost every night. -50 First Dates (2004)"""
301556480488910848,2013-02-13 05:00:42,b'High school is like the training wheels for the bicycle of real life. -Ghost World (2001)'
301541257837150208,2013-02-13 04:00:12,b'The effort must be total for the results to be meaningful. -Wit (2001)'
301360212097515520,2013-02-12 16:00:48,b'Dying is something you have no control over. Why waste your life being afraid of it? -K-PAX (2001)'
301352668817936384,2013-02-12 15:30:49,"b""Do I know what I'm doing today? No. But I'm here, and I'm going to give it my best shot. -Zoolander (2001)"""
301345174796242944,2013-02-12 15:01:03,"b""The greatest thing you'll ever learn is just to love and be loved in return. -Moulin Rouge 2001 (2001)"""
301337576709713920,2013-02-12 14:30:51,b'Inspiration is like a baby. It does not choose a nice seemly hour to enter the world. -The Dreamers (2003)'
301330202829676545,2013-02-12 14:01:33,"b'When you tell a lie, you steal someone\xc2\x92s right to the truth. -The Kite Runner (2007)'"
301322409523421184,2013-02-12 13:30:35,"b'When you forgive, you love, and when you love, God\xc2\x92s light shines on you. -Into the Wild (2007)'"
301315061614514177,2013-02-12 13:01:23,b'You know what music is - a harmonic connection between all living beings. -August Rush (2007)'
301307380623368192,2013-02-12 12:30:52,"b'When you\xc2\x92re really enjoying what you do, there\xc2\x92s your balance. -Michael Clayton (2007)'"
301299912954490880,2013-02-12 12:01:11,b'I believe in music just like the way some people believe in fairy tales. -August Rush (2007)'
301284669134102529,2013-02-12 11:00:37,"b""If you want to limit yourself, that's fine. But don't let other people do it for you. -Gracie (2007)"""
301269672781811713,2013-02-12 10:01:01,b'Nothing is yours permanently so you better enjoy it while it\xc2\x92s happening. -Joan Rivers: A Piece of Work (2010)'
301261976292712448,2013-02-12 09:30:26,"b'Sometimes you have to be apart from people you love. Sometimes, it even makes you love them more. -The Last Song (2010)'"
301254441284276225,2013-02-12 09:00:30,b'Life is made from the choices that we make. -Back to the Future (1985)'
301224205247193089,2013-02-12 07:00:21,b'All you can do in life is try and solve the problem in front of you. -Mean Girls (2004)'
301194008439443456,2013-02-12 05:00:22,"b'I just like to smile! Smiling is my favorite. You make me smile, that makes you my favorite. -Elf (2003)'"
301178878909620224,2013-02-12 04:00:15,"b""If you're afraid of dying, it shows you have a life worth living. -The Last King of Scotland (2006)"""
300998039521345537,2013-02-11 16:01:39,"b""It's better to have something and not need it, than to need something and not have it. -AVP: Alien vs Predator (2004)"""
300990367187226625,2013-02-11 15:31:10,"b'Don\'t ever let somebody tell you You can\'t do something!"" -The Pursuit of Happyness (2006)'"
300982866223976450,2013-02-11 15:01:21,"b""Don't let anyone ever make you feel like you don't deserve what you want. -10 Things I Hate About You (1999)"""
300975170980569088,2013-02-11 14:30:47,"b""I live in a world full of people pretending to be something they're not. -A Cinderella Story (2004)"""
300967742910111744,2013-02-11 14:01:16,b'Aku mengetahuinya sejak kami berjumpa kali pertama. Aku mengetahui aku akan jatuh hati. -Firasat'
300960114876223488,2013-02-11 13:30:57,b'Hujan bahkan membasuh air mata yang belum ada. Membuatku seolah-olah menangis. -Firasat'
300952625644457984,2013-02-11 13:01:12,"b'Saat kita belajar menerima, kita juga belajar berdamai. Melalui firasat kita belajar menerima diri, &amp; berdamai dgn hidup ini -Rectoverso'"
300944947610267648,2013-02-11 12:30:41,"b'Aku tahu kamu sayang banget sama aku dan kamu pacarku, tapi sebagaian hati kamu selalu ada buat dia. iya kan? -Perahu Kertas'"
300937503056216064,2013-02-11 12:01:06,"b'Tidak mudah menjadi bayang-bayang orang lain. Lebih baik, tunggu sampai hatinya sembuh &amp; memutuskan dalam keadaan jernih. -Perahu Kertas'"
300922352768806912,2013-02-11 11:00:54,"b'Ada saatnya cinta harus dilepas, ga digenggam dengan begitu erat. Bahwa ada saatnya kita ga perlu berlari, tapi berhenti -Perahu Kertas'"
300907215013945344,2013-02-11 10:00:45,"b'A: ""Can I stay for a while?"" W: ""No. You can stay forever."" -Notting Hill (1999)'"
300899647927496704,2013-02-11 09:30:41,"b'You have nothing, nothing to threaten me with. Nothing to do with all your strength. -The Dark Knight (2008)'"
300892131847979008,2013-02-11 09:00:49,"b""You cannot deny the existence of hell. You'll live in it. It is place without love. -The American (2010)"""
300861886591795200,2013-02-11 07:00:38,"b""If you keep going over the past, you're going to end up with a thousand pasts and no future. -The Secret in Their Eyes (2009)"""
300831706154418177,2013-02-11 05:00:42,b'The older I get the more things I gotta leave behind. -Rocky Balboa (2006)'
300801469119082497,2013-02-11 03:00:33,"b""We're women. Our choices are never easy. -Titanic (1997)"""
300635577810829315,2013-02-10 16:01:21,"b""Relationships aren't just about being happy. -Sex and the City (2008)"""
300627871569936385,2013-02-10 15:30:44,b'What is the definition of insanity? Doing the same thing over and over again and expecting a different result. -Wall Street (2010)'
300620356492865536,2013-02-10 15:00:52,"b""Life's simple, you make choices and you don't look back. -The Fast and the Furious: Tokyo Drift (2006)"""
300612727343284224,2013-02-10 14:30:33,"b""I didn't come here to tell you I can't live without you. I can live without you. I just don't want to. -Rumor Has It... (2006)"""
300605266662129664,2013-02-10 14:00:55,"b'Rasa hangat ketika 2 tubuh bertemu, rasa lengkap ketika 2 jiwa mendekat, rasa rindu yg tuntas ketika 2 pasang mata menatap-PerahuKertas'"
300597630608736256,2013-02-10 13:30:34,"b'Diangkasa terukirlah kisah kita, dua manusia yang berjuang demi cinta. -Perahu Kertas'"
300590153011953664,2013-02-10 13:00:51,b'Kdng\xc2\xb2 langit bisa kelihatan seperti lembar kosong. Pdhl sebenarnya tdk. Bintang km tetap di sana. Bumi hanya sedang berputar-PerahuKertas'
300582525305233408,2013-02-10 12:30:33,b'Lo gak bisa nilai orang dari kulit luarnya -Rectoverso'
300575003815051266,2013-02-10 12:00:39,"b'Saya ngga mungkin begini terus, melepas kepergian kamu, tanpa tahu kpn kamu akan kembali &amp; apakah kamu mau kembali -Perahu Kertas'"
300559895957225472,2013-02-10 11:00:37,"b'Hidup ini sudah di atur.Kita hanya melangkah, sebingung &amp; sesakit apapun, semua sudah di siapkan untuk kita -Perahu Kertas'"
300544792469848066,2013-02-10 10:00:37,"b""I think I'm in love with her. But I gotta get that out of my head, you know? -The Wedding Singer (1998)"""
300537228092907520,2013-02-10 09:30:33,b'To forget easily is a gift. Let go of your past mistakes. Make a fresh start. -A Moment to Remember (2004)'
300529683945119744,2013-02-10 09:00:34,"b""Love is funny. Makes you happy, sad and do all sorts of things you never thought you'd do before. -I Love You Phillip Morris (2009)"""
300499493743374336,2013-02-10 07:00:36,"b""The worth of a life is not determined by a single failure or a solitary success. -The Emperor's Club (2002)"""
300454147214430208,2013-02-10 04:00:25,"b""Do you know the best way to make a dream come true? Do you? It's to WAKE UP. -Excess Baggage (1997)"""
300439103713988608,2013-02-10 03:00:38,"b'They say there is a cup of life that is either half-empty or half-full, depending on how you feel about things. -The Sessions (2012)'"
299467606920921088,2013-02-07 10:40:15,"b'Bagi yang suka galau, daripada galau sendirian mending ungkapin di @Isidarihati Follow sekarang ya.'"
299376996885086210,2013-02-07 04:40:12,"b'Karena wanita ingin dimengerti, Follow @sehatcantik untuk dapatkan info kesehatan, kecantikan dan motivasi utk wanita'"
299105232607117312,2013-02-06 10:40:19,"b'Bagi yang suka galau, daripada galau sendirian mending ungkapin di @Isidarihati Follow sekarang ya'"
299014596801462272,2013-02-06 04:40:09,"b'Karena wanita ingin dimengerti, Follow @sehatcantik untuk dapatkan info kesehatan, kecantikan dan motivasi utk wanita..'"
298823508182589442,2013-02-05 16:00:50,"b""Masa depan penuh harapan. Biarpun hidupmu tinggal satu hari, kamu harus menjalaninya! - Wait 'Till You're Older"""
298815923790413824,2013-02-05 15:30:42,b'The right guy will love you exactly the way you are - Soul Surfer'
298808449037381632,2013-02-05 15:01:00,"b'Cinta itu bisa datang, cinta bisa memilih, cinta bisa pergi, tapi inget cinta itu ga bisa menunggu -Jomblo'"
298800886665342976,2013-02-05 14:30:57,"b'When you want something in life, you just gotta reach out and grab it. -Into the Wild (2007)'"
298793444321673218,2013-02-05 14:01:23,b'I loved the way a photo could capture a moment before it was gone. -The Lovely Bones (2009)'
298785700726321152,2013-02-05 13:30:36,"b'Tuhan aku rindu saat itu saat itu aku punya alasan utk cemburu, tertawa &amp; menangis dlm waktu bersamaan -Mika'"
298778229177716738,2013-02-05 13:00:55,b'Aku mencintaimu bahkan ketika aku mengingat kenangan yg menyebalkan tentangmu -MIKA'
298770609171734528,2013-02-05 12:30:38,"b'Cinta itu tdk perlu sempurna, cinta itu tdk perlu pinta. Tapi tulus, tanpa syarat. Karena cinta memang seperti itu! -MIKA'"
298763111706537984,2013-02-05 12:00:51,b'I wish somebody had the courage to come along and make it different. -Lottery Ticket (2010)'
298747941114486784,2013-02-05 11:00:34,"b'Everything in this world, no matter how big, no matter how small, is connected in ways that we never expected. -Happy Feet Two (2011)'"
298742860914769920,2013-02-05 10:40:23,"b'Bagi yang suka galau, daripada galau sendirian mending ungkapin di @Isidarihati Follow sekarang yaa..'"
298732844195385344,2013-02-05 10:00:34,b'It\xc2\x92s part of the job of life to figure out who you are and what you\xc2\x92ve got. -Happy Feet Two (2011)'
298725289079492608,2013-02-05 09:30:33,b'I love the rain - it washes memories off the sidewalk of life.\xc2\x94 -Play it Again Sam (1972)'
298717748215812096,2013-02-05 09:00:35,"b'When you lose someone you love, they never really leave you. They just move into a special place in your heart. -Frankenweenie (2012)'"
298687521733373952,2013-02-05 07:00:29,"b'\xc2\x93You\xc2\x92ve got to go after your dreams. If you don\xc2\x92t make an effort, nothing\xc2\x92s ever going to change."" -Here Comes the Boom (2012)'"
298657347922956288,2013-02-05 05:00:35,"b'If you want to change who you are, you have to change what you do. -Repo Men (2010)'"
298652192473243649,2013-02-05 04:40:06,"b'Karena wanita ingin dimengerti, Follow @sehatcantik untuk dapatkan info kesehatan, kecantikan &amp; motivasi utk wanita.. :D'"
298642242497806336,2013-02-05 04:00:33,"b""Film is like a battleground. There's love, hate, action, violence, death... in one word: emotion. -Pierrot le fou (1965)"""
298461045297651712,2013-02-04 16:00:32,"b""Life is like film, it always has a happy ending. If there's no happy ending, it means that the film is not done yet. -Om Shanti Om (2007)"""
298453489003163648,2013-02-04 15:30:31,"b'Kalo kita merasa takut dalam melakukan sesuatu, itu tandanya kita SALAH -Demi ucok'"
298446046865014786,2013-02-04 15:00:57,b'Masa depan milik mereka yang percaya pada kekuatan mimpi mereka -Dream Obama'
298438376036646912,2013-02-04 14:30:28,b'Tidak ada yang tidak mungkin bagi yang percaya. - Dream Obama'
298430908950773761,2013-02-04 14:00:47,b'Masa depan milik mereka yang percaya pada kekuatan mimpi mereka. - Dream Obama'
298423269802000384,2013-02-04 13:30:26,"b'Kamu harus berani bermimpi. Gak boleh nangis, gak boleh cengeng. - Dream Obama'"
298415722932092928,2013-02-04 13:00:27,"b'Wajah cantik/tampan akan hilang seiring bertambahnya umur. Tp jk hati yg cantik/tampan, slamanya akan begitu -Habibie&amp;Ainun'"
298408154490871808,2013-02-04 12:30:22,"b'Sometimes, all somebody needs is a good chance. -Seabiscuit (2003)'"
298400695177072641,2013-02-04 12:00:44,"b'\xc2\x93You have to leave a certain kind of love behind. It will destroy you if you don\xc2\x92t."" -Skins (TV Series)'"
298385568977518593,2013-02-04 11:00:38,b'Love... shall we deny it when it visits us? Shall we not take what we are given? -The New World (2005)'
298380417164267521,2013-02-04 10:40:09,"b'Bagi yang suka galau, daripada galau sendirian mending ungkapin di @Isidarihati Follow sekarang ya ^^'"
298370454345887744,2013-02-04 10:00:34,b'Happiness only real when shared. -Into the Wild (2007)'
298362863930728449,2013-02-04 09:30:24,b'Life is a series of arrivals and departures. -View from the Toop (2003)'
298355353974886400,2013-02-04 09:00:34,"b'Our behavior, like our physical forms, evolves according to our needs. -Creation (2009)'"
298325127035248641,2013-02-04 07:00:27,"b'If people didn\xc2\x92t try something new, there would hardly be any progress at all. -Cat Ballou (1965)'"
298294840725237760,2013-02-04 05:00:06,b'Life rarely gives us what we want at the moment we consider appropriate. Adventures do occur but not punctually -A Passage to India (1994)'
298289809280077825,2013-02-04 04:40:07,"b'Karena wanita ingin dimengerti, Follow @sehatcantik untuk dapatkan info kesehatan, kecantikan &amp; motivasi utk wanita :)'"
298279840350605313,2013-02-04 04:00:30,"b'If we allow ourselves to be full of hate, then they have won. We must not let them take our hearts. -Machine Gun Preacher (2011)'"
298098880392867840,2013-02-03 16:01:26,b'There\xc2\x92s no greater search than that of lost love. -Seeking a Friend For the End of the World (2012)'
298091252530958338,2013-02-03 15:31:07,"b'God, how I hope the problems of my own tiny life don\xc2\x92t blind me to everything. -Hemingway and Gellhorn (2012)'"
298083894211796993,2013-02-03 15:01:53,b'When you\xc2\x92re down is when you find out who your true friends are. -The Queen of Versailles (2012)'
298075975420375041,2013-02-03 14:30:25,"b'There is nowhere to run, nowhere to hide, there is no escaping ourselves. The human dilemma must be experienced. -'"
298068510448447490,2013-02-03 14:00:45,"b'Sometimes, you really can\xc2\x92t listen to what anybody else says. You just got to listen inside. -October Sky (1999)'"
298060900777213952,2013-02-03 13:30:31,b'People get up everyday and tell themselves they\xc2\x92re going to change their lives and they never do.\xc2\x94 -The Town (2010)'
298053415911686144,2013-02-03 13:00:46,"b'We only have one real rule: don\xc2\x92t do anything that would embarrass you, the team, or your family. -Forever Strong (2008)'"
298045781095632896,2013-02-03 12:30:26,b'There are times when choices just have to be made or you\xc2\x92ll simply miss out. -Miss Pettigrew Lives for a Day (2008)'
298038301330391042,2013-02-03 12:00:42,"b'I like to keep busy, I find it more interesting than keeping still. -Frost-Nixon (2008)'"
298023241132417024,2013-02-03 11:00:52,"b'Sometimes we reach a point where, in order to move on, we have to wipe the slate clean. -The Beaver (2011)'"
298018039348219904,2013-02-03 10:40:12,"b'Bagi yang suka galau, daripada galau sendirian mending ungkapin di @Isidarihati Follow sekarang ya ;)'"
298008097874669568,2013-02-03 10:00:41,b'Life is too damn short and you can\xc2\x92t waste a minute of it. -Friends With Benefits (2011)'
298000479298932737,2013-02-03 09:30:25,"b""\xc2\x93You've got to learn to deal with your feelings, before they deal with you.\xc2\x94 -Postcards From the Edge (1990)"""
297992937210511360,2013-02-03 09:00:27,"b'We can\xc2\x92t retract the decisions we\xc2\x92ve made, we can only affect the decisions we\xc2\x92re going to make from here. -Law Abiding Citizen (2009)'"
297962745293316096,2013-02-03 07:00:29,"b'You\xc2\x92ve got to go after your dreams. If you don\xc2\x92t make an effort, nothing\xc2\x92s ever going to change. -Here Comes the Boom (2012)'"
297932613149147136,2013-02-03 05:00:44,"b'Women\xc2\x92s hearts, like their desires, remain a mystery to me. -Cloud Atlas (2012)'"
297927418910478337,2013-02-03 04:40:06,"b'Karena wanita ingin dimengerti, Follow @sehatcantik untuk dptkan info kesehatan, kecantikan dan motivasi utk wanita :D'"
297917456075345920,2013-02-03 04:00:31,b'It is the quality of ones convictions that determines success. -Harry Potter and the Deathly Hallows: Part 2 (2011)'
297736308120494081,2013-02-02 16:00:42,b'Perspective is what shuts out the universe. Everyone with their little perspective - it keeps the love out. -Taking Woodstock (2009)'
297728734205718528,2013-02-02 15:30:36,b'How much people like you is directionally proportional to what you look like. -Beastly (2011)'
297721288498233344,2013-02-02 15:01:01,"b'There are words that are better unheard, better unsaid. -Les Miserables (2012)'"
297713633113288704,2013-02-02 14:30:36,"b'Why do I, and everyone I love, pick people who treat us like we\xc2\x92re nothing? -The Perks of Being a Wallflower (2012)'"
297706168229457921,2013-02-02 14:00:56,b'Life is not worth living without a family. -A Thousand Words (2012)'
297698479638188032,2013-02-02 13:30:23,"b'The cruelest kind of love, the one that almost kills its victims.. Its called unrequited love. -The Holiday (2006)'"
297691035025420290,2013-02-02 13:00:48,b'I tried to remember the last time I felt safe... and I thought of you. -Enough (2002)'
297683409378107392,2013-02-02 12:30:30,b'All this waiting for better is making you bitter. -Think Like a Man (2012)'
297676000349794304,2013-02-02 12:01:03,"b'If you want a man\xc2\x92s attention, ignore him. -Easy Virtue (2008)'"
297660782894800896,2013-02-02 11:00:35,"b'In a relationship, it is better to be the leaver than the leavee. -Everyone Says I Love You (1996)'"
297655653168709632,2013-02-02 10:40:12,"b'Bagi yang suka galau, daripada galau sendirian mending ungkapin di @Isidarihati Follow sekarang ya :D'"
297645679327715330,2013-02-02 10:00:34,b'Choices are like connecting highways. They all take you to same place. Some just take longer to get there. -Dream for an Insomniac (1996)'
297638135762935808,2013-02-02 09:30:36,"b'The key to a great story is not who, or what, or when, but why. -Tomorrow Never Dies (1997)'"
297630572270985216,2013-02-02 09:00:32,b'All we have to decide is what to do with the time that is given to us. -Lord of the Rings: Fellowship of the Ring (2001)'
297600346778398720,2013-02-02 07:00:26,b'Worry is like interest paid in advance on a debt that never comes due. -The Spanish Prisoner (1997)'
297570187589341185,2013-02-02 05:00:35,b'There is no past that we can bring back by longing for it. -The Best Exotic Marigold Hotel (2012)'
297565030344429569,2013-02-02 04:40:06,"b'Karena wanita ingin dimengerti, Follow @sehatcantik untuk dptkan info kesehatan, kecantikan &amp; motivasi utk wanita :D'"
297540034125512704,2013-02-02 03:00:46,"b'I guess sometimes the past just catches up to you, whether you want it to or not. -The Green Mile (1999)'"
297293287411286017,2013-02-01 10:40:17,"b'Bagi yang suka galau, daripada galau sendirian mending ungkapin di @Isidarihati Follow sekarang ya :)'"
297202652238979073,2013-02-01 04:40:08,"b'Karena wanita ingin dimengerti, Follow @sehatcantik untuk dapatkan info kesehatan, kecantikan dan motivasi utk wanita ;)'"
296930879522099201,2013-01-31 10:40:13,"b'Bagi yang suka galau, daripada galau sendirian mending ungkapin di @Isidarihati Follow sekarang ya..'"
296840258371346432,2013-01-31 04:40:07,"b'Karena wanita ingin dimengerti, Follow @sehatcantik untuk dapatkan info kesehatan, kecantikan dan motivasi utk wanita :)'"
296120604866781184,2013-01-29 05:00:28,"b""My closest relationship is with my Blackberry, Thank God it vibrates! -Valentine's Day (2010)"""
296105547550302208,2013-01-29 04:00:38,"b""Love is the only shocking act left on the planet. -Valentine's Day"""
295924582911729664,2013-01-28 16:01:33,"b""I need happy, I need romantic, I need love, and I need it from you. -Valentine's Day"""
295916849286242304,2013-01-28 15:30:49,"b'David: ""I love you"" Elizabeth: ""... No ones ever said that to me before"" -Just Like Heaven'"
295909491692666880,2013-01-28 15:01:35,"b""People don't realize this, but loneliness is underrated. -(500) Days of Summer"""
295901757475799043,2013-01-28 14:30:51,"b'You should know up front, this is not a loves story, but it is a story about love. -(500) Days of Summer'"
295894383331512321,2013-01-28 14:01:33,b'I love her smile. I love her hair. I love her knees. I love how she licks her lips before she talks -(500) Days of Summer'
295879150898655233,2013-01-28 13:01:01,"b'Most days of the year are unremarkable. They begin, and they end, with no lasting memories made in between -(500) Days of Summer'"
295871496281288705,2013-01-28 12:30:36,"b""I love how she makes me feel, like anything's possible, or like life is worth it. -(500) Days of Summer"""
295864029426114560,2013-01-28 12:00:56,b'You only got one life. You can\xc2\x92t sit around waiting for your next life to begin. -Crazy in Alabama (1999)'
295848925389258752,2013-01-28 11:00:55,"b""Men are like parking spaces: all the good ones are taken, and the available ones are handicapped. -The Astronaut's Wife (1999)"""
295833752796545025,2013-01-28 10:00:37,"b'The past is past, and it should remain buried along the side of our memories. -Everything is Illuminated (2005)'"
295826168106586112,2013-01-28 09:30:29,"b'It\xc2\x92s not whether or not you get knocked down, it\xc2\x92s what you do when you get back up. -The Adjustment Bureau (2011)'"
295818650865262593,2013-01-28 09:00:37,"b'It\xc2\x92s not dying that you need to be afraid of, it\xc2\x92s never having lived in the first place. -The Green Hornet (2011)'"
295788452421713921,2013-01-28 07:00:37,"b""I love you. I love you so much. But I just don't like you anymore. -One Day (2011)"""
295758263717347328,2013-01-28 05:00:39,"b""Well, I have a microphone, and you don't, SO YOU WILL LISTEN TO EVERY DAMN WORD I HAVE TO SAY! -The Wedding Singer"""
295743149719040000,2013-01-28 04:00:36,"b'Well, if you need more time, I guess I could wait. -The Wedding Singer'"
295562040821559296,2013-01-27 16:00:56,"b'I know what I want, because I have it in my hands right now. You. -P.S I Love You'"
295554405804171264,2013-01-27 15:30:36,b'Every morning I still wake up and the first thing I want to do is to see your face. -P.S I Love You'
295546932942733314,2013-01-27 15:00:54,"b""There's no man, alive or dead, who's going to fault you for living. -P.S I Love You"""
295539287905165312,2013-01-27 14:30:31,b'A woman know when a man looks into her eyes and sees someone else. -The Notebook'
295531853866217472,2013-01-27 14:00:59,"b""I'm impossible to forget, but I'm hard to remember. -Elizabethtown"""
295524165270777856,2013-01-27 13:30:26,"b""I'm going to miss your lips. -Elizabethtown"""
295516735635873792,2013-01-27 13:00:54,"b""I love you. I know you don't like me very much any more... but I love you. -Ice Castle (1978)"""
295509077893709824,2013-01-27 12:30:29,"b""Whatever happens, I'll love you just as I do now until I die. -Gone with the Wind"""
295501555032006656,2013-01-27 12:00:35,b'I only know that I love you. -Gone with the Wind'
295486462286241792,2013-01-27 11:00:37,"b""If I said I was madly in love with you you'd know I was lying. -Gone with the Wind"""
