id,created_at,text
971553263408496640,2018-03-08 01:08:43,b'RT @AnangSujana: 3. ...yg membuatmu mengendapkan akal dan pikiran kebencian....\nKarena cinta adalah energi ... https://t.co/mXvYekwgfG'
971553235465990144,2018-03-08 01:08:36,"b'RT @AnangSujana: 2. Aku sudah menerima untuk tidak mengatur pikiranmu, karena kini aku lebih suka ... https://t.co/ZZUmpodNnz'"
971553207624253442,2018-03-08 01:08:29,"b'RT @AnangSujana: 1.Pagi ini aku mencari kata kata, untuk menghantar kelembutan jiwamu... Kadang ... https://t.co/ELFuUVAHGF'"
971538011417591808,2018-03-08 00:08:06,"b'Pendidikan politik menjadi kesadaran bersama, bahwa politik itu kehidupan sehari hari yg hrs dipertanggung jawabkan..'"
971537672505196544,2018-03-08 00:06:46,"b'Jangan bangun politik atas dasar sentimen dendam, tapi dasarkanlah pada argumen..'"
971525379201449984,2018-03-07 23:17:55,"b'Selamat pagi sobat, apa kabar pagi ini?'"
971209574609969152,2018-03-07 02:23:01,"b'2. ..Yg penting kamu tahu mana yg aku suka dan mana yg aku tdk suka, mana yg boleh dan mana yg nggak boleh... Bukankah keburukan yg kita lakukan akan kembali pada kita ?..\n\nSemua prilaku kita adalah tanggung jawab kita sepenuhnya...'"
971209459635638272,2018-03-07 02:22:34,"b'1. Dalam aku ada akal dan hati, aku tidak mau marah2 padamu, tidak mau semena mena padamu, karena aku mencintaimu... #NasehatHebat'"
971059171893297152,2018-03-06 16:25:22,b'Cakep https://t.co/ps75BOXYQw'
971059120533946368,2018-03-06 16:25:10,b'Sip https://t.co/ZxHzezVUKO'
971054679881740289,2018-03-06 16:07:31,b'Apa itu? https://t.co/n2yReDM55j'
971020612360593409,2018-03-06 13:52:09,"b'Kebenaran bukan milik semua org, tapi milik pencari kebenaran'"
971020014982541313,2018-03-06 13:49:46,"b'Ada banyak racun di tubuh ini, bukan karena kurang obat tapi justru kebanyakan obat'"
971019838620446720,2018-03-06 13:49:04,"b'Jgn bermain2 utk menyembunyikan semacam kebencian pd satu kelompok, lalu memanfaatkan itu utk menghukum kelompok lain'"
971019499641102336,2018-03-06 13:47:44,b'Me to hehe https://t.co/Y5kRL3uTzY'
971019386281578496,2018-03-06 13:47:17,"b'2.Kenyataannya, perkataan kita memancarkan energi atau pesan tertentu yg menimbulkan reaksi dalm diri orang ... https://t.co/eGi1CFtulZ'"
971019161890471936,2018-03-06 13:46:23,"b'KATAKAN YG BAIK SAJA\n\n1.Kata kata adalah doa, selain itu kata kata yg baik keluar dari mulut kita menjadi kekuatan,  tidak hanya buat diri sendiri, dan juga kebaikan buat orang lain...\nKetika kita berbicara hanya yg baik saja, itu modal dasar bagi semua hubungan.'"
971018703251779584,2018-03-06 13:44:34,"b'Mata yg tetap jernih, dan tidak pernah menua...\nMeskipun dari matalah jendela kemaksiatan itu bermula terbuka...\nMata yg tua namum tidak udzur, karena tidak pernah kehilangan cintanya, dan mata itu tetap indah #NasehatHebat'"
971018255857893376,2018-03-06 13:42:47,b'Keragu raguan itu adalah kekacauan berfikirr. Atau persekongkolan yg blm selesai..#NasehatHebat'
971014763898531841,2018-03-06 13:28:54,"b'Selamat malam sobat, apa kabar?'"
971014398142640128,2018-03-06 13:27:27,b'Menjaga persatuan adalah tanggung jawab kita bersama #NasehatHebat'
970866704908656641,2018-03-06 03:40:34,"b'Hanya mereka yg mau mengkonsumsi akal sehat, akan mampu merubah keadaan ini'"
970866569248063488,2018-03-06 03:40:02,"b'2. Pertanyaan metafor itu, lambung yg baik macam apa yg mampu mencerna akal sehatmu? Sementara otak dangkalmu gagal memahami manfaat buah itu...'"
970866496070066176,2018-03-06 03:39:45,"b'1.Pikiran positif itu ibarat buah yg baik buat kesehatan akal manusia, dan hanya lambung yg baik mampu mencernanya dg baik juga..'"
970606434671931393,2018-03-05 10:26:21,b'Sip https://t.co/NQlPo9ngS0'
970606362483806209,2018-03-05 10:26:04,b'Knp anies? https://t.co/sfjZoN3EdN'
970606294355734528,2018-03-05 10:25:48,b'Gitu ya https://t.co/n3PQDxah5U'
968658418918596608,2018-02-28 01:25:38,"b'Menurutmu, siapa yg cocok presiden berikutnya Dan wakilnya?'"
968658032895803392,2018-02-28 01:24:06,"b'Selamat pagi, tetap rasional di musim politik...'"
968657803786137600,2018-02-28 01:23:11,"b'Musim politik, di musim hujan'"
966554058822594560,2018-02-22 06:03:39,b'Dan Agama adalah dokumen final yg tdk boleh diadu atas nama akal..'
966553706941464578,2018-02-22 06:02:16,"b'Demokrasi itu memungkinkan pelebaran payung hukum, karena pelebaran akal.'"
966117166129979394,2018-02-21 01:07:36,b'Sip https://t.co/Ftd63ufq9C'
966117132042842112,2018-02-21 01:07:28,b'Cakep https://t.co/0WvKlgua4x'
966105165873819648,2018-02-21 00:19:55,"b'Sekolahan itu bukan kerjaan, karena jika sekolahan jadi profesi pendidikan akan kehilangan maknanya'"
966103878327349248,2018-02-21 00:14:48,"b'Politik itu bukan kerjaan, politik itu adalah amanah'"
965983366360088576,2018-02-20 16:15:56,b'Salam https://t.co/5n5hwDERDj'
965983262450507779,2018-02-20 16:15:31,b'Manusia yg sombong itu banyak ruang kosong yg diisi oleh kesombongannya... Sedangkan manusia bersyukur itu ruangnya dipenuhi oleh kerendah hatian....'
965981348472090624,2018-02-20 16:07:55,b'Org yg besrsyukur itu hidupnya rendah hati'
965981178820902913,2018-02-20 16:07:14,b'Org yg besrsyukur itu hidupnya dipenuhi rendah hati'
965980954056564736,2018-02-20 16:06:21,b'Keren https://t.co/SwHxAVSDzs'
965980825954107392,2018-02-20 16:05:50,b'Damai https://t.co/XJr0zSYCtB'
965980756215455744,2018-02-20 16:05:33,b'Sip https://t.co/gkSbm3u8Wf'
965980653777960960,2018-02-20 16:05:09,b'Mantap https://t.co/gqQk5wKr6i'
965922629474443265,2018-02-20 12:14:35,b'Kita bisa belajar dari siapa saja https://t.co/YElil6HEPS'
965922415422275584,2018-02-20 12:13:44,b'Haha https://t.co/UwYNf1jy79'
965922266314784769,2018-02-20 12:13:08,b'Iya gitu aja https://t.co/wYWLQbxDI2'
965922163323584513,2018-02-20 12:12:44,b'terima kasih https://t.co/kqpOPYUP5u'
965921720216383489,2018-02-20 12:10:58,b'7. Ayo kendalikan masa depan kita sendiri #NasehatHebat'
965921265344131072,2018-02-20 12:09:10,"b'6. Jika kita rencanakan dan atur kemudi, maka perahu akan mampu mencapai pulau impian #NasehatHebat'"
965920708369895425,2018-02-20 12:06:57,"b'5. Kita serahkan pada angin dan ombak, perahu akan tanpa arah terombang ambing tanpa tujuan #NasehatHebat'"
965920051831255043,2018-02-20 12:04:20,"b'4. Tanpa merencanakan masa depan, sama dg perahu tanpa kemudi #NasehatHebat'"
965919777460912128,2018-02-20 12:03:15,"b'3. Dua aturan kehidupan, kita atur atau kita akan di atur #NasehatHebat'"
965919468567212033,2018-02-20 12:02:01,b'2. Cara terbaik menghadapi masa depan kita adalah dg menciptaknnya #NasehatHebat'
965919123170447360,2018-02-20 12:00:39,"b'1. Masa depan adalah sesuatu yg tdk pasti, masa depan adalah misteri #NasehatHebat'"
965762134687678464,2018-02-20 01:36:50,"b'2. .. Adalah org yg sangat sendiri, sehingga saat mendapat kesulitan org lain tdk perlu menolongnya'"
965761771960131584,2018-02-20 01:35:24,"b'1. Tangan yg bergerak mengerjakan sesuatu, seolah itu tangannya sendiri, dan Tuhan tdk terdapt dlm kesadarannya..'"
965761133922607104,2018-02-20 01:32:51,"b'Syirik itu tdk terletak pada benda dan tempatnya, tapi bersemayam pada gagasan gagasanmu sendiri..'"
965758689540894720,2018-02-20 01:23:09,b'Harap bnyk maklumnya https://t.co/gGgi6FGioj'
965758588558852096,2018-02-20 01:22:45,b'Knp gitu ya https://t.co/kDBr85LxSj'
965758497051705344,2018-02-20 01:22:23,b'Gitu ya https://t.co/7lFeEJnjjc'
965738845194002433,2018-02-20 00:04:17,b'Hmm https://t.co/0w7whO149i'
965718574571560960,2018-02-19 22:43:45,b'Lagi2 Proyek tol dijakarta roboh.. Kali ini di proyek Tol BECAKAYU.. Jam 4 dini hari tadi'
965548561411682304,2018-02-19 11:28:10,"b'Org yg bijaksana tdk perlu taat hukum, karena apa yg diperbuatnya baik adanya...'"
965545889170309120,2018-02-19 11:17:33,"b'Dan memutar balikan yg kita kejar seperti syurga, padahal neraka'"
965545619434569728,2018-02-19 11:16:29,b'Materialisme adalah alat iblis dan dajjal utk memperdaya manusia'
965545161735352320,2018-02-19 11:14:40,b'Kita terlena sibuk pada pengejaran yg sebenarnya tdk akan abadi'
965545085021577216,2018-02-19 11:14:21,b'Keindahan materialisme adalah alat yg memperdaya kita'
965543247513731073,2018-02-19 11:07:03,b'Cahaya itu ada yg tampak dan ada yg tdk tampak'
965543026419417088,2018-02-19 11:06:11,"b'Perjalanan manusia, menuju kepadaNYA'"
962361010534326272,2018-02-10 16:21:59,b'Hayashitoysmart produsen boneka seagame https://t.co/1XD2YC9Kba'
961841524701933572,2018-02-09 05:57:44,b'Mungkin... https://t.co/ncMsjOk40e'
961841447400951809,2018-02-09 05:57:25,b'Oh milea https://t.co/ytkAF4A0EY'
961632091816443904,2018-02-08 16:05:31,"b'Bumi ini serasa indah, sejak aku tahu kamu ada di dlmnya...'"
961630920133419008,2018-02-08 16:00:52,"b'Aku tdk akan mengekangmu, silahkan kemanapun kamu pergi bebas aja. Asal aku ikut'"
961629847683346432,2018-02-08 15:56:36,b'Malam ini kalau tidur jgn rindukan aku ya! Tapi kalau nggak kuat jgn paksakan'
961606721952088064,2018-02-08 14:24:42,b'Iyaaa https://t.co/PapUD2xOQx'
961606644244267008,2018-02-08 14:24:24,b'Gitu ya.. https://t.co/mEXjyyPw5e'
961606578343260164,2018-02-08 14:24:08,b'Ok https://t.co/MjdVgJJj9A'
961403773766713344,2018-02-08 00:58:16,b'Gitu ya... https://t.co/kG7My10WWl'
961403599052918785,2018-02-08 00:57:34,b'Alasannya? https://t.co/tavKYuFPfH'
961386229236461573,2018-02-07 23:48:33,"b'Bagaimna pendapat anda, dg Zakat yg akan dipungut oleh pemerintah?'"
961382063457751041,2018-02-07 23:32:00,"b'Dari dulu cintaku selalu berubah, tapi saat ini cintaku sama kamu awet...'"
961381693415288833,2018-02-07 23:30:31,"b'Begitu rindunya aku pagi ini, tapi biasanya sore berubah, entahlah.'"
961381200966250497,2018-02-07 23:28:34,"b'Seperti kemarin, hari inipun aku mampu melewatinya...'"
961380884636028929,2018-02-07 23:27:19,"b'Selamat pagi, apa kabar?'"
961380775210885120,2018-02-07 23:26:53,b'Syukur alhamdulillah https://t.co/maubsEoiR1'
961380688233611264,2018-02-07 23:26:32,b'Keren tuh.. https://t.co/4yX3FSpfAQ'
961380613998592000,2018-02-07 23:26:14,b'Sabar ya.. https://t.co/SthZqmRIEo'
961380549720854529,2018-02-07 23:25:59,b'Alhamdulillah https://t.co/mWDryN0fZ1'
961380460831023104,2018-02-07 23:25:38,b'Pesan tayo wa 081381451636 https://t.co/QGExYEtPp0'
960286695240298496,2018-02-04 22:59:24,b'Tayo produksi @AnangSujana https://t.co/evXlrpZUZR'
960286337982021633,2018-02-04 22:57:58,b'Pesan odong2 wa 081381451636 wa https://t.co/9Fe73UvWUf'
960285987627704320,2018-02-04 22:56:35,b'Hooh https://t.co/KrhkNN7HOH'
960285929091956736,2018-02-04 22:56:21,"b'Selamat pagi, apa kabar pagi ini?'"
960134055739015168,2018-02-04 12:52:51,"b'Meskipun kamu cantik, tapi aku belum mencintaimu.. Tunggu setelah aku putus dg pacarku...@AnangSujana'"
960133373569060865,2018-02-04 12:50:09,"b'Pekerjaanku sibuk banget, sibuk mikirin kamu terus...@AnangSujana'"
960132923516010497,2018-02-04 12:48:22,"b'Malam ini kamu jgn ingat aku terus ya, kecuali kamu nggak kuat, silahkan saja... @AnangSujana'"
960132349768884224,2018-02-04 12:46:05,"b'Jika poligami itu kesalahan, ya sudah, biar aku salah terus...kamu nggak bakal kuat hidup dlm kesalahan terus @AnangSujana'"
960127678773776384,2018-02-04 12:27:31,"b'Jgn kawatir perpisahan ini tdk membuatku sedih, yg membuat aku sedih kau habiskan harta peninggalan istriku #NasehatHebat'"
960126036456357893,2018-02-04 12:21:00,"b'Aku tdk cemburu, dia adalah property hatiku, tdk boleh ada org yg berteduh dipelataran hatimu#NasehatHebat'"
960125360342843394,2018-02-04 12:18:18,"b'Kalau kamu mau nagih hutangmu itu hakmu, asal jgn kamu bayarin perkawinan pacarku #virusDilan'"
960124696611110912,2018-02-04 12:15:40,"b'Jangan cintai aku ini berat, sebab kamu harus nanggung hutangku, kamu nggak bakal kuat #virusDilan'"
960124215520194560,2018-02-04 12:13:45,"b'Dik jgn pergi jauh jauh ya, kan ada uangku di tabunganmu #virusDilan'"
960026750955667456,2018-02-04 05:46:28,b'Selaraskan dg alam https://t.co/y88EDh9MNK'
959578334886756353,2018-02-03 00:04:37,b'Tenangkan diri https://t.co/BtJ0LImXGP'
959566726185627650,2018-02-02 23:18:30,b'Pesan boneka grosir hubungi hayashitoysmart 08129913502 wa'
959566484577050625,2018-02-02 23:17:32,"b'3. Tipe org kedua, selalu menggampangkan masalah. Jadi masalah kecil dibiarkan numpuk terus'"
959566166015361024,2018-02-02 23:16:16,"b'2. Org yg selalu meruwetkan segala persoalan. Baginya semua masalah ruwet, padahal sebenarnya sederhana'"
959565827413438465,2018-02-02 23:14:55,b'1.Ada 2 tipe org yg hidup bermasalah mulu'
959564689200984065,2018-02-02 23:10:24,"b'Selamat pagi sobat, apa kabar di hari sabtu ini?'"
959448440009666560,2018-02-02 15:28:28,b'Anangsujana Anang:\nAnangsujana Anang:\nSATU LAGI TENTANG SABAR DAN SYUKUR\n\nBila seseorang mau marah dan ... https://t.co/879cGHLLLM'
959448004947095558,2018-02-02 15:26:44,"b'Jika tangan kita sakit mungkin kita akan kesulitan mengangkat sesuatu...\nJika kaki yg sakit, akan sulit utk ... https://t.co/Xs0RXc7L6K'"
959447871773843456,2018-02-02 15:26:12,"b'Jika tangan kita sakit mungkin kita akan kesulitan mengangkat sesuatu...\nJika kaki yg sakit, akan sulit utk ... https://t.co/csD4FtcJ67'"
959447467002490880,2018-02-02 15:24:36,"b'Selamat malam sobat, ada yg masih melek?'"
959447019533168640,2018-02-02 15:22:49,b'Wah telat jawab ni https://t.co/I2Sz3IQRhr'
959021235521781760,2018-02-01 11:10:54,b'Apa ya mikir ni https://t.co/mXSRuHVKmg'
958148466802176000,2018-01-30 01:22:50,"b'Jgn mau jadi Dilan, karena itu berat, biar Dilan saja!!!'"
958148237336051718,2018-01-30 01:21:55,"b'Jangan mau jadi hakim, karena itu berat kamu nggak bakal kuat, biar aku saja!!!'"
958146974410141698,2018-01-30 01:16:54,"b'Jgn poligami itu berat, kamu nggak bakal kuat mengelola dua hati biar aku saja!! Haha'"
958146568359587840,2018-01-30 01:15:18,"b'Jgn masak sendir, nyuci sendiri, itu berat biar aku saja, kamu nggak bakal kuat'"
957843737723285507,2018-01-29 05:11:57,"b'Kamu tahu segalanya bisa jadi sok tahu,  org yg mempuni ilmunya tdk mengetahui segalanya'"
957476554551967744,2018-01-28 04:52:54,b'Mau naikin omzet sedekahlah...'
957476417842724864,2018-01-28 04:52:21,b'Sedekah itu ilmu pasti yg sederhana utk usaha apapun'
957106906492936193,2018-01-27 04:24:03,b'Hidup ini kan hanya perpindahan dari satu hikmah ke hikmah berikutnya....'
957106656998928384,2018-01-27 04:23:03,b'Tes'
955005919577829376,2018-01-21 09:15:29,b'Haha https://t.co/JgJukaIoCc'
954154341660700673,2018-01-19 00:51:37,"b'4. Wanita dewasa tertarik pada pria mapan, sedangkan wanita abg tertarik pria tampan #NasehatHebat'"
954153598501339136,2018-01-19 00:48:39,"b'4. Yg heran itu, ada wanita cuek loh tdk menjaga tubuhnya, mentang2 dah laku  haha #NasehatHebat'"
954153303717289984,2018-01-19 00:47:29,"b'3. Makanya jgn heran para pria berlomba lomba ingin kaya, semenara wanita berlomba lomba olah tubuhnya'"
954152995628859394,2018-01-19 00:46:16,b'2. Sementara lelaki cemas wanitanya akan tertarik pada pria yg lebih kaya'
954152800035921920,2018-01-19 00:45:29,b'1.Wanita banyak yg cemas pasangannya akan tertarik pada wanita lain yg lebih seksi...#NasehatHebat'
953798181602476032,2018-01-18 01:16:21,"b'Setelah menikah, jgn lama2 tinggal bersama mertuanya #NasehatHebat'"
953797380196810752,2018-01-18 01:13:10,"b'Ingin bahagia dlm rumah tanggamu, lupakan semua kesalahan masa lalu pasanganmu#NasehatHebat'"
953796492224954370,2018-01-18 01:09:39,"b'Lelaki itu pemimpin bagi kaum wanita, ini konsep dasarnya #NasehatHebat'"
953751855183446016,2018-01-17 22:12:16,"b'selamat pagi, hari ini lebih semangat karena aku tahu apa yg harus dikerjakan #NasehatHebat'"
953751519991447553,2018-01-17 22:10:56,"b'Menyadari kelemahan kita, lalu fokus pada kehebatan kita #NasehatHebat'"
953751291162841089,2018-01-17 22:10:02,b'Haha https://t.co/fIMb1IjAQa'
953749181981601792,2018-01-17 22:01:39,b'Bukan berada dimma kini.tapi akan kmna nanti https://t.co/lC8BVG8guV'
953671023404105734,2018-01-17 16:51:04,"b'Akupun sama, susah tidur mikirin kamu'"
953670892579520513,2018-01-17 16:50:33,b'Cakep https://t.co/L7DrfFMFIC'
953670818097111041,2018-01-17 16:50:16,b'Gitu ya https://t.co/OmHuEYjawg'
953670711788228609,2018-01-17 16:49:50,b'Haha https://t.co/6nAjewM4bN'
953670611733131264,2018-01-17 16:49:26,b'Oohhh https://t.co/8Or7oKtZzZ'
953670559874732032,2018-01-17 16:49:14,b'Aseeekkk https://t.co/jRktL5Vb5N'
953670496465297408,2018-01-17 16:48:59,b'Haha https://t.co/YaSE1X1CKw'
953662129340432384,2018-01-17 16:15:44,"b'Malam gini belum tidur, mikirin apa sih?'"
952788328323039233,2018-01-15 06:23:34,b'Sampai saat ini evakuasi masih berlangsung...'
952788106830168065,2018-01-15 06:22:41,"b'Kurang lebih jam 11 tadi, Lantai bursa efek jakarta ambruk, bnyk yg jadi korban #NasehatHebat'"
952787827367882752,2018-01-15 06:21:34,b'Top https://t.co/Bbz2Gc1Wio'
952787788675432449,2018-01-15 06:21:25,b'Top https://t.co/VIEvFVWQH2'
952787742357782528,2018-01-15 06:21:14,b'Sip https://t.co/qNYl6gwUuR'
952192294085574657,2018-01-13 14:55:08,b'Selamat malam sobat...'
951581347725811712,2018-01-11 22:27:27,b'Keren https://t.co/Bb7Pm029QV'
951581287151579136,2018-01-11 22:27:13,b'Top https://t.co/abXRKt4nHK'
951581217970794496,2018-01-11 22:26:56,b'6. Berikutnya sy akan bahas bisnis LINGKARAN SOLUSI....BERSAMBUNG'
951580994913513474,2018-01-11 22:26:03,"b'5. Jika lingkaran ini tdk segera diatasi, bisnismu hancur'"
951580814927523840,2018-01-11 22:25:20,"b'4. Kuncinya, nego dg suplier, atau tambah modal'"
951580638720679936,2018-01-11 22:24:38,"b'3. &gt; akhirnya stok dikit, terus aja dlm lingkaran masalah itu...'"
951580412517560322,2018-01-11 22:23:44,b'2. Stok sedikit &gt; omzet dikit &gt; skhirnya untung dikit &gt; tdk bisa beli barang &gt; suplier malas kirim barg'
951577617387307008,2018-01-11 22:12:38,"b'Selamat pagi sobat, apa kabar?'"
951577361220231168,2018-01-11 22:11:37,b'1.Pernah ngalamin bisnis LINGKARAN MASALAH? Gmr menunjukan bisnis serba salah #NasehatHebat https://t.co/bpO3y8UIYc'
951356239560126464,2018-01-11 07:32:57,b'TAYO wa 08176793339 https://t.co/Ris1rQmkQk'
951355775409995776,2018-01-11 07:31:06,"b'3. Kerjakan demi org lain, maka kekuatanmu akan lebih kuat #NasehatHebat'"
951355250065137665,2018-01-11 07:29:01,"b'2. Karena meminta yg tdk mampu dia bisa, kamu akan kecewa dan dia merasa goblog #NasehatHebat'"
951354892567822338,2018-01-11 07:27:36,"b'1. Mintalah pada suamimu yg mampu dia beli, jgn meminta yg tdk bisa dia lakukan #NasehatHebat'"
951289139382513664,2018-01-11 03:06:19,"b'Tidak perlu berbuat ingin dicintai org lain, berbuat baiklah utk dicintai Allah #NasehatHebat'"
951284038790033408,2018-01-11 02:46:03,"b'Semua kejadian tdk ada yg kebetulan, semua atas ijinnya #NasehatHebat'"
951283661713817600,2018-01-11 02:44:33,"b'Banyak yg bahaya didunia ini, dan dosa adalah yg paling bahaya buat kita #NasehatHebat'"
951280540132392961,2018-01-11 02:32:09,"b'Otak ini diciptakan bukan utk menyelesaikan masalah, otak diciptakan utk berfikir bagaimna utk ditolong Allah..#NasehatHebat'"
951277834521079808,2018-01-11 02:21:24,"b'Org yg tdk ikhlas, akan banyak sakit hati...#NasehatHebat'"
951271930950172672,2018-01-11 01:57:56,"b'Selamat pagii, apa kabarr...tetap semangat ya....'"
950563226697089025,2018-01-09 03:01:48,"b'Sayangnya, hidup ini selalu berpasangan, ada bahagia dan sengsara. Keduanya satu pasang yg hrs kita jalani #NasehatHebat'"
950562959633170432,2018-01-09 03:00:44,"b'Setiap org berhak meminta hidup yg enak, dan menolak kehidupan yg tdk enak #NasehatHebat'"
950531766741159936,2018-01-09 00:56:47,"b'Buktikan saja kamu yg benar RT @_nugrah420: Kalo lagi ngejalanin hubungan, terus si dia masih risau sama kita dan masih percaya apa yg d'"
950504967151824896,2018-01-08 23:10:18,"b'Selamat pagi, hari yg penuh harapan. Tetap semangat sobat...'"
950504703003058176,2018-01-08 23:09:15,b'Nikah aja langsung hahaRT @risma1209: @NasehatHebat pengen pnya pcr:(('
950220128230109185,2018-01-08 04:18:27,"b'5. Jadi, kata bijak juga tergantung orgnya mau gunakan tdk kebijakan itu #NasehatHebat'"
950219610665623552,2018-01-08 04:16:24,b'4. \xe2\x80\x9cTerima kasih utk melupakan hutangku\xe2\x80\x9c haha..#NasehatHebat'
950219394914766848,2018-01-08 04:15:32,"b'3. Termasuk juga berdampak besar utk mengelabui, seperti \xe2\x80\x9cTolang Pinjem Uang\xe2\x80\x9c dan \xe2\x80\x9cMaaf blm bisa bayar hutangku\xe2\x80\x9c#NasehatHebat'"
950218892470771713,2018-01-08 04:13:32,"b'1. Kata org bijak 3Kata ajaib \xe2\x80\x9cMaaf\xe2\x80\x9c Tolong\xe2\x80\x9cTerima Kasih\xe2\x80\x9c..berdampak besar dlm hidup, #NasehatHebat'"
950214910025199617,2018-01-08 03:57:43,"b'2. artikel, statement  didasarkan penelitian ilmuan Universitas Oxford. Monggo yg wanita bokong kecil protes ke ilmuan ini #NasehatHebat'"
950214352681893888,2018-01-08 03:55:30,b'1. Perempuan yg bokongnya besar lebih pintar dan sehat.. #NasehatHebat'
950213717798498304,2018-01-08 03:52:59,"b'Mengulang ngulang doa dan tdk putus asa, karena Tuhan tdk pernah bosan #NasehatHebat'"
950213537342697472,2018-01-08 03:52:16,"b'Semua doa akan dikabulkan, selama tdk tergesa gesa #NasehatHebat'"
950210094066626560,2018-01-08 03:38:35,b'Yg menyembuhkan penyakit adalah Tuhan.'
950209822527385600,2018-01-08 03:37:30,"b'Rezeki itu hanya Tuhan saja yg bisa memberikannya, bukan makhluk #NasehatHebat'"
950208364637691904,2018-01-08 03:31:42,"b'Karena saat mati, rezeki kita sudah disempurnakan #NasehatHebat'"
950208243099303936,2018-01-08 03:31:13,"b'Kita tdk tahu ditakdirkan miskin atau kaya, saat kita mati baru kita tahu takdir kita #NasehatHebat'"
950207916505624581,2018-01-08 03:29:55,b'Takdir itu ketahuan setelah terjadi...#NasehatHebat'
949852373156966401,2018-01-07 03:57:07,b'Kesempatan slalu ada utk mereka yg mau mengambil tanggung jawabnya #NasehatHebat'
949852234006724608,2018-01-07 03:56:34,"b'Kita sudah berada di zona baru, suasana baru, thn baru. Tdk ada gunanya menyesali yg sudah terjadi #NasehatHebat'"
949851846356606976,2018-01-07 03:55:02,b'Kesungguhan hati yg membuat kehidupanmu menemukan yg terbaik #NasehatHebat'
949851500083212288,2018-01-07 03:53:39,b'DIA hanya menerima doa yg tulus dari kita. #NasehatHebat'
949851355316854785,2018-01-07 03:53:05,"b'Dan DIA juga tdk lebay kaya kamu, menilai hanya dg keindahan kata katamu #NasehatHebat'"
949851114815438848,2018-01-07 03:52:07,"b'DIA tdk menilai dg indah dan hebatnya akrobatik kata katamu, karena DIA bukan pujangga #NasehatHebat'"
949850849332707328,2018-01-07 03:51:04,"b'Saatnya kita berdoa, DIA selalu ada waktu, dan tdk perduli dg gaya bahasamu #NasehatHebat.'"
949834020631662593,2018-01-07 02:44:12,b'MantappRT @NeerNirwana85: @NasehatHebat Nikmati min weekend pertama di awal tahun 2018 ayyyeeeeee \xef\xbf\xbd\xef\xbf\xbd\xef\xbf\xbd\xef\xbf\xbd'
949833946245640193,2018-01-07 02:43:54,b'Aamiin RT @RapmahitaS: @NasehatHebat Impian saya ingin punya open dengan mixsernya saya tahun depan saya ... https://t.co/n6YCG3OKK6'
949833845787930625,2018-01-07 02:43:30,"b'Mantep RT @Odhie_22: @NasehatHebat kondangn min, ke resepsinya shabat pas SMA hehehee.. siapa tau bisa ikutan nular min \xef\xbf\xbd\xef\xbf\xbd\xef\xbf\xbd\xef\xbf\xbd #demam2018 #k'"
949811357477515265,2018-01-07 01:14:08,b'Asiiik ni RT @NeerNirwana85: @NasehatHebat Berkumpul bersama keluarga dan piknik\xef\xbf\xbd\xef\xbf\xbd \xef\xbf\xbd\xef\xbf\xbd'
949811289412354048,2018-01-07 01:13:52,"b'Hal hal kecil membawa kesempurnaan, dan kesempurnaan bukanlah hal kecil #NasehatHebat'"
949809710554791936,2018-01-07 01:07:36,b'Semua bisnis perlu masa pengembangan dan persiapan. Pastikan agar produk anda sesuai dg kebutuhan konsumen. #NasehatHebat'
949807612526080001,2018-01-07 00:59:16,"b'Selamat pagi sobat, apa agendanya hari ini?'"
949807404492845056,2018-01-07 00:58:26,b'Hmmm https://t.co/jKvlr4FQRY'
949511339256328192,2018-01-06 05:21:59,b'Sip https://t.co/flO6o8wVrl'
949511213632782343,2018-01-06 05:21:29,b'Memanfaatkan riak2 perubahan utk menjadi yg terdepan'
949510561984753664,2018-01-06 05:18:53,b'Ups..knp ni? https://t.co/FInzdG3gkA'
949506598153592832,2018-01-06 05:03:08,"b'Selamat siang, apa kabar sobat?'"
949506419753025536,2018-01-06 05:02:26,b'Aamiin https://t.co/ohCuzO9a8s'
947955559503863808,2018-01-01 22:19:52,b'Aamiin RT @NadineTika4: @NasehatHebat Masuk PTN'
947955519167242240,2018-01-01 22:19:42,b'Aamiin RT @Dysaputra87: @NasehatHebat Amin...'
947955475793903616,2018-01-01 22:19:32,b'Aamiin RT @Deyya10: @NasehatHebat Selaluu hehe'
947840908032057345,2018-01-01 14:44:17,"b'Tonton ""Anang Sujana Sukses Bisnis Boneka"" di YouTube https://t.co/xhy3RKzAWw'"
947496099979202560,2017-12-31 15:54:08,"b'Thn kemarin bisa, thn ini bisa, thn depan juga pasti bisa...'"
947495872887013376,2017-12-31 15:53:14,b'Masa lalu tidak sama dg masa depan..'
947495715533611008,2017-12-31 15:52:36,"b'Semoga kita semua, menjadi lebih baik, berezeki berkah, dan banyak. Aamiin'"
947495070889943041,2017-12-31 15:50:03,b'Tinggal 2jam lgi menuju 2018...'
947494879361351681,2017-12-31 15:49:17,"b'RT @GalihPetra: @NasehatHebat Sukses, dapet jodoh, nikah, dan bahagia'"
947494401328025600,2017-12-31 15:47:23,b'Aamiin https://t.co/I0OpLPt8ZI'
947494360261603329,2017-12-31 15:47:13,b'Aamiin https://t.co/bQtSuBcMLl'
947494310714392577,2017-12-31 15:47:01,b'Tetap bahagiakan? https://t.co/5YJPGZNQSj'
947494163892731905,2017-12-31 15:46:26,b'Aamiin https://t.co/Kx8s3GgPvg'
947244228819562496,2017-12-30 23:13:17,"b'Selamat pagi sobat, kemana liburan malm ini?'"
947243758239674368,2017-12-30 23:11:25,b'Aamiin https://t.co/zA0O8zk89a'
947243705987039232,2017-12-30 23:11:13,b'Aamiin https://t.co/22iTjaY4rz'
947243641063424000,2017-12-30 23:10:57,b'Aamiin https://t.co/tCxE9YevPs'
947243579314880512,2017-12-30 23:10:42,b'Aamiin https://t.co/zo63HeBUjP'
947243520082845696,2017-12-30 23:10:28,b'Aamiin https://t.co/dpEzU5EWt2'
947243465779191809,2017-12-30 23:10:15,b'Aamiin https://t.co/Gde0x3K34V'
