id,created_at,text
853527406505840640,2017-04-16 08:36:06,"b'1. Jika ada guru yg mendekati kesempurnaan, karena kualitas ilmunya sangat jauh dari kita. Mereka tetaplah manusia.'"
853431083773435905,2017-04-16 02:13:21,"b'Bagaimana bisa menjadi baik bagi orang lain, tapi belum baik bagi diri sendiri.'"
853426039384616963,2017-04-16 01:53:18,"b'Salah satu kemulyaan malaikat adalah selalu melakukan hal yg baik, maka yg mengajak dlm kebaikan adalah manusia berhati malaikat.'"
853425705186623489,2017-04-16 01:51:58,b'Sedih itu karena kita kehilangan sesuatu yg berharga.'
853423675277791232,2017-04-16 01:43:54,"b'Selama hatimu tdk melekat, waktu akan menyembuhkanmu. Selama hatimu sangat melekat waktu akan memperpanjang penderitaanmu'"
853422986149470208,2017-04-16 01:41:10,b'Semangat baru harapan baru'
853419209237385216,2017-04-16 01:26:09,"b'Selamat pagi, kemana ni agendanya hari ini?'"
853187721652838400,2017-04-15 10:06:18,"b'10. Saat itulah, ada hikmah yg banyak buat kita jadikan pelajaran #Hikmah'"
853187581873467392,2017-04-15 10:05:45,"b'9. Dengan bertobat, maka Tuhanlah yg akan menutupi aib itu, lalu mulai buka lembaran baru #Hikmah'"
853187310292258816,2017-04-15 10:04:40,"b'8. Setiap masalah hadir, adalah tanda untuk perbaikan diri, bukan sibuk cari alasan agar aib tidak tersebar #Hikmah'"
853187057862266880,2017-04-15 10:03:40,"b'7. Bukannya introspeksi diri, malah sibuk cari pembenaran pembenaran diri, agar org lain memaklumi perbuatan kita #Hikmah'"
853186724108931072,2017-04-15 10:02:21,"b'6. Banyak diantara kita kehilangan momen hikmahnya, karena tdk berani ambil resiko mengakui kesalahan itu #Hikmah'"
853186402288361472,2017-04-15 10:01:04,"b'5. Ketika kita melakukan kesalahan, dan menyebabkan banyak org terluka karenanya #Hikmah'"
853186203985858561,2017-04-15 10:00:17,b'4. Semua saling berhubungan satu sama lain silih bergantian'
853185964713357312,2017-04-15 09:59:20,"b'3. Bahagia tdk selamanya dalam genggaman, begitu juga derita #Hikmah'"
853185771855110144,2017-04-15 09:58:34,"b'2. Terlalu banyak ketawa dan bahagia, bersiap siaplah menghadapi tangisan dan penderitaan #Hikmah'"
853185521731948544,2017-04-15 09:57:34,b'1. Kehidupan ini selalu memaksa kita ke arah keseimbangan. #Hikmah'
853185142751408129,2017-04-15 09:56:04,"b'Selamat sore sobat, apa kabar?'"
852309080718929921,2017-04-12 23:54:54,"b'Jika sesuatu itu dia pergi, dan kamu biasa aja. Berarti dia tdk banyak berarti dlm hidupmu..'"
852308952117374976,2017-04-12 23:54:23,"b'Sesuatu itu berharga atau tidak, ketika sesuatu itu pergi. Jika dia pergi kamu merana dia berharga bagimu.'"
852307731226787840,2017-04-12 23:49:32,"b'Bergaulah dg org yg membuatmu tumbuh, jika tidak pergaulanmu hanya akan banyak melihat keluhan.'"
852307334105792513,2017-04-12 23:47:58,"b'Hidup itu terlalu memudahkan sesuatu, kurang kewaspadaan. Terlalu serius membuat kita terlihat bodoh haha..'"
852305959036870656,2017-04-12 23:42:30,"b'Selamat pagi, tetap semangat menjemput rezeki.'"
852305857404694528,2017-04-12 23:42:06,"b'Kopdar UKM kali ini di Hotel Bahari Inn Tegal, bekerja sama dg Pegadaian'"
852305600671342592,2017-04-12 23:41:04,"b'RT @madarif_: Salam admin @NasehatHebat  tolong retweet tweet atas ni \xef\xbf\xbd\xef\xbf\xbd\xef\xbf\xbd\xef\xbf\xbd\xef\xbf\xbd\xef\xbf\xbd satu, bantu rezeki saya tq'"
852305491476742145,2017-04-12 23:40:38,"b'RT @AnangSujana:  sy sudah berada di lokasi HOTEL BAHARI INN TEGAL , acara KOPDAR UKM yg di sponsori oleh PEGADAIAN. https://t.co/Q0G9JpdAVH'"
852161877954056192,2017-04-12 14:09:58,"b'Malam ini saya sudah di HOTEL BAHARI INN TEGAL, siap KOPDAR UKM yg di sponsori PEGADAIAN besok siang. https://t.co/6p8A5BTjfj'"
852069458197827584,2017-04-12 08:02:44,"b'Segala sesuatu berawal dan berakhir, awal dan akhir bersamaan. Akhir hari ini pukul 00 dan awal hari ini pukul 00'"
852068549581561857,2017-04-12 07:59:07,"b'Aku pernah juga makan pete ada ulatnya kemakan, tapi ko nggak bisa merayap di pohon ya?'"
852068252075388929,2017-04-12 07:57:56,"b'Aku pernah minum tea berikut nyamuk yg nyemplung, rasanya geli di leher. Tapi ko aku nggak bisa terbang ya? ..'"
852067494227578882,2017-04-12 07:54:55,"b'Jika hidup terlalu gampang, kurang waspada. Jika hidup terlalu serius kurang pinter haha'"
851460416970665986,2017-04-10 15:42:37,b'RT @AnangSujana: Just posted a photo https://t.co/MhMdUJE4iR'
851271155033833473,2017-04-10 03:10:33,"b'1.Anda harus bangga jadi orang jawa, karena namamu di sejajarkan dg nama2 beken pemain bola Eropa'"
851228155784331264,2017-04-10 00:19:42,"b'4. Iya mas, showernya jgn di pijit2 mas..tapi di puter nanti airnya keluar hahaha..#KabayanSabaKota'"
851227735179620354,2017-04-10 00:18:01,"b'3. Showernya juga susah ni di pijit2..ini hotel aneh, apa gue yg aneh..'"
851227532821233664,2017-04-10 00:17:13,"b'2. Mau mandi jadi susah ni..katanya nggak pakai gayung mas, tapi pakai shower...'"
851227252893331456,2017-04-10 00:16:06,"b'1. Katanya hotel Mahal, ko kamar mandinya nggak ada gayungnya?'"
851223913535336448,2017-04-10 00:02:50,"b'Maka idealnya, ingatlah Tuhan saat susah maupun senang.'"
851223600535416832,2017-04-10 00:01:35,"b'Kalau kebiasaan kamu ingat Tuhan saat sedang susah, ketika mulai lupa Tuhan, maka kehidupan akan memanggil wujud kesusahan'"
851221919303163904,2017-04-09 23:54:55,"b'Kebiasaan itulah, yg akan digunakan kehidupan utk membuat kamu ingat Tuhan..'"
851221383099056128,2017-04-09 23:52:47,"b'Kamu biasanya lebih ingat Tuhan, saat lagi susah? ..atau pas lagi senang?'"
851216661701156864,2017-04-09 23:34:01,"b'Yg terbaik adalah, temukan sumber cinta sejatimu, dimana itu? Mencintai Tuhan..'"
851216369760821253,2017-04-09 23:32:52,"b'Banyak org mencari obat utk luka batinnya, padahal luka itu hanya bisa disembuhkan oleh batin diri sendiri, org lain hanya membantu'"
851214841410965508,2017-04-09 23:26:47,"b'Org yg hidupnya damai, kelihatan dari dalam maupun dari luar dirinya.'"
851214312299540480,2017-04-09 23:24:41,"b'Tetap lembut dan penuh kasih, begitulah yg disenangi oleh kehidupan'"
851213954399571969,2017-04-09 23:23:16,"b'Kebodohan dan kebencian tidak usah dipelihara, apa lagi di ternak haha..'"
851213723310096385,2017-04-09 23:22:21,"b'Tidak usah membandingkan kekurangan orang lain dg kelebihanmu, jika itu yg ditonjolkan itu kesombongan'"
851213330777866241,2017-04-09 23:20:47,"b'Kalau dia ingin hidup bersamamu, dia pasti akan berjalan bersamamu.'"
851212858390188032,2017-04-09 23:18:54,"b'Jika pikiran penuh dg prasangka, dan hati gelap gulita, mari terangi dg amalan baik perintah kitab suci.'"
851212547059580933,2017-04-09 23:17:40,"b'Jika hatimu seputih awan, tidak indah jika kamu kotori dg mendung yg bergantung'"
851211162557575170,2017-04-09 23:12:10,"b'Selamat pagi, tetap semangat menjemput rezeki'"
851050221882810370,2017-04-09 12:32:39,"b'Petani rajin2 loh, tdk perlu ada asisten, seperti pemain golf.'"
851026009977741312,2017-04-09 10:56:26,"b'Kita bisa membetulkan sesuatu, saat kita berhenti menyalahkan.'"
851024040835915778,2017-04-09 10:48:37,b'Ini penghuninya pada kemana ? Haha'
851022912404561920,2017-04-09 10:44:08,b'Ada yg monitor?'
850617122753572864,2017-04-08 07:51:40,b'Banyak org kecewa karena belum siap menerima resiko terburuk apa awalnya'
850616773640695809,2017-04-08 07:50:17,"b'Berdamai dg kemungkinan terburuk sejak awal, membuat kita siap menerima kemungkinan takdir apapun'"
850612627667550209,2017-04-08 07:33:48,b'4. Misalnya kebiasaan olah ragai pagi bikin seger dan buger. Saat tdk olah raga aja badan tdk berasa buger lagi'
850612206681116672,2017-04-08 07:32:08,"b'3. Sesuatu yg terus dilakukan akan menjadi kebiasaan, akhirnya ada rasa ketagihan jika tdk melakukannya, atau perasaan tdk enak'"
850611892393570304,2017-04-08 07:30:53,"b'2. Itu biasanya berasa ada sesuatu yg belum lengkap, atau berasa ada yg hilang'"
850611738869452800,2017-04-08 07:30:16,"b'1.Kebiasaan bila dirutinkan berbulan bulan dilakukan, apa yg terjadi saat kebiasaan itu ditinggalkan?'"
850610140491526145,2017-04-08 07:23:55,"b'Realitanya perasaan bathin itu naik turun, emang begitulah adanya'"
850609845803913216,2017-04-08 07:22:45,"b'Jabatan bisa jadi naik terus, tapi perasaan bathinmu itu pastinya naik turun'"
850609646578618368,2017-04-08 07:21:57,"b'Hidup ini sudah dari sononya naik turun, bukan fisiknya tapi bathinnya'"
850609480517767168,2017-04-08 07:21:18,"b'Hidup itu sudah menjadi takdirnya naik turun, bukan berarti soal fisiknya naik turun, tapi batinnya'"
850603149530460160,2017-04-08 06:56:08,b'Persiapan hadiri ceramah zakir naik di stadiun lapang bola patriot bekasi..'
850602918290042880,2017-04-08 06:55:13,"b'Hidup yg seimbang itu, ditengah2, segala sesuatu jika berlebihan tidak baik'"
850599623119056896,2017-04-08 06:42:08,"b'Belajarlah pada binatang, yg selalu memberi manfaat pada yg memeliharanya.'"
850594432793620480,2017-04-08 06:21:30,"b'Pentingnya melatih keseimbangan hidup, jangan terlalu tinggi dan jangan juga terlalu rendah..'"
850592990640971776,2017-04-08 06:15:46,"b'Kamu hanya bisa berteori akan segala hal soal kebahagiaan, namun bagiku apa yg kujalani aku nikmati saja. Pura2 maupun beneran'"
850592342201573377,2017-04-08 06:13:12,b'Meskipun kebahagiaan itu ada yg bilang bersyarat dan tidak bersyarat. Aku jalani saja dari bangun tidur sampai tidur lagi'
850592012185341952,2017-04-08 06:11:53,"b'Bahagiaku, mensyukuri atas kehidupanku ini..'"
850589374156869632,2017-04-08 06:01:24,b'Tes'
850510244673466374,2017-04-08 00:46:58,"b'Cintaku seperti inti atom, yg tdk bisa di bagi lagi haha'"
850136844578811904,2017-04-07 00:03:13,b'RT @AnangSujana: https://t.co/AYkNTNMcpq'
849876353537257472,2017-04-06 06:48:07,"b'RT @AnangSujana: Hayashikids\nJl. Dasa Darma No.5, Bojong Rawalumbu, Rawalumbu, Kota Bks, Jabar 17115\n0817-6793-339\xe2\x80\xa6 https://t.co/YsRj3f4lls'"
849806884865548292,2017-04-06 02:12:04,"b'Kalau terus2an saling menyalahkan, sebenarnya nggak ada niat utk saling membetulkan diri'"
849805347648929796,2017-04-06 02:05:58,"b'Orang yg menyayangimu sepenuh hati, bisa berubah membencimu setengah mati.'"
849803201553457152,2017-04-06 01:57:26,"b'5. Ini, saya beli mie rebus di tawarin SEKALIAN dg pulsa, apa hubungannya? Emang makan mie ngabisin pulsa? Haha..'"
849802773029892096,2017-04-06 01:55:44,"b'4. Misalnya, beli roti SEKALIAN dg selainya, atau sirupnya..beli mie rebus sekalian dg saos sambalnya..'"
849802468246552576,2017-04-06 01:54:31,"b'3. Kalau memakai kata SEKALIAN, mestinya 2 barang yg saling berhubungan.'"
849802295827197953,2017-04-06 01:53:50,b'2. \xe2\x80\x9cNggak SEKALIAN sama pulsa?\xe2\x80\x9c Kalau menurutku ini pertanyaan aneh yg dilakukan kasir minimarket.'
849802017161826304,2017-04-06 01:52:44,"b'1. Coba cermati saat belanja di minimarket, kasirnya selalu menawarkan PULSA, apapun barang yg kamu beli \xe2\x80\x9cNggak sekalian sama PULSA mas?\xe2\x80\x9c'"
849801484296495104,2017-04-06 01:50:37,b'Kata TELOLET juga mirip dengan kata TOILET haha..'
849801308152442880,2017-04-06 01:49:55,"b'Sama juga dengan WILAYAH CINA, bila di singkat jadi nggak nafsu bahasnya saat sarapan haha..'"
849800955369574402,2017-04-06 01:48:30,"b'Dua kata bila di gabungkan jadi nggak enak di bahas saat sarapan, JAM dan BAN jadi..'"
849787637997203456,2017-04-06 00:55:35,"b'2. Bagi orang peka, kebencian terlalu terang meskipun di tutupi dengan kebaikan.'"
849787331938844672,2017-04-06 00:54:22,"b'1.Bagi pembenci, kebencian seperti api yg membakar tubuhnya dan mengira api itu penerang jalan.'"
849768004590108674,2017-04-05 23:37:34,"b'Bila hati sejerniah air, tidak elok kan membiarkannya keruh'"
849767672724279297,2017-04-05 23:36:15,"b'Bahagia sejati itu, menerima apapun takdir yg sudah di takdirkan..'"
849767310143479809,2017-04-05 23:34:49,b'Bersyukur setiap hari atas semua hadiahNYA'
849766909868376064,2017-04-05 23:33:13,b'Coba belajar menerimaRT @ninna2408: @NasehatHebat Gak bahagia sama sekali yg ada sakit hati mulu \xef\xbf\xbd\xef\xbf\xbd\xef\xbf\xbd\xef\xbf\xbd\xef\xbf\xbd\xef\xbf\xbd\xef\xbf\xbd\xef\xbf\xbd'
849766553822400512,2017-04-05 23:31:48,b'Hooh RT @AndySopian10: @NiningKasmani @NasehatHebat oh.bgtu ya'
849543594344153089,2017-04-05 08:45:51,"b'Banyak keyakinan yg kita anggap benar, padahal salah'"
849399115570171904,2017-04-04 23:11:44,"b'Akhirnya semua orang bisa merasakan kebahagiaan, dengan caranya masing2. Anda bahagia?'"
849398916500140037,2017-04-04 23:10:57,"b'Semua org bisa mendefenisikan bahagia apa saja, padahal bahagai itu sederhana, menemukan sumber cinta sejati dariNYA.'"
849398495610097664,2017-04-04 23:09:17,"b'Jika kebahagiaan bisa kita niatkan saat ini juga, itu artinya bahagia buatan. Memang awalnya kita buat dulu, sampai bener2 terjadi'"
849394810402242564,2017-04-04 22:54:38,"b'Apapun definisiku yg kuyakini, maka keyakinan itu yg akan mewujudkan dalam kehidupanku'"
849394610229084160,2017-04-04 22:53:50,"b'Apapun definisiku tentang bahagia, tdk akan mampu menyentuh bahagia itu sendiri'"
849394379827671040,2017-04-04 22:52:55,"b'Merasa paling baik dan benar, padahal ada alternatif lain yg paling bener haha..'"
849392728639250432,2017-04-04 22:46:22,b'Bahagia itu pasti jika DIA slalu ada dlm hatimu  @NasehatHebat. IG @anangsujana. FB/nanaanangsujana channel telegram http//t.me/nasehathebat'
849247863947264001,2017-04-04 13:10:43,"b'Reputasi tidak begitu penting, yg penting itu saat ini di sini kamu berusaha lebih baik.'"
849247434626805760,2017-04-04 13:09:01,"b'Menemukan cinta dengan hati, karena kalau pakai pikiran banyak kamu temukan keruwetan haha..'"
849247175641059328,2017-04-04 13:07:59,b'Ora percoyo ya wis hahaRT @ivann_1109: @NasehatHebat mosooookkk?????'
849247018237218816,2017-04-04 13:07:22,"b'Kalau cinta semudah ngomong I love you, maka cinta itu murah dan loakan haha'"
849245787657777154,2017-04-04 13:02:28,"b'Perduli itu muncul dalam hati, bukan dalm kata2'"
849245395981127680,2017-04-04 13:00:55,"b'Jika hal2 kecil saja susah berintegritas, bagaimana mencapai hal besar?'"
849245111485681665,2017-04-04 12:59:47,"b'Awali dg harapan, lalu membangun impian, lalu bangun keinginan, lalu dapat pengalaman.'"
849244815657234433,2017-04-04 12:58:36,"b'Hidup itu mudah, kalau lebih dikurangi, kalau kurang ditambahi. Simple..'"
849244398747619328,2017-04-04 12:56:57,"b'Selama kamu masih bisa merasakan sedih, kamu masih hidup. Selama kamu masih suka salah kamu masih manusia'"
849243424632995840,2017-04-04 12:53:05,"b'Aamiin RT @nuria_asiyah: @NasehatHebat impianku, apa iya nggk lah ini jg lagi usaha buat ngejar semoga terlaksana,sukses selalubuat mimin jg'"
849243164674334720,2017-04-04 12:52:03,b'Kusus grosiran yah? RT @AnangSujana: Edisi doraemon wa 081381451636. Grosiran https://t.co/Pt2OzhpzPB'
849240548728868864,2017-04-04 12:41:39,b'Apa impian terbesarmu yg belum terwujud? Itu karena kamu kebanyakan mikir'
849239953167048705,2017-04-04 12:39:17,"b'Sering kekawatiranmu itu merepotkan orang lain, padahal di jam sibuk..'"
849239533057134593,2017-04-04 12:37:37,"b'Cinta sejati itu, bukan bagaimana orang lain mencintaimu, tapi bagaimana kamu mencintai org lain itu dg kesungguhan.'"
849239243536904192,2017-04-04 12:36:28,"b'Cinta sejati itu tidak buta, dan tidak membutakan'"
849238451161628672,2017-04-04 12:33:19,"b'Kalau hidupmu berhasil, pengen lama hidup, sampai bener2 hidup membosankan haha..'"
849238182122180608,2017-04-04 12:32:15,"b'Hal kecil kadang sering menghalangi usaha besar kita, kalau itu penting kenapa mesti menunggu? Ayuk! Kejar! Haha'"
849237115246452737,2017-04-04 12:28:00,"b'Manusia saat ini sungguh mengherankan, di tempat lain sulit cari makan, di tempat kita ketakutan utk makan, karena takut gemuk haha..'"
849236806596009993,2017-04-04 12:26:47,"b'Makan sejatinya juga untuk dinikmati, selayaknya pikiran dan perasaan hadir dalam keadaan nyaman'"
849236529927127041,2017-04-04 12:25:41,"b'Sobat, sejatinya hidup itu untuk dinikmati, jadi fokus pada kehidupan yg membahagiakan..'"
849066543879266304,2017-04-04 01:10:13,"b'Peluang masih luas bagi manusia untuk menguasai pasar dunia akhirat, yaitu ekspedisi antar dimensi haha'"
849061496256704514,2017-04-04 00:50:10,"b'Jangan berhenti menasehati diri sendiri dan orang lain, hanya karena takut apa yg kita nasehatkan terjadi pada kita.'"
849061241188483072,2017-04-04 00:49:09,"b'Menasehati diri sendiri dan orang lain, adalah tugas kita sebagai manusia.'"
849060351740129283,2017-04-04 00:45:37,"b'kehidupan ini tidaklah gampang seperti penasehat omongkan, dan menjadi penasehat juga tdk segampang yg kita pikirkan.'"
849059824415502336,2017-04-04 00:43:31,"b'Apa yg kita bicarakan, sebaiknya yg sudah kita kerjakan.'"
849059543992721408,2017-04-04 00:42:24,"b'Dan akun ini, @nasehathebat lebih untuk menasehati diri sendiri.'"
849059352636002304,2017-04-04 00:41:39,"b'Di sosmed, menulis kebaikan salah, keburukan juga salah. slalu ada komentar miring. Kalau hasilnya sama, saya memilih menulis kebaikan saja'"
849058857284501504,2017-04-04 00:39:40,"b'Orang yg lagi ruwet banget, tidak suka di nasehati. Dia butuh solusi.'"
849058670226935809,2017-04-04 00:38:56,"b'Tulisan saya ini penuh dg nasehat2, dan nasehat ini untukku...menasehati diri sendiri.'"
849057909220757504,2017-04-04 00:35:54,"b'Saya termasuk tdk percaya dg apa yg kita bicarakan, akan selalu kembali pada kita. Menurutku tdk selalu.'"
849045263050321921,2017-04-03 23:45:39,"b'Jaman terus berubah, pikiran dan pengetahuan harus terus bertumbuh.'"
849044999551549440,2017-04-03 23:44:37,"b'Bukan berada dimana kini, tapi akan kemana kita nanti'"
849043210219532288,2017-04-03 23:37:30,"b'Selamat pagi, tetap semangat menjemput rezeki'"
848809646433476610,2017-04-03 08:09:24,b'Tangan mereka biar urusan mereka hahaRT @egirizki_s: @NasehatHebat lalu tangan mereka guna nya buat apa min? haha'
848714142185910272,2017-04-03 01:49:54,b'RT @AnangSujana: Edisi Hayashitoysmart wa 081381451636 https://t.co/Fb376Rsy4q'
848714114079875073,2017-04-03 01:49:47,b'RT @AnangSujana: Edisi pagi Hayashitoysmart wa 081381451636 https://t.co/f27GPwjdxu'
848712716458086401,2017-04-03 01:44:14,"b'Kita punya 2 tangan, tdk akan mampu menutup semua mulut mereka, tapi kita punya 2 telinga utk menutupi telinga kita haha..'"
848712398332731392,2017-04-03 01:42:58,"b'Bila tertekan kamu sedang hidup di masa lalu.  jika takut, kamu sedang hidup di masa depan. Berdamailah biar kamu hidup di masa kini'"
848711992303132672,2017-04-03 01:41:21,"b'Banyak org menutupi keterbatasannya, dg segala kehebatannya. Padahal, ada yg lebih mudah mengakui keterbatasan dg damai.'"
848711565356486657,2017-04-03 01:39:40,"b'Otak bisa saja sudah penuh dg berbagai ilmu, tapi prilaku bisa saja tdk berpendidikan.'"
848694602819391488,2017-04-03 00:32:15,b'Bolehkah kita berdoa keburukan utk orang lain?'
848674774603755524,2017-04-02 23:13:28,"b'Di indonesia, org2 yg tdk berAgama tidak ada tempat baginya.'"
848674634287468544,2017-04-02 23:12:55,"b'Membenci karenaNYA, mencintai karenaNYA. Itu prinsip org2 berAgama'"
848674374622302208,2017-04-02 23:11:53,"b'Jangan Menyebarkan kebencian, dan kamu juga jgn menimbulkan org membenci. Hiduplah bersama penuh kedamaian.'"
848548395916591104,2017-04-02 14:51:17,"b'Fokuslah pada apa yg bisa kamu kerjakan, bukan pada apa yg tdk bisa kamu kerjakan'"
848548150528937988,2017-04-02 14:50:19,"b'Yg menyebabkan org tdk mendapatkan apa yg dia inginkan, karena tdk fokus pda keinginannya.'"
848513781693067266,2017-04-02 12:33:44,b'Yg hanya sekedar tahu biasanya teriakannya paling kenceng haha'
848513423222738946,2017-04-02 12:32:19,"b'Hari terus berganti hari, masa isi batinmu belum pernah di perbaharui.'"
848513001510535170,2017-04-02 12:30:38,"b'Menerima apapun hidup ini tanpa bertanya, semua hanyalah miliknya'"
848507081338609664,2017-04-02 12:07:07,"b'Semua kebaikan dan semua keburukan yg datang pada kita, adalah dinamika kehidupan'"
848343741341552640,2017-04-02 01:18:04,b'Keseimbangan hidup adalah keseimbangan antara otak kanan dan otak kirinya..'
848342088374734848,2017-04-02 01:11:29,b'Beribadat yg kusuk ya?RT @arifdjara: @NasehatHebat Ke gereja sobat \xef\xbf\xbd\xef\xbf\xbd'
848338080113274880,2017-04-02 00:55:34,"b'Hidup itu bukan mencapai kesempurnaan, manusia tetaplah manusia dg egonya dan kekurangannya.'"
848335384476090369,2017-04-02 00:44:51,"b'Ego kadang melemahkan telinga utk mendengar, dan menguatkan mulut untuk terus berbicara.'"
848334524538912768,2017-04-02 00:41:26,"b'Dalam hidup saya tidak mencari kesempurnaan, mencari kesempurnaan malah itu satu kecacatan'"
848333838862471168,2017-04-02 00:38:43,"b'Ketempat rekreasi atau olah raga RT @egirizki_s: @NasehatHebat belum tau, ada saran?'"
848333063033675780,2017-04-02 00:35:38,b'Mau di ruqyah niRT @Santikchova: @NasehatHebat : mau ke gedung sujono lumajang ada acara ruqiyah bersama ustad @TRANS7'
848327442448211973,2017-04-02 00:13:18,"b'Pagi sobat, kemana ni agendanya hari ini?'"
847932968589045760,2017-03-31 22:05:48,"b'Pagi ini sudah hari baru, apa dirimu juga sudah baru? Bertobatlah sebelum dipaksa berobat haha..'"
847932178021437440,2017-03-31 22:02:39,"b'Rasa ingin tahu apa yg dikerjakan org lainlah, yg menghabiskan waktumu.'"
847931501429891072,2017-03-31 21:59:58,"b'Saat orang menyukaimu maka akan mendengarkanmu, saat org mempercayaimu maka akan mengajakmu berbisnis.'"
847930873383194624,2017-03-31 21:57:28,"b'Cara terbaik utk mempengaruhi orang lain, dengan kebaikan dan kebajikan.'"
847929813713268738,2017-03-31 21:53:16,"b'Kita lahir ke dunia ini bukan tanpa sengaja, kita lahir dari tangan cinta Tuhan.'"
847729133501071361,2017-03-31 08:35:50,"b'Saran, beri hiburan dan lawakan yg lucu lucu.'"
847728858442874880,2017-03-31 08:34:44,"b'Orang yg masalah hidupnya terlalu berat, di titik ini males di beri nasehat bijak.'"
847613183711825922,2017-03-31 00:55:05,"b'Saat kaya, kurangi kehidupan di luar rumah, lebih banyaklah hidup bersama keluarga di rumah.'"
847612950281977858,2017-03-31 00:54:09,"b'Saat susah perbanyaklah silaturahim, bertemu dg sebanyak banyaknya org.'"
847595018210639872,2017-03-30 23:42:54,b'Sukses itu pekerjaan yg kamu selesaikan.'
847591788403716097,2017-03-30 23:30:04,b'Takdir menunjukan kekuasaanNYA'
847591678781386756,2017-03-30 23:29:38,"b'Selamat pagi, ujung dari segala usaha adalah TAKDIR'"
847439896667013121,2017-03-30 13:26:30,"b'Setiap saat bersyukur, atas hadiah hidup yg ENGKAU berikan, selain bersyukur mau apa lagi?'"
847438676376264706,2017-03-30 13:21:39,"b'Selalu mikirin orang lain, sehingga banyak waktu produktif yg terbuang, yg membuat menunda tanggung jawab kehidupanmu sendiri'"
847438154348888064,2017-03-30 13:19:35,"b'Kadang kita sok tahu, lalu ngasih tahu org lain yg belum tahu, padahal semua org tahu dia pembuat tahu haha..'"
847433755702681600,2017-03-30 13:02:06,"b'Demi kekuasaan, segala cara di gunakan. Bukankah lebih elok adu gagasan?'"
847377129998123008,2017-03-30 09:17:05,"b'Sebaiknya, dlm satu keluarga ada 1 orang yg jadi pengusaha'"
847376876385452034,2017-03-30 09:16:05,"b'Menjadi pengusaha adalah pilihan, dan menjadi pengusaha salah satu alasan utk meningkatkan ekonomi keluarga.'"
847373973595734016,2017-03-30 09:04:33,"b'Dlm bisnis, kadang org baik ada kalanya ingkar janji, bukan karena dia niat berbohong, kadang keadaan memaksanya begitu.'"
847370661190225920,2017-03-30 08:51:23,"b'Masalah kalau tidak membuat kita lemah, akan menumbuhkan kekuatan dan hikmah kehidupan'"
847370464515063809,2017-03-30 08:50:36,"b'Menumbuhkan kesadaran bahwa masalah adalah hikmah yg belum tahu manfaatnya, memang tdklah mudah'"
847370274710274052,2017-03-30 08:49:51,"b'Masalah banyak menghadang kita, itu bisa mendewasakan bisa juga menghancurkan.'"
847364846056161280,2017-03-30 08:28:17,b'Bahagia itu pasti jika DIA slalu ada dlm hatimu  @NasehatHebat. IG @anangsujana. FB/nanaanangsujana channel telegram http//t.me/nasehathebat'
847252152766439425,2017-03-30 01:00:29,"b'Selamat pagi sobat, mengenal diri lebih penting dari pada mengenal diri orang lain.'"
847251927683350531,2017-03-30 00:59:35,"b'Saat kamu di percaya, banyak orang mau berbisnis dan bekerja sama denganmu.'"
847251796196073473,2017-03-30 00:59:04,"b'Saat nasehatmu di dengarkannya, kamu di percaya.'"
847026736600682496,2017-03-29 10:04:45,"b'TAKDIR itu, menunjukan kekuasaan-NYA'"
847026197561270272,2017-03-29 10:02:37,"b'Tidak semua yg kita inginkan terlaksana, karena pada akhirnya semua takdirNYA..'"
847025681880039424,2017-03-29 10:00:34,b'Ujung dari usaha maksimal adalah TAKDIR..'
846976987159810049,2017-03-29 06:47:04,"b'Kalau ada yg rugi, adalah org yg memendam api kebencian.'"
846976755919470592,2017-03-29 06:46:09,b'Pikiran kita di bajak oleh kebencian dan kemarahan yg kita bawa kemana mana'
846976592211558400,2017-03-29 06:45:30,"b'Ketika hati terlukan, kita cendrung ingin membuat luka pada org yg telah membuat kita terluka.'"
846976032402018304,2017-03-29 06:43:16,"b'Tubuh akan sulit bergerak, karena banyak membawa beban. Begitu juga dg jiwa kita akan susah tumbuh jika di bebani dg banyaknya keinginan'"
846975679384244224,2017-03-29 06:41:52,"b'Kehidupan ini akan terus menghantammu dg pelajaran masalah yg sama, sampai kamu mengerti dan mengambil hikmahnya.'"
846930872876126209,2017-03-29 03:43:49,"b'Memang tdk enak mengampuni orang lain, jika perasaan ego kita ngikutin hawa nafsu'"
846930612967669760,2017-03-29 03:42:47,"b'Makanya menerima pencerahan itu sedikit demi sedikit, biar tdk membebani pikiran'"
846930448240578560,2017-03-29 03:42:08,"b'Pencerahan itu harusnya membebaskan, bukan membebani.'"
846930206841618432,2017-03-29 03:41:11,"b'Memang yg bisa kita pahami hanya sedikit dari pencerahan itu, kalau banyak bisa jadi langsung kelepekan haha..'"
846917403103629313,2017-03-29 02:50:18,"b'Pencerahan itu harusnya membebaskan, bukan membebani'"
