id,created_at,text
926818015055716352,2017-11-04 14:26:48,b'Hooh https://t.co/7QYorODcD4'
926817959707688961,2017-11-04 14:26:35,b'Hehe https://t.co/CvEyvgIIz7'
926817873674231809,2017-11-04 14:26:15,b'Haha https://t.co/IXnDOmLoAQ'
926817746125438976,2017-11-04 14:25:44,b'Alhamdulillah https://t.co/qZTnB52Zi5'
925383875605553152,2017-10-31 15:28:03,"b'Bagaimna bisa memberi, jika mental diri serba kekurangan'"
925383527079616514,2017-10-31 15:26:40,"b'Itulah sebabnya org yg senang dg gratisan, sulit lepas dari kemiskinan...'"
925383226046029824,2017-10-31 15:25:28,b'Haha https://t.co/WoKM82d9mo'
925381770941362177,2017-10-31 15:19:41,"b'Org yg senang di beri, berarti senang dlm keadaan kekurangan.'"
925381462198706176,2017-10-31 15:18:28,"b'Jgn, bisa kirim pakai gojek https://t.co/SisMH1AtEt'"
925381325011353603,2017-10-31 15:17:55,"b'Seringnya kita bersyukur saat menerima, klw tidak hati2 beda tipis dg suka diberi..'"
925380604610220033,2017-10-31 15:15:03,"b'Saat sendiri, kegiatan paling asik melamun.'"
925379614729371648,2017-10-31 15:11:07,b'Bikinin dong haha https://t.co/TFNw8g3xSe'
925379535054368768,2017-10-31 15:10:48,b'Wah..enak.nii https://t.co/JcvfNjgc9n'
925375567209172992,2017-10-31 14:55:02,"b'Lagi susah tidur ni, perasaan lagi gimana gitu...'"
925375355946393601,2017-10-31 14:54:12,"b'Saat malam gini, enaknya ngapain ya?'"
925375244348538886,2017-10-31 14:53:45,"b'Malam sobat twit, apa kabar?'"
924615518991958016,2017-10-29 12:34:52,b'Sip https://t.co/yTjv9FoCKx'
924615400301592576,2017-10-29 12:34:24,b'Hayashitoysmart 08176793339  081381451636 https://t.co/oNPMUpZmL0'
924562343966556160,2017-10-29 09:03:34,"b'MAU SEMPURNA OTAK DIDENGKUL \nOlah : anangsujana\n\nJika mencari kesempurnaan dalam hidup ini, kamu akan banyak ... https://t.co/QSuewSHKqD'"
924544485119291393,2017-10-29 07:52:37,"b'Tidak semua hal bisa kita rubah, kadang ada yg hanya butuh kita tunggu'"
924543878450966528,2017-10-29 07:50:12,"b'Selamat sore sobat, apa kabar?'"
923873267437395968,2017-10-27 11:25:26,"b'BERSYUKUR KARENA PIKIRAN, BERSYUKUR PADA RUHANI, ...DAN BERSYUKUR KARENA ALLAH....\n\nSYUKUR itu, bahasa ... https://t.co/qihkP8nBaX'"
923873019847630848,2017-10-27 11:24:27,"b'CINTA ITU BERSARAT\nOleh : anangsujana\n\nSetiap kita mencintai orang yg berbuat baik pada kita, sesungguhnya ... https://t.co/X7pYpmeuAw'"
923872265845972992,2017-10-27 11:21:27,b'Kadang fakta mengalahkan keyakinan'
923871885837836288,2017-10-27 11:19:56,"b'Selamat malam sobat, apa kabar?'"
923703926586712066,2017-10-27 00:12:32,b'Bagi istri mana yg lebih sering dipegang tangan suami atau gejet?'
923702921291644928,2017-10-27 00:08:32,"b'Bagi pasangan suami istri, mana yg lebih sering dipegang, tangan istri atau gejet?'"
923702552096530432,2017-10-27 00:07:04,"b'Sosmed itu netral, kitalah yg harus bijak menyikapinya'"
923702032237707264,2017-10-27 00:05:00,"b'Di sosmed ini, pakai bahasa terbaik saja bisa miskomunikasi, apa lagi dg bahasa yg kasar...'"
923701608210350082,2017-10-27 00:03:19,"b'Saat mau posting, pastikan pakai bahasa terbaik, dan tdk menyinggung perasaan org lain..'"
923701387858395136,2017-10-27 00:02:27,"b'Setiap tulisan yg kita tulis di sosmed ini, kelak akan dimintai pertanggungjawabannya'"
923701073495257088,2017-10-27 00:01:12,"b'Setiap ada berita, kroscek dulu atau akan menyesal nantinya..'"
923700495557976064,2017-10-26 23:58:54,"b'Pena itu artinya, tulisan dan berita, impormasi yg gencar dan masif, seperti saat ini di sosmed...'"
923692206916956161,2017-10-26 23:25:58,b'Kira2 bangun tidur apa yg pertama kita pegang?'
923691842100543489,2017-10-26 23:24:31,"b'Hari ini terbukti, apa yg diucapkan oleh Nabi, bahwa suatu hari nanti akan tersebarnya PENA ,itu diucapkan 15 abad yg lalu'"
923691090254774272,2017-10-26 23:21:31,"b'Gejet begitu pentingnya buat kita, sehingga kemana mana kita pegang...'"
923690748968550400,2017-10-26 23:20:10,b'Bayangkan saat itu bnyk org yg tdk bisa baca dan tulis....\nJika kita hidup dimasa itu mungkin kita akan tertawa dg ucapan nabi..'
923690632517787648,2017-10-26 23:19:42,b'Kemanakah hati kita bertawaqal?'
923690216354824192,2017-10-26 23:18:03,b'Top https://t.co/sC4nmyo2b2'
923689962129653760,2017-10-26 23:17:02,"b'Akan ada satu masa sebelum hari kiamat, tersebarnya PENA..'"
923687478267060224,2017-10-26 23:07:10,"b'Setiap org yg menelan mentah2 satu berita, tanpa kroscek dulu, itu org bodoh..'"
923686142871928833,2017-10-26 23:01:52,b'Top https://t.co/10tLqaprfm'
923186369723117568,2017-10-25 13:55:57,b'Ig @AnangSujana'
923182928825221120,2017-10-25 13:42:16,b'Boneka karya @AnangSujana ...di sukai LARAS ojek pengkolan https://t.co/O8KNJECSVv'
923182505414475776,2017-10-25 13:40:35,b'Kabarkabri rcti @AnangSujana bersama DewiOktaviani. https://t.co/WiVwStTJTi'
923181785776660480,2017-10-25 13:37:44,"b'Saat penyakit hati tumbuh, saat tercemar oleh gemerlapnya dunia'"
923181535162908672,2017-10-25 13:36:44,"b'Dan hati adalah, menuju jln kebaikan dan kebenaran'"
923181330451521537,2017-10-25 13:35:55,b'Hati adalah daya utk memahami dan mengenal maha pencipta...'
923108588809207808,2017-10-25 08:46:52,"b'Mencari rezeki itu bukan ngejar jumlahnya, tapi kejarlah keberkahannya...'"
923049572754063360,2017-10-25 04:52:22,"b'Tidak ada yg tdk bisa dilakukan, meskipun kadang sulit, tapi bisa dilakukan'"
922826949541556225,2017-10-24 14:07:44,b'Kabar kabari Rcti bersama @AnangSujana dan pemeran ojek pangkalan @Dewioktaviani https://t.co/2p7HZVA0FB'
922826232403595264,2017-10-24 14:04:53,b'Kabar kabari rcti bersama @AnangSujana dan bintang ojek pangkalan..Dewi oktaviani https://t.co/d1foasgubZ'
922825276307808257,2017-10-24 14:01:05,b'Malm https://t.co/2gku76H6CC'
922825173534773248,2017-10-24 14:00:41,b'Kabar kabari @AnangSujana dan @dewioktaviani https://t.co/jTo8UpbE26'
920061022869716997,2017-10-16 22:56:56,"b'Berarti kmu mencintai kebaikannya, bukan diri org itu..'"
920060842283905024,2017-10-16 22:56:13,"b'Karena kebaikannya, kamu mencintainya. Saat kebaikannya hilang, kmupun tdk mencintainya lagi..'"
920060518039109632,2017-10-16 22:54:56,b'Keselarasan jiwa adalah keajaiban cinta'
920060387889840128,2017-10-16 22:54:25,"b'Karena cinta mendamaikan, kenapa sulit tidur mikirin dia, itu namanya kecanduan'"
920060118619774976,2017-10-16 22:53:20,"b'Karena cinta menerima apa adanya, jika cinta mbuatmu kawatir, cintu itu menjajahmu'"
920059762372378626,2017-10-16 22:51:55,b'Sip https://t.co/e0rHNghua8'
918809564161511425,2017-10-13 12:04:05,"b'Yg paling tepat utk menguji akhlak yg baik, adalah KETABAHAN saat menghadapi penderitaan, dan KESABARAN atas perlakuan buruk org lain'"
918806009325355008,2017-10-13 11:49:57,"b'Org yg tunduk pada hawa nafsunya, akan jadi tawanan bagi hasrat2nya...'"
918805699261472768,2017-10-13 11:48:43,"b'Ada 3 musuh bagimu yaitu, gemerlap dunia, godaan setan, dan dirimu sendiri..'"
918805064378023937,2017-10-13 11:46:12,b'Berjuang melawan hawa nafsumu dg pedang kedisiplinan...'
918804721736937473,2017-10-13 11:44:50,"b'Tidak ada binatang yg hrs dikekang lebih kuat, selain hawa nafsuku sendiri..'"
918804464143818752,2017-10-13 11:43:49,"b'Nafsuku kadang membantuku, tapi kadang juga menentangku...'"
918804272581505024,2017-10-13 11:43:03,b'Yg paling menyulitkan adalah NAFSU ku sendiri...'
918804081245691904,2017-10-13 11:42:18,b'Top https://t.co/e0rHNfZSLy'
918005398040338434,2017-10-11 06:48:37,b'Keren abis https://t.co/095KO4MsRL'
918000456890068992,2017-10-11 06:28:59,b'https://t.co/8Lvd9TJoEE 08176793339 https://t.co/gfCbUeK3fQ'
917996888221036544,2017-10-11 06:14:48,b'Cakep ni https://t.co/rxB66pjmPm'
917996792976777216,2017-10-11 06:14:25,"b'Jika kamu tdk bisa berhubungan dg manusia, kamu akan kesepian didunia ini...manusia itu inik, kamu perlu mempelajarinya'"
917993956503445504,2017-10-11 06:03:09,"b'Sadari, org akan lebih banyak membela diri dari pada meminta maaf akan kesalahannya'"
917993448782753792,2017-10-11 06:01:08,"b'Memulai hal baru dari kebiasaan kita, selalu rasanya nggak enak...karena org cendrung males pada perubahan'"
917993147367673856,2017-10-11 05:59:56,b'Keren https://t.co/r7HhOKIgza'
917991031328604162,2017-10-11 05:51:31,b'Sip https://t.co/LEBLwyfzFu'
917990942174572548,2017-10-11 05:51:10,"b'Asal hidup itu beda dg benar2 hidup, mau hidup lebih bermakna...berjuang dong bikin hidup berkualitas'"
917905749346414592,2017-10-11 00:12:39,"b'Harta yg hanya kamu simpan, tdk banyak berguna buat dirimu, maupun org lain..'"
917905510375890944,2017-10-11 00:11:42,"b'Harta akan punya nilai lebih, saat digunakan utk kebaikan,  atau utk dagang hingga ada perputaran uang...'"
917904955750563842,2017-10-11 00:09:29,"b'Percaya tidak, apa yg kmu impi2kan akan terwujud, simple ...'"
917893428280680448,2017-10-10 23:23:41,"b'Kesungguhan hati, lebih bisa menggerakan dirimu dari pada pikiranmu..'"
917893016660017152,2017-10-10 23:22:03,b'aku yakin bahwa kemampuanmu bertindak jauh lebih dipengaruhi kesungguhan hatimu ketimbang kecerdasan pikiranmu ..'
917892901002125312,2017-10-10 23:21:35,b'Cakep https://t.co/XliuEWexTf'
917192864597139456,2017-10-09 00:59:54,b'Selamat sukses utk semua...'
917191433852878848,2017-10-09 00:54:13,b'Ingin tahu lebih bnyk soal ITO? Gabung bersama masyarakat riteil indonesia (AMRI)....08176793339'
917187870904918017,2017-10-09 00:40:03,b'15. Bersambung.....'
917187770644234240,2017-10-09 00:39:39,"b'14. Secara STOK mereka sama, namun alfamart jauh lebih lengkap variasinya...'"
917184615281917953,2017-10-09 00:27:07,b'13. ITO alfamart 20 hari lebih cepat 4 kali dari toko konvensional 80 hari'
917184123201921025,2017-10-09 00:25:10,b'12. Toko konvensional 200juta dibagi 2.5juta menghasilkan ITO 80 hari...'
917183574687735808,2017-10-09 00:22:59,b'11. Alfamart 200juta di bagi 10juta menghasilkan ITO 20 Hari...'
917183079055159296,2017-10-09 00:21:01,b'9. ITO dihitung dg cara membagi total  STOK dg omzet/hari....'
917182462375092224,2017-10-09 00:18:34,b'8. Perputaran barang dari kedua toko itu berbeda..'
917182283664154624,2017-10-09 00:17:51,"b'7. Hal ini, disebabkan ITO (inventory turn over/perputaran barang)...'"
917181678304468992,2017-10-09 00:15:27,"b'6. Namun omzet alfamart 10juta/hari, sedangkan toko konvensional 2.5juta/hari'"
917181373806288896,2017-10-09 00:14:14,"b'5. Utk memudahkan kita pakai angka perkiraan, STOK barang keduanya berjumlah sama 200juta..'"
917180961002995712,2017-10-09 00:12:36,b'4. Kenapa Alfamart dan indomart selalu menang bersaing dg toko konvensional?'
917180730890846208,2017-10-09 00:11:41,b'3. Kenapa toko modern selalu menang bersaing dg toko tradisional?'
917179961244475392,2017-10-09 00:08:37,"b'2. Sedangkan 75% nya mustahil di pelajari hanya dg  teori, tapi PRAKTEK'"
917179465813258240,2017-10-09 00:06:39,"b'1.ilmu bisnis termasuk riteil, hanya bisa di pelajari dlm teori 25 % saja...'"
917178520291336192,2017-10-09 00:02:54,"b'Selamat pagi sobat, apa kabar?'"
916085483653914624,2017-10-05 23:39:34,b'Kenapa kita tdk mau diatur sama ALLAH ?...'
916084969872560128,2017-10-05 23:37:31,"b'Barang siapa yg hidupnya beramal soleh, maka hidupnya akan bahagia'"
916084671636631553,2017-10-05 23:36:20,"b'ALLAH menurunkan perintah larangan dan yg di bolehkan, bentuk kasih sayangNYA'"
916084268643659776,2017-10-05 23:34:44,"b'ALLAH, menurunkan kitab suci bukan utk menyengsarakan kita, tapi mengatur agar hidup bahagia'"
916083559328129026,2017-10-05 23:31:55,"b'Yg Maha Pencipta, tdk mungkin membuat peraturan utk menyengsarakan hambanya..'"
916083056846311424,2017-10-05 23:29:55,"b'Dan anaknya yg tdk mau diatur karena merasa di batasi, itulah kita hamba yg bodoh...'"
916082364421304320,2017-10-05 23:27:10,"b'Ketika Ibu melihat anaknya menghisap rokok, tentu Ibu itu melarangnya, dan anaknya marah, larangan ibu itu  karena kasih sayannya'"
916081452684525569,2017-10-05 23:23:32,"b'Kita di suruh beramal soleh, karena ALLAH sayang pada kita...'"
916081133309198336,2017-10-05 23:22:16,"b'ALLAH, menurunkan Agama dan para Rasulnya untuk kebahagiaan hamba2nya...'"
916080863749668864,2017-10-05 23:21:12,"b'Dg demikian, ALLAH mengatur cara hidup kita bukan utk menyengsarakan kita, tapi utk membahagiakan kita'"
916079998733213697,2017-10-05 23:17:46,b'jika demikian ALLAH tdk mungkin menyengsarakan hamba2nya'
916079279246499840,2017-10-05 23:14:54,"b'Itulah ALLAH, yg lebih sayang pada hambanya dari pada seorang ibu pada anaknya...'"
916078816807682049,2017-10-05 23:13:04,"b'Tidak mungkin, anak yg dipeluknya dg kasih sayang, dia tega lemparkan k bara api..tdk mungkin!'"
916078241013567488,2017-10-05 23:10:47,"b'Ketika melihat kejadian ini, bagaimana bahagianya seorang ibu mendapatkan kembali anaknya, apakah Ibu ini tega melemparkannya ke bara api?'"
916077492779196416,2017-10-05 23:07:48,b'Ibu itu akan mencurahkan rasa rindu dan kasih sayangnya pada anaknya itu'
916077165208264704,2017-10-05 23:06:30,"b'Dia akan menghampiri, memeluk dan menggendongnya, lalu menyusuinya...'"
916076797300686848,2017-10-05 23:05:03,b'Apa yg terjadi saat Ibu menemukan anak balita tersebut?'
916076415073652736,2017-10-05 23:03:31,"b'Pernah lihat seorang ibu yg kehilangan anak balitanya beberapa jam, lalu dia menangis mencari kesana sini...'"
916076017516634112,2017-10-05 23:01:57,"b'Anak yg penuh perjuangan utk dilahirkan, lalu kita ingin meracuninya? Tdk mungkin'"
916075621905612802,2017-10-05 23:00:22,b'Adakah org tua yg terbersit utk menyakiti kita?'
916074871561449473,2017-10-05 22:57:23,"b'Ibu sayang pada anak2nya, Tuhan lebih sayang lagi pada hamba2nya...'"
916074612487733250,2017-10-05 22:56:22,b'Tuhan mengatur kita bukan utk menyengsarakan kita...'
916069117228064768,2017-10-05 22:34:31,"b'Selamat pagi sobat, tetap semangat selamat berkarya'"
915834884240711681,2017-10-05 07:03:46,b'Ayuukk https://t.co/zWZUQOH3Mi'
915529094082842625,2017-10-04 10:48:40,"b'Bukan saat ini kamu tanya saya dimana, tapi tanyakan nanti saya sudah berada dimana'"
915528748488724480,2017-10-04 10:47:17,b'Sip https://t.co/IuXvsDkbOk'
915528659028525056,2017-10-04 10:46:56,"b'Menjelang malam, istirahat menunggu magrib, sambil ngetuit haha..'"
915011395841748994,2017-10-03 00:31:31,"b'Sedikit cukup, banyak kurang...'"
915011207941152768,2017-10-03 00:30:46,"b'Selamat pagi sahabat, apa kabar?'"
914347735712620544,2017-10-01 04:34:22,b'Haha https://t.co/a5nhYvu65Y'
914347669157376000,2017-10-01 04:34:06,"b'Anangsujana\nWan MH:\n\xf0\x9f\x92\xa3\xf0\x9f\x92\xa3\xf0\x9f\x92\xa3 MELEDAKKAN OMSET DENGAN ""ITO""\n\nHanya di ... https://t.co/gc9iHBMTgH'"
913783173758074881,2017-09-29 15:11:00,"b'Inginnya sih dikejar uang, yg terjadi malah banyak hutang dikejar2 penagih hutang haha..'"
913782542439825409,2017-09-29 15:08:30,"b'Benci setan itu harus, dan lebih bijak lagi benci sama sifat setan...'"
913780106388107265,2017-09-29 14:58:49,"b'Dendam, kesal, frustasi, dan rasa bosan penyebab utama KELELAHAN'"
913779729903140865,2017-09-29 14:57:19,"b'Keletihan sering kali bukan karena kerja keras, bisa sering kali karena rasa kawatir...'"
913779190687686656,2017-09-29 14:55:10,b'Aseeekkk https://t.co/vDbDdi9Cct'
913757144452808705,2017-09-29 13:27:34,b'Selamat malam selamat beristirahat...'
913756972750487552,2017-09-29 13:26:53,b'Sedekah harian adalah hal mudah untuk kelancaran usaha dan gol anda...'
913756712078761984,2017-09-29 13:25:51,"b'Apakah tujuan sedekah hanya untuk omzet dan usaha lancar? Tentu saja tidak, meskipun tdk salah juga'"
913756446533156866,2017-09-29 13:24:48,"b'Kenapa sedekah harian? Agar gampang lupa, berlatih ikhlas...'"
913745587903725568,2017-09-29 12:41:39,"b'Bukan besarnya, tapi rutinnya dan jgn berkurang, kalau lebih itu bagus..'"
913745310735769600,2017-09-29 12:40:33,"b'Cara bisa melupakan sedekah, lakukan dg sedekah  harian. Paling bagus setelah shalat subuh..'"
913744901925249024,2017-09-29 12:38:55,"b'Sedekah akan di balas cepat, saat kita melupakannya...'"
913744582445211648,2017-09-29 12:37:39,"b'Jika sedekah ingin cepat di balas lupakan,dan sedekah lagi lalu lupakan lagi'"
913744213128355841,2017-09-29 12:36:11,b'Sedekah knp kadang berasa tdk di balas? (nggak mungkin tdk di balas)..'
913743841957617664,2017-09-29 12:34:43,"b'Belajar ilmu ekonomi, belajar ilmu kesadaran, jika tujuannya ingin jualan laris dan omzet bagus, coba belajar sedekah #simple#'"
913743212862332928,2017-09-29 12:32:13,b'Siippp https://t.co/YGh7m9Q34F'
913743153416478721,2017-09-29 12:31:58,b'Mantappp https://t.co/xcEe5hv7uO'
913743056670621696,2017-09-29 12:31:35,b'Kadang FAKTA mengalahkan KEYAKINAN....'
912630101493243904,2017-09-26 10:49:06,"b'RISET SEDEKAH DAN MEMELIHARA KEBODOHAN....\n\nAKU BODOH, KAMU BODOH, KITA BODOH BERJAMAAH....\n\nSEDEKAH itu ... https://t.co/5VroHIZryv'"
912621015632457728,2017-09-26 10:13:00,"b'Sy membuat catatan selama 4 thn lebih, membaca pola sedekah'"
912620650115645440,2017-09-26 10:11:33,b'Aseekk https://t.co/5MjaHxlv8J'
912620571787014144,2017-09-26 10:11:14,b'Haha juga https://t.co/DmeDI0TVFq'
912620209734688769,2017-09-26 10:09:48,b'Gitu ya... https://t.co/7d9leOT4cK'
912620134593785857,2017-09-26 10:09:30,b'Haha https://t.co/L0yNXfsmzN'
912619970667806720,2017-09-26 10:08:51,b'Alhamdulillah...sangat baik dan bersemangat https://t.co/srKovxLHid'
912619786458218501,2017-09-26 10:08:07,b'Lelah knp ni? https://t.co/thDCHJiHui'
912619610351951872,2017-09-26 10:07:25,b'Ingin sukses tapi bingung caranya? Coba mulai dg bersedekah...'
912617281150058496,2017-09-26 09:58:10,b'Setiap org punya caranya sendiri utk menggapai mimpi'
912616727640289281,2017-09-26 09:55:58,b'Terima kasih atas kesetiaan teman2 di akun ini...'
912616292489732096,2017-09-26 09:54:14,"b'Selamat sore, apa kabar?'"
912616132263030784,2017-09-26 09:53:36,b'Top https://t.co/WDsSdwE8Nl'
912616044354707456,2017-09-26 09:53:15,b'keren https://t.co/Xt1FoK7bro'
910832079910297603,2017-09-21 11:44:24,"b'RT @ritelnews: Quote of today\n\nDengan merubah diri kita kita bisa merubah dunia.\n\n(Wan MH, Guru Besar Ritel Indonesia dan Ketum AMRI)'"
907973297534517248,2017-09-13 14:24:38,b'Haha... https://t.co/7d9leOT4cK'
907973216408264705,2017-09-13 14:24:18,b'haha... https://t.co/L0yNXfsmzN'
907771190688673793,2017-09-13 01:01:32,"b'Selamat pagi bakwan, dadar gulung, sikaaatttt....'"
907771018818678785,2017-09-13 01:00:51,b'Hooh https://t.co/mTEDGAyh6v'
907770939147874304,2017-09-13 01:00:32,b'Haha https://t.co/qPHNFfFdpu'
907770876317200384,2017-09-13 01:00:17,b'Haha https://t.co/m47NFAbpD4'
907604725033349121,2017-09-12 14:00:03,"b'Gampang mas, jgn dengerin haha https://t.co/ZzJj0dQTtl'"
907598459909185539,2017-09-12 13:35:09,b'Jadi ilmu marketing paling jago saat kepepet haha https://t.co/zB2X69HYaC'
907595742004383745,2017-09-12 13:24:21,"b'Berhentilah menimba ilmu, ngapain juga cape2, karena ilmu tdk ada di dalam sumur...'"
907595110698778631,2017-09-12 13:21:51,"b'kemampuan paling hebat yg bisa kita lakukan, adalah saat susah, kita paling pandai menjual'"
907593363896987649,2017-09-12 13:14:54,b'Haha https://t.co/6esFyrhMDM'
907593301150150656,2017-09-12 13:14:39,b'Iyaa benar https://t.co/ouwG9MVGlu'
907558129042309120,2017-09-12 10:54:54,b'Kadang berenang https://t.co/JZLNv3tSvw'
907558018153291776,2017-09-12 10:54:27,b'Berarti bisa sama dg atau tambahin https://t.co/7foz887dcP'
907557836498001920,2017-09-12 10:53:44,b'Emang haha https://t.co/zVH1oPrast'
907444441245409280,2017-09-12 03:23:08,"b'Jika masa lalumu membosankan, jadikan masa lalumu menjadi MASABODO....'"
907444141654544384,2017-09-12 03:21:57,"b'Mau sukses atau gagal tidaklah penting, yg penting itu BERHASIL...'"
907440959280922624,2017-09-12 03:09:18,"b'Jika setelah nikah kamu kesusahan, maka PASRAH saja. Artinya, kamu PASRAHKAN saja anaknya ke MERTUAMU, supaya ringan'"
907439660388966400,2017-09-12 03:04:09,"b'Motivasi ala cak lontong lebih mengena, knp?....'"
907439390669934594,2017-09-12 03:03:04,b'Wkwk lontong https://t.co/7KVpnGS9PO'
907437583881314304,2017-09-12 02:55:54,"b'Jangan MENGARUNGI lautan, emang bisa? Karena KARUNG itu cocok utk BERAS haha...'"
907436612727926789,2017-09-12 02:52:02,"b'Setiap ada kesalahan nyalahin org lain, lo pikir yg lain setan, dan kamu malaikatnya haha...'"
907406265235628032,2017-09-12 00:51:27,"b'Miskin itu beda dg sederhana, MISKIN itu kondisi hidup, SEDERHANA itu GAYA HIDUP'"
907405672064573440,2017-09-12 00:49:05,"b'Jika kamu JELEK, jgn takut mencintai, karena yg mesti takut mencintai adalah org kamu cintai....'"
907404689657937920,2017-09-12 00:45:11,"b'Kalau pusing mikirin jalan KELUAR, cobaLah kembali ke jalan MASUK....'"
907404256696614913,2017-09-12 00:43:28,"b'Hal terpenting dlm PERNIKAHAN bukanlah soal STATUS atau PERBEDAAN USIA, api yg terpenting adalah PERBEDAAN JENIS KELAMIN'"
907399540784881664,2017-09-12 00:24:43,"b'""MENGHALALKAN SEGALA CARA ADALAH LICIK, SUPAYA TDK LICIK JANGANLAH IRI. SUPAYA TDK IRI MARILAH KITA ANAN""'"
907395956072521729,2017-09-12 00:10:29,"b'Sepandai pandainya tupai melompat, akhirnya pandai juga, KARENA RAJIN PANGKAL PANDAI..'"
907394163146031104,2017-09-12 00:03:21,b'Yg membuat PENYESALAN disuatu hari itu karena GEGABAH. Tapi SATUAN untuk MEMORY itu adalah GEGABYTE....'
907393887316074496,2017-09-12 00:02:15,b'Cakep https://t.co/GE0VP8hOZg'
906714599822524417,2017-09-10 03:03:01,"b'Nafas normal lebih santai, nafas olah raga kecapean mirip dg nafas org yg sedang kerasukan birahi..'"
906713959511728128,2017-09-10 03:00:28,b'penyakit kanker bukan menakutkan penderitanya.. tapi lebih menakutkan untuk orang-orang yang dicintainya.'
906411007584563200,2017-09-09 06:56:39,b'Sip https://t.co/UgJzxQeBXl'
906410933664153601,2017-09-09 06:56:21,b'Top https://t.co/5GTLyfoNmO'
906281122367078400,2017-09-08 22:20:32,"b'Dg sedekah 1 dpt 10, sebenarnya nggak perlu kerja keras, tapi tdk banyak org melakukannya kan?...'"
906280784771694597,2017-09-08 22:19:11,"b'Sedekah itu unik, sekuat apapun anda mengajak org bersedekah, tetap buuh Allah yg menggerakannya hati seseorang'"
906280354255822848,2017-09-08 22:17:28,"b'Meskipun bertahun tahun meneliti soal sedekah, ada statistik dan riset, tetap sedekah itu misteri...'"
906280037740986368,2017-09-08 22:16:13,"b'sedekah itu soal mental, sedekah itu juga ternyata butuh hidayah...'"
906279169121599489,2017-09-08 22:12:46,"b'Meskipun bnyk org sudah membuktikan, bahwa sedekah memakmurkan. Tetap saja tdk semua org mau'"
906278498397962240,2017-09-08 22:10:06,"b'Selamat pagi, apa kabar?'"
905590754231197696,2017-09-07 00:37:15,b'Mantap https://t.co/bUWtk4fMfW'
905560234663411712,2017-09-06 22:35:59,"b'Kamu bilang hatiku terbuat dari batu, padahal kekerasanku pada idealisme dibutuhkan demi masa depanku dan kamu'"
905559753169895424,2017-09-06 22:34:04,"b'Saat ada masalah, kamu mengadu sama org lain, sama aja kan kamu mengadukan Allah...'"
905559358917902336,2017-09-06 22:32:30,b'Baik bro https://t.co/IOdpXXF8PP'
905451634716581888,2017-09-06 15:24:26,"b'Setiap ada kesalahan nyalahin org lain, lo pikir yg lain setan kamu malaikat...'"
905451242654019584,2017-09-06 15:22:53,b'Hentikan kebiasaan mencari alasan utk pembenaranmu'
905451017642246146,2017-09-06 15:21:59,b'Sip https://t.co/8p7LljMYaA'
904509052603924489,2017-09-04 00:58:57,b'Putriku umur 7 thn jualan slime https://t.co/ed8GY9TG2A'
904344758801186817,2017-09-03 14:06:07,b'RT @ritelnews: Kesuksesan tanpa perjuangan (dan) keberhasilan tanpa pengorbanan... Sama mustahilnya dengan hidup tanpa dilahirkan.\n(Wan MH\xe2\x80\xa6'
904344712437313537,2017-09-03 14:05:56,b'Top https://t.co/fL15l0Kl9g'
904138198070181888,2017-09-03 00:25:19,b'3. Sedangkan anak muda bawa masa depan ke masa kini...'
904138038841810945,2017-09-03 00:24:41,"b'2. Salah satu alasannya, org tua banyak bawa masa lalu ke masa kini...'"
904137788316033024,2017-09-03 00:23:41,b'1.Kenapa pebisnis sukses saat ini banyk dari kalangan muda?'
904136863706824705,2017-09-03 00:20:01,b'Saat mendapatkan sesuatu bukan berarti itu kemenangan...'
904136702519681024,2017-09-03 00:19:22,"b'Saat kehilangan apapun dlm hidup ini, itu bukan kekalahan...'"
904136377989701632,2017-09-03 00:18:05,"b'Pemenang sesungguhnya, jika bisa dg damai dan tenang menghadapi setiap masalah...'"
903804224785362945,2017-09-02 02:18:13,"b'\xe2\x80\x9cmengetahui sedikit tentang saint menjadikanmu seorang ateis\xe2\x80\x9c \xe2\x80\x9cNamun mendalami tentang sains menjadikanmu beriman kepada Tuhan yg satu,'"
903572303786647552,2017-09-01 10:56:39,"b'Makna idul qurban, pengorbanan dan kerelaan hati atas perintahnya...'"
903571879767678977,2017-09-01 10:54:58,b'Selamat Hari Raya idul adha....'
903571640922980353,2017-09-01 10:54:01,b'Mantap AMRI https://t.co/imRWUYypfg'
903081021905584128,2017-08-31 02:24:28,b'Setiap kita adalah produk dari pikiran kita...'
903079620647436288,2017-08-31 02:18:54,b'Kepercayaam yg kuat menggerakan pikiran mencari jalan dan sarana utk melakukannya'
903063787036491776,2017-08-31 01:15:59,"b'TUHAN punya keinginan, kita  punya keinginan..keingin yg berlaku adalah keinginan TUHAN..'"
903063140912447488,2017-08-31 01:13:25,"b'Semua kesusahan yg kita terima, itu karena ulah kita sendiri..'"
903058770284036096,2017-08-31 00:56:03,"b'Saat marah ingin menghukum org lain, saat merasa bersalah ingin menghukum diri sendiri'"
903058336655880192,2017-08-31 00:54:20,"b'Setiap org itu punya caranya sendiri dlm jalani hidup, pahit manis sendiri yg rasakan...'"
903057016188411904,2017-08-31 00:49:05,"b'Doa kebaikan akan kembali kebaikan itu ke pendoanya, makanya coba berani tdk doakan kompetitor anda maju?'"
903055646815207424,2017-08-31 00:43:38,b'Sabar2 ya https://t.co/Q2NnVzjDHy'
903055547108278272,2017-08-31 00:43:15,b'Hooh https://t.co/bJAnojRBFu'
903055420981313536,2017-08-31 00:42:44,b'Cocok https://t.co/uNiCftaD0V'
903055343978110976,2017-08-31 00:42:26,b'Lawan malaysia kalah loh nanti... https://t.co/JYtY33mFaz'
