id,created_at,text
1187209641278787584,2019-10-24 03:30:10,"b'""Kalau kamu ingin punya pola pemikiran berbeda, kamu butuh orang lain untuk mengubah pola pikirmu."" https://t.co/GnRazRLUcX'"
1187202143977181185,2019-10-24 03:00:22,"b'Popularitas aplikasi media sosial satu ini di Indonesia membingungkan kalangan awam. Jika tak ada lagi pornoaksi, kenapa banyak orang masih tertarik menggunakannya? https://t.co/xTfdPPdayr'"
1187141771949682689,2019-10-23 23:00:29,b'Tren apa yang matinya terlalu cepat?'
1187036160427732992,2019-10-23 16:00:49,b'Gimana caranya kita melestarikan identitas Indonesia?'
1187021012858261504,2019-10-23 15:00:37,b'Hubungan sehat mustahil muncul dari sosok perundung yang tidak pernah memperlakukan pasangannya secara setara. https://t.co/4WpajrdTNT'
1187013377861804032,2019-10-23 14:30:17,"b'""Media sosial yang harusnya digunakan untuk bersosialisasi dan berinteraksi malah menjadi pemecah belah,"" kata seniman asal Yogyakarta ini. https://t.co/cqRiOZqrBS'"
1187005900424433665,2019-10-23 14:00:34,"b""Sejak dibuka pada 2000, yayasan Nu\xc3\xa7i's Space menolong lebih dari 1.700 musisi yang mengalami gangguan mental. https://t.co/1NL1oYAdu6"""
1186998264199024641,2019-10-23 13:30:14,b'Penyewa pembunuh bayaran yang dapat tugas pertama kali tapi kemudian melemparkan kerjaan itu ke kenalannya ikut diamankan polisi. https://t.co/wx0SAoCvXX'
1186990793728450561,2019-10-23 13:00:33,b'Foto-foto depresif Qosim Kalabahi di berbagai WC Indonesia menghasilkan penggemar fanatik. https://t.co/XMBCvMvc3w'
1186983154671857664,2019-10-23 12:30:11,"b'""Ya, saya menulis artikel ini karena mengidap gangguan pencernaan dan terobsesi dengan persoalan berak."" https://t.co/dfZxJmD66Y'"
1186975657940717572,2019-10-23 12:00:24,b'Model Starlie Smith berjasa memulai percakapan penuh makna tentang jerawat dan kesadaran tentang kondisi wajah yang dulu dianggap nista. https://t.co/ME1fx4Wx0d'
1186968047959101441,2019-10-23 11:30:10,b'Salah satu kejutan paling tak menggembirakan dari kabinet Indonesia Maju adalah kembalinya sosok menkumham. https://t.co/8IH3Vmaiet https://t.co/qEpRL7bcn6'
1186960539748048896,2019-10-23 11:00:19,"b'Sumpah, DJ bernama Cavad Recebov itu keren abis. Aphex Twin aja kalah. https://t.co/MHJl7d62GP'"
1186954202595102720,2019-10-23 10:35:09,b'Clown Season https://t.co/TR4agygKG4'
1186945432024502272,2019-10-23 10:00:18,"b'""Hanya di game itulah aku tak perlu memakai topeng seperti saat menjalani pergaulan sehari-hari."" https://t.co/WO4CtTVK1S'"
1186940255800184833,2019-10-23 09:39:43,b'Ayo Ikut Keliling Dunia Melihat Berbagai Macam Kancah Gulat Profesional di JawaPosTV: https://t.co/tCQa9zPpFu'
1186934062201688066,2019-10-23 09:15:07,"b'Salah satu kejutan paling tak menggembirakan dari kabinet Indonesia Maju adalah kembalinya sosok menkumham. Rekam jejaknya lima tahun belakangan disorot negatif, terutama saat mahasiswa gelar demo besar. https://t.co/jN4nTbTNUC'"
1186930323499732997,2019-10-23 09:00:15,"b""Dibawakan oleh vokalis hardcore dan penggemar berat gulat, Damian Abraham, seri 'The Wrestlers' menyelami dunia gulat profesional yang berkembang pesat di berbagai belahan dunia. Tonton setiap Rabu malam pukul 22.00 WIB di JawaposTV. https://t.co/HOtvxmVG66"""
1186922803683123200,2019-10-23 08:30:23,b'Warga malah kepikiran memungut tiket masuk ke tangga di Bronx itu sekalian. https://t.co/u4LElcXqNY https://t.co/oXhupI2Ohn'
1186915222314983424,2019-10-23 08:00:15,"b""Tragedi Pembantaian 'Dukun Hitam' Di Pedesaan Kamboja: https://t.co/I2BvJh8EoT https://t.co/IXPEv1Xc3J"""
1186907668448976896,2019-10-23 07:30:14,b'Masalah keuangan menjadi sumber utama stres bagi anak-anak muda yang sekarang di awal karir profesional atau sedang kuliah. https://t.co/mqQA2ndosn'
1186900109193306112,2019-10-23 07:00:12,"b'""Kalian pasti sulit membayangkan rasanya kehilangan kepribadian pelan-pelan seperti yang kualami."" https://t.co/gfAl3rjQ1e'"
1186892565666242560,2019-10-23 06:30:13,b'Film tentang monster yeti imut ini bikin orang dewasa marah. Karena ada penggambaran peta mengesankan Tiongkok berkuasa penuh atas Laut Cina Selatan. https://t.co/tlhpFueZsl'
1186885000056180736,2019-10-23 06:00:09,"b'Lebih dari setengah abad lalu, stadion kebanggaan kita di Senayan itu sempat seolah-olah jadi Koloseum. https://t.co/ghcRB7CeM1 https://t.co/gRKKgKd5eg'"
1186877447435968512,2019-10-23 05:30:09,"b'Kelakuan pelajar ini enggak bisa dibenarkan sama sekali, contoh gejala frustrasi agresi. RIP pak guru.... https://t.co/XHiWJGkXxA'"
1186869009691623424,2019-10-23 04:56:37,"b'Kabinet Indonesia Maju sudah diumumkan, tetap gemuk seperti biasanya kendati ada bongkar pasang nomenklatur. Menurut pengamat, eksekutif yang lebih ramping sebetulnya lebih baik buat Indonesia. https://t.co/oAUTslvnVC'"
1186861505490362368,2019-10-23 04:26:48,"b'Rey bertarung dengan Kylo, dan C-3PO ternyata peduli dengan teman-temannya, dan masih banyak lagi info menarik lainnnya. https://t.co/f7bDfR6Ygb'"
1186860046623182848,2019-10-23 04:21:00,"b'Last but not least, ada lima lulusan Akabri (pas mereka lulus, Akpol-Akmil belum dipisah)'"
1186859091106205696,2019-10-23 04:17:12,"b'Ralat dikit:\n\nUGM ada tujuh menteri gaes.\n\nSisa yang belum disebut *tolong mimin jangan ditimpuk*:\n\nUndip, IPB, STIE Port Mumbai Jayapura, STIE Swadaya Jakarta'"
1186857070089265152,2019-10-23 04:09:10,"b'Mimin iseng nih, dilihat dari latar pendidikan Strata 1-nya, maka ini sebaran almamater yang paling banyak sumbangkan meteri sipil di Kabinet Indonesia Maju:\n\nUGM 6, UI 3, ITB 3\n\n5 menteri S1 di kampus AS.\n\nSisanya: UII, USU, UIN Sunan Ampel, UPI, UM, Unhas, Atma Jaya, Moestopo'"
1186854859565404160,2019-10-23 04:00:23,"b'Kata ilmuwan, jendela mobil yang tertutup dan AC tak ada pengaruhnya sama sekali. https://t.co/Igh23ndbVK'"
1186847261818572801,2019-10-23 03:30:12,"b'""Kulit ayam emang enak banget coy, tapi ga lucu juga kalau kita mati gara-gara ayam goreng tepung."" https://t.co/cPmklPURgM'"
1186839783882055680,2019-10-23 03:00:29,"b'Kemungkinan, ini hanya tipu-tipu belaka. https://t.co/qrW9FfcJHK'"
1186779395727474688,2019-10-22 23:00:31,b'Masyarakat harus lebih peduli tentang...'
1186673814597443585,2019-10-22 16:00:59,b'Deskripsiin teman baik kamu dalam 6 kata dong.'
1186658621083541504,2019-10-22 15:00:36,b'Enggak usah juga dicoba di rumah ya. https://t.co/w6KGNqn3G2'
1186651044174016518,2019-10-22 14:30:30,"b'Putus, tapi tetap berteman baik. Mengapa? https://t.co/ysLBeBLiEz'"
1186643521991823362,2019-10-22 14:00:37,"b'""Makna hidup seseorang meningkat saat seseorang merasa kebutuhan mendasar mereka terpenuhi."" https://t.co/M1v7Bkrkkd'"
1186635941965946881,2019-10-22 13:30:29,"b'Jangan-jangan ini cuma ilusi mata, bukan misteri betulan. https://t.co/oOiG6jc1ti'"
1186628391744823298,2019-10-22 13:00:29,b'Ternyata ada orang yang secara profesional dibayar untuk menjadi penyambung lidah generasi milenial dengan generasi-generasi sebelumnya. https://t.co/3wGo44XVLW'
1186620825681747970,2019-10-22 12:30:25,b'Para peneliti bilang cara kita melahap sepotong pizza bisa digunakan untuk menentukan kualitas kepribadian kita yang paling menonjol. https://t.co/UDbb6YNPzp'
1186613254262607872,2019-10-22 12:00:20,"b'Menjelang 2020, Wali Kota Bandung berniat membagikan anak ayam kepada para siswa SD untuk dipelihara agar mereka punya kegiatan selain mantengin gawai. https://t.co/ehOlGIp3sD https://t.co/NLGNoQ6r7R'"
1186605662161264640,2019-10-22 11:30:10,b'BMKG bilang cuaca panas akan terus menguji rakyat Indonesia hingga akhir Oktober 2019. Apa aja sih yang perlu kita lakukan biar kepala enggak ikut panas? Pakar memberi solusinya. https://t.co/mkwOcVPzH7'
1186598156898885637,2019-10-22 11:00:21,"b'Depresi menjadi topik yang umum mereka singgung. Sayang, publik dan fans selama ini mengabaikan tanda-tanda tersebut. https://t.co/L5wxKXESsv'"
1186590546694987776,2019-10-22 10:30:06,"b'Walau mungkin keras kepala, tapi mereka sebenarnya kumpulan pemimpi dan manusia kreatif yang baik hati kok. https://t.co/YCHtcLSWWH'"
1186583020884692997,2019-10-22 10:00:12,b'Selama ini kalian terlalu banyak mengonsumsi kalori tanpa sadar. https://t.co/GDU4Wcnr3X'
1186575485192589314,2019-10-22 09:30:15,b'Para ahli pemrograman komputer menduga Google Translate mendadak jadi peramal kiamat gara-gara sifat jaringan neural database-nya. https://t.co/tViSfypu1c'
1186567314508046336,2019-10-22 08:57:47,"b""Dalam program 'VICE Guide to Film,' kami menyelami otak-otak sutradara jenius dan eklektik di balik film-film paling legendaris sepanjang masa, seperti David Fincher dan Quentin Tarantino. Tonton seri ini setiap hari Selasa di JawaposTV, jam 22.00 WIB. https://t.co/bYqpmCinFR"""
1186560387413692416,2019-10-22 08:30:16,b'Lanskap Cina Hasil Jepretan Thierry Bornier Akan Bikin Anda Terpana: https://t.co/9EnrQAlRZl https://t.co/vugHEM9Nae'
1186549924428685312,2019-10-22 07:48:41,"b'Bagi anak yang berhasil membesarkan ayamnya, mereka dapat hadiah pemerintah dengan tiga anak ayam lain untuk lanjut dibesarkan. https://t.co/sOcb4SPD7o'"
1186545284068888577,2019-10-22 07:30:15,"b'Katanya sih, kebijakan aneh itu diberlakukan biar tidak ada mahasiswa yang menyontek. https://t.co/btT801toy5'"
1186537715317252097,2019-10-22 07:00:10,"b'Napi Nusakambangan cuma dapat Rp30 ribu per tahun. Bayangkan saja, duit segitu paling cuma bisa beli dua strip obat sakit kepala paracetamol. https://t.co/1LqG3N44YO https://t.co/fK7eBvgCe6'"
1186530172167737344,2019-10-22 06:30:12,b'Pengunjuk rasa yang selama ini dicap \xe2\x80\x9cperusuh\xe2\x80\x9d dan \xe2\x80\x9cteroris\xe2\x80\x9d oleh Tiongkok terbukti punya hati nurani bahkan terhadap binatang. https://t.co/QGLVeE5Ia1'
1186522608210194432,2019-10-22 06:00:08,"b'Perempuan di Melbourne itu berhasil menyelamatkan diri, dan kini sudah dibolehkan pulang dari rumah sakit. https://t.co/COwoWB9FIv'"
1186515055950602240,2019-10-22 05:30:08,"b""Desain piring terbang 'Super Great White Shark' mirip seperti pesawat siluman AS dan Kanada yang ditelantarkan sejak 1960-an. https://t.co/aXj3wFA9U6"""
1186507500931207168,2019-10-22 05:00:07,"b'Banyak yang kecewa melihat Prabowo mau ditawari jadi menhan, satu calon menteri gugur tanpa alasan jelas, sampai Nasdem tiba-tiba bermanuver hendak jadi oposisi. https://t.co/koEhhvNzew https://t.co/htPFI3J1ET'"
1186499943818764288,2019-10-22 04:30:05,"b'Lebih dari setengah abad lalu, stadion kebanggaan kita di Senayan itu sempat seolah-olah jadi Koloseum. Warga sampai pejabat nonton pertarungan pegulat Bandot Lahardo versus binatang buas. https://t.co/qeAG8pIlkP'"
1186492465257287681,2019-10-22 04:00:22,b'Sejumlah ilmuwan menangkap rekaman langka pembibitan gurita dalam jumlah besar dekat Gunung Laut Davidson California. https://t.co/ZGpkzeMkyy'
1186484865862176768,2019-10-22 03:30:10,b'Warga setempat percaya mereka sedang mengikuti sunnah Nabi Muhammad SAW yang disebut-sebut para sahabat pernah menyarankan kencing unta sebagai pengobatan alternatif. https://t.co/1RsA9ZDCJI'
1186477370993250306,2019-10-22 03:00:23,b'Seorang filsuf dan budayawan menyatakan budaya swafoto membantu manusia masa kini menyembunyikan identitas aslinya. https://t.co/CiUJTntBag'
1186311383299907584,2019-10-21 16:00:49,b'Gimana caranya kamu akalin tanggal tua?'
1186296229241769987,2019-10-21 15:00:36,"b'Jangan kelamaan ditahan. Secara ilmiah, nanti napasmu bau.... https://t.co/PAkcRoIdfO'"
1186288591372214277,2019-10-21 14:30:15,"b'Mengenakan cadar, hantu Kum Kum berkeliling dari rumah ke rumah siap mengisap darah perempuan. https://t.co/3oAwcumHl1'"
1186281128661078016,2019-10-21 14:00:35,"b'Di Jepang, kari dan nasi juga dianggap sebagai masakan nasional seperti sushi atau ramen. Kok bisa? Begini ceritanya. https://t.co/h8rROGgB9m'"
1186273476262481920,2019-10-21 13:30:11,b'Laki-laki ini menyelinap ke dalam bagasi bandara untuk tidur dan malah ikut terbang sampai ke Chicago akibat aksinya tersebut. https://t.co/xedHm75Xig'
1186266000129515522,2019-10-21 13:00:28,b'Mending dihindari daripada berabe lho. https://t.co/c9W7eNdW95'
1186258374893211648,2019-10-21 12:30:10,"b'Kami bertanya pada ahli, meminta tips duduk yang ideal biar kita enggak gampang sakit tulang. https://t.co/NZkSgHVWmb'"
1186250873627906048,2019-10-21 12:00:22,b'Nadiem termasuk tokoh muda menonjol yang dipanggil ke Istana. https://t.co/agLpoZNUtX https://t.co/2Wcf26GKCU'
1186248053323288576,2019-10-21 11:49:09,"b'Plot ""twist"" yang sebenarnya ketebak: Prabowo jadi menhan, PKS kecewa\n\nPlot twist betulan: Nasdem mengaku siap jadi oposisi.\n\nDrama.... drama everywhere!\n\nhttps://t.co/zR3AMjulbI'"
1186243272139784193,2019-10-21 11:30:10,b'\xf0\x9f\x91\xbd\xf0\x9f\x91\xbd\xf0\x9f\x91\xbd https://t.co/xpmFSVBqrE'
1186235744530173952,2019-10-21 11:00:15,b'Fotografer asal Hong Kong mendokumentasikan busana yang dikenakan anak muda di kota itu agar taktis menghadapi represi aparat. https://t.co/iuFFgGDvzA'
1186227312452239361,2019-10-21 10:26:44,"b""Ikuti perjalanan model dan jurnalis Hailey Gates, menyambangi berbagai kancah fashion di seluruh dunia dalam acara 'States of Undress'. Tonton setiap hari Senin dan Jumat di Jawapostv jam 22.00 WIB. Info selanjutnya di https://t.co/3HPeC2G5Xp. https://t.co/2TzS3H0mHN"""
1186224744913350657,2019-10-21 10:16:32,b'Bukan cuma mitra GO-JEK yang tak terima melihat bekas CEO-nya jadi menteri. Serikat driver ojol Grab diklaim siap ikut demo untuk solidaritas. https://t.co/eFFssJKZIj'
1186213091056476161,2019-10-21 09:30:14,b'Enggak perlu menunggu ada teman barengan atau ikut tur bersama grup untuk liburan. Pergilah sendiri. https://t.co/T09OcpqKhF'
1186205539321155585,2019-10-21 09:00:13,"b""Penelitian baru menyimpulkan ada 1 hingga 2 persen responden yang kesulitan membedakan perasaan mereka dengan perasaan orang lain, alias mereka punya kemampuan 'empath'. https://t.co/WYbjIVioPJ"""
1186198004073713664,2019-10-21 08:30:17,"b'Birokrasi bukan startup. Jadi, presiden harus memastikan sekian prasyarat agar menteri dari latar anak muda bisa bekerja maksimal. https://t.co/Bh2ofEdAga'"
1186192918278742016,2019-10-21 08:10:04,"b'Napi Nusakambangan cuma dapat Rp30 ribu per tahun. Ombudsman sampai ICJR mengecam sikap Kemenkum HAM memangkas anggaran kesehatan lapas, karena bertentangan dengan prinsip kemanusiaan. https://t.co/srO9jdrqaE'"
1186190453525356544,2019-10-21 08:00:17,"b'Aku Menjalin Hubungan Romantis Sama Ibu Sahabatku, Kisah Itu Lantas Kujadikan Esai Foto: https://t.co/2YQvbi2CQT https://t.co/CRlX93aCYk'"
1186182903224557569,2019-10-21 07:30:16,b'Filmnya dikabarkan berjudul \xe2\x80\x98Fashion Week\xe2\x80\x99 dan terinspirasi novel grafis. https://t.co/Wpbj0HaYev'
1186175332270989313,2019-10-21 07:00:11,"b""Tangga di Bronx tak pernah sepi turis yang ingin berfoto di lokasi tersebut, menunjukkan mereka sudah menonton dan menyukai 'Joker'. Warga kepikiran memungut tiket masuk sekalian. https://t.co/ouFH0KI6aj"""
1186167787993124864,2019-10-21 06:30:13,b'Astronot NASA Christina Koch dan Jessica Meir melakukan spacewalk bersejarah di Stasiun Luar Angkasa Internasional. https://t.co/gtSWx1AgBu'
1186160230943641600,2019-10-21 06:00:11,"b'Ikuti perjalanan host acara ini Hailey Gates, menyambangi berbagai kancah fashion di seluruh dunia. Dia tak cuma membahas busana, tapi lebih penting lagi, ini acara tentang pengalaman manusia. Tonton di JawaPosTV jam 22.00 WIB. https://t.co/g6AxtqlCWo'"
1186152670891073536,2019-10-21 05:30:09,"b'Jika benar semua uang dari penggelapan mobil habis difoya-foyakan, perempuan kriminal dari Jakarta Timur layak jadi contoh konkret diktum ""makin besar penghasilan, makin tinggi pula gaya hidup."" https://t.co/AtTjiLAwko https://t.co/Dw7TINhYdr'"
1186145148146728962,2019-10-21 05:00:15,b'Diduga jamur tahi memiliki potensi membangkitkan kesadaran mereka yang otaknya sudah tidak responsif. https://t.co/7GoZXXXzEq'
1186137554380296193,2019-10-21 04:30:04,b'Penjara Tihar di India rencananya mengizinkan wisatawan mengunjungi dan merasakan langsung hidup di dalam hotel prodeo yang dijaga ketat. https://t.co/Xl8EjKaQym'
1186130087994937344,2019-10-21 04:00:24,"b'Seorang lelaki di Jawa Timur membunuh demi mendapatkan kembali istri yang terlanjur ia gadaikan saat berutang. Tragisnya, pembunuhan itu salah sasaran. https://t.co/1aALrLPPa1'"
1186122476377591808,2019-10-21 03:30:10,b'Page Facebook Semiotika Adilihung penuh foto unik itu adalah sensasi dunia maya Indonesia. https://t.co/yKMhZfglrG'
1186114977645711360,2019-10-21 03:00:22,"b'Udah mana disuruh bayar, ketemunya enggak sampai satu menit pula. Sungguh tradisi yang mubazir.... https://t.co/bpx7EbpFVn'"
1186054624702357504,2019-10-20 23:00:33,b'What are you passionate about?'
1185948819286048768,2019-10-20 16:00:07,b'What should more people care about?'
1185933753413259265,2019-10-20 15:00:15,"b'Dibaca lagi woy hasil penelitiannya, bukan seks pas jam kerja ya. https://t.co/wwH0e9p71p'"
1185922369384275970,2019-10-20 14:15:00,b'Penampakan kesannya dialami cuma oleh penduduk selain negara-negara Barat.. https://t.co/TfRmhpaTUx'
1185911047368118272,2019-10-20 13:30:01,"b'Orang Indonesia, Jepang, dan Amerika Serikat punya selera anime berbeda-beda.  https://t.co/dEtH8VCj75'"
1185899720075599873,2019-10-20 12:45:00,"b'Walau tidak bisa disamakan seperti hewan, pertanyaan ini tetap valid karena manusia masih masuk kategori mamalia. https://t.co/XW5cxGk0So'"
1185888408276819968,2019-10-20 12:00:03,b'Kreasi seni visual yang diciptakan pada awal-awal revolusi ini sangat imajinatif setelah dilihat lagi sekarang. https://t.co/INHWNY7wYK'
1185865746783571977,2019-10-20 10:30:01,"b'""Saya enggak tahu bagaimana orang bisa skeptis terhadap kuah kaldu."" https://t.co/YkBN4rrUup'"
1185854420933844993,2019-10-20 09:45:00,"b'Suatu saat, percayalah, kamu lebih milih mati saja ketimbang makan bareng tapi diem-dieman sama doi. Inilah panduan putus cinta bagi manusia dewasa. https://t.co/LP6s5AUfpO'"
1185843111425183745,2019-10-20 09:00:04,b'Hermione Hoby menyebut turtleneck pakaian paling cocok supaya tak disorot orang lain. https://t.co/PVLi3UY0X1'
1185831780860989441,2019-10-20 08:15:02,b'Kami Mendatangi Kompetisi Tarung Antar Ternak Sapi di Swiss: https://t.co/kbNQu7unVA https://t.co/kwjAmKyh1O'
1185820447998431232,2019-10-20 07:30:00,b'Ternyata gara-gara air di bola mata. https://t.co/IR66bI2nXY'
1185809122182213632,2019-10-20 06:45:00,b'Inilah pertanyaan yang selalu jadi bahan spekulasi umat manusia sepanjang hayat. https://t.co/TfRmhpaTUx'
1185797800442945537,2019-10-20 06:00:01,b'Jawabannya rupanya terkait cara kerja otak remaja https://t.co/M8gtYTdUaH'
1185786472294686720,2019-10-20 05:15:00,"b'Ada foie gras lezat di stasiun penelitian Concordia, Kutub Selatan. https://t.co/nOxE8t2Zp2'"
1185763823137050624,2019-10-20 03:45:00,"b'""Walau engga bau pas diendus, jangan pernah merasa celana dalam kalian higienis lho"" https://t.co/LZqfBD4jrI'"
1185752503922647040,2019-10-20 03:00:01,"b'Pameran seni fotokopi di Museum Whitney, New York, akan membuka mata kita betapa alat kantor itu bisa menghasilkan karya visual luar biasa. https://t.co/o6WSJhV5iF'"
1185692119698153473,2019-10-19 23:00:05,b'Kenapa kalian baca VICE?'
1185586474491809796,2019-10-19 16:00:17,b'Gimana caranya jadi orang baik?'
1185571340771831808,2019-10-19 15:00:09,b'Kami mengunjungi lab fermentasi koktailnya yang dipenuhi ratusan botol dan gelas minuman beralkohol. https://t.co/SljyTeWojg'
1185559985721401345,2019-10-19 14:15:01,b'Tonton acara-acara VICELAND di @jawapostvofficial. Setiap hari. 22.00 WIB. https://t.co/kJO6jqMHGf'
1185548662698627076,2019-10-19 13:30:02,"b'Wolfram Schultz, Ilmuwan dari University of Cambridge, menyatakan kemasan warna-warni dari jajanan tidak sehat membuat orang terus tertarik mengkonsumsinya. https://t.co/shm5dA1DV3'"
1185537332809752577,2019-10-19 12:45:01,b'Kalian punya alternatif lebih baik daripada mengikuti program detoksifikasi yang digembar-gemborkan media. https://t.co/NruLnl1HUp'
1185526024668372992,2019-10-19 12:00:04,b'Jawabannya cukup jelas sih... https://t.co/4cmyAOBW9o'
1185503360650231810,2019-10-19 10:30:01,b'Konon jatuh lebih dari lima detik masih aman lho.  https://t.co/8E2pIO60uV'
1185492033391210496,2019-10-19 09:45:00,"b'Kisah perempuan yang tumbuh dalam keluarga poliandri, suatu konsep yang teramat tabu di Indonesia. https://t.co/UtdsQo89X5'"
1185480724314492928,2019-10-19 09:00:04,b'Olahraga dan rokok sekilas tampak bermusuhan. Namun ternyata nama-nama besar dalam sepakbola tanpa ragu menunjukkan kebiasaan merokok. https://t.co/SpF5V1F7pC'
1185469395700736000,2019-10-19 08:15:03,"b""'Kisah-Kisah Tanah Manusia': Refleksi Visual Kritis Atas Persoalan Lahan Indonesia: https://t.co/zwvnicLs2L https://t.co/sFSXHN5HQ5"""
1185458104001019904,2019-10-19 07:30:11,b'Traveling hack https://t.co/Uy8qgXfpO7'
1185446733582684160,2019-10-19 06:45:00,"b""Fitur 'Ask Me Anything' di Instagram menggambarkan realitas fungsi media sosial di zaman sekarang. https://t.co/9Jl7ClSGy8"""
1185445926933975040,2019-10-19 06:41:48,"b""Jalan hidup fotografer Alexander Deprez dari Belgia sekilas bagai plot video di Internet yang biasanya berjudul 'my best friend's mom'\xe2\x80\x94tapi lebih menyentuh dan jujur\n\nhttps://t.co/GEc0y0iGlg"""
1185435411809820672,2019-10-19 06:00:01,"b'Terbukti, selama main bareng Nicol\xc3\xb2 Falcone selalu berhasil membuatku bangkrut dan masuk penjara. Apa rahasianya? https://t.co/ckTmjtb4yk'"
1185424085293109249,2019-10-19 05:15:00,"b""Andaikata kelak ada kasus perselingkuhan yang kembali menyedot perhatian publik, jangan lupa sertakan 'Paltit' tiap kali 'Pelakor' disebut-sebut. https://t.co/Xd6qTVYDnU"""
1185401435183353857,2019-10-19 03:45:00,b'Bocah asal Australia ini bikin pengalaman kita nginep di rumah teman seminggu habis ribut sama bokap-nyokap enggak ada apa-apanya. https://t.co/tScFOwROuz'
1185390114916188161,2019-10-19 03:00:01,"b'Jika mengalami masa remaja awal 2000-an, kalian pasti paham wabah akun-akun alay yang menjangkiti waktu itu. https://t.co/D7tnARfw37'"
1185329734298853378,2019-10-18 23:00:05,b'Kalian tahu gak sih bisa nonton acara-acara VICE di Jawapostv?'
1185224215290662914,2019-10-18 16:00:47,b'What do you spend too much money on?'
1185209062520184834,2019-10-18 15:00:35,b'Zaman sekarang segala penelitian mah ada... https://t.co/5vRTdjOQ4Y'
1185201421152608256,2019-10-18 14:30:13,"b'Ada enaknya, ada gak enaknya juga sih... https://t.co/WuSfidoaZ3'"
1185196968970047489,2019-10-18 14:12:31,"b'Djeni Herilewi berpotensi tercatat sebagai kriminal paling jago dalam kancah penggelapan mobil, sekaligus yang paling boros di sejarah Indonesia\n\nhttps://t.co/ke188VCAEJ'"
1185194100351553536,2019-10-18 14:01:08,"b'Untuk tampil cantik, kadang-kadang harus berani bertaruh nyawa. https://t.co/39rUETMokH'"
1185186313340891145,2019-10-18 13:30:11,"b'Rilisan Sufjan Stevens, Bj\xc3\xb6rk, hingga Mick Jenkins pantas digeber minggu ini, agar hari-harimu bertambah menyenangkan. https://t.co/vK2r3StEOA'"
1185178831763771399,2019-10-18 13:00:27,"b'Konsep ini sayangnya mustahil terwujud di Indonesia, mengingat karyawan sering dicap pemalas dan tak tahu diri jika enggak mematuhi permintaan bos di luar jam kerja. https://t.co/CNQmyFRtvU'"
1185171209845125121,2019-10-18 12:30:10,b'Cuplikan CCTV perusakan buku merah diungkap oleh IndonesiaLeaks bersama Tempo dan Tirto. Diduga skandal ini terkait penyiraman air keras ke Novel Baswedan. https://t.co/uotznspp7O https://t.co/NSXQ2C7XjC'
1185163703563497473,2019-10-18 12:00:20,b'El Mencho ingin menggantikan dominasi Kartel Sinaloa pimpinan El Chapo. https://t.co/nkNCC3sQFM'
1185156099374272512,2019-10-18 11:30:07,"b""Kontributor VICE ini girang banget. Supaya tak mati muda, tanpa harus nge-gym, dia rupanya cukup menghindari lift dan eskalator pas jalan ke mal. \n\n*Artikel ini adalah kolaborasi antara VICE X Ion Water dalam seri 'Step By Step'. https://t.co/cg9wBQDv4A"""
1185148606665371649,2019-10-18 11:00:21,b'Indonesia dikejutkan berbagai persoalan lingkungan akibat tumpang tindih pemanfaatan lahan. Anak muda berbagai kota lewat lokakarya fotografi berusaha menyadarkan kita tentang pentingnya peta. https://t.co/ueNiLjzlRM'
1185135357257568259,2019-10-18 10:07:42,b'Cuplikan CCTV perusakan buku merah diungkap oleh IndonesiaLeaks bersama Tempo dan Tirto. Diduga skandal ini terkait penyiraman air keras ke Novel Baswedan. https://t.co/OhvsLw0OCn'
1185133510799048705,2019-10-18 10:00:22,"b'""Banyak artikel menyarankan meditasi \'mindfulness\' sebagai cara mengatasi lingkungan kerja buruk. Saya sih pilih berhenti kerja daripada memaksakan diri tetap di sana."" https://t.co/fh3UF126s0 https://t.co/HnO0CleI5p'"
1185125952013160449,2019-10-18 09:30:20,"b'Layaknya insiden kapal atau pesawat di Segitiga Bermuda, fenomena anjing bunuh diri dari Jembatan Overtoun Skotlandia tak kunjung terjawab para pakar. https://t.co/w5g78FpM5W'"
1185118389473288192,2019-10-18 09:00:17,"b""Dua orang goks membuka jasa pijat buat para 'punksien'. https://t.co/wCDg8muhpA"""
1185110850333544448,2019-10-18 08:30:19,"b'Menurut berbagai penelitian, efek perubahan iklim bikin lahan kopi makin menyusut. Untunglah, masih ada lebah. https://t.co/oBQlEFASIT'"
1185103279153467392,2019-10-18 08:00:14,b'Karya Seni Abstrak Berikut Hasil Utak-Atik Foto Ledakan Nuklir: https://t.co/FOo9IM7SDe https://t.co/UNTDyEtMIr'
1185088167654973440,2019-10-18 07:00:11,b'Sebuah kolektif fashion asal Belanda menciptakan tren fashion yang bisa dimakan. https://t.co/Eim8YRVOaO'
1185080629056233472,2019-10-18 06:30:14,b'Mixtape 24 jam sehari berisi track-track hip-hop kalem jadi langganan jutaan pengguna YouTube. https://t.co/7cfuZeTXaj'
1185073059545436160,2019-10-18 06:00:09,"b'Perjuangan rakyat Hong Kong menuntut demokrasi di hadapan Beijing, menurut seorang politikus Norwegia, patut diakui dunia. https://t.co/lY3QG2X7OR'"
