id,created_at,text
1176693077035180032,2019-09-25 03:01:06,b'VICE dengan Bango (@WarisanKuliner) menyelidiki tantangan apa saja yang dihadapi petani Indonesia dan solusi yang bisa diambil agar petani nusantara bisa terus menyajikan #KelezatanAsli kuliner autentik Indonesia. Selengkapnya: https://t.co/wn7uINnKtK #PetaniUntukIndonesia https://t.co/uZXaH2p6jE'
1176632520894558210,2019-09-24 23:00:28,b'Apa yang memberimu harapan?'
1176526915332689921,2019-09-24 16:00:50,b'Apa yang bikin kamu resah?'
1176511765733154822,2019-09-24 15:00:38,"b""Mereka beralasan \xe2\x80\x9ckonten vulgar\xe2\x80\x9d dalam 'Hustlers' tak layak dipertontonkan. https://t.co/viQiJ2mx6R"""
1176504199833620480,2019-09-24 14:30:34,b'Penelitian baru menyimpulkan kucing membentuk semacam keterikatan pada pengasuhnya yang mirip seperti anak manusia dan anjing. https://t.co/HKVOe6jiB4'
1176498938821496832,2019-09-24 14:09:39,b'Berikut recap hingga pukul 20.40 WIB. #ReformasiDikorupsi #HidupMahasiswa https://t.co/XWseNMUi4w'
1176496636954103808,2019-09-24 14:00:31,"b'Bagi penggemar sake, Kuchikamizake adalah minuman beralkohol bercitarasa terbaik, walaupun proses pembuatannya sangat tidak biasa.\nhttps://t.co/bswKKPoibC'"
1176492021898309632,2019-09-24 13:42:10,b'RT @ardyanme: Foto oleh sahabat saya @maskhairulanam yang meliput di DPR. Pantas gas air mata hari ini lebih perih dua kali lipat. Selain k\xe2\x80\xa6'
1176489003698118656,2019-09-24 13:30:11,"b'""Industri musik sebenarnya seksis banget. Tapi pengalaman hidupku membuktikan ada keuntungan bagi sosok groupie di skena.""\nhttps://t.co/siyq04MPkb'"
1176481505440423936,2019-09-24 13:00:23,"b'Seniman asal Jerman, liina klauss\xe2\x80\x8b, menggugah kesadaran publik soal pencemaran sampah di laut Indonesia yang terlanjur parah. https://t.co/Gwt8VCRg9N'"
1176473897719521283,2019-09-24 12:30:09,b'Kenno Robby Pradana ingin tuna daksa tak lagi kesusahan memakai kursi roda manual. Maka dia mengajak sesama mahasiswa Politeknik Negeri Surabaya menciptakan TRIKE. https://t.co/G5qCkmQtIi'
1176466376355188736,2019-09-24 12:00:16,b'Penelitian gabungan Indonesia-Australia itu menemukan bukti arkeologis budaya artistik yang maju di Sulawesi sejak akhir Zaman Es. https://t.co/pJil4Kul6Y'
1176460881468592129,2019-09-24 11:38:26,"b'Berikut rangkaian peristiwa polisi memukul mundur mahasiswa dari area gerbang DPR ke Semanggi dan Slipi, memicu korban cedera. #ReformasiDikorupsi #HidupMahasiswa https://t.co/ApCDI2YyWG https://t.co/chk9fWnvLZ'"
1176458795209363456,2019-09-24 11:30:08,b'RUU Pertanahan ini dianggap tidak memihak petani sehingga aliansi masyarakat kompak menentang. https://t.co/PLZYv0OI9W'
1176451281403224064,2019-09-24 11:00:17,"b'Kita akan tinggal di Indonesia yang sepenuhnya berbeda dibanding sekarang, andai KUHP yang sedang direvisi oleh DPR akhirnya disahkan. https://t.co/QNKCAHjSDr https://t.co/WfDzU2dl9j'"
1176446755283427328,2019-09-24 10:42:18,b'Keadaan di gerbang DPR setelah polisi lempar gas air mata. #ReformasiDikorupsi #HidupMahasiswa https://t.co/SIdb3ieG4B'
1176441376407293954,2019-09-24 10:20:56,"b'Berdasarkan laporan jurnalis VICE di lokasi, begini kondisi terkini area gerbang DPR setelah polisi memukul mundur mahasiswa dengan gas air mata dan meriam air.\n\n#ReformasiDikorupsi #HidupMahasiswa https://t.co/DdYHI1h4ny'"
1176439002636767232,2019-09-24 10:11:30,"b'*Info terkini dari DPR*\n\nPolisi kuasai gerbang DPR. Mahasiswa terpukul mundur ke Semanggi dan arah Slipi. Tembakan gas air mata masih terdengar. Akibat tembakan gas air mata, Ketua DPR Bambang Soestyo ikut kabur dan batal menemui massa.\n\n#ReformasiDikorupsi #HidupMahasiswa https://t.co/tzOvHPHvm3'"
1176435548795195392,2019-09-24 09:57:46,b'*Info terkini dari DPR*\n\nPolisi memukul balik massa dan mahasiswa dari gedung dengan gas air mata dan semprotan meriam air. Sebagian peserta aksi pingsan.  \n\n#ReformasiDikorupsi #HidupMahasiswa https://t.co/isKB5ZGI0j'
1176432738926305280,2019-09-24 09:46:36,"b'Terjadi kericuhan dan tembakan gas air mata, sebagian mahasiswa terpaksa kabur ke arah Semanggi. Massa tetap ingin RUU bermasalah dibatalkan. #ReformasiDikorupsi #HidupMahasiswa https://t.co/qI6RQMvKYH'"
1176432117401755649,2019-09-24 09:44:08,"b'Berikut beberapa foto dari protes mahasiswa di depan gedung DPR, yang mulai memanas sejak pukul 16.00 WIB. Massa berniat menginap bila RUU bermasalah hanya ditunda tapi tidak dibatalkan. #ReformasiDikorupsi #HidupMahasiswa https://t.co/yR2PXMBtzh'"
1176428655913910272,2019-09-24 09:30:23,"b'DPR sedikit lagi mengesahkan revisi yang dikritik banyak pihak. Beleid itu mengatur moral, mengekang kebebasan berekspresi, menyasar minoritas LGBTQ, bahkan berpotensi menjerat pidana korban perkosaan. https://t.co/pNCmVQZlIU'"
1176421054937554944,2019-09-24 09:00:11,"b'Bila problem pengelolaan sampah Jabodetabek gagal diatasi, dan TPST Bantargebang overload, maka bencana lingkungan dan kesehatan serius bisa mengancam warga maupun pemulung di Bekasi. https://t.co/5sFIr40gMg'"
1176413495321071616,2019-09-24 08:30:08,b'Suasana aksi protes mahasiswa di DPR #ReformasiDikorupsi #HidupMahasiswa https://t.co/AQoYekb0y2'
1176405978742435842,2019-09-24 08:00:16,"b'Setelah Coba Menembak Pakai Peluru Tajam, Aku Paham Kenapa Indonesia Batasi Senjata Api: https://t.co/2tJ3WFDDe7 https://t.co/FqSE8A2p4b'"
1176398427363643392,2019-09-24 07:30:16,b'Penelitian ilmiah mengungkapkan dampak majalah pria penuh humor seksis yang mempengaruhi sikap laki-laki jadi berperilaku misoginis serta berisiko terlibat kekerasan seksual. https://t.co/aIwDgi7lj4'
1176390854463893504,2019-09-24 07:00:10,"b'Jadi ingat, dua tahun lalu Mendikbud bilang menolerir kekerasan di sekolah sepanjang masih dalam ""batas tertentu."" https://t.co/XgyvC4xTqQ'"
1176383328989192193,2019-09-24 06:30:16,"b'Dampak pertama tentu saja kalian akan merasa terasing, selanjutnya, hmmm, semua hal memburuk. https://t.co/vkdu9bGAMD'"
1176375747465875456,2019-09-24 06:00:08,"b'Bill Wurtz\xe2\x80\x94sang youtuber cult\xe2\x80\x94mengajak kita menjelajahi sejarah manusia dan alam semesta, sejak planet ini masih berupa gumpalan gas di ruang hampa. https://t.co/opSEGhE5sZ'"
1176368193075654656,2019-09-24 05:30:07,"b'Berdasarkan hukum soal pencabulan ini, seorang laki-laki menghadapi hukum penjara maksimal tiga tahun karena digugat saudara iparnya. https://t.co/oqIRE3CFHD'"
1176360640753164288,2019-09-24 05:00:07,b'Simak daftar CEO perusahaan yang paling bertanggung jawab atas polusi global dan meningkatnya suhu planet Bumi: https://t.co/NdCbwFBSLh https://t.co/2BvZK4QkVz'
1176353087038115841,2019-09-24 04:30:06,"b""Sayangnya dia sedang dalam masalah dalam cerita versi layar lebar bertajuk 'El Camino' ini. https://t.co/GQUIAsXQu7"""
1176345616479412225,2019-09-24 04:00:25,b'Gender seseorang dapat memengaruhi cara kita menyimpan uang. Termasuk mempersiapkan dana pensiun. https://t.co/VKEFZucBT7'
1176338003968634880,2019-09-24 03:30:10,"b'Ya ampun, mau bahagia aja kok repot. \xf0\x9f\x98\x96https://t.co/TyhdDtD2e2'"
1176330510622187527,2019-09-24 03:00:23,"b'Nyokap: ""Bah, apa itu ngentot?"" https://t.co/hrQQjVcMwA'"
1176270117333819394,2019-09-23 23:00:24,b'Apa buku favoritmu?'
1176164504427749378,2019-09-23 16:00:44,"b""Do you think your zodiac's traits represents you?"""
1176149364550635522,2019-09-23 15:00:34,"b'Engga kaget sih. Tapi lumayanlah, kesimpulan ilmiah ini bisa jadi bahan renungan pas kalian sedang sulit tidur lelap.\nhttps://t.co/xGxIES2BPW'"
1176141738077036544,2019-09-23 14:30:16,"b'Tiga puluh lima tahun lalu, Granger Taylor meninggalkan pesan bahwa dia hendak naik pesawat alien menjelajahi semesta. \nhttps://t.co/hWhFNC5Gs2'"
1176134256680153089,2019-09-23 14:00:32,b'Engga ada salahnya kan siap-siap. Pakar nuklir membantu kita membayangkan skenarionya.\nhttps://t.co/2hM6F3b5f8'
1176126616797405186,2019-09-23 13:30:11,b'Penulis artikel ini menelepon ibunya sendiri untuk meminta rahasia hidup tanpa harus ketakutan mati sendirian.\nhttps://t.co/qc0Ht53zNT'
1176119131503882242,2019-09-23 13:00:26,b'Kriminolog minta pemkot siapkan perangkat aturan hukum sebelum menghubungkan CCTV dengan data kependudukan. Salah-salah hak menyatakan pendapat malah dilanggar.\nhttps://t.co/mifr6wrcox'
1176111583539470337,2019-09-23 12:30:27,"b'\xe2\x80\x9cSaya berusaha mengisi setiap sudut tubuh saya dengan rajah, tapi belakangan saya mikir daerah wajah sudah agak kepenuhan tato.\xe2\x80\x9d https://t.co/mTDfc7qTVy'"
1176104019623907329,2019-09-23 12:00:23,"b'""Aku penasaran apa yang mereka dapat dari bertelanjang bulat bersama ratusan orang lainnya."" https://t.co/9RvuTSuYRA'"
1176096479078993920,2019-09-23 11:30:26,"b'Bali punya macam-macam kuliner khas, namun rasanya tidak ada yang bisa menandingi keluhuran babi gulingnya. https://t.co/xa5eHeJaEG'"
1176088886075957250,2019-09-23 11:00:15,"b'Walau isu berbeda, semangat para anak muda sama: melawan kebijakan pemerintah yang tak sesuai nurani publik. https://t.co/3cqsWFj3PZ https://t.co/V1JO1jJdK0'"
1176077522636873728,2019-09-23 10:15:06,"b'Elemen anak muda lintas kota menggelar protes. Agendanya dari lingkungan sampai menolak RKHUP. Walau isu berbeda, semangatnya sama: melawan kebijakan pemerintah yang tak sesuai nurani publik. https://t.co/8yqWQCFaSf'"
1176073787533594624,2019-09-23 10:00:15,b'Jatuh cinta dan mengajak rekan kerja ke pelaminan memicu masalah bagi banyak karyawan di Indonesia. https://t.co/4k9KrWOwJY'
1176066249421463552,2019-09-23 09:30:18,"b'Kami mengikuti dua rikishi, atlet sumo profesional, yang terpaksa mengubur cita-citanya setelah tak bisa lagi bertanding. https://t.co/ZxH5lmVsdb'"
1176058671043948545,2019-09-23 09:00:11,b'Barang langka nih buat penggemar Beatles....\nhttps://t.co/Tl0SU0IopO'
1176051134575853568,2019-09-23 08:30:15,"b'""Aku yang gampang kaget dan tak pernah pegang pistol ternyata bisa menembak.""\nhttps://t.co/mXw9gd6buA'"
1176043582819577857,2019-09-23 08:00:14,b'Obsesi Mencetak Foto Bumi Dalam Resolusi Paling Tinggi: https://t.co/16ikU9ij5o https://t.co/NVHMtkdAHj'
1176036038575362048,2019-09-23 07:30:15,"b'Dulu musik Molam dianggap sebagai ""musik supir taksi"" atau hiburan bagi kaum bawah di Thailand. Kini pencinta musik Barat malah tergila-gila. https://t.co/w6U8SYs0Ja'"
1176028470893305858,2019-09-23 07:00:11,"b'Tiga puluh lima tahun lalu, Granger Taylor meninggalkan pesan bahwa dia hendak naik pesawat alien menjelajahi semesta. Taylor seperti lenyap ditelan bumi setelahnya. https://t.co/hWhFNC5Gs2'"
1176021020576296960,2019-09-23 06:30:35,b'Nikotin semprot itu digadang-gadang bisa menyaingi popularitas rokok elektrik. https://t.co/DSf7ObzpAL'
1176013369821843456,2019-09-23 06:00:11,b'Manekin kayak gini tuh idenya Balenciaga. https://t.co/59bVg6SiHu'
1176005812466139136,2019-09-23 05:30:09,b'Empat dari sembilan petugas konservasi satwa liar dituduh jadi mata-mata buat negara lain. https://t.co/wqPwVTYspd'
1175998300652232704,2019-09-23 05:00:18,"b'Sukanto Tanoto lewat PT ITCI Hutani Manunggal dan PT ITCI Kartika Utama masing-masing mengelola 41 ribu hektare dan 36 ribu hektare lahan, atau hampir separuh dari luasan lahan konsesi yang tersedia. https://t.co/kxItPaKc9Y https://t.co/2I8IIldHWO'"
1175990705673723906,2019-09-23 04:30:07,"b'ilmuwan sukses merekonstruksi wajah ""manusia purba"" Denisova untuk pertama kalinya berkat info dari DNA. https://t.co/JKhIZUHD1p'"
1175983129418485761,2019-09-23 04:00:01,"b'Tenang, ini bukan perkara klenik. Ada pengaruh dari kerja otak kita membedakan obyek yang dilihat mata. https://t.co/9wyvnojQDT'"
1175975578047877120,2019-09-23 03:30:01,b'Seorang pakar syaraf dan seorang psikopat betulan menjelaskan apa saja kriterianya. https://t.co/3uPJWZx9hd'
1175968039885561856,2019-09-23 03:00:03,b'Sebel sama cara komunikasi macam itu? Kata sains sih salahkan ibu mereka. https://t.co/L58FLsXo4t'
1175907647779987456,2019-09-22 23:00:05,b'Tempat apa yang kamu ingin datangi?'
1175801952376111104,2019-09-22 16:00:05,b'What do we have too much of?'
1175786860678930439,2019-09-22 15:00:07,"b'Seriusan ini pengakuan beneran, bukan cuma film. https://t.co/nSv61U1lPD'"
1175775511848652802,2019-09-22 14:15:01,"b'Depresi merampas banyak hal: waktu, pikiran, dan pemahaman diri. Tapi, pertama-tama, depresi merampas kawan-kawan terdekat. https://t.co/UthtTZcKfZ'"
1175764193053683716,2019-09-22 13:30:02,"b'Daripada menebak-nebak sendiri, mending dengarkan penjelasan dokter ini. https://t.co/sYrzoNxWpM'"
1175752860396638208,2019-09-22 12:45:01,b'Jawabannya cukup jelas sih. Tapi kami biarkan sains yang bicara. https://t.co/oVTIVfycvT'
1175741554448838656,2019-09-22 12:00:05,"b'""Menari adalah kunci perilaku manusia yang terkait dengan ikatan sosial\xe2\x80\x94juga kemampuan mengekspresikan diri dan bersenang-senang!\xe2\x80\x9d https://t.co/djkSucTW5Z'"
1175718885934469121,2019-09-22 10:30:00,b'Padahal Menulis lagu hanya salah satu aspek yang membuat seorang penyanyi pop jadi terkenal. https://t.co/YOZCoevgwa'
1175707561632436224,2019-09-22 09:45:00,"b'Iya deh bro, kita paham alasanmu bilang ""Inception"" film terbaik sepanjang masa. https://t.co/j2tgxAUFPa'"
1175696251129618433,2019-09-22 09:00:04,b'Kaleng birunya ikonik banget. Kuenya? Enak banget. https://t.co/Rzv51Ui4EN'
1175684922289328128,2019-09-22 08:15:03,b'Begini Pengalamanku Mendatangi Konferensi Peminat UFO Terbesar di Indonesia: https://t.co/mSXDiMP5aU https://t.co/SnT4fNRwfY'
1175673588713758720,2019-09-22 07:30:01,b'Apalagi kalo cuma dikucek-kucek doang. https://t.co/82Pflyzdc1'
1175662261735710720,2019-09-22 06:45:00,"b'Kenyataannya, berbagai penelitian telah menunjukkan bahwa kita cenderung tertarik dengan seseorang yang memiliki banyak kesamaan. https://t.co/USBIklnK2h'"
1175650946501763072,2019-09-22 06:00:02,b'Sembilan hal yang harus kamu ketahui sebelum masuk ke studio yoga untuk pertama kalinya. https://t.co/uMZU2Z339m'
1175643397102567425,2019-09-22 05:30:02,b'Nasib balapan malam hari itu terancam karena udara Singapura terus memburuk akibat kiriman asap dari Sumatra dan Kalimantan.\n\nhttps://t.co/txJxz724sy'
1175639612645138432,2019-09-22 05:15:00,"b'Tentukan apa hal paling kamu inginkan dalam hidup setahun ke depan, lalu rinci semua biaya yang kamu perlu lakukan (beserta biayanya) untuk mewujudkannya. https://t.co/OS48IuIMKt'"
1175616963139244032,2019-09-22 03:45:00,b'Seniman Alex Soloviev menyajikan teknik editing gambar energetik yang hasilnya sangat memukau. https://t.co/cCnrMisR3M'
1175605644600184832,2019-09-22 03:00:02,b'Simak dan lakukan langkah-langkah dari redaksi MUNCHIES ini supaya tidak salah pilih pas belanja ya. https://t.co/A2q6lP8lAz'
1175545256856686597,2019-09-21 23:00:04,b'Kopi mana yang enak?'
1175439605946040320,2019-09-21 16:00:15,b'Apa yang membuat Indonesia unik?'
1175424483139760129,2019-09-21 15:00:09,"b'Di tempat ibadah seperti gereja, kita bahkan masih berpeluang teler, hmm.... https://t.co/vpNMN6CZUB'"
1175413123743985668,2019-09-21 14:15:01,b'Delapan anime berikut bisa menangkap suasana dan emosi remaja lebih baik daripada live-action. https://t.co/EMyTUXlt3H'
1175401805230018560,2019-09-21 13:30:02,b'\xe2\x80\x9cYang paling menakutkan saat nonton film di bioskop justru popcorn.\xe2\x80\x9d https://t.co/GbCtzwy8hg'
1175390472128385024,2019-09-21 12:45:00,"b'Pulau Dewata seakan kembali ke era saat budaya skateboard lahir di ""Dogtown"" California. https://t.co/shw3VBGr5g'"
1175379172614651906,2019-09-21 12:00:06,b'Sejumlah besar orang Argentina lebih memilih bercinta tidak pakai kondom karena harganya yang makin tak masuk akal. https://t.co/KvPKfw4M7M'
1175356498379202560,2019-09-21 10:30:00,b'Musisi Nilufer Yanya memilih lagu-lagu Timur Tengah yang menurutnya progresif. https://t.co/NmJWZUnEVU'
1175345175536779264,2019-09-21 09:45:01,"b'Sepekan terakhir, rasanya suram jadi orang Indonesia. https://t.co/fOnT3zld20 https://t.co/7ppizW1A3x'"
1175333872298528770,2019-09-21 09:00:06,"b'Mereka ngaku menderita ""hipersensitif gelombang elektromagnetik"". https://t.co/pA7G8CAApt'"
1175322538630635525,2019-09-21 08:15:04,b'Cuplikan beberapa foto dari liputan VICE untuk event #climatestrike di Jakarta. Simak lebih lanjut di Insta story kami: https://t.co/OrHIFhxV2w #coveringclimatenow #environmentalextremes https://t.co/aQ3cfavZc7'
1175311646127874051,2019-09-21 07:31:47,"b'Pembegalan dan pelecehan seksual kembali meneror jalanan Yogya, mengingatkan orang pada trauma klitih beberapa tahun lalu\n\nhttps://t.co/pHtyr4QUaz'"
1175311200399364101,2019-09-21 07:30:01,"b'Siapa tahu pembaca ada yang tajir melintir, kami kasih gambarannya. https://t.co/nHNs5S33lT'"
1175299874079825920,2019-09-21 06:45:00,"b'Sebuah survei mengatakan bahwa millennial adalah generasi yang paling tidak semangat di kantor, dan kebanyakan dari mereka selalu berpikir mencari pekerjaan baru.  https://t.co/nEV7l2IMFP'"
1175297762256011265,2019-09-21 06:36:37,"b'Setelah lebih dari 30 tahun, dengan dua juta personel kepolisian terlibat penyelidikan\xe2\x80\x94dan diadaptasi jadi film terbaik Korsel\xe2\x80\x94akhirnya sang pembunuh teridentifikasi\n\nhttps://t.co/FnsvOz9EP6'"
1175288553816907777,2019-09-21 06:00:01,"b'Contohnya, hindari makan es krim sama timun supaya enggak sesak napas. Daging kelinci+jamur = kematian! https://t.co/7kUbBIigaD'"
1175277224259465216,2019-09-21 05:15:00,"b'""Hal pertama yang kuingat yaitu berada di tempat gelap dengan cahaya kemerahan. Kepalaku ada di antara kedua kakiku."" https://t.co/n70nEy1Ic4'"
1175254575496007681,2019-09-21 03:45:00,"b'Partikel karbon hitam, yang biasanya keluar dari pembangkit listrik tenaga batu bara atau knalpot mobil, dapat masuk ke plasenta janin. https://t.co/2QUKiSJZPE'"
1175243262275272705,2019-09-21 03:00:03,b'Perlindungan privasi data di Indonesia terbukti belum menjadi perhatian serius. https://t.co/p6m7Rld3y1'
1175182881007620096,2019-09-20 23:00:07,b'What are you looking forward to this weekend?'
1175077442089865216,2019-09-20 16:01:08,b'Isu apa yang paling mendesak?'
1175016887463403520,2019-09-20 12:00:31,b'Tindakan lelaki Jambi ini memperparah bencana asap hebat melanda Sumatra. Ratusan sosok sejenis memicu krisis serupa di Kalimantan. Tapi pembakar berbendera korporasi yang sebenarnya paling sulit ditangkap. https://t.co/9eWlAS13L8 https://t.co/9g1sJlAOwU'
1175005480839761920,2019-09-20 11:15:11,b'Video VICE merekam risiko tenggelamnya ibu kota yang makin nyata. https://t.co/Nv75dDDUKU'
1174994193367883778,2019-09-20 10:30:20,b'Tak ada hal lebih menyenangkan selain membawa kursi yang menempel di bokong supaya bisa duduk di mana saja.\nhttps://t.co/9tITeB4Mlg'
1174989056251318272,2019-09-20 10:09:55,"b'Melihat kecaman berbagai pihak, Jokowi turun tangan. DPR tak bisa jelaskan alasan ada pasal absurd. Sayang, ini belum final. Dulu Revisi UU KPK juga ditunda, akhirnya lolos juga\n\nhttps://t.co/ICwvsrdqxO'"
1174982818427883522,2019-09-20 09:45:08,b'Peneliti menemukan bahwa cangkang kepiting bisa dimanfaatkan sebagai kemasan yang dapat didaur ulang.https://t.co/Y95SG7X3Ty'
1174971529756438530,2019-09-20 09:00:17,b'Presiden Filipina Rodrigo Duterte ingin memenjarakan kembali napi yang secara tidak sengaja dibebaskan karena kelalaian pemerintah. https://t.co/mBZPibRTsf'
1174960187569930242,2019-09-20 08:15:13,b'Limbah Kebocoran Minyak Pertamina di Utara Jawa Dikelola Serampangan: https://t.co/XnGqOPLYcL #environmentalextremes #coveringclimatenow https://t.co/9OFy5CcUKw'
1174948896453251072,2019-09-20 07:30:21,"b'""Walau puisiku jelek banget, aku menemukan pola kalau kutipan puitis di feed IG kalian enggak harus bagus-bagus amat biar rame dibaca orang.""\nhttps://t.co/qgxDc7S0eW'"
1174937511933558785,2019-09-20 06:45:06,b'Tindakan lelaki Jambi ini memperparah bencana asap hebat melanda Sumatra. Ratusan sosok sejenis memicu krisis serupa di Kalimantan. #environmentalextremes #coveringclimatenow \nhttps://t.co/5q8Qwax0KJ'
1174926213212594180,2019-09-20 06:00:12,b'Barangkali menpora berikutnya jangan berkumis lagi :P https://t.co/HdiYIhZsW2 https://t.co/BkoaWusJWR'
1174914852994699264,2019-09-20 05:15:04,b'Simak daftar CEO perusahaan yang paling bertanggung jawab atas polusi global dan meningkatnya suhu planet Bumi. #environmentalextremes #coveringclimatenow https://t.co/AOrUxgR4Qx'
1174903565153816577,2019-09-20 04:30:13,b'Emang bener memisahkan dunia jadi bagian kecil atas nama kedaulatan adalah hal yang alamiah dan berdampak positif? https://t.co/roUafGc3Ry'
1174892210480791553,2019-09-20 03:45:06,"b'Ketika ada bangunan memasang logo Indomaret, hampir pasti akan muncul Alfamart di sekitarnya. Begitu pula sebaliknya. https://t.co/TRsPgnEvHT'"
1174880953958838273,2019-09-20 03:00:22,b'Lupakan utang kartu kredit dengan sup dan konsumsi lainnya.https://t.co/kSkpWO3Yd5'
1174866227350556672,2019-09-20 02:01:51,b'Info lebih lanjut tentang climate strike yang akan berlangsung di dekat tempat tinggalmu: https://t.co/a0FR6HlWpm'
1174820574369128449,2019-09-19 23:00:26,b'Pada ikut aksi climate strike di kota kalian masing-masing gak?'
1174715020997005312,2019-09-19 16:01:00,"b""What's the most fucked up thing we normalised as a society?"""
1174699804192120832,2019-09-19 15:00:32,"b'""Makna hidup seseorang meningkat saat seseorang merasa kebutuhan mendasar mereka terpenuhi.""\nhttps://t.co/M1v7Bkrkkd'"
1174692174400765952,2019-09-19 14:30:13,b'Seorang perias jenazah buka-bukaan seputar pekerjaannya kepada VICE.\nhttps://t.co/GJPUvR2eSF'
1174684717221912580,2019-09-19 14:00:35,"b""Dengan teknologi 'bone conduction' pakar kelautan Andrew Thaler merancang headphone yang bikin manusia bisa melacak lokasi secara akurat seperti lumba-lumba.\nhttps://t.co/rUSEFprB4P"""
1174677070368202753,2019-09-19 13:30:12,b'Aksi heroik tapi goblok ini ternyata nekat dilakukan lelaki amatir ini supaya dilirik klub rugby premier Australia.\nhttps://t.co/21y9EZ7Qzr'
1174669576140984321,2019-09-19 13:00:25,b'Kesimpulan dokter ini jangan bikin kamu berhenti diet ya.\nhttps://t.co/fYIU2WFlDc'
1174665787694469126,2019-09-19 12:45:22,"b'Imam Nahrawi jadi tersangka suap, ikuti jejak Andi Mallarangeng. Roy Suryo juga tak bebas masalah. Menpora berikutnya jangan berkumis lagi deh :P\n\nhttps://t.co/00AXevs2a8'"
1174661970777268225,2019-09-19 12:30:12,"b'Seperti gaya fesyen dan rambutmu, story IG merupakan ungkapan identitasmu. https://t.co/a6pnghAgZ3 https://t.co/REIMqVzaH1'"
1174654520355426305,2019-09-19 12:00:36,b'#anakindie #sayangorangtua https://t.co/rt3wLMxd2J'
1174646859446607872,2019-09-19 11:30:09,"b'Tumpahan minyak termasuk limbah berbahaya. Dari pantauan VICE, proses pengangkutan berlangsung alakadarnya, membahayakan petugas, dan tak ada transparansi mitra Pertamina atas pengelolaannya. #environmentalextremes #coveringclimatenow https://t.co/t53an3uh8g'"
1174639346445631488,2019-09-19 11:00:18,"b'Pekerja lepas bisa terjebak gangguan mental, walaupun tak ada beban jam kerja rutin seperti pegawai kantoran. https://t.co/iL9L0cK6sO'"
1174631807242919937,2019-09-19 10:30:21,b'Ternyata inilah penyebab vokalis black metal atau post-hardcore pita suaranya tak ada yang rusak. Mereka teriak kayak bayi. https://t.co/OzfsrJeYiX'
1174624229603663873,2019-09-19 10:00:14,"b'Pestanya sih meriah, hujatan netizen ikut rame. Propam Lampung segera turun tangan. https://t.co/hvXSUrfMBE'"
1174616686521192453,2019-09-19 09:30:16,b'DeepPrivacy menyamarkan wajah asli dengan jutaan wajah lain. https://t.co/8OKSse8b8K'
1174609140582354944,2019-09-19 09:00:16,"b""We're currently looking for a freelance video editor to join the team. If you're interested, please send your CV and portfolio to omar.prazhari@vice.com. https://t.co/hYtcWVo65b"""
1174601602776391681,2019-09-19 08:30:19,"b'Contoh lagu-lagu dengan tema asap atau api dalam playlist Spotify itu: ""No Air\xe2\x80\x9d - Jordin Sparks, \xe2\x80\x9cFire Burning\xe2\x80\x9d - Sean Kingston, dan \xe2\x80\x9cMask Off"" - Future. https://t.co/gXFqb3qxBW https://t.co/pagQjAqO5x'"
1174594035706712066,2019-09-19 08:00:15,b'Krisis Daur Ulang di Australia Ini Menjelaskan Kenapa Sampah Sampai Diekspor ke Indonesia: https://t.co/bRyNpezN4g\n#environmentalextremes #coveringclimatenow https://t.co/jEFA6DOHk5'
1174586491458207745,2019-09-19 07:30:16,"b'Membagi screenshot dari Spotify lagi? Iya deh, kami ngerti kok, kamu demen musik. https://t.co/GqOP7MnSwN'"
1174575117864787970,2019-09-19 06:45:05,b'Sebagian anak muda mungkin familier sama nama keluarga Tanoto karena yayasannya senang ngasih beasiswa. Sementara yang lain mengingat kiprah sang konglomerat karena tersandung kasus penggelapan pajak. https://t.co/4Reg8IYzhd'
1174571376562364417,2019-09-19 06:30:13,"b'Sambil mengutuk pemerintah, aparat, hingga korporasi pembakar lahan hutan di Sumatra dan Kalimantan, mari kita sedikit menghibur diri mendengarkan lagu seperti \xe2\x80\x9cFire Burning\xe2\x80\x9d dan \xe2\x80\x9cMask Off\xe2\x80\x9d. https://t.co/qwzllUfatp'"
1174563808783806465,2019-09-19 06:00:09,"b'""Aku datang [ke ""Pemakaman KPK] soalnya aku turut merasakan kecewaan yang dirasakan pegawai KPK dengan pengesahan UU KPK yang baru. Menurutku nilai-nilai KPK jadi hilang."" https://t.co/dGolAa8p15 https://t.co/a3uhkWQ362'"
1174556269778210816,2019-09-19 05:30:11,"b'Sekitar 100 tabung cyrogenik hancur, memicu kesedihan bagi peternak setempat. https://t.co/78Pw1CEwZZ'"
1174548709448781825,2019-09-19 05:00:09,b'Gunung tertinggi di dunia berubah jadi \xe2\x80\x9ctempat sampah tertinggi\xe2\x80\x9d karena jumlah pendaki yang berlebih dan perubahan iklim. #environmentalextremes #coveringclimatenow https://t.co/7T6MIVZlMu'
1174541148356075520,2019-09-19 04:30:06,"b'Banyak kapal tongkang mematikan pelacak ketika memasuki perairan Karimunjawa. Jika dibiarkan, pariwisata dan nelayan lokal jadi korbannya. https://t.co/nRoIlFxHKU'"
1174533678271217664,2019-09-19 04:00:25,"b'Jika terus seperti sekarang, bisa-bisa dalam di masa mendatang satu benua Afrika malah harus impor ikan.\nhttps://t.co/5c1dHnMiOx'"
