id,created_at,text
1165874066898718720,2019-08-26 06:30:13,b'Banyak yang perlu dikorbankan perempuan demi \xe2\x80\x9ckeseimbangan\xe2\x80\x9d kehidupan dan pekerjaannya. https://t.co/nhWWc46f4i'
1165866511199854593,2019-08-26 06:00:11,"b'""Skorsing itu namanya pemberhentian sementara, sifatnya temporer. Walaupun sebenarnya itu merupakan sanksi juga ya, jadi hak-hak dia dikurangi juga,"" ujar Kepala Penerangan Kodam (Kapendam) V/Brawijaya Letkol Arm. https://t.co/2QkIbX1Zsy https://t.co/PyrGtjSFFa'"
1165858949607940098,2019-08-26 05:30:08,"b'Penyebab tewasnya orang-orang di ""Danau Tulang Rangka"" selama satu millenium terakhir menjadi topik penelitian ilmuwan. https://t.co/c7YreNXlgC'"
1165851449139564546,2019-08-26 05:00:20,"b'Di sirkus keluarga Ritz, anak-anak menjadi bintang utama pertunjukan. https://t.co/aVnA9Lndkb'"
1165840226998194176,2019-08-26 04:15:45,b'Korlap aksi yang merupakan anggota ormas FKPPI dipecat organisasinya. Tindakan rasis mereka memicu kerusuhan di Papua. https://t.co/qvKmklQw78'
1165836269169053697,2019-08-26 04:00:01,"b'""Saya menulis esai menjelek-jelekkan album legendaris itu, lalu semua orang hendak membakar saya hidup-hidup."" https://t.co/anxgfdGwwP'"
1165828717979086848,2019-08-26 03:30:01,b'Alasannya sederhana: anak yang kurang tidur tidak bisa meraih hasil maksimal selama belajar. https://t.co/RmeYNxCUvn'
1165821174921728000,2019-08-26 03:00:02,b'Rusak sudah gambaran T-Rex di masa kecil kita semua. https://t.co/yuOHJhtD5x'
1165760778898673664,2019-08-25 23:00:03,b'Apa pekerjaan impianmu?'
1165655120341811205,2019-08-25 16:00:12,b'Apa kata favoritmu?'
1165640031689728000,2019-08-25 15:00:14,"b'Peristiwa tewasnya sembilan pendaki di Pegunungan Ural, Uni Soviet, pada 1959 oleh beberapa pihak dianggap melibatkan campur tangan alien. https://t.co/dw9Sf9GelD'"
1165628648671633408,2019-08-25 14:15:00,"b'Kami menyelidiki muasal kepercayaan yang populer di Indonesia maupun Asia Tenggara, mengenai pemicu kelumpuhan sementara saat kita terbangun dari tidur. https://t.co/GkeTpn1IUh'"
1165617327636910080,2019-08-25 13:30:01,"b'Kolor Ijo tidak seram, sebab kenyataan perempuan kapanpun bisa dilecehkan dan diperkosa di jalanan ibu kota jauh lebih mengerikan. https://t.co/pSppRZs6J8'"
1165607566652538880,2019-08-25 12:51:14,b'Ini daftarnya: https://t.co/JlihBfZXrM \xf0\x9f\x99\x83'
1165605998888914945,2019-08-25 12:45:00,"b'Kesehatan mental kalian konon akan mencapai kondisi terbaik. Tentu, syarat dan ketentuan berlaku. https://t.co/yHmUHbtzty'"
1165594702013505536,2019-08-25 12:00:07,b'Kubrick bukan cuma sutradara visioner. https://t.co/Pm6IUNqEQZ'
1165572027840962560,2019-08-25 10:30:01,b'Profesi kalian ada ga di daftar ini?'
1165560703887036416,2019-08-25 09:45:01,b'Lihat bagaimana sayuran bisa bikin kita merasa mendengar tulang belakang dikoyak oleh Sub Zero dan Liu Kang: https://t.co/RtebLnHQCB https://t.co/dCpmb6qsKV'
1165549397037506560,2019-08-25 09:00:05,b'*Spoiler: lari gaya Naruto tidak disarankan sama pelatih pelatnas atletik. Waduh! https://t.co/y3OqzDtwZI'
1165538063835119616,2019-08-25 08:15:03,b'Deretan Foto dan Desain Grafis Berikut Gambarkan Keseharian di Korea Utara: https://t.co/rD3qSE75jr https://t.co/wy0jw95WUN'
1165526728124579840,2019-08-25 07:30:01,b'Ditanya gaji yang kita inginkan itu tidak mudah. https://t.co/oEzURdkaGM'
1165515401733771265,2019-08-25 06:45:00,"b'""Banyak orang Indonesia ke Singapura buat belanja atau wisata, tapi pasti sedikit yang datang menemui dukun setempat sepertiku.\xe2\x80\x8b"" https://t.co/xK1k3megjX'"
1165504081689026560,2019-08-25 06:00:01,b'Salahkanlah orbit Saturnus... https://t.co/dc9lSjc9vM'
1165492752131534849,2019-08-25 05:15:00,b'Masa kecil kita yang polos rupanya penuh kepalsuan kawan-kawan... https://t.co/jKoTDDZRBw'
1165470103271542785,2019-08-25 03:45:00,b'Berikut hal-hal yang bisa menjadi pelajaran penting bagi kalian semua calon anak magang. https://t.co/TPCSpByfQU'
1165458787311980544,2019-08-25 03:00:02,b'Efek secangkir kopi ternyata lebih kuat dari yang kamu kira. https://t.co/COsm2xdoBO'
1165398392807276546,2019-08-24 23:00:03,b'Kopi terbaik adalah....'
1165292717259264000,2019-08-24 16:00:08,b'What do you wish you knew a year ago?'
1165277619031564288,2019-08-24 15:00:08,"b'Topik ini emang gelap sih. Tapi karena manusia pasti mati, membayangkan proses yang ideal tak ada salahnya kan. https://t.co/5ArwtIrmbG'"
1165266262651482112,2019-08-24 14:15:01,"b""Karena, menurut pakar, kita memang nyaris selalu bekerja walaupun resminya sedang datang ke 'pesta'-nya kantor. Hadeh... https://t.co/qNaeGuGeTN"""
1165254946683416577,2019-08-24 13:30:03,"b'Kadang kenyataan harus kita terima, walau pahit. https://t.co/vl9sdjusZf'"
1165243612302630912,2019-08-24 12:45:01,"b'Mereka mengeluarkan batrachotoxin, racun paling mematikan di dunia, melalui bulunya. https://t.co/lW2WZf3Gdc'"
1165232306669391872,2019-08-24 12:00:05,b'Penggemar durian di Tiongkok terpaksa mengalami nasib nahas itu.  https://t.co/5Ltv7k6lWY'
1165209644794560513,2019-08-24 10:30:02,b'Kami ngobrol bareng mereka-mereka yang bangkit dari keterpurukan setelah mendengarkan musik idolanya. https://t.co/OmmZN4tMJ3'
1165198314989674496,2019-08-24 09:45:01,"b'Di zaman serba \xe2\x80\x98cashless\xe2\x80\x99 tanpa harus direpotkan lembaran uang dan koin, emangnya apa kerugian yang bisa dialami konsumen? https://t.co/XaUWurN7Wp https://t.co/8ToQZfUYgs'"
1165186999327907842,2019-08-24 09:00:03,b'Jadi inilah alasan kita sering pusing liat ada notif grup wa keluarga datang bertubi-tubi. https://t.co/bi4Ji9hPJj'
1165181976099377152,2019-08-24 08:40:05,"b'Sesudah merusak patung pakai pipa besi, pelaku malah tidur-tiduran di lapangan tak jauh dari kuil. https://t.co/ptHoJLrZkB https://t.co/ToPMcm2l0B'"
1165175427150897152,2019-08-24 08:14:04,b'Menyulap Jalan Tikus Jadi Galeri Seni: https://t.co/s1WACLHx9D https://t.co/9rIzaN0FyI'
1165164342427475968,2019-08-24 07:30:01,"b'Njirr, kool... https://t.co/f3lXcdPTjC'"
1165153013704642561,2019-08-24 06:45:00,"b'""Hidup di Indonesia bikin saya sadar satu hal: tiap hari kayaknya saya berurusan sama plastik."" https://t.co/HtoUXjUYgM'"
1165141696302211073,2019-08-24 06:00:02,b'SmileyWorld Ltd kini memiliki hak cipta logo tersebut di lebih dari 80 negara dan mendapatkan keuntungan $265 juta setiap tahunnya. https://t.co/YRNJap74YF'
1165130364194611206,2019-08-24 05:15:00,"b'""Dia hanya berak pada hari kerja. Kalau weekend aku tidak pernah menemukan kotoran di lapangan golf."" https://t.co/fgzHq6Bh2R'"
1165107716085469184,2019-08-24 03:45:00,"b'Ada satu titik kalian pasti merasa ""kerjaan gue kok gini-gini amat ya?""  https://t.co/GWGZG7KU9e'"
1165096402474680321,2019-08-24 03:00:03,b'Rasanya tak ada insiden lain bisa mengalahkan tololnya kepura-puraan ball boy laga Copa Sudamaericana. https://t.co/VwNIQQchO3'
1165036015788208134,2019-08-23 23:00:06,b'Apa yang paling kamu hargai?'
1164930460830580738,2019-08-23 16:00:39,"b'Mimin lagi kurang fit nih, mau di rumah aja malem ini. Minta rekomendasi film dong!'"
1164915336816287744,2019-08-23 15:00:34,b'Dia baik kok...\nhttps://t.co/XUOnuVu7VD'
1164907702130282496,2019-08-23 14:30:13,b'Apa benar itu selimut berumur 13.000 tahun dari luar angkasa? Mungkin saja.\nhttps://t.co/o5rcLXS13N'
1164900218900496385,2019-08-23 14:00:29,"b'Hampir satu miliar orang di seluruh dunia tinggal di kawasan rentan bencana lingkungan seperti badai, banjir, dan naiknya permukaan laut.\nhttps://t.co/LxGnjJQOU0'"
1164892663881093121,2019-08-23 13:30:28,"b""Beberapa tahun ini banyak cowok hobi banget melakukan kebiasaan yang kami juluki 'Tindstagramming'. https://t.co/Y2C4PlBmsT"""
1164888833747542016,2019-08-23 13:15:15,"b'Sesudah merusak patung pakai pipa besi, pelaku malah tidur-tiduran di lapangan tak jauh dari kuil. Aksinya memicu kecaman warga Negeri Jiran. https://t.co/CmkuN1ekbq'"
1164885121972998144,2019-08-23 13:00:30,"b'Halo cowok-cowok. Daripada sok tahu, mending baca tanya-jawab berikut buat memahami proses cewek datang bulan ya. https://t.co/shbxVmCma7'"
1164877546393165824,2019-08-23 12:30:24,b'Udah saatnya lepas dari stereotip patriarkis. https://t.co/6ZWAO98dNq'
1164877482610384897,2019-08-23 12:30:08,"b'Sempat beredar info Kalimantan Timur jadi lokasi ibu kota baru Indonesia, namun dibantah Presiden Jokowi.  Menurut anak muda, yang bakal mendiaminya, seperti apa ibu kota yang ideal itu?\nhttps://t.co/OaFj7mtszO'"
1164869985614872577,2019-08-23 12:00:21,"b'Pekerjaannya membina kaum miskin kota itu, menurut Agus Gumiwang Kartasasmita, tak kunjung kelar karena ada keterlibatan mafia. https://t.co/maOcAOIonB https://t.co/VX65rIRIDt'"
1164862397712142336,2019-08-23 11:30:12,b'Good news... https://t.co/8YxDL1yMPH'
1164862376153403392,2019-08-23 11:30:07,"b'Sempat beredar info Kalimantan Timur jadi lokasi ibu kota baru Indonesia, namun dibantah Presiden Jokowi. Pro-kontra bermunculan. Menurut anak muda, yang bakal mendiaminya, seperti apa ibu kota yang ideal itu? https://t.co/OaFj7mtszO'"
1164854864133918720,2019-08-23 11:00:16,"b'Pelaku catcall alias pelecehan verbal di jalan biasanya enggak ngerasa salah, karena cewek biasanya memilih diam. https://t.co/ednmbxQfD5'"
1164847347521740801,2019-08-23 10:30:24,b'Jutaan orang dari etnis muslim Uighur di Tiongkok menghilang selama lima tahun terakhir. https://t.co/Hor4Gy8JFr https://t.co/5BlOxJQxRD'
1164839757441974273,2019-08-23 10:00:14,b'Salah satu faktornya karena doi-doi pada belum move on dari mentalitas penguasa zaman Orde Baru. https://t.co/EdTRUu2f6v'
1164832224593641474,2019-08-23 09:30:18,"b'Agus Gumiwang Kartasasmita melontarkan tuduhan serius itu, sembari menyitir bahwa populasi gelandangan dan pengemis di Indonesia mencapai 77.500 orang. https://t.co/eeulWonnMw'"
1164824654176931841,2019-08-23 09:00:13,"b'Meningkatnya penggundulan hutan menyebabkan kebakaran hebat di hutan Amazon, sampai-sampai asapnya juga dirasakan di S\xc3\xa3o Paulo pada Senin. https://t.co/ZsqpojFQG9'"
1164817117780180992,2019-08-23 08:30:16,b'Tiongkok adalah bangsa paling diawasi CCTV di dunia. https://t.co/q9UuDG4yPY'
1164809554208493568,2019-08-23 08:00:13,b'Kumpulan Foto dari Komplek Pengungsi Terbesar di Dunia: https://t.co/BCUiVhDHhU https://t.co/zJxt1OPTLj'
1164802015588864000,2019-08-23 07:30:16,"b'Di tengah laut, tiga awak kapal ini membajak kapal dan membantai ABK lain. Namun, ketika aparat berhasil menguasai kapal, seisi penghuni kapal telah lenyap tanpa jejak. https://t.co/sAJ6wwLHlE'"
1164794446593978368,2019-08-23 07:00:11,"b'Ternyata ada vendornya sendiri, dan mereka merasa sering diresek-in sama klien-klien para sineas pembuat film.\nhttps://t.co/euBlC6dfxI'"
1164786905235329025,2019-08-23 06:30:13,"b'Dulu kala, gamer terpaksa menggunakan kode khusus demi membuka rahasia untuk menuntaskan game-game sulit. Belakangan, tak ada lagi budaya itu. \nhttps://t.co/y52QSQbXCp'"
1164779334369853440,2019-08-23 06:00:08,b'Homoseksualitas tidak terlarang di Tiongkok. Namun terapi memaksa gay berganti orientasi seksual dan persekusi masih marak terjadi.\nhttps://t.co/EFs0Ni9oqs'
1164771789559357442,2019-08-23 05:30:09,"b'Sejumlah video kontes Battlebot dihapus dari layanan streaming itu, dianggap melanggar kebijakan konten YouTube. Penyebabnya misterius.\nhttps://t.co/nVAKiNxt08 https://t.co/vpIY6IlcKX'"
1164764270657097728,2019-08-23 05:00:17,b'Lembaga ini bakal mengirim misi robot khusus menjelajahi gua-gua belum terjamah yang berpotensi dihuni manusia.\nhttps://t.co/1w5B4dhdWV'
1164756678799052803,2019-08-23 04:30:07,"b'Di zaman serba \xe2\x80\x98cashless\xe2\x80\x99 tanpa harus direpotkan lembaran uang dan koin, emangnya apa kerugian yang bisa dialami konsumen? Artikel ini menelisik kemungkinan terburuknya.\nhttps://t.co/ipGQEOpffG'"
1164749192092246017,2019-08-23 04:00:22,b'Seorang keturunan imigran Tiongkok menceritakan ketakjubannya pada kuliner resepsi nenek moyang yang sangat kaya nuansa. https://t.co/xM33zjY4jG'
1164741600104386560,2019-08-23 03:30:11,"b'Walau mendapat tekanan dari WHO maupun Kemenkes, nyatanya pertumbuhan bisnis sufor tetap tinggi. https://t.co/cP7D4nPFmP'"
1164734090156883968,2019-08-23 03:00:21,"b'VICE menelusuri alasan sebagian warga tetap nekat memproduksi mercon kelas banting hingga dinamit, walau berkali-kali digerebek polisi. https://t.co/AqxNW2krtw'"
1164673710294556672,2019-08-22 23:00:25,b'Kapan terakhir kamu nangis?'
1164568076270166017,2019-08-22 16:00:40,b'What do you do when you hang out with your friends?'
1164552937865207810,2019-08-22 15:00:31,b'Kami ngobrol bareng satu cowok asal Ciputat yang tiap hari makan mi goreng instan.\nhttps://t.co/rMQgZtxm08'
1164545395252482048,2019-08-22 14:30:33,"b'Ini sudah abad 21, tapi kita masih saja disibukkan debat Bumi bulat atau datar. https://t.co/fAzrxkaFLo'"
1164537840421789702,2019-08-22 14:00:31,"b'""Ada yang nyebelin ketika kualitas diri kita dinilai dari penampilan fisik doang. Sama kasusnya seperti di Tinder."" https://t.co/DrxMYmqat6'"
1164530307401474053,2019-08-22 13:30:35,"b'Penelitik dari Finlandia menghasilkan bubuk berbahan dasar listrik, yang dapat kita konsumsi dalam berbagai cara.\nhttps://t.co/PnnfkROuf2'"
1164522740029829125,2019-08-22 13:00:31,"b'Dari Bugs Bunny, Scrappy Doo, Elmo, sampai Piccolo. https://t.co/71gJwHHy5R'"
1164515158858915840,2019-08-22 12:30:24,b'Yah seenggaknya penelitian ini ngasih sedikit harapan bagi mereka yang masih berkubang di kenangan. https://t.co/ZdmtcjOPQI'
1164507610038591488,2019-08-22 12:00:24,b'Tren sepatu jelek akan terus bertahan selama hasrat untuk caper masih ada. https://t.co/Kw7e6SxPqu https://t.co/vy1RZEOcqw'
1164500066591289345,2019-08-22 11:30:25,"b'Lansia asal Jepang ini adalah DJ tertua di dunia, dan dia dipanggil DJ Sumirock. https://t.co/6tD39jG1El'"
1164496235669196800,2019-08-22 11:15:12,"b'Pakar kesehatan menyatakan sikap skeptis ini perlu, karena kajian yang ramai dibahas tempo hari perlu diuji lebih lanjut. https://t.co/NsFIkAfv4I'"
1164492476599676928,2019-08-22 11:00:16,"b""Film dokumenter 'Shadowman' menggambarkan perjuangan dan talent luar biasa Richard Hambleton selama berkarya di jalanan Inggris. https://t.co/qhg9LksK2F"""
1164484933500506113,2019-08-22 10:30:17,"b'Saat kapitalisme berkuasa seperti sekarang, tipis sekali batas antara kerja keras dengan mempermalukan harkat manusia. https://t.co/p40gYx1Qfm'"
1164477371191320579,2019-08-22 10:00:14,"b'Sejumlah video kontes Battlebot dihapus dari layanan streaming itu, dianggap melanggar kebijakan konten YouTube. https://t.co/hXlAbYJWMb'"
1164469846266060801,2019-08-22 09:30:20,b'Jutaan orang dari etnis muslim Uighur di Tiongkok menghilang selama lima tahun terakhir. https://t.co/8UyJBkOVxF'
1164462274196705282,2019-08-22 09:00:15,"b'Kalau dapat orderan jastip dari kenalan, pastikan dulu ya barangnya bukan sabu. https://t.co/C9NgjyOoQ4'"
1164454730359365633,2019-08-22 08:30:16,b'Bumi Cendrawasih seakan zona yang selalu berbahaya bagi orang luar... https://t.co/BuaG8c1WQg'
1164447166498316288,2019-08-22 08:00:13,b'Fotografer Maroko Melawan Misogini Dunia Arab Lewat Jepretan Kamera: https://t.co/ZVlEFbsiSZ https://t.co/MBZj505AJp'
1164439629199814656,2019-08-22 07:30:16,b'Pemerintah sejauh ini memilih menambah jumlah personel keamanan dan pemblokiran medsos di Papua. https://t.co/KrkPVU2NWk https://t.co/ZD06wrL5Q0'
1164432054555226112,2019-08-22 07:00:10,b'Keputusan ini diumumkan pengelola pelabuhan usai terjadi diskriminasi terhadap transgender yang masuk ke WC perempuan di ruang publik. https://t.co/QYc0VBdw3R'
1164424511439196160,2019-08-22 06:30:12,b'Sebuah studi melacak kenapa anjing akan mengeluarkan jurus \xe2\x80\x9cpuppy eyes\xe2\x80\x9d setiap kali ingin dimanja atau diperhatikan. https://t.co/ZD6zFXsMUK'
1164416947443904512,2019-08-22 06:00:08,"b'Para pelaku industri minta organisasi kesehatan dunia mempertimbangkan ulang kajian itu, khawatir orang tua makin parno lihat anak bermain game. https://t.co/zPpNbtTx1r'"
1164409396560093187,2019-08-22 05:30:08,b'Pemerintah sejauh ini memilih menambah jumlah personel keamanan dan pemblokiran medsos di Papua. Demo merembet dari Fakfak ke Nabire. Pengamat politik dan HAM menilai itu tak cukup meredakan situasi. https://t.co/igdnVqqUwz'
1164401886201634817,2019-08-22 05:00:17,b'Ternyata manusia produktif idealnya tidak boleh kebanyakan kerja. https://t.co/AIQ7iZo9Gy'
1164394287406231553,2019-08-22 04:30:06,"b'Atas nama kesenian, dua pecinta fotografi memotret spageti atau pancake gosong yang sudah setahun didiamkan saja di dapur kosan. https://t.co/73Q8EnicKR'"
1164386820878163968,2019-08-22 04:00:26,"b'Dalam opini provokatif ini, kontributor VICE beralasan jika wajah manusia dalam foto bakal terlihat sama saja jika di-zoom sampai lima ratus persen. https://t.co/VZXfpyqIqN'"
1164379216999305221,2019-08-22 03:30:13,b'Seri foto Sara Hylton mendokumentasikan anak-anak pelarian Afghanistan yang tinggal di pemukiman khusus pinggiran ibu kota Pakistan. https://t.co/eEsYBlwQbv'
1164371705231548416,2019-08-22 03:00:22,"b'Siapa sangka, latihan membentuk otot memberi saya kepercayaan diri dan keberanian. https://t.co/fhyT9GNP3n'"
1164311315671846912,2019-08-21 23:00:24,b'Mimin ngantuk nih \xf0\x9f\x98\xaa Kenapa bangun pagi susah banget?'
1164205681815248896,2019-08-21 16:00:39,b'Apa dinosaurus favoritmu?'
1164190549827563520,2019-08-21 15:00:31,b'Tim peneliti memindai kerja otak dan denyut jantung orang sering mimpi buruk. Ternyata beda banget dari mereka yang tidurnya pulas atau mimpi indah.\nhttps://t.co/ORfIQaGjnV'
1164182922234126336,2019-08-21 14:30:12,"b'Tenang, ini bukan perkara klenik. Ada pengaruh dari kerja otak kita membedakan obyek yang dilihat mata.\nhttps://t.co/9wyvnojQDT'"
1164175450119311361,2019-08-21 14:00:31,"b'""Rasanya kaya dikejar-kejar dosa.""\nhttps://t.co/Qi77dONqqy'"
1164167824572604417,2019-08-21 13:30:13,b'Bahkan rasa penasarannya kadang lebih intens dibanding putus dari pacar beneran. \nhttps://t.co/sgkxv4cK7t'
1164160326184710144,2019-08-21 13:00:25,"b'Silakan disimak, supaya kalian yang sedang atau baru akan menjalani inisasi masuk pendidikan tinggi bisa selamat.\nhttps://t.co/JjCDCBH9fC'"
1164152706350628869,2019-08-21 12:30:08,b'Otak kita merespon stres dengan cara yang cerdas. Bahkan mampu mewariskan ingatan semata-mata untuk membuat anak-cucu lebih waspada.https://t.co/miBsNcA7Hl'
1164145217429278721,2019-08-21 12:00:23,"b'""Anime itu membentuk identitas queer saya saat remaja."" https://t.co/GxzZDNzW36'"
1164137681296809985,2019-08-21 11:30:26,"b'Anggaran untuk pengadaan pin emas ini terserap Rp1,3 milliar. https://t.co/UQVSZCcfW6 https://t.co/t2DMxXc0X0'"
1164130101354815488,2019-08-21 11:00:19,"b'Di dunia nyata, tersambar petir tidak menjadikanmu sakti seperti Gundala. Di Sumatra dan Jawa, insiden sambaran petir yang mematikan relatif sering terjadi. https://t.co/oY5xPxODnC'"
1164122550257029123,2019-08-21 10:30:18,b'Keluarga Kardashian membangkitkan tren paling kontroversial pada 2019. https://t.co/67rzpZtzV2'
1164115435928731649,2019-08-21 10:02:02,b'\xf0\x9f\x8e\xb6tet tot tet tooot teeet\xf0\x9f\x8e\xb6 https://t.co/eXHpVGz1Gx'
1164107452129972224,2019-08-21 09:30:19,b'*cepet-cepet bersihin hape* https://t.co/MfShCuuA7i'
1164101100884172801,2019-08-21 09:05:05,"b'Ada yang memuji, tapi tak sedikit pembaca Pram menghujat film Hanung Bramantyo. https://t.co/KnrkL9evcH'"
1164092340551770112,2019-08-21 08:30:16,b'Para pemegang asuransi kesehatan di Thailand bisa mendapatkan minyak terapi ganja cuma-cuma. https://t.co/1ZoDfjcfVS https://t.co/uUWVB8cCiZ'
1164084787235250177,2019-08-21 08:00:15,b'Eksperimen Ekstrem Seniman Jepang Membungkus Pasangan dan Rumahnya Pakai Plastik: https://t.co/nXiFCCtDIp https://t.co/2wcu44I0QT'
1164077245398487040,2019-08-21 07:30:17,b'Jangan kaget nonton episode pertamanya. https://t.co/w4t693Ra0h'
1164069667213910016,2019-08-21 07:00:10,"b'Belakangan ini, seniman tato di Hong Kong sedang kebanjiran pesanan membuat desain yang terinspirasi dari aksi demo besar-besaran. https://t.co/4bynrvuiIC'"
1164062151721574400,2019-08-21 06:30:18,"b'Gugatan itu dilayangkan oleh koalisi korban sejak 2011. Tadinya pemerintah menolak tuntutan warga, tapi digagalkan oleh MA. https://t.co/l2JrJuBc9I'"
1164054560622678016,2019-08-21 06:00:08,b'Di Indonesia mungkin tak jauh beda. https://t.co/lTxNDDnmm7'
1164047017729044480,2019-08-21 05:30:10,"b'Pakar gizi ini bahkan bilang micin selain aman dikonsumsi, juga bermanfaat bagi anak-anak. https://t.co/xTvExvugfT https://t.co/uWqhALAbNs'"
1164039496486346752,2019-08-21 05:00:17,"b""Perancang game 'Mortal Kombat' mengajak VICE merasakan langsung proses menghasilkan suara tulang patah, daging ditusuk, atau kepala karakter terpisah dari leher. https://t.co/O3dDJcD2Kf"""
1164031902854078466,2019-08-21 04:30:06,b'Haruhiko Kawaguchi berharap eksperimennya dengan teknologi vacuum seal dapat menggambarkan relasi pasangan dan benda dalam masyarakat. https://t.co/1YlZdbGvVA'
1164024416285671424,2019-08-21 04:00:22,b'Wahyuri Ramadhan adalah musisi difabel yang berhasil melawan stigma berkat kecintaannya bermain musik.\nhttps://t.co/ULdgjkNLfU'
1164016831037919234,2019-08-21 03:30:13,"b'Penelitian dalam jurnal PNAS menyatakan punya waktu luang lebih membahagiakan daripada menghabiskan hari kita berbelanja. Jadi tak perlu merasa bersalah lagi, hehe.\nhttps://t.co/upQCF2xOFn'"
1164009315348418560,2019-08-21 03:00:21,b'Rumput tetangga tidak selalu lebih hijau.\nhttps://t.co/dVav1tC9on'
1163948942494748672,2019-08-20 23:00:27,"b'What makes you, you?'"
1163843324383510528,2019-08-20 16:00:46,b'Berapa lama waktu yang kalian perlukan untuk nyuci piring dalam sehari?'
1163828155154599936,2019-08-20 15:00:29,b'Kesimpulan penelitian  ini bikin merinding sih.\nhttps://t.co/EIOrEqvFn2'
1163820653360795648,2019-08-20 14:30:41,"b'Survei menunjukkan Generasi Z merasa lebih kesepian daripada generasi sebelumnya. Konon, medsos bukan satu-satunya penyebab.\nhttps://t.co/JtY1PaiDnJ'"
1163813047858683904,2019-08-20 14:00:27,"b'Prinsipnya sama kayak tidur\xe2\x80\x94semakin keras kamu berusaha tidur, makin sulit kamu terlelap.\nhttps://t.co/vzUymnb93b'"
1163805507490066433,2019-08-20 13:30:30,b'VICE bertanya kepada pakar tanaman cabai demi mengetahui risiko menjadi pecinta makanan pedas.\nhttps://t.co/p1j4a4VZ9E'
1163797982992642048,2019-08-20 13:00:36,b'Ummm... https://t.co/Ow5T6epUGL'
1163790372516093953,2019-08-20 12:30:21,"b'Memisahkan karakter penikmat rock, rap, hingga country tidak lagi relevan.\nhttps://t.co/BQxPlXCZXI'"
1163782805345767426,2019-08-20 12:00:17,"b'Oskar Blues, sang pemilik bir itu, mengaku tak terinspirasi nama band GnR. https://t.co/BUcDdBd9Jf'"
1163775281397731329,2019-08-20 11:30:23,b'Seorang lelaki menjadi viral karena video dirinya menikahi dua pacar wanitanya sekaligus tersebar di media sosial. https://t.co/V6vsDFSUCk https://t.co/uHNgUk1K9k'
1163767698205159425,2019-08-20 11:00:15,"b'Bukannya dipelihara, teman yang diberi amanah justru mengubah si babi jadi isian roti p\xc3\xa2t\xc3\xa9. https://t.co/24fQ1waPxo'"
1163760169370693633,2019-08-20 10:30:20,"b""Kebiasaan 'norak' di mata sebagian pecinta fashion ini ternyata punya sejarah panjang. https://t.co/XGYiKS3vHQ"""
1163752581321166850,2019-08-20 10:00:11,"b'Pin emas akan jadi tanda pengenal anggota DPRD masa jabatan 2019-2024 di empat wilayah, termasuk DKI. Anggaran terserap miliaran Rupiah. https://t.co/PGv9XOb8XT'"
1163745051702419456,2019-08-20 09:30:16,"b""Banyak musisi sengaja merancang lagu supaya tidak di-'skip' pendengar. https://t.co/4sMl6th5S7"""
1163737487338082304,2019-08-20 09:00:12,b'Para pemegang asuransi kesehatan di Thailand bisa mendapatkan minyak terapi ganja cuma-cuma. https://t.co/9MBIs4X1b1'
1163729952283484160,2019-08-20 08:30:16,b'Disney enggak suka melihat kalian selama ini nebeng nonton Netflix atau Amazon Prime pakai password akun pacar. https://t.co/v5UXE2Nq9b'
1163722384299483138,2019-08-20 08:00:11,b'Ngobrol Bersama Kolektor Foto Halte Bus Uni Soviet Terbanyak Sedunia: https://t.co/h0kkp0cja7 https://t.co/fW9XSHd9S7'
1163714863090294784,2019-08-20 07:30:18,"b'Bukan Supreme kalau enggak merilis produk aneh selain busana, tapi terus dipuja-puja penggemarnya. https://t.co/4NLcLZSvYg'"
1163707280665272320,2019-08-20 07:00:11,b'Pejabat di Jatim bergantian minta maaf atas insiden yang memicu tagar solidaritas #Papuabukanmonyet. https://t.co/Q7mLJoYfLi https://t.co/PnBHI3cOq4'
1163699737129824257,2019-08-20 06:30:12,"b'Pernikahan ini berlangsung di Kalbar, mengulang peristiwa serupa di Lombok dan Sumsel. Maharnya pun cuma Rp10 ribu. https://t.co/MkeqckHPYs'"
1163690447451099136,2019-08-20 05:53:17,b'Polisi kini mencari sosok rasis saat ormas dan aparat mengepung asrama mahasiswa Papua Barat di Surabaya. Pejabat di Jatim bergantian minta maaf atas insiden yang memicu tagar solidaritas #Papuabukanmonyet. https://t.co/HGWElqeCng'
1163684625492959233,2019-08-20 05:30:09,b'Tren penggambaran keliru gangguan kecemasan dan depresi mengancam kesehatan jiwa raga anak-anak muda. https://t.co/EnLAkTz31r https://t.co/osnBKh7Gm1'
1163677114945724421,2019-08-20 05:00:18,"b'Pakar gizi ini bahkan bilang micin selain aman dikonsumsi, juga bermanfaat bagi anak-anak. https://t.co/Qei4K562Sa'"
1163669518809468929,2019-08-20 04:30:07,"b'Dopamin adalah elemen terpenting bagi Silicon Valley untuk menciptakan kebahagiaan semu, yang sebenarnya hanya menyamarkan rasa kekosongan dan kesepian pengguna. https://t.co/DJC28a4oQs'"
1163662044249415681,2019-08-20 04:00:25,"b'Menurut seorang peneliti kelautan, sedang terjadi kematian kerang remis massal terparah selama 15 tahun terakhir. https://t.co/QWOzTDsgGp'"
1163654430677504000,2019-08-20 03:30:10,b'Pembalut atau tampon ternyata menghasilkan lebih dari 200.000 ton limbah per tahun. https://t.co/Bh2WUwtrH6'
1163646929454227456,2019-08-20 03:00:22,b'Seniman dan programmer Darius Kazemi baru saja membagikan panduan membuat situs jejaring sosial kecil-kecilan. https://t.co/HVdTwVvQMo'
