id,user,created_at,place,text676053508756377601,2015-12-13 14:58:11,b'RT @manusia_kerdil: @LumayanWaras bahagia kui ngeneki https://t.co/4LGTKAnV70'
676053467664789504,2015-12-13 14:58:01,"b'RT @nvndrz19: Iso bareng awakmu saklawase :D ""@LumayanWaras: bahagia itu......? #isisakkarepmu""'"
676053409162661889,2015-12-13 14:57:47,b'nek kelingan aku bahagia pora? https://t.co/s0aFquPaxZ'
676051202421886976,2015-12-13 14:49:01,b'RT @muhammad2598: Sederhana \xf0\x9f\x98\xaa https://t.co/k1yF7Juqcy'
676050331000692736,2015-12-13 14:45:33,b'bahagia itu......? #isisakkarepmu'
676041624426643457,2015-12-13 14:10:58,"b'ajar ngising nang wc duduk, seminggu punjul lagi iso ngrasakke kepenak -___-'"
676018513773903872,2015-12-13 12:39:08,"b'jomblo teros, ora kesel po?'"
675730217449558020,2015-12-12 17:33:32,"b""selamat tidur kamu yang sudah lama kabur dan meninggalkan kenangan yang tak mudah luntur :'("""
675711802752176129,2015-12-12 16:20:22,b'lha to.. tenan to! wes tak batin nek aku ki jomblo :|'
675706810951589888,2015-12-12 16:00:32,b'jam jam rawan mantan reunian nang pikiran!'
675706714184769536,2015-12-12 16:00:09,b'kepo sih kamu.. huff https://t.co/m4jJXvXdq3'
675701182115942400,2015-12-12 15:38:10,b'angel move on mergo pas pacaran kakean  blusukan nang kebon. #pikirdewe'
675700292483026944,2015-12-12 15:34:38,b'tambah sambel kacang joss!! https://t.co/TIuAKcbOzx'
675695467196366848,2015-12-12 15:15:27,"b""piye malem minggune, wes oleh-olehan opo malah tombok de'e ngejak mangan??"""
675680252983578624,2015-12-12 14:15:00,"b'awale sih ndukung, tapi akhire nikung!'"
675669808541655040,2015-12-12 13:33:30,b'yang mau curhat hangat bisa lewat Line :))'
675669570447785984,2015-12-12 13:32:33,"b'tarik kupinge njuk omong ""rasah sok cuek, mengko nek tak tinggal koe mewek!"" https://t.co/0Vi514Z8Xe'"
675659202245754880,2015-12-12 12:51:21,"b'hujan sudah reda, tapi marahnya belum :('"
675659011685941248,2015-12-12 12:50:36,"b'yo sukur ""@manusia_kerdil: enek ras. malah kudanan ki yo enek. RT @LumayanWaras: ciyee sing wes dandan malah udan \xf0\x9f\x98\x84'"
675658667476180992,2015-12-12 12:49:14,"b'turuo cuk, rasah kakean atraksi!! https://t.co/kceSfXUoiY'"
675654506219110401,2015-12-12 12:32:41,b'ciyee sing wes dandan malah udan \xf0\x9f\x98\x84'
675592068081696768,2015-12-12 08:24:35,b'setu sore hujan deras.. sing tak perjuangke berakhir kandas :('
675585764529311744,2015-12-12 07:59:32,"b""udan udan ngene iki penak'e ndusel ndusel diantara hubungane uwong.. mesti anget \xf0\x9f\x98\x84"""
675565242005389312,2015-12-12 06:37:59,b'ramaikan Line saya gais : lumayanwaras :)) okesip tak tunggu!!'
675338761614430208,2015-12-11 15:38:02,"b'ayo, aku diampiri yak https://t.co/wiA3cQeysG'"
675317271607160836,2015-12-11 14:12:38,"b""namatke jeneng'e pacarmu wae aku males, opo meneh ketemu langsung. Tak idoni raine oleh ra  ? :("""
675310728778153984,2015-12-11 13:46:39,"b'nek aku kon mbahagiake koe nggo cara sing podo mantanmu aku raiso. tapi nek koe teko manut, aku yakin iso mbahagiake koe nggo caraku dewe.'"
675304329163608064,2015-12-11 13:21:13,"b'karo aku wae, aku udu gamer koyo mantanmu \xf0\x9f\x98\xb3 https://t.co/5BGpEGNHzd'"
675304053069365248,2015-12-11 13:20:07,"b'ragatmu entek gawe kampanye po? ""@manusia_kerdil: mergo kurang ragat ras RT @LumayanWaras: koe jomblo mergo ngopo gais?? #takTakon'"
675303888082239489,2015-12-11 13:19:28,b'ha tikung genti! wani ra? https://t.co/vsHy0mh6cK'
675303474490310657,2015-12-11 13:17:49,b'diobral ben cepet payu https://t.co/h8yqhz6a2B'
675303312862765057,2015-12-11 13:17:10,b'sing menurutmu bener ki sing koyo opo? https://t.co/0vcXeGipjI'
675302949698928641,2015-12-11 13:15:44,"b'jal golek nang planet lain, mbok menowo tipemu ki koyo alien https://t.co/pyH5vwewc6'"
675302750251409408,2015-12-11 13:14:56,"b'pacar kan juga nyata, cuma janji janjinya aja yang enggak\xe2\x80\xa6 huf! https://t.co/2KUprf4RlT'"
675302621087830017,2015-12-11 13:14:26,b'yowes berarti dadio jomblo sak modare wae koe https://t.co/bYeZF8rC5A'
675302206573154304,2015-12-11 13:12:47,b'raiso golek liyane po? duniamu sempit kayak lubang sil*t https://t.co/mCLGwmt0BJ'
675301911227031554,2015-12-11 13:11:36,b'mungkin spikanmu kurang masuk akal sehat https://t.co/pzTFz2JThe'
675301729546604544,2015-12-11 13:10:53,"b'mbiyen bapakmu orandue ferari iso macari mbokmu ""@rosidi_doank: Ora nduwe ferrari.! ""@LumayanWaras: koe jomblo mergo ngopo gais?? #takTakon'"
675301463455760384,2015-12-11 13:09:50,"b""jawabanmu kuno banget --' https://t.co/uszzNnmkov"""
675287823545597952,2015-12-11 12:15:38,b'koe jomblo mergo ngopo gais?? #takTakon'
674980573920690176,2015-12-10 15:54:44,"b""nek pas malem jum'at krungu waung njegog njegog ojo wedi gais, mungkin sebelah omahmu lagi doggy style.."""
674973899340185600,2015-12-10 15:28:12,b'mulai memasuki jam jamnya dia menghilang tanpa kabar entah tidur atau kabur \xf0\x9f\x98\xab'
674961630485057536,2015-12-10 14:39:27,b'nek aku ndue pacar wagu ra? ndagel ra? patut ra?'
674951408530026496,2015-12-10 13:58:50,"b'nunggu sing gelem ngeLove uwonge, ora mung ngeLove twitte \xf0\x9f\x98\x9a'"
674937473248583680,2015-12-10 13:03:28,"b'paketan bar tuku, batre full, powerbank ready. tapi hp sepi -___-'"
674657042464825345,2015-12-09 18:29:08,"b'gek mbayangke nganu (^^,)&gt; https://t.co/kGM4TWnOEB'"
674590519238877184,2015-12-09 14:04:47,b'opo aku kudu lungo ndisik ben koe sadar??'
674560305930735616,2015-12-09 12:04:44,b'sebagai warga yang baik aku selalu ikut nyoblos :)) https://t.co/0JGsNNTvqG'
674394414324707328,2015-12-09 01:05:32,"b'jangan harap negeri ini bebas korupsi kalau suara anda masih bisa dibeli. nyoblos manut ati, ojo ngasi kapusan janji janji.. mari nyoblos :)'"
674176577307938816,2015-12-08 10:39:56,b'sore hari hujan deras.. sing dikangeni ora tau nggagas \xf0\x9f\x98\x82'
674174029419286528,2015-12-08 10:29:48,"b'jadi jomblo jangan loyo, walau sudah sore harus tetap kece! ( \xcb\x98\xcc\x80\xcb\x98\xcc\x81, )\xe0\xb8\x87'"
674155271497781248,2015-12-08 09:15:16,"b'Mung pengen sapa menyapa ro koe meneh, ora mung gengsi-gengsinan :('"
673884378435424256,2015-12-07 15:18:50,"b'wingi wingi koe cuek, saiki nek aku kon ngehubungi koe ndisik yo wegah! ora kenal yo rapopo kok, ora kenal koe yo ora marai mati to!!'"
673874019301507072,2015-12-07 14:37:40,"b""gaweane mung ngomongke elek'e uwong! mungkin uripmu kurang rencana!!"""
673848066445742080,2015-12-07 12:54:33,b'sudah berapa hati yang kamu singkirkan demi satu orang yang belum tentu hatinya untuk anda??'
673533422778736641,2015-12-06 16:04:16,b'kulupakan kau dengan Bismillah. bye!'
673525036733489153,2015-12-06 15:30:56,b'nyamuk sini gak kenal autan :('
673519817215709184,2015-12-06 15:10:12,"b'sugeng ndalu poro mantan sing wes berlalu, walaupun aku wes suwe ora ketemu karo awakmu tapi aku iseh selalu kelingan rasamu^^'"
673510850804641792,2015-12-06 14:34:34,"b'numpak angkot dicopet, numpak motor dibegal, numpak kapal wedi tenggelam, numpak koe wedi meteng. trus kudu piye? :('"
673433251092946944,2015-12-06 09:26:13,"b""semangat golek pacar ki yo oleh tp nek udan ki yo ngeyup sek Mblo , nek masuk angin raono le ngerik'i koe , ELING !!! *selamatsoreVroh :)"""
673190314761326592,2015-12-05 17:20:52,b'kok belum tidur?'
672462952973242368,2015-12-03 17:10:36,"b'selamat tidur pacar yang sudah kabur, semoga hubunganmu sama pacarmu yang sekarang tidak pernah akur \xf0\x9f\x91\xbb'"
672447584657473536,2015-12-03 16:09:32,b'cepet ndang stalking ngasi akhir sakdurunge akunmu diblokir :v'
672390509936029696,2015-12-03 12:22:44,"b'aku lungo ora mergo benci, tapi mergo aku tau diri!'"
671706836513394689,2015-12-01 15:06:04,"b'rapopo koe nolak aku, mungkin pancen seleramu rendah \xf0\x9f\x98\xb0'"
671691913431388160,2015-12-01 14:06:46,b'krisis kabar dari dia :('
671667247971110912,2015-12-01 12:28:45,"b'hp sepi tapi dompet berisi ( \xcb\x98\xcc\x80\xcb\x98\xcc\x81, )\xe0\xb8\x87'"
671353493450440704,2015-11-30 15:42:00,b'kangen sego goreng :('
670977986074578945,2015-11-29 14:49:52,"b""ho'o.. jamanku cilik yo kecanduan kelek'e makku \xf0\x9f\x98\x84 https://t.co/Pf2p9CRtWp"""
670977733409705984,2015-11-29 14:48:52,b'yoh.. masuk https://t.co/PIEUxGz7ua'
670976244352090112,2015-11-29 14:42:57,b'mambu marai nyandu. opo? monggo jawab sak njeplakmu :)'
670972162396676097,2015-11-29 14:26:44,b'mau aku ora piknik tapi mantanku sing piknik.. piknik nang pikiranku -___-'
670701913210384384,2015-11-28 20:32:51,b'duh! lain kali kalau mau narsis otaknya jangan lupa dibawa!! #SaveAmaryllis https://t.co/1OaBgw8vIA'
670486031108444160,2015-11-28 06:15:01,b'selamat siang kamu yang dulu katanya sayang!'
670256164303581185,2015-11-27 15:01:36,b'cah saiki lagi usum dadi dalang. ndalangi uwong pegatan \xf0\x9f\x98\x84'
670231243905069056,2015-11-27 13:22:35,b'yo mung jenengmu sing selalu tak sebut disetiap doa ku. ben cepet putus karo pacarmu \xf0\x9f\x99\x8f'
669862969283514369,2015-11-26 12:59:11,"b'ingat, dia milik orang!'"
669549002988236801,2015-11-25 16:11:36,b'kebahagiaan kui ora mung iso diperoleh seko pacar! dadi koe rasah merasa dadi uwong paling merana sak dunia mergo randue pacar!!'
669546218029121536,2015-11-25 16:00:32,b'ngopo kok kangen? https://t.co/Kp63Me6kZw'
669545863581036545,2015-11-25 15:59:08,"b'yuk kenalan dulu, nanti kalau udah kenal kamu ngangenin aku yak \xf0\x9f\x98\xb3 https://t.co/vTW7BvpAla'"
669526857612562432,2015-11-25 14:43:36,"b""ini yang namanya gak berdarah tapi sakit :'( https://t.co/HgQvYXgdDR"""
669525646444367872,2015-11-25 14:38:47,b'kangen po ora? rasah ita itu \xf0\x9f\x98\x92 https://t.co/eUKlkQMdNU'
669525430156726272,2015-11-25 14:37:56,b'gelem tapi isin \xf0\x9f\x98\xb3 https://t.co/9pSRksawIj'
669517055574474753,2015-11-25 14:04:39,"b'jujur wae, koe kangen lumayan waras opo kangen admine?? wkwkwkwk'"
669172843364544512,2015-11-24 15:16:53,b'ini nyamuk caper banget!! jomblo ya?!! sama :('
669158752185028608,2015-11-24 14:20:53,b'deres derese udan mbengi iki jeh luwih deres tangise sing gagal ketemu pacare. \xf0\x9f\x8f\x83\xf0\x9f\x8f\x83\xf0\x9f\x8f\x83'
669155468514725888,2015-11-24 14:07:50,b'oh gitu. oke https://t.co/uWiygoshLL'
669154201511981056,2015-11-24 14:02:48,"b'ubah nasib yuk, biar bbmnya rame \xf0\x9f\x98\xb3 https://t.co/UoOop0m3XQ'"
669151997522673666,2015-11-24 13:54:03,b'sinih mintak pin muh \xf0\x9f\x98\xb3\xf0\x9f\x98\xb3 https://t.co/1MM4q2UXGv'
669146637843894272,2015-11-24 13:32:45,b'pending karo ora pending podo wae tetep raono sing bbm \xf0\x9f\x98\xa2'
668824333712683009,2015-11-23 16:12:01,"b'caper, gonta ganti dp/pm tapi sing dicaperi ora peka!'"
668815461442695168,2015-11-23 15:36:46,"b'yoh, kowe sedulurku. pacarmu yo sedulurku https://t.co/6z7MCnHLVP'"
668807789112782848,2015-11-23 15:06:17,b'pacaran ora genep setahun tapi le melupakan bertahun tahun -______-'
668803633216028673,2015-11-23 14:49:46,b'iki kehidupan udu persetubuhan. dadi rasah kakean gaya!'
668773015128113153,2015-11-23 12:48:06,"b'memaafkan mantan itu urusan saya, tapi mengirim mereka kembali kepelukan saya itu urusan Tuhan.'"
668474164114681857,2015-11-22 17:00:35,"b'wes mbengi, mripate raiso merem, atine raiso move on.. bikin KZL ajah!!'"
668472302724476928,2015-11-22 16:53:11,b'jare sopo?? aku ki ndue tapi mung kesingsal mbuh nandi https://t.co/HGdRb4t42I'
668472044938354688,2015-11-22 16:52:09,"b'bagus, sesuk nek pas pahing digowo nang pasar. jolke sapi https://t.co/KyzR6tlOxS'"
668470703839023106,2015-11-22 16:46:50,"b'selamat malam gais, sorry dari kemarin durung ngetuit. piye kabare, pacarmu sehat to??'"
667761097470906370,2015-11-20 17:47:06,b'selamat tidur juga kamuh :* btw kamu kok ora katokan??  https://t.co/hU46pw4lJR'
667754381954052098,2015-11-20 17:20:25,b'husss minggato husss husss...! https://t.co/Xrf9ShIr5Q'
667752355543166977,2015-11-20 17:12:22,b'yakin iki raono sing ngucapke aku selamat tidur disertai titik dua bintang?'
667751886578053120,2015-11-20 17:10:30,b'yuk beb^^ https://t.co/kj7gmybJOn'
667740521960333313,2015-11-20 16:25:21,"b'wes mbengi mblo, ndang turu ben hubunganmu ro bantal semakin erat..'"
667729498331156480,2015-11-20 15:41:32,b'udan deres penake ngopi. pekok po yo? udan deres ki penake ngeyup!'
667701327741349888,2015-11-20 13:49:36,"b'berbahagialah kalian sing ndue pacar doyan turu gasik.. nek mbengi bebas, iso nyambi nganu liyane^^'"
667671752743383040,2015-11-20 11:52:05,"b'hallo mbak, piye kabare.. pacare wes ngajak putus po durung??'"
667003765312983040,2015-11-18 15:37:44,b'meriang : merintih sambil digoyang'
666979303951900677,2015-11-18 14:00:32,"b'aku ameh turu gasik, soale dilit neh jam-jame masa lalu mampir nang ati'"
666668874213908480,2015-11-17 17:27:00,b'selamat tidur bagi yang sudah tidur dan selamat berjuang bagi yang mau nikung pacar orang yang lagi ditinggal tidur pacarnya :))'
666665665109979136,2015-11-17 17:14:15,"b'curhat nang tuiter rapopo, meh curhat nang konco lagi do sibuk nyekeli hp! -___-'"
666660031522209794,2015-11-17 16:51:52,"b""kelingan saat saat kelangan koe :'("""
666612839998603264,2015-11-17 13:44:20,b'curhat malah dadi soyo kelingan -____-'
666597888999342080,2015-11-17 12:44:56,"b""lemute dikeplak rakeno keno malah soyo caper wira wiri nang kuping, dikirone aku tepuk tangan mergo weruh de'e mabur po yo?"""
666422546691174401,2015-11-17 01:08:11,"b'ra butuh ucapan Selamat Pagi , nek pancen sayang ki yo teko langsung moro nggo sego soto sak panci , Vroh ! *paham'"
666279280150638592,2015-11-16 15:38:53,"b'mangan oreo ro susu enak kih koyone, oreone dipangan, susune diplintir plintir \xf0\x9f\x98\xb3'"
666244629013008386,2015-11-16 13:21:12,b'pengen selingkuh tapi durung ono wektu. sibuk teros.. hmm \xf0\x9f\x98\x92'
665913188798435328,2015-11-15 15:24:10,"b'listrik padam, Magelang gelap.. segelap masa depanmu jika tanpa aku^^'"
665911940762304512,2015-11-15 15:19:13,b'tapi iki masalah PLN ora masalah ati! -__- https://t.co/8l8cBKJmQl'
665911512683253766,2015-11-15 15:17:31,"b'de\'e?? terang bagimu tapi gelap baginya :v ""@ndandaaa_: @lumayanwaras terang benderang koyo masa depanku nek karo de\'e..'"
665910795356639232,2015-11-15 15:14:40,"b'mbok aku nunut menerangi hatiku ""@luthfiarisky: @lumayanwaras padang noh'"
665910440103247872,2015-11-15 15:13:15,"b'rasah sok koyo ngono, nek tak bribik tenan malah gilo koe.. hmm https://t.co/HoNRuGmvEf'"
665909135238557696,2015-11-15 15:08:04,"b'Magelang gelap, listrik padam.. daerahmu piye gais?'"
665894030874669056,2015-11-15 14:08:03,"b'jare mung konco, tapi nek boncengan peluk peluk :('"
665885072986238976,2015-11-15 13:32:27,b'koe kelingan jenengku wae aku wes bahagia oponeh koe kangen karo aku..'
665588763741974528,2015-11-14 17:55:01,b'kamu tuh nyebelin banget! suka bikin kangen malem malem :('
665574088153423872,2015-11-14 16:56:43,"b'turu wes mbengi, koe uduk tikos \xf0\x9f\x98\x83'"
665491597694402561,2015-11-14 11:28:55,"b'iki malem minggu o? ""@Syafaul_A_A: Tangi lik, wes meh malem minggu iki. PL Vitu wes mulai mbuka pupu kae.! @LumayanWaras'"
665238441764876288,2015-11-13 18:42:58,b'jam segini ono sing iso dijak curhat mesra pora kih??'
665192098149367809,2015-11-13 15:38:49,b'pengen stalking mantan tapi aku randue mantan. trus aku kudu piye? :('
665188311858872320,2015-11-13 15:23:46,"b'paket internetku awet, tapi hubunganmu ro pacarmu ora :p'"
665164979050520578,2015-11-13 13:51:03,b'kapan koe ono wektu gawe selingkuh karo aku??'
665154928059523072,2015-11-13 13:11:07,"b'rasah takon soal pangkat, sing mesti lahir batin iso nyukupi ""@Aknin_aini: njuk koe ki pangkate opo? Kok aku kon putus kr pacarku'"
665150426560483328,2015-11-13 12:53:14,b'kapan kamu rela putus sama pacarmu demi aku??'
664453392228454401,2015-11-11 14:43:28,"b'rasah takon sopo pacarku saiki, cukup undangan wae sesuk sing njawab :))'"
664437019313967104,2015-11-11 13:38:24,"b""urip kui wangsinawang. sing ketok'e ndue pacar jebul jomblo, sing ketok'e jomblo jebul tenan \xf0\x9f\x98\x84"""
664420499624079360,2015-11-11 12:32:46,"b'weslah.. mugo2 ora ono opo opo, diparingi kselamatan kabeh karo Gusti Allah \xf0\x9f\x99\x8f'"
664416330162946048,2015-11-11 12:16:12,b'tapi koe rapopo to?? https://t.co/frWEhXv2su'
664416076764069889,2015-11-11 12:15:11,"b'aku?? ""@AinunNabillaM: Lindu km yg selalu kurasakan ;;) RT @LumayanWaras: do kroso lindu po ora??'"
664415923437047808,2015-11-11 12:14:35,b'liyat liyut jebul ngelih https://t.co/mN25yDJXbW'
664415751642615808,2015-11-11 12:13:54,"b'rasah sok koyo ngono, timbang tak bribik! https://t.co/sQxdSWJnz1'"
664415425325760512,2015-11-11 12:12:36,b'baca!\xe2\xac\x87\xe2\xac\x87\xe2\xac\x87 https://t.co/rXqPUaBFvu'
664411655283994624,2015-11-11 11:57:37,b'lindu po rindu? https://t.co/ixYmC2G1wq'
664411580935749632,2015-11-11 11:57:19,"b'sek, tak ndelok tipi sek ""@seblakliciouss: @lumayanwaras pusate ngendi pakde?'"
664411409145425921,2015-11-11 11:56:38,"b'prek! ""@FaithBoncel: Aku kroso\'ne rindu :D ""@LumayanWaras: do kroso lindu po ora??'"
664411307894923264,2015-11-11 11:56:14,b'RT @JonoOSD: @lumayanwaras kroso ndes . Degdegan koyo nak gek lindu pacar :v'
664411286503972864,2015-11-11 11:56:09,b'ngendi ngendi kroso  https://t.co/qquoTcbbFa'
664411167092178944,2015-11-11 11:55:41,"b'durung ngerti mbak, nunggu kabar seko yang lain sek ""@Lita_abdulfid: @LumayanWaras kroso mind.. ngendi kui pusate..'"
664409524040654848,2015-11-11 11:49:09,b'do kroso lindu po ora??'
664079696309567488,2015-11-10 13:58:32,b'mendung tak berarti hujan. durung bathi ngambung malah wes dijak pegatan :('
664072100924100608,2015-11-10 13:28:21,"b""umur 1 - 30 tahun jodoh masih ditangan Tuhan. umur 30 tahun ke atas Tuhan lepas tangan --'"""
663982038777638914,2015-11-10 07:30:28,b'mendung tak berarti hujan. akibat kena tikung jadi gagal jadian \xf0\x9f\x98\xa2'
663978372247265280,2015-11-10 07:15:54,"b'gitu juga boleh, terserah yang penting kamu bahagia -___- https://t.co/Zp3ec1OsoS'"
663725985741729793,2015-11-09 14:33:01,"b""mantanku ragelem follow aku, berarti mantanku durung siap weruh aku upload foto bahagia berdua karo pacar anyarku. soale de'e jeh jomblo \xf0\x9f\x98\x84"""
663682851464855552,2015-11-09 11:41:37,b'makan malame lawuh mantan goreng :('
662677727837749249,2015-11-06 17:07:36,"b'wes jam rolas lewat, wayahe istirahat. mugo mugo podo terhindar seko pacar pacar jahat \xf0\x9f\x99\x8f'"
662677345682092033,2015-11-06 17:06:05,"b'sesuk nek koe wes dadi pacarku \xf0\x9f\x98\xb3 ""@MonikeMo_: @LumayanWaras kapan aku mbok folbek? :| #nunutCurhat'"
662677164291047424,2015-11-06 17:05:22,b'koe kudu nguntal sabar sedino 3x koyo wong mangan obat https://t.co/9Y2wBc2EF9'
662663370286325760,2015-11-06 16:10:33,b'koe kudu ngombe obat untu :| https://t.co/7Xl1QAuWJD'
662663220918771712,2015-11-06 16:09:58,"b'mung gendaan to, koe jeh ono kesempatan dadi pacare https://t.co/53c4mjhGuW'"
662662832278732800,2015-11-06 16:08:25,"b'luwih apik diungkapke, ditolak opo ditompo kui urusan keri ""@Liisoh: nek seneng karo uwong apik e ngomong rak yo? -_-  #nunutCurhat'"
662641928849092608,2015-11-06 14:45:21,"b'dadio uwong sing apik supoyo de\'e gelo ninggal koe ""@Meme01002436: aku kudu piye ras yen sing di sayang milih lungo #nunutcurhat'"
662637630668996609,2015-11-06 14:28:17,"b'ojo gelem, sesuk ujung ujunge yo mung dadi mantan meneh https://t.co/SCqiyoZuSv'"
662637386623422464,2015-11-06 14:27:18,b'sorry aku raiso mbayangke. teko sing sabar wae https://t.co/K6vWhuERD3'
662636626519068673,2015-11-06 14:24:17,"b'kurang ajar kui, pegat wae! ""@hambatuhan05: @LumayanWaras aku bm pcarku ,, tapii dee wes turuu #nunutCurhat'"
662635496523194368,2015-11-06 14:19:48,"b'nunggu pegat karo nyambi hubungan ro liyane ""@RizkiHaniyatulH: @lumayanwaras aku sayang de\'e tapi malah wonge wes dwe pacar #nunutcurhat :D'"
662635016380248065,2015-11-06 14:17:53,"b'nek ragelem berjuang berarti kono ora sayang ""@EstiWul49229570: ijek pdo sayange tpi kono ra glm berjuang,,,munafik bgt #nunutcurhat'"
662634366430916609,2015-11-06 14:15:18,"b'tapi de\'e rakangen koe ""@xmawarx: Aku kangen dee ""@LumayanWaras: koe pengen curhat?? mention rene, ojo lali hastage #nunutCurhat'"
662634217654751232,2015-11-06 14:14:43,"b'nuruti gengsi rabakal iso meraih mimpi  ""@Nlxpamungkas: (koyo e) iseh podo sayange, tapi gengsi nek meh ngejak balen min #Nunutcurhat'"
662633611544231937,2015-11-06 14:12:18,"b""wes kadung sayang ora iso dadi alesan, nek pancen de'e wes ora peduli karo koe, ngopo koe peduli karo de'e?? https://t.co/mbzR86PlUp"""
662632390469115905,2015-11-06 14:07:27,"b'wong iki kepeseng, ono sing peduli?? ""@LuckySteeven: @LumayanWaras aku kepeseng ndess #nunutCurhat'"
662630092372205568,2015-11-06 13:58:19,"b'koe pengen curhat?? mention rene, ojo lali hastage #nunutCurhat'"
662628384065785856,2015-11-06 13:51:32,b'sinih tak kasih dan tak sayang sinih :* https://t.co/lXrqYbNDNW'
662628213575712768,2015-11-06 13:50:51,b'iki ki ngopo?? -__- https://t.co/uFrbC1ih1f'
662265207394189312,2015-11-05 13:48:24,"b""matursuwun mbiyen wes iso gawe aku ngguyu. wes iso gawe aku seneng ro koe, koe yo wes seneng ro aku, walaupun akhire dewe gagal jadian :')"""
662261824599932928,2015-11-05 13:34:57,b'krisis kuota rapopo sing penting ora krisis kasih sayang \xf0\x9f\x98\x81'
662247661181886464,2015-11-05 12:38:41,b'mengko nek koe jatuh cinta karo aku piye?? https://t.co/5iKd2kPnIS'
662243324045033472,2015-11-05 12:21:26,b'bbm sepi tak kiro nek mergo pending. jebul mergo jomblo :('
661904905808928768,2015-11-04 13:56:41,"b'dibuang sayang, disimpen menyakitkan. *foto mantan*'"
661587829881831424,2015-11-03 16:56:45,"b'yahmene nglilir, penake ngopo ya?? ada yang bisa ngasih saran? *tolong diberi saran, jangan diberi harapan*'"
661586819868327936,2015-11-03 16:52:44,"b""sedino raono bbm, tega :'("""
661542096898134016,2015-11-03 13:55:01,"b'pacar ki ojo kakean dimutungi, mengko nek pacarmu keno tikung malah koe sing mbingungi!'"
661188841617821696,2015-11-02 14:31:18,b'lebih baik keluar malam daripada keluar didalam. #pikirDewe'
661188465267113985,2015-11-02 14:29:49,"b'oh kamu golput, aku kira kamu yunita ratna :o ""@yunitaratna71: @lumayanwaras aku golput ras :v'"
661179847897583616,2015-11-02 13:55:34,"b'dada boleh besar, asal gengsinya gausah ikut ikutan besar..'"
661177638845677572,2015-11-02 13:46:47,"b'yaudah kamu diam aja :v ""@inayani_inaya: @LumayanWaras *aku ra cantik tak meneng wae yo ras'"
661173272784990208,2015-11-02 13:29:26,b'yang cantik mana suaranya?? sinih absen dulu :*'
661171481984958464,2015-11-02 13:22:19,b'ojo lali bali~ https://t.co/ddWpmUipyS'
660861899890753536,2015-11-01 16:52:09,"b'rasane pengen bobok siang tapi iki wes mbengi, aku harus kepiye?? :('"
660845734627905537,2015-11-01 15:47:55,b'nek pacarmu sing naksir ro aku njuk aku sing salah?? hellawww'
660807658954297344,2015-11-01 13:16:37,"b'aku jomblo ora mergo rapayu, tapi mung mergo sing tak bribik durung putus karo pacare \xf0\x9f\x98\x81'"
660792545639706626,2015-11-01 12:16:34,b'alesanmu mbiyen pas mutus aku ki podo karo sinetron jaman saiki. RAMUTU!'
660785024426373120,2015-11-01 11:46:41,"b""'ikan pindang' dapat digunakan agar celana tidak melorot -___-"""
660143237378629632,2015-10-30 17:16:27,"b'selamat jalan Pak Raden, terima kasih untuk semua kenangan dan hiburan dimasa kecil, semoga tenang dialam sana \xf0\x9f\x98\xa2 https://t.co/a5yWYe017n'"
660106448093904896,2015-10-30 14:50:16,"b""ojek aja punya tujuan, masa hubungan kita enggak :'("""
660097778870161408,2015-10-30 14:15:49,b'daripada mung sibuk ngedunke berat badan mbok mending ngedunke gengsi ben gelem nyapa ndisik!'
660080213645111296,2015-10-30 13:06:01,"b'nek wong liyo sing ngeping, sing getar mung hp ku, tapi nek koe sing ngeping jiwaragaku sing bergetarrrrrr^^'"
660079886875234304,2015-10-30 13:04:43,"b'ora mung BPJS, kae wes do ndue rumah sakit dewe dewe.. https://t.co/5r4cOCinqq'"
659769251218067456,2015-10-29 16:30:22,b'semoga yang sedang tawuran antara karanggading vs paten njurang segera selesai dan hubunganmu sama pacarmu juga lekas selesai \xf0\x9f\x99\x8f'
659768632465993730,2015-10-29 16:27:54,"b""RT @Syafaul_A_A: cangkem'e gatel pengen nyapa, pengen namatke. tur kok kecegat gengsi. :(  https://t.co/r54jQXHOc6"""
659727288766894080,2015-10-29 13:43:37,"b'aku bisa apa ketika melihatmu, namun tak berani menyapamu :('"
659722377425612800,2015-10-29 13:24:06,b'https://t.co/N7WhhZr5Ug'
659018851049299969,2015-10-27 14:48:32,"b""sabar terus kapan ngamuk'e?"""
659004616437288960,2015-10-27 13:51:58,"b'cari pacar tuh gausah narget yang ganteng, cantik, kaya, gaul, kekinian atau apalah.. yang pasti cari yang mau sama elu!! \xf0\x9f\x98\x84'"
658990164035792896,2015-10-27 12:54:33,b'nek fotomu kerep digawe dp bbm karo pacarmu berarti selingkuhane pacarmu pengertian^^'
658648629402406913,2015-10-26 14:17:25,"b'mangan sego goreng kepedesen, pedese level nggendong anake mantan \xf0\x9f\x98\xa2'"
658627051071471616,2015-10-26 12:51:40,"b'golek pacar kui ora kudu sing ayu utowo ganteng, percumah! sesuk nek putus yo bakalan mung di elek elek^^'"
658596021602156544,2015-10-26 10:48:22,b'selamat sore jomblo jomblo kece!'
658355209542856706,2015-10-25 18:51:28,b'sing durung turu love you \xf0\x9f\x98\x98\xf0\x9f\x98\x8d'
658318807421751296,2015-10-25 16:26:49,"b'turu teko turu, rasah aleman!!'"
658318166192353280,2015-10-25 16:24:16,b'#KulinoRadigagas https://t.co/VbsndZgUb7'
658302089383161857,2015-10-25 15:20:23,"b'soal bal balan sih aku ora ndukung sopo sopo, tapi nek soal koe aku tep ndukung ben cepet putus ro pacarmu..'"
658300997958144002,2015-10-25 15:16:03,"b'ayo nobar nang anime cafe sebelah lor gedung tri bhakti, gratis tapi nek ngombe po mangan wajib bayar.. hahaha'"