id,user,created_at,place,text837313319576875009,2017-03-02 14:47:06,"b""ora ono gorengan yo remuk'an rapopo, sing penting cemilan ben ora ngowoh koyo jomblo nek pas weruh wong pacaran (^^,)&gt;"""
837301151754153984,2017-03-02 13:58:45,b'sing gemati biasane kalah ro sing sok ngeterke wira wiri. . huffff \xf0\x9f\x98\x94'
836946888377024512,2017-03-01 14:31:02,"b'ojo kesusu merasa nek awakmu kui diphp. introspeksi diri, mungkin koe mung terlalu baper..'"
836562019511754756,2017-02-28 13:01:42,b'lawan dari cinta bukanlah kebencian tapi pengabaian.\ndadi artine nek dia cuek berarti dia ora cinta :D'
836558251646836736,2017-02-28 12:46:44,b'meh ngetweet karo meh rabi kui podo2 ndadak nganggo mikir jeru ndisik! haaaahhhh!!'
835880471867248641,2017-02-26 15:53:29,b'tak kiro nek pending. jebul ngenei kabar nang aku ki bagimu pancen ora penting..'
835178601788002304,2017-02-24 17:24:30,b'selamat malam dan selamat beristirahat kamu yang pernah membuat nyaman lalu tiba-tiba minggat :|'
835114906059849729,2017-02-24 13:11:23,"b'sepeduli apapun dia karo koe, akhire yo bakal lungo ninggalke koe nek mung tok sia-siake. makane ojo dumeh dipedulikke njuk koe sekarepedewe'"
834751539407253504,2017-02-23 13:07:30,b'betah dewe mergo setiap berdua anane mung dilarani nek ora yo ditikung :('
834441305065295873,2017-02-22 16:34:44,b'selamat malam dan selamat beristirahat kamu yang pernah aku sayang walau sikapmu ke aku teramat jahat.. heeh \xf0\x9f\x98\xa5'
834421409875058688,2017-02-22 15:15:41,b'yakin mbak. oleh koe aku leren le jomblo https://t.co/hfTYrQGHNQ'
834388342095507458,2017-02-22 13:04:17,"b'bukane piye piye lho iki. tapi nek aku oleh koe aku janji aku bakal leren le njomblo.. hehe (^^,)&gt;'"
833691044743090176,2017-02-20 14:53:28,b'tiap mbribik njuk tak takoni kok mesti statuse jomblo. padahal aku ki pengen nikung pacare uwong yaAllah :('
833687944892329984,2017-02-20 14:41:09,b'mbok eling nek pas mohon2 njaluk tulung kae lho! ditulungi ora ono matur nuwune kok saiki nggaya!'
833304216697397250,2017-02-19 13:16:21,b'dadi tujuan hidupmu wae po? https://t.co/djYAK1vKnr'
833304067354959872,2017-02-19 13:15:46,b'buktikan cintamu! https://t.co/sn7ERgKgTh'
833301035586170881,2017-02-19 13:03:43,b'opo aku harus tak lagi menjadi dirku lagi ben koe suka? #repot #gelutajayuk'
833282156008837121,2017-02-19 11:48:42,b'koe wae tegel karo wong liyo. dadi yo rasah kaget nek wong liyo yo do tegel ro koe!'
833281502242693122,2017-02-19 11:46:06,b'raono sing gelem ro aku og \xf0\x9f\x98\xa2 https://t.co/CmzjEHV9tE'
832970683143446529,2017-02-18 15:11:01,b'foto dewe kok terusan.. huff https://t.co/cy3fgbsGlD'
832230654855163904,2017-02-16 14:10:24,"b'aku lungo bukane aku kesel bertahan, tapi mung merasa sia-sia wae perjuanganku selama iki ora tau tok hargai. aku yo wes kesel berjuang dewe'"
831524349014192129,2017-02-14 15:23:48,b'mau perhatian seperti apapun kalu dihatinya tidak ada kita ya sama aja. percuma !'
831514597379026945,2017-02-14 14:45:03,"b'beb, kamu mau coklat batangan apa batang berwarna coklat aja??'"
831203142922498048,2017-02-13 18:07:26,b'sing durung turu love you :*'
831148152040206340,2017-02-13 14:28:56,"b'""cari yang mau merubahku menjadi lebih baik"" \nPREK! niat dirubah malah dikiro ora gelem opo anane kok!'"
831110651800018944,2017-02-13 11:59:55,"b'RT @bintangkecilt: Kiwo ngopling, tengen ngegas\nNiate wedding, jebule the past \n#krikkrik https://t.co/POpleHQ4gH'"
830775389282709504,2017-02-12 13:47:42,"b'kiwo ngopling, tengen ngegas. niate nyanding jebule kandas..'"
830051300461010944,2017-02-10 13:50:26,"b'udan deres, lali ora nggowo mantol. bejone aku nang njero omah.. hiuuhhhh'"
829684651149053952,2017-02-09 13:33:30,"b'sorry nek perhatianku berlebihan, aku wis kadung nyaman. sampek aku bener2 lali nek awak dewe ki mung konconan :('"
829358653681475585,2017-02-08 15:58:06,b'elek tapi ndue pacar.. kadang aku sok iri karo hal kui! :('
829341829938098176,2017-02-08 14:51:15,"b'jarang bercinta, sering patah hati..'"
829293572042141700,2017-02-08 11:39:29,b'jika meninggalkan dapat mempercepat melupakan.\nlalu bagaimana dengan aku yang dulunya ditinggalkan? mboh ah! \xf0\x9f\x98\xaa'
828966326387384320,2017-02-07 13:59:08,b'rupane pacarmu manjur gawe melancarkan bab !'
828940638775226368,2017-02-07 12:17:03,b'rewel pegat! anteng keloni \xf0\x9f\x98\x85'
828856726162075649,2017-02-07 06:43:37,"b'siap rumah tangga?? ""@ellaBee26: Melu #nunutselfi @LumayanWaras https://t.co/74q7dx6Spx'"
828826660644401152,2017-02-07 04:44:09,"b'mungkin koe nyokotan ""@pokokekoe21: Kurang mancung piye ndan ? Koyo ngene isih golek liyo wae #nunutselfi https://t.co/gczYRmFG5S'"
828818475174948864,2017-02-07 04:11:37,"b'\xf0\x9f\x98\xb1 ""@Ndepis14: @LumayanWaras  kurang elek piye aku dab? Mosok yo dee tetep ragelem mbek aku? \xf0\x9f\x98\x82 #nunutselfie https://t.co/GvLrNmSZhq'"
828818038333939712,2017-02-07 04:09:53,"b'disofa.3gp ""@SangarYowes: #nunutselpi Berdua gapapa kan, asal ora bertiga ndak dikiro syuting vidio film Okep \xf0\x9f\x98\x82\xf0\x9f\x98\x82\xf0\x9f\x98\x82 https://t.co/qc1JFqJdXv'"
828817497872691200,2017-02-07 04:07:44,b'#nunutselfie hanya sampai jam 12 siang ini ya gais. sesuk tak buka meneh :))'
828815526881144833,2017-02-07 03:59:54,"b'kok cemberut? kurang bahagia po? ""@Agtsndyn: Melumelu ah #nunutselfie @LumayanWaras https://t.co/6qWAoUtemR'"
828804861172912128,2017-02-07 03:17:32,"b'salam buat buguru ""@devintadwisarah: fucking to pencitraan (!) #nunutselfie @LumayanWaras https://t.co/iT65Nm8AL9'"
828804388722401282,2017-02-07 03:15:39,"b'tangi turuu yaaa ""@Aiviil: @LumayanWaras ikutan lah #nunutselfie https://t.co/tdX6z7Hm6p'"
828801753650917376,2017-02-07 03:05:11,"b'jo lali adus ""@Henii_Putri: Jo lali bahagia\xf0\x9f\x98\x84 @LumayanWaras #nunutselfi https://t.co/hrZS1Jm0dI'"
828800197526302720,2017-02-07 02:59:00,"b'gelem wae asal ora bnyk tuntutan :p ""@KumalaLinda: Koyo ngene iki opo jeh ono sik gelem \xf0\x9f\x98\x82 #nunutselfie @LumayanWaras https://t.co/TrulTxoFsC'"
828799747678822400,2017-02-07 02:57:12,"b'nggo topeng sisan mbak. karuan raketok sisan rupane -__- ""@DiniDin12406184: Melu ah #Nuntutselfi\n\n@LumayanWaras https://t.co/aKfHR2CDkT'"
828799420577615872,2017-02-07 02:55:54,"b'mobile marai wedi arep mbribik :( ""@chikachik69: kene mas poto~ @LumayanWaras #nunutselfie https://t.co/GCXqSiM31j'"
828799145615904773,2017-02-07 02:54:49,"b'om telolet om! ""@anwrstory: Rung telat ki lek? #nunutselfi @LumayanWaras  \xf0\x9f\x98\x86\xf0\x9f\x98\x86 https://t.co/nxd9cOs5a2'"
828796685144821760,2017-02-07 02:45:02,"b'mripatmu apik \xf0\x9f\x98\x8d ""@oktapinanti: Melu kancane #nunutselfi @LumayanWaras  \xf0\x9f\x98\x86\xf0\x9f\x98\x86 https://t.co/vMWxpRUBkB'"
828796547047387136,2017-02-07 02:44:29,"b'kui dekik e diedit nggo aplikasi opo?? ""@vinakkk: Masih anak sekolah \xf0\x9f\x98\xb3 #nunutselfie @LumayanWaras https://t.co/1Jnv30cU8J'"
828796222945189888,2017-02-07 02:43:12,"b'morning jugak. sing jomblo sing endi kih?? ""@vianaAGR: Morning\n@LumayanWaras \n#nunutselfie https://t.co/0gH4dH4CKp'"
828777231904239616,2017-02-07 01:27:44,"b'untu kelinci \xf0\x9f\x98\x8c ""@agusthina_2: @LumayanWaras  aku #nunutselfie look at the picture \xf0\x9f\x98\x81 https://t.co/9iZ4wABgCs'"
828777030363672576,2017-02-07 01:26:56,"b'kui pitik jenis opo e mas?? ""@Pesinx_Revolt: Melokk ahhh... #nunutselfie @LumayanWaras https://t.co/OWCMumdMRm'"
828655994850865161,2017-02-06 17:25:59,b'raoleh! koe elek og! @sipet_: meluuu #nunutselfie @LumayanWaras \xf0\x9f\x98\x9b https://t.co/yW7oU3dwaR'
828652043753500672,2017-02-06 17:10:17,"b'kerahmu molor, kulino nyusoni po mas? ""@kuncunk40: @LumayanWaras niki sakeng anu om #nunutselfie https://t.co/6JeYmt0GIG'"
828644402037870592,2017-02-06 16:39:55,"b'nunut nylempit nang kelekmu oleh mbak? \xf0\x9f\x98\x8d ""@pamelia_felita: @LumayanWaras tatap mata saya #nunutselfie https://t.co/WN7TSroM3n'"
828643603912142848,2017-02-06 16:36:45,"b'minusnya apa gan? ""@ari_khin: @LumayanWaras \nIreng rapopo yen puteh gampang reGet \n#nunutselfi https://t.co/EbTa8xidvp'"
828634504818352128,2017-02-06 16:00:35,"b'WTS! minat pm! minus karbu banjirr! ""@robby_RD18: @LumayanWaras #nunutselfi\nMbok menowo enek seng sreg .. https://t.co/21BlwsCpI4'"
828632900492931073,2017-02-06 15:54:13,"b'kumis tipissss ""@tecaa_: @LumayanWaras \xf0\x9f\x98\x8e #nunutselfie https://t.co/1gH78GkFBX'"
828632207661035520,2017-02-06 15:51:28,"b'kelincine pesek \xf0\x9f\x98\x85 ""@nofitadewi73: Jelek yg ptg sombong\xf0\x9f\x91\x85\n#nunutselfie\n@LumayanWaras https://t.co/bbGijw6zhU'"
828628963413012480,2017-02-06 15:38:34,"b'aku kepincut! ""@Wahyunitrie02: Eh tak #nunutselfie sopo ruh enek sing pincut wkwk \xf0\x9f\x98\x81\xf0\x9f\x98\x81 @LumayanWaras https://t.co/8c5HtU88eF'"
828628796458668032,2017-02-06 15:37:54,"b'woww hidungmu bersinarrr ""@yuripudiing: Petengan le foto ndadak gosenter hape nokiaa #nunutselfie @LumayanWaras https://t.co/qUOAk9hK9G'"
828628489670586368,2017-02-06 15:36:41,"b'kamu mendess?? \xf0\x9f\x98\xb1\xf0\x9f\x98\xb1 ""@funnyvaany: @LumayanWaras #nunutselfie \nNek jare koncoku mendi (mendes trendi\xf0\x9f\x98\x8e ) https://t.co/V1LDjeltSP'"
828627683542069249,2017-02-06 15:33:29,"b'sesuk nek wes ketemu om ""@krismonithanit1: Elek rapopo sesok ayu dewe\xf0\x9f\x98\x85\n#nunutselfie\n@LumayanWaras https://t.co/hXss4cocHw'"
828627399482839041,2017-02-06 15:32:21,"b'siap ketjup? ""@Wahyunitrie02: #Nunutselfie @LumayanWaras https://t.co/rZSbUCD0JU'"
828627096251494400,2017-02-06 15:31:09,"b'kok pucet, wes madyang durung? ""@ezy_fatimah: Dimanis2in apa emang udah manis\xf0\x9f\x98\x81\n.\n#nunutselfie\n@LumayanWaras https://t.co/hryMLp2Owr'"
828625610788401153,2017-02-06 15:25:15,"b'kok mecucu? ""@safitriika29: #nunutselfie @LumayanWaras repos min reposs\xf0\x9f\x98\x82 https://t.co/dGA3OXsS2y'"
828625007282491392,2017-02-06 15:22:51,"b'oleh. mugo wae do kuat le ndelok \xf0\x9f\x98\xb1 ""@saedongdotcom: Aku oleh #nunutselfie po ra? \xf0\x9f\x98\x85\xf0\x9f\x98\x82 @LumayanWaras https://t.co/JzDdTa5hRt'"
828616413401083906,2017-02-06 14:48:42,"b'nek koe dadi mantanku, koe dadi mantan tercantik ""@rasjenong: Nda secantik mantanmu \xf0\x9f\x99\x88\n#nunutselfie\n@LumayanWaras https://t.co/CUDXwBSn3p'"
828616193426624512,2017-02-06 14:47:50,"b'tak tunggu beb :* ""@Istyindahs_: @LumayanWaras aku melu yo ojo ditinggal muehehe #nunutselfie https://t.co/Ph4Wo63eff'"
828616072865517568,2017-02-06 14:47:21,"b'irungmu diminyak bulus yo? ""@rila_rilalala: #nunutselfie @LumayanWaras \xf0\x9f\x98\x86 https://t.co/qEYfQfPFuG'"
828612153359765504,2017-02-06 14:31:46,"b'cah golkar ya? ""@enypuspita_: @LumayanWaras repost ndang repost #nunutselfie \xf0\x9f\x98\x82 https://t.co/3accYizwyH'"
828611944890314752,2017-02-06 14:30:57,"b'senyumnya sadiss!! \xf0\x9f\x98\x8d ""@Lusimry: @LumayanWaras #nunutselfie https://t.co/h3jf30OrI5'"
828605080194543616,2017-02-06 14:03:40,"b'wani narsis tanpa pensil alis! \xf0\x9f\x98\x98 ""@EvariskaS: @LumayanWaras #nunutselfie https://t.co/41naipemZC'"
828604870466760704,2017-02-06 14:02:50,"b'kok gede sek \'ngisor\' ?? ""@novalia_ep: @LumayanWaras \nNumpang lewat #nunutselfie https://t.co/qxrKnrXMmX'"
828604603704807424,2017-02-06 14:01:46,b'ready? https://t.co/mIf9ZS9ryi'
828600915099738113,2017-02-06 13:47:07,b'nek aku buka hastag #nunutselfie koyo mbiyen ndak jeh ono sing gelem do selfie? mengko tak repost lho :D'
828595112951238656,2017-02-06 13:24:04,"b'sering guyonan iso brakibat ddi merasa nyaman, bolabali kpikiran njuk dadi saling perhatian. guyon berarti cen kudu karo wong sing tepat \xf0\x9f\x98\x8c'"
827750244368519168,2017-02-04 05:26:51,b'sak wareg warege weteng tapi nek mambu endog dadar goreng opo indomi goreng mesti marai pengen mangan meneh \xf0\x9f\x98\x9e'
827534029318533120,2017-02-03 15:07:42,"b""maaf, aku hanya manusia biasa yang masih copot kathok kalo pas e'ek.. :3"""
827165480821469184,2017-02-02 14:43:13,b'malah tak bribik tenan lho koe \xf0\x9f\x98\xa4 https://t.co/bM0neGHoJQ'
827160781703704576,2017-02-02 14:24:32,"b'golek sing anyar kui gampang, tapi golek sing nyaman njuk marai ora pengen pindah meneh kui angele setengah modar..'"
826794475959652353,2017-02-01 14:08:58,b'udane ora rampung rampung koyo lehmu gawe galau aku :('
826391833928306688,2017-01-31 11:29:01,"b""sadaro, hudu koe sing dikarepke de'e \xf0\x9f\x98\x8c"""
826371571925151749,2017-01-31 10:08:30,b'aku kudu lapor polisi! mosok wes yahene pacarku ora ngongkon adus po madang. podo wae kui wes mlebu kasus penelantaran! ngasuog!'
825728024280760320,2017-01-29 15:31:16,"b'semoga kita tetap sahabat selamanya, tak ada kata mantan sahabat apa lagi mantan diembat sahabat.. \xf0\x9f\x98\x8c'"
825724160827547648,2017-01-29 15:15:55,b'oooooh https://t.co/A7RKji7tlA'
825724127759589377,2017-01-29 15:15:47,b'dahar mbak https://t.co/fB813qcFTW'
825718639013748736,2017-01-29 14:53:59,b'nggawe dewe yo pangan dewe!\nwes randue sing gelem didulang :( https://t.co/GG6Yu0VrnJ'
825017723985858560,2017-01-27 16:28:48,b'hawane atisss tenan to kih!! mbok aku dijak padu ben rodo anget sitik \xf0\x9f\x98\x8c'
825010873529884673,2017-01-27 16:01:34,b'males ngetuit tapi semangat stalking..'
824983876749496320,2017-01-27 14:14:18,b'ndue pacar alise palsu rapopo daripada cintane sing palsu \xf0\x9f\x98\x94'
824637035688271874,2017-01-26 15:16:04,"b'nek koe wes kesel golek sing kaya raya, mungkin wes saate koe golek sing kaya saya. hihi'"
824198882519379970,2017-01-25 10:15:01,b'lagi semangat adus malah raono ciduk!!\nyaampunnn masalah uripku kok ngene banget sihh \xf0\x9f\x98\xad'
824195965238312960,2017-01-25 10:03:25,b'ngopo kok melas? https://t.co/zJ5hrvXU7H'
824123544325996544,2017-01-25 05:15:39,b'kelingan sego padang lawuh ayam pop wedange es teh \xf0\x9f\x98\xa2'
823900513733201920,2017-01-24 14:29:24,b'pengen dihormati tapi ora gelem menghormati genti. ha dadio gendero!!!'
823515992064045058,2017-01-23 13:01:27,b'dipuji saya tidak akan terbang dan dihinapun saya tidak akan tumbang!!!'
822804961893322753,2017-01-21 13:56:04,b'tak bikin baper mau? https://t.co/Cfo4oF0BX1'
822789662334861312,2017-01-21 12:55:16,b'ojo sero sero ndak bocae krungu https://t.co/mllphZsPw6'
822789532558856192,2017-01-21 12:54:45,b'upss \xf0\x9f\x98\xb7 https://t.co/Z7DezJyIEs'
822787172516270081,2017-01-21 12:45:23,b'mbendino kok brotkes TC ki caper po goblok?'
822657840791912448,2017-01-21 04:11:28,b'koe ketok ayu nek pas ngono kui \xf0\x9f\x98\xb7 https://t.co/yxPyRvDSVJ'
822464086449340416,2017-01-20 15:21:33,b'luwih apik sadar akan kekurangan dari pada terlalu bangga akan kelebihan. urip teko low profile wae ayem :))'
822461342632144896,2017-01-20 15:10:39,b'lov yu tu https://t.co/asWSdy8wVS'
822460364793249796,2017-01-20 15:06:46,b'RT @Noviaanggitar: @LumayanWaras lumayan waras'
822447505518432257,2017-01-20 14:15:40,b'sehat mbak?'
822364126324195328,2017-01-20 08:44:21,b'jarang dicocol :('
822109056324157440,2017-01-19 15:50:47,b'anda memasuki zaman dimana yang cewek cantik karena makeUp + editan dan yang cowok ganteng karena kendaraan.. huff'
821723903315718148,2017-01-18 14:20:20,"b'santai aja coeg, anjingnya gausah dibawa \xf0\x9f\x98\x92 https://t.co/ipKlfFNjdg'"
821715809575632896,2017-01-18 13:48:10,b'golek sing gelem disayang kok angele setengah modar! :('
821421551455084545,2017-01-17 18:18:53,b'nek jomblo njuk insomnia ngene iki terus sing arep ngancani melek sopo jal? :('
821390037459709952,2017-01-17 16:13:40,b'oleh sing elek rapopo asal jeh iso didandani daripada memaksakan ngoyak sing apik tapi raoleh oleh. aku capek :('
821379067073040386,2017-01-17 15:30:04,b'rausah repot2 https://t.co/yu2hQTptI9'
821378732703162368,2017-01-17 15:28:45,b'@novisase koe pengen?'
821377669388378116,2017-01-17 15:24:31,b'tak jak kemringet purun?'
821340893672194049,2017-01-17 12:58:23,"b'cukup cintamu kepada Tuhan saja yang berlebihan, kalo cuma kepada seseorang cukup biasa saja, biar kalo kecewa gak berlebihan juga.'"
820652591142948864,2017-01-15 15:23:19,"b'anteng salah, obah keliru :('"
820619746907287552,2017-01-15 13:12:48,b'ngantuk wahh! pengen bobo cantik tapi aku lanang. mana bisa :('
820602236791177216,2017-01-15 12:03:13,b'carane?? TUKU \xf0\x9f\x98\x8c https://t.co/u4thUc3oys'
820583857518841856,2017-01-15 10:50:12,"b'cocote bules \xf0\x9f\x98\xb1 ""@aregkoleng: yo mek udan penghalang cinta kita dek \xf0\x9f\x99\x8a ,adek e gagal \xf0\x9f\x98\x85 T-shirt by @LumayanWaras https://t.co/f6nQPoFs6s'"
819908481364807680,2017-01-13 14:06:29,b'jujur dan setia itu mahal. yo maklum nek menungso koyo koe ora iso jujur dan setia. koe kan murahan!'
819805700448600064,2017-01-13 07:18:04,"b'koe cuek, koe ratau peduli! yowis biarkan air hujan yang membasuh keringatku ini \xf0\x9f\x98\x94'"
819805128966275074,2017-01-13 07:15:48,b'kamu kenapa? ayan apa laper? https://t.co/mhWTehjVob'
819804991342772224,2017-01-13 07:15:15,"b'magelang theater, sebelah matahari, ngarep alun alun Magelang https://t.co/z1LegupiEK'"
819548290291093504,2017-01-12 14:15:13,"b'anakmu ki lho mak, Alhamdulillah sehat wal afiat tapi mung entek duite \xf0\x9f\x98\x9e'"
819227509875085312,2017-01-11 17:00:33,"b'gah, ndak ketularan jomblo! https://t.co/k0TaQCJvtm'"
819224633551400961,2017-01-11 16:49:07,b'koe lagi ngopo?'
819163465151483905,2017-01-11 12:46:04,b'siap melacur.. eh meluncurrrr \xf0\x9f\x98\x85\n#LumayanWaras\n#LumayanWarasMerch\n#LumayanWarasMGL https://t.co/d5mAdjUnYF'
818746649354739714,2017-01-10 09:09:47,b'selamat sore jomblo korban tikung konco dewe... piye wes oleh gantine??'
818700404829454336,2017-01-10 06:06:01,b'perih tenan nek iki. yakin! *truestory* https://t.co/08Nwyn7YfJ'
818488774912942080,2017-01-09 16:05:05,b'yakin? https://t.co/PHIoeZkklm'
818478628161789952,2017-01-09 15:24:46,b'kok raono sing ngode njaluk ditikung to iki? \nmumpung lagi semangat lho iki aku!'
818456065087938565,2017-01-09 13:55:06,"b'masih dengan rasa yang sama, untuk orang yang sama... namun belum bisa bersama. ulala!!'"
818413085811539969,2017-01-09 11:04:19,"b'ora usah adus ah, gek rahowo weruh ciduk..'"
818111430935252992,2017-01-08 15:05:39,b'close order. matur suwun sing wes order.. koe cen ngene \xf0\x9f\x91\x8d'
817988797560274944,2017-01-08 06:58:21,"b'mingguku sibuk nyambut gawe, lumayan duite keno gawe tuku kapal selam sak laute \xf0\x9f\x98\x8e'"
817779523647258624,2017-01-07 17:06:46,b'males turu.. pengen disemangati :('
817389700570894338,2017-01-06 15:17:45,b'pacar emang gitu.. jare masalalu biarlah berlalu. tapi jeh sok diungkit ungkit nek pas padu..'
817331330568458240,2017-01-06 11:25:49,"b'walaupun aku rugi karena telah mengharapmu, tapi setidaknya aku jadi tau betapa BOSOKnya atimu!!'"
817062978587541504,2017-01-05 17:39:29,b'mari kita tidur dan lupakan yang melupakan kita!'
817061328716054528,2017-01-05 17:32:55,b'sugeng tilem mbak! https://t.co/U4GzmoxSsM'
817057217241235457,2017-01-05 17:16:35,b'stok ucapan selamat tidurku wes numpuk akeh rung kanggo. sesuk nek sing dadi pacarku tetep rabakalan kekurangan ucapan selamat tidur.. yakin'
817049376476393472,2017-01-05 16:45:26,"b""ngenteni sepur lewat kene rasane koyo ngenteni de'e pegat ro bojone.. mustahil \xf0\x9f\x98\xa5 https://t.co/6Ztd0prqbW"""
816686890552205312,2017-01-04 16:45:02,b'apakah orang pekok tercipta hanya untuk menyusahkan orang pintar?? hih!! \xf0\x9f\x98\xa4'
816640321148702720,2017-01-04 13:39:59,b'mulane nek pas disayang ki rausah kakean tingkah! saiki ditinggal lungo malah koe dewe to sing susah! hahah!!!'
816320062978043906,2017-01-03 16:27:24,b'more info \nBBM : D2B8CAC6 \nWA : 085727000835 https://t.co/HTQeBpKI6Z'
816300208598302720,2017-01-03 15:08:30,b'hobinya sia-siain cinta orang yang tulus cuma buat ngejar gengsi dan juga fulus!'
816255359467667456,2017-01-03 12:10:17,b'wes molai kulino ngobrol ro jempol sikil!\n*efek kesuen jomblo!'
816254854905491456,2017-01-03 12:08:17,"b'wes meh tanggal 8 lho, ayo sopo sing durung pesen kaos ndang pesen ndak selak tak close order! sesuk wes ora cetak meneh lho iki!'"
816254459940478977,2017-01-03 12:06:43,b'timbang aku?? emang aku ngopo!! https://t.co/bwD8wx0SCu'
815576098763218945,2017-01-01 15:11:09,b'pacar sing tok bangga-banggakan kui durung mesti banga ro koe genti. dadi yo bersikap biasa wae! pacaran lagi wingo sore we nggaya!'
815222772397813760,2016-12-31 15:47:09,b'tahun baru kok do ribut pengen ndue pacar anyar. ha koe ki do ndue pacar lawas pora e??'
814757941395877892,2016-12-30 09:00:05,b'masih bukan dalam posisi untuk cemburu'
814452474249560065,2016-12-29 12:46:16,"b'ora pengen po? kancane wes do pesen lho, mosok kancane ndue koe randue dewe.\nPO mung tekan tgl 8 januari lho iki\nCP\xe2\x80\xa6 https://t.co/jW4gSva9Ih'"
814438576410632194,2016-12-29 11:51:02,"b'uwes rausah repot repot, teko penakke. aku kan wes rapenting..'"
814430601587494918,2016-12-29 11:19:21,b'heh.. kui pacar opo larahan kok nang ngendi ngendi ono??'
814361762820550656,2016-12-29 06:45:49,b'kangen pacar tapi lali le deleh \xf0\x9f\x98\xa2'
814144571705671680,2016-12-28 16:22:46,b'monggo diorder gais :))\nPIN : D2B8CAC6\nWA : 085727000835 https://t.co/xF8LLBrJXP'
814114769674211328,2016-12-28 14:24:21,b'pengen ngganteni boy tapi aku randue ninja \xf0\x9f\x98\x8c'
814083680507310081,2016-12-28 12:20:49,b'kalo minat bisa order lewat bbm atau whatsapp mbak.\nD2B8CAC6 / 085727000835 https://t.co/m4uaA72s7s'
813966251659624450,2016-12-28 04:34:11,b'monggo mau yang mana?? \nPIN : D2B8CAC6\nWA : 085727000835 https://t.co/s56JINNW0H'
813783541796352001,2016-12-27 16:28:10,b'preorder kakak :)) https://t.co/5fcODT4KfW'
813718025115344896,2016-12-27 12:07:49,"b'kaos hanya tersedia warna putih. bisa lengan panjang/pendek. \npesen seko saiki, tak preorder mung tekan tanggal 8 januari tok njuk uwes.'"
813717064015720448,2016-12-27 12:04:00,b'tidak ada https://t.co/ZoyAyd25nw'
813715074128846849,2016-12-27 11:56:06,b'yang masih minat kaos kayak punya mbake ini bisa pesen dari sekarang. info lebih lanjut bisa hubungi : D2B8CAC6/085\xe2\x80\xa6 https://t.co/VqU9etCnC8'
813713973333741568,2016-12-27 11:51:43,"b'masih, tapi cuma sedia warna putih https://t.co/upYHe3tsUD'"
813392057507024896,2016-12-26 14:32:33,b'nek wes bahagia njuk lali karo sing gelem diajak susah..\njiwamu parah!'
813380377779662849,2016-12-26 13:46:08,"b'ojo sok nggaya, semua ada masanya. walaupun koe wes bola bali dikeloni tapi durung mesti koe akhire dirabi!'"
813369842740797440,2016-12-26 13:04:16,b'wes oleh olehan njuk minggat.. sudah saya duga! dasar tak tau malu!'
813010604113805312,2016-12-25 13:16:47,b'sing arep takon2 soal kaos iso lewat bbm/wa : D2B8CAC6/085727000835'
812995512462819329,2016-12-25 12:16:49,"b'tak pre-order tekan tanggal 8 januari. mung warna putih tok. pendek 100, panjang 110. free sticker. Cp : D2B8CAC6 /\xe2\x80\xa6 https://t.co/o71D4ykFVp'"
812712795309363200,2016-12-24 17:33:24,b'turu?? hahah.. wes rausum! saiki lagi usum telolet!'
812712533664493568,2016-12-24 17:32:22,b'ora ndue toko. modele cod po kirim2 https://t.co/0KfbIsTvxf'
812321853976891393,2016-12-23 15:39:56,b'antemi wi! https://t.co/vc6iE7S3CA'
812321511432286208,2016-12-23 15:38:35,"b'piye, jeh do minat karo kaos iki pora? tapi mung khusus warna putih tok :)) https://t.co/k2DjiYzKfA'"
812320536055271424,2016-12-23 15:34:42,b'nek misal kaos iki tak pre-order meneh kiro2 do minat ora?? https://t.co/7kjD6ZhFVu'
812280925111218176,2016-12-23 12:57:18,"b'jenenge wae menungso, kadang salah kadang salah banget kadang nyalah nyalahke tapi kadang disalahke ora gelem.'"
811955883013914625,2016-12-22 15:25:42,"b'ingat! penyesalan butuh waktu, jangan berbangga dulu dengan keputusan tanpa pemikiranmu itu.'"
811912346620686337,2016-12-22 12:32:42,b'koe ki mung durung sadar karo opo sing tok siasiakan saiki!'
811911686047137796,2016-12-22 12:30:05,b'sudah sold semua. https://t.co/vQ8x7lwqQp'
811521611958366208,2016-12-21 10:40:04,b'mandi dalam posisi masih cakep tu gapapa kan?'
811270586030694400,2016-12-20 18:02:35,"b'jaga sikap dan tindakan, jangan sampai tingkah lakumu jadi pemicu kebencian orang lain terhadapmu..'"
811250876253773824,2016-12-20 16:44:15,b'bola bali ditulungi tapi ratau ono matur suwune. nek gengsi ojo kebangeten!  wong yo matur suwun kui ora marai medun derajatmu!'
811236880834408448,2016-12-20 15:48:39,"b'manisnya cuma disaat butuh saja, setelah dapat semua kau pergi entah kemana... \xf0\x9f\x92\xa9'"
810869750548967425,2016-12-19 15:29:48,"b'katanya semua cowok sama aja, kenapa kamu masih milih2 mbak?'"
810824910549286913,2016-12-19 12:31:37,b'kamu mau enggak jadi penyemangatku waktu aku malas mandi? \xf0\x9f\x98\x8c'
810484999535218690,2016-12-18 14:00:56,"b'bukan bermaksut untuk pamrih, hanya saja rasa ini perih saat semua telah aku lakukan tapi ucapan terima kasihpun tak aku dapatkan..'"
809789555314262016,2016-12-16 15:57:29,"b'weslah, ben dadi kenangan daripada dadi siji malah mung mangan ati..'"
809784894071017472,2016-12-16 15:38:58,b'mending padu tapi njuk akhire mbalik dadi siji dari pada mung meneng2an tapi akhire pisah \xf0\x9f\x98\x93'
809414404412358656,2016-12-15 15:06:46,"b'aku i termasuk cakep lho, tapi kok golek pacar wae rasane angel, mbasan kancaku sing elek2 malah wes do rabi. nek ngene iki sing salah sopo?'"
809046330412630016,2016-12-14 14:44:11,"b'awale kekancan, njuk sok cerito cerito, soyo suwe dadi curhat, njuk ngroso nyaman, trus dadi sayang. njuk koe ngilang! asu!'"
808695954287140864,2016-12-13 15:31:55,"b'nek jomblo ki cen mboseni.. mboseni mergo raiso selingkuh maksute! ha piye arep selingkuh, wong pacar wae randue :|'"
