id,user,created_at,place,text731888184049557504,2016-05-15 16:45:15,"b""tambai tulisan 'welcome' kan dadi keset wi https://t.co/PXRAhLE2SG"""
731882103852294145,2016-05-15 16:21:05,b'ndang mapan https://t.co/GDqXMEXPUv'
731881759835480064,2016-05-15 16:19:43,b'purun? https://t.co/uv0dAJULgB'
731873238742007808,2016-05-15 15:45:52,b'tak sun nggo kumisku sing tipis niki purun??'
731868458074275841,2016-05-15 15:26:52,b'koe golek pacar sing mapan?? tapi nek mapane mujur ngalor koe tasih purun??'
731836450765832193,2016-05-15 13:19:41,b'kalau tidak bisa berkata baik ya lebih baik diam saja!!'
731131532149030912,2016-05-13 14:38:35,"b'gak usah lirik lirik gitu. kalau suka bilang aja, kita bisa pacaran diem diem kok biar pacarmu gak tau^^'"
731105822302838785,2016-05-13 12:56:25,"b'yo sorry, mungkin aku raiso nunjukke rasa sayangku nang koe podo mantan mantanmu mbien. tapi aku iso gemati nganggo caraku dewe :))'"
730752799202414592,2016-05-12 13:33:38,b'tidak kelihatan bukan berarti tidak ada dan tidak ngetuit bukan berarti tidak stalking :v'
730748046200315904,2016-05-12 13:14:45,b'sesuk minggu jam rolas timbang kesepian mending ikut meramaikan sopo ngerti oleh dorrprize bribikan :)) https://t.co/duY7d0FACX'
730736618928099328,2016-05-12 12:29:21,b'ngutil jajanan nang warung https://t.co/SAAKxE1GOw'
730417401129406465,2016-05-11 15:20:53,"b'sing tak senengi pancen akeh, tapi sing ora seneng karo aku luwih akeh :('"
730390269338624001,2016-05-11 13:33:04,"b'ndue pacar tapi hobi pamer rono rene! pamer kui podo wae promosi, dadi ojo mutung nek akhire pacarmu keno tikung!'"
730012938442919936,2016-05-10 12:33:42,"b""koe kok gampang banget sih gonta ganti pacar?? oh iyo ding, barang 'murah' kan cepet payune. :D"""
729998017470697472,2016-05-10 11:34:24,"b'wes sue ora ndue pacar, mugo2 sesuk pas ndue pacar naluriku sebagai seorang pacar durung ilang \xf0\x9f\x98\x94'"
729711306144501761,2016-05-09 16:35:07,"b'sejak aku jomblo, aku selalu merasa kalau aku ini tidak punya pacar :|'"
729669849442488320,2016-05-09 13:50:23,b'tenane?? raimu ketok mesum lho.. *ups* https://t.co/0ydGvWNyEa'
729669736213057537,2016-05-09 13:49:56,b'podo jon! :( https://t.co/w37xiienDO'
729669699189886977,2016-05-09 13:49:47,b'pinter! :* https://t.co/ZO1Bu9ozXO'
729660628021870593,2016-05-09 13:13:44,b'ngopo wae? rutin ngucapke selamat pagi? https://t.co/5FVcBv1DSD'
729660417086119937,2016-05-09 13:12:54,b'dipojokne tembok njuk digrepe grepe?? https://t.co/WCJg6Nd4Q2'
729654515465523202,2016-05-09 12:49:27,"b""koe pacaran karo pacarmu wes tau 'melakukan' opo wae gais? #takTakon"""
728623321483386880,2016-05-06 16:31:51,"b'aku jomblo ora mergo rapayu, tapi aku jomblo mergo aku sabar lan ora sembarangan golek pacar..'"
728607036364054528,2016-05-06 15:27:08,b'ora sido oleh koe aku arep nakal meneh!!'
728268088521560065,2016-05-05 17:00:17,b'kamu galau ya? peluk sinih \xf0\x9f\x98\xb3 https://t.co/LY47gC2dF7'
728257938142306304,2016-05-05 16:19:57,"b'aku mending meneng. timbang kesel2 jelaske tapi tetep wae salah, bahkan kata maaf wae tetep tok salahke!'"
728255229326565377,2016-05-05 16:09:11,"b'manut, meh nang kamarku opo kamarmu? https://t.co/cHkVdjFwQq'"
728240922232688640,2016-05-05 15:12:20,"b'mbien lumayan waras ono kontak bbne, tapi tak nonaktifke mergo do kakean bc rajelas. saiki nek do tak kon nginvit pine admine gelem ra?? :v'"
728219670679945216,2016-05-05 13:47:53,b'sambat jomblo tapi disepik angel. sambat hp sepi tapi dibbm rambales. karepmu piye to? gelut purun??'
728219192319578112,2016-05-05 13:45:59,b'mungkin percintaanku ora bakal semesakke ini nek sama kamu mbak \xf0\x9f\x98\xb3 https://t.co/dFSzyFfHWN'
728209794264223745,2016-05-05 13:08:39,"b""senenge kok mbanding2ke aku ro mantanmu. nek memang mantanmu luwih apik seko aku ngopo mbiyen de'e ninggalke koe?"""
727900409734422528,2016-05-04 16:39:16,b'saingan mbribik karo uwong sing pinter ngapusi kui berat. yakin!'
727886909721083904,2016-05-04 15:45:37,b'kadang aku sok merasa goblog nek pas mikir ngene. aku sibuk mikir keadaane wong liyo sedangkan keadaanku dewe montang manting rakaruan. :|'
727886776287698946,2016-05-04 15:45:05,b'tolong benahin atiku mbak \xf0\x9f\x98\xb3 https://t.co/HzbdkIl9vo'
727883011195215872,2016-05-04 15:30:07,b'iki tuitere opo apane sih sing errorrr!!!! jancuk!'
727531422844510208,2016-05-03 16:13:02,b'mungkin semua tak akan seperti ini jika dulu kau mendelkonnya :|'
727531354766774272,2016-05-03 16:12:46,b'jeh sayang to karo aku? https://t.co/tma0m1V45X'
727528505450209281,2016-05-03 16:01:27,"b'piye, sehat??'"
727526464027955200,2016-05-03 15:53:20,"b'piye,, sido pora mbak? https://t.co/Gu1QnMs4Bm'"
727141463536988160,2016-05-02 14:23:29,b'bingung arep melampiaskan kasih sayang karo sopo :('
727126637293109251,2016-05-02 13:24:34,"b'ngomongo, ojo digawe status! marai ribett!!'"
726831020197048321,2016-05-01 17:49:53,"b'nek rakuat yo teko turu wae mblo, le begadang sesuk awan rapopo..'"
726829669585035264,2016-05-01 17:44:31,b'ha mbok sak ceret wae tak turuti kok mblo. asal diombe lewat irung https://t.co/fjj3IZCWpv'
726829331054391296,2016-05-01 17:43:11,b'nek tak bribik purun?? https://t.co/FyNh0CL4Oc'
726829186803867648,2016-05-01 17:42:36,"b'kene jejer aku, kita curhat sambil tak elus elus batukmu :3 https://t.co/11n02KWPCv'"
726823980200517632,2016-05-01 17:21:55,b'tak jak begadang nyambi curhat purun??'
726821645566889985,2016-05-01 17:12:38,b'arep ngetuit kok wes yahene.. ndak yo jeh ono sing melek??'
726071634352697344,2016-04-29 15:32:22,b'hmm.. podo tulisane tok. tapi nggon aku original \xf0\x9f\x98\x8e https://t.co/ZiHopT7tjf'
726061801155100672,2016-04-29 14:53:17,b'kamu kok lucu sihhh... tak buat bandol kunci mau??'
725718483674091520,2016-04-28 16:09:04,b'#jangantakutdolanpecinan  #magelangorawediteror \xf0\x9f\x92\xaa'
725714100668358657,2016-04-28 15:51:39,b'woco dewe \xe2\x9e\xa1\xe2\x9e\xa1 https://t.co/ZdXV7QmLRe https://t.co/BRN0Pdheof'
725712402461790208,2016-04-28 15:44:54,b'lokasi teror penembakan misterius nang Magelang soyo meluas. sing jomblo monggo podo keliaran ben ditembak. mayan lho njuk rajomblo meneh..'
725707601804021761,2016-04-28 15:25:49,"b'wes kono balio nang kae sing wes gawe koe lali karo aku, percuma koe mbalik rene tapi jeh nggowo2 jenenge kae.'"
725333505249411074,2016-04-27 14:39:18,"b'DEAR MANTAN!\naku wegah minta maaf wong mbiyen sing salah koe, udu aku! :v'"
725310414393729028,2016-04-27 13:07:33,b'menyayangiku mau?'
725308020205350912,2016-04-27 12:58:02,b'biasane do ngekost nang rumah penduduk kampung tidar baru https://t.co/qvTUc7Txik'
725305046263422978,2016-04-27 12:46:13,"b'RT @EvaLailanda: Dadio aku sedelo ae , rasakno ! Pahamono ! Men koe mudeng rasane jungkir balik nyayangi koe kui koyo opo :3 @LumayanWaras'"
724964750543572992,2016-04-26 14:14:00,b'nek ora peka berarti pekok \xf0\x9f\x98\x82 https://t.co/qs85O2U0hG'
724952164729237504,2016-04-26 13:23:59,"b'jane pengen gawe foto ""dear mantan maafin aku yg dulu"" ben kekinian. tapi sayange aku wes cakep seko masa ke masa :('"
724267347427479552,2016-04-24 16:02:46,b'niat arep melupakan tapi malah soyo kelingan kui rasane koyo uthik uthik upil tapi upile malah soyo mlebu jeru :|'
724229627380568065,2016-04-24 13:32:53,b'sepanjang ora konangan... kita selalu bergandeng tangan. sepanjang ora konangan kau peluk diriku mesraaaa'
724214252907569152,2016-04-24 12:31:47,"b'RT @Syafaul_A_A: penembak misterius di pecinan, namun selalu ditolak. :( ---&gt; @sipet_'"
723886636799389696,2016-04-23 14:49:58,"b'weslah cukup semene, rasah diteruske. percuma nek jeh ono kae diantara aku ro koe!'"
723531607827570689,2016-04-22 15:19:12,b'sakumpomo awakdewe mbiyen ora pacaran kan mungkin saiki awak dewe jeh iso guyonan. putusnya sebuah hubungan cen iso mengubah keadaan og :('
723177624466378752,2016-04-21 15:52:36,b'sedang dilanda krisis bribikan :('
723141390016749568,2016-04-21 13:28:37,b'hati hati. walaupun sudah tiersimpan dalam hati kadang masih bisa pindah kelain hati..'
723022628600967168,2016-04-21 05:36:42,"b'RT @EvaLailanda: Saumpomo pecahe ati muni ""pyarrr"" mungkin koe wes budek mas krungu pecahe atik sak bendino @LumayanWaras'"
722797844453720065,2016-04-20 14:43:29,"b'mbiyen sih opo opo kanggo koe, nek saiki yo koe rakanggo!'"
722782975113318401,2016-04-20 13:44:24,"b'jika mencari yang single dirasa sudah sangat susah, maka menikunglah dengan Bismillah'"
722484441566740482,2016-04-19 17:58:08,"b'aku tak turu ndisik yo dik, mengko nek mendadak pacarmu ngejak putus berarti doaku manjur^^'"
722455316516904961,2016-04-19 16:02:24,b'soyo ditutke malah soyo diangel angel dalane. yowes aku tak menggok nganu liyane!'
722421276178927617,2016-04-19 13:47:08,b'dp bbm e kok mung kui kui wae sih?? pacarmu siang saiki ratau ngajak bertamasya po? :v'
722386581307334657,2016-04-19 11:29:16,"b""RT @EvaLailanda: Cinta ra perlu mekso . Lek de'e ra iso cinta ng andewe yoweslah bebasne ae raperlu di kekang . Ben sak seneng e atine @Lum\xe2\x80\xa6"""
721732580404363264,2016-04-17 16:10:30,"b'ora, ora aku sing kepenen lungo seko koe, tapi mung koe sing ora tau nganggep aku ono. yo mung kui alesane, paham to?'"
721689323788115968,2016-04-17 13:18:37,"b'cukup sekian dan terima kasih, tulus yang kau sia-siakan ini sungguh sangat perih.'"
720982054674898944,2016-04-15 14:28:11,"b'aku lungo. ora mergo aku kesel bertahan, tapi mung sampek saiki usahaku ora tau tok hargai. ngerti dewe to nek sabar kui yo ono batese.'"
720962610590384129,2016-04-15 13:10:55,"b'aku membaca kembali chat lama kita. lalu aku tersenyum, tertawa... dan menangis :('"
720594696393728001,2016-04-14 12:48:58,b'ojo lali ngabari aku nek pacarmu wes molai raniat ngabari koe^^'
720300504362844161,2016-04-13 17:19:57,"b'sesuk nek wes ono koe, guling iki tetep tak pensiunke^^'"
720295728199766016,2016-04-13 17:00:58,b'ono. KOE.. amin \xf0\x9f\x99\x8f https://t.co/E1dgL2L7Bf'
720291171172425730,2016-04-13 16:42:52,b'selamat tidur calon pendamping hidup yang selalu membuatku merasa sanggup untuk melewati semua ujian hidup :*'
720277911240970241,2016-04-13 15:50:10,b'pengen rewel ben dipuk puk ro disusoni :('
720255606859235328,2016-04-13 14:21:33,"b'santai wae, aku bar ngombe jamu kuat ngeyel. dadi masalah opo wae tetep wani tak eyel!'"
720234384473722880,2016-04-13 12:57:13,"b'bukane aku cuek, tapi aku mung ajar urip tanpo koe seko sitik. percuma aku berjuang ngoyo nek akhire koe karo wong liyo.'"
719584115079577601,2016-04-11 17:53:16,b'sugeng tilem wae gawe koe calon jodoku sing lagi disiapke Tuhan gawe aku :*'
719561174140919809,2016-04-11 16:22:07,"b'cah wedok rasah ngoyo le mbutgawe, sesuk calone melu bojone https://t.co/H2cMrcNRwH'"
719561172924502016,2016-04-11 16:22:07,b'yo kekancan karo demit wae https://t.co/vpdiVH8v0o'
719553377844080640,2016-04-11 15:51:08,b'koe kudu sadar. mungkin wes bosen *uhuk https://t.co/HW2vCpFRMI'
719552700724064256,2016-04-11 15:48:27,b'gah! tak njogo koe wae *melu turu nang sebelahmu* https://t.co/kWOsmFQ2du'
719552596654952448,2016-04-11 15:48:02,"b'diamkan saja, sesuk nek wes keno diabetes kan njuk leren dewe :v https://t.co/qjcwts7t2l'"
719549342890139651,2016-04-11 15:35:06,b'tikung wae! https://t.co/8h7bVx1Zan'
719549016678137856,2016-04-11 15:33:48,b'semangat menjalankan utsnya ea caiiiyaaankkk :* https://t.co/kpstxg74RQ'
719548860666777600,2016-04-11 15:33:11,b'gah koe lanang og! https://t.co/0zQ88BHFlW'
719546015196401664,2016-04-11 15:21:53,b'rasah bombongan! urip ora kudu sangar https://t.co/C38NAiMcNG'
719545257164013568,2016-04-11 15:18:52,b'rasah digagas.. gengsi tauk! https://t.co/v1gQ0h2DdT'
719545256417501184,2016-04-11 15:18:52,b'tangane ditugel njuk dipaketke lewat JNE https://t.co/XdvvHNFbGX'
719544634821578752,2016-04-11 15:16:24,b'podo :* https://t.co/uku0EuKuGE'
719544594686287872,2016-04-11 15:16:14,"b'rasah garap, urip ojo digawe mumet :v https://t.co/i9i1Vj7v7f'"
719543621158965248,2016-04-11 15:12:22,b'gantengmu kurang dipublikasi https://t.co/abnMS0FDgS'
719543252936818688,2016-04-11 15:10:54,b'koe ki malah ngopo e?? https://t.co/4LdV5WXZy6'
719543173458956288,2016-04-11 15:10:35,b'karo aku wae sing cedak \xf0\x9f\x92\x9c https://t.co/cTrqv0taZt'
719542850677936130,2016-04-11 15:09:18,"b'rasah ngejak putus, teko langsung tinggal rabi karo liyane wae.. https://t.co/qv0pqV9Cl4'"
719542524423966720,2016-04-11 15:08:00,b'koe mabuk yo? https://t.co/1X7mmMMhIK'
719542219393269764,2016-04-11 15:06:48,b'mlebu UGD wae malah gampang \xf0\x9f\x98\x84\xf0\x9f\x98\x84 https://t.co/jHLQ0dR7Ye'
719542110735609856,2016-04-11 15:06:22,b'yowes koe rasah bahagia wae ndak mung nangis :v https://t.co/up8benjvnx'
719541908339437568,2016-04-11 15:05:34,b'y https://t.co/gvorVeS7Ay'
719541892149415937,2016-04-11 15:05:30,b'jal takon peta https://t.co/kf1dzRg1le'
719541380557582336,2016-04-11 15:03:28,b'rasah balen koyo raono liyane wae https://t.co/dldzuohdbp'
719537915055857664,2016-04-11 14:49:41,b'#nunutSambat dibuka! monggo sambat sak njeplakmu!! :*'
719519008467263489,2016-04-11 13:34:34,b'rapopo! koe ora tenanan tur yo wujudmu ora nyata og! https://t.co/A33iBfw2mA'
719516441528041472,2016-04-11 13:24:22,"b'wes tak ungkapke kabeh. iki saate aku meneng, ngomongo yo percuma rabakal gawe koe paham. wes cukup tekan semene wae perjuanganku. aku kagol'"
719169980013522944,2016-04-10 14:27:39,"b'sebelum sedingin laut lepas, kau pernah sehangat napas :('"
718468126539534336,2016-04-08 15:58:44,"b'kok ora sms aku sih, pacarmu durung turu po?? :('"
718434309426667522,2016-04-08 13:44:21,"b'wong liyo ngono isone mung nyawang. kene susah malah disoraki, giliran seneng do iri.. kan tai!!'"
718094979114008576,2016-04-07 15:15:59,"b'nek hubunganmu wes soyo cedak ki yo ndang ditembak, rasah kesuwen ndak selak kesasak!'"
718086782328266752,2016-04-07 14:43:24,b'aku mah apa. mung wani mlirik tapi rawani mbribik :('
718076392160690176,2016-04-07 14:02:07,b'nek ono sing merasa kehilangan duit 1jt lembaran 20rb dikareti warna abang segera hubungi aku. iki karete warna abang keri nang kene. \xf0\x9f\x98\x82'
717751141488963585,2016-04-06 16:29:41,"b'nek mbengi arep turu angel, giliran wes isuk arep tangi yo angel! huff KZL!!'"
717734383835152384,2016-04-06 15:23:06,"b'aku ki bingung meh menggoda koe lewat opo, nang line ku raono koe :( https://t.co/sKwzZo5uVA'"
717730896867004417,2016-04-06 15:09:15,b'yakin? meh model privat opo model blak blakan?? :v https://t.co/O9KidIkjdp'
717723142387408896,2016-04-06 14:38:26,b'terus aku kon repot repot ngrebut koe seko pacarmu?? ha rabutoh! ndak gede ndasmu!'
717722857845825536,2016-04-06 14:37:18,b'emm.. piye ya? nek tak goda tenan ndak malah jatuh cinta karo aku mengko https://t.co/gUExd3BYG6'
717719239960842240,2016-04-06 14:22:56,"b'oh iyo, nek arep curhat opo sambat lewat line monggo mumpung admin selo. ID line cek bio :))'"
717717524347887616,2016-04-06 14:16:07,"b'tak godane kene!! pin bbm mu piro, nomer hpmu piro, pesbukmu opo, line mu opo? cepet, selak ngantuk! https://t.co/AFqKuFDoxJ'"
717714517422018562,2016-04-06 14:04:10,b'aku rakopen... godanen aku. aku tak mapan. https://t.co/f9aT7D0Dr6'
717714128341569536,2016-04-06 14:02:37,b'besok aja ya kalo ga hujan \xf0\x9f\x98\x8c https://t.co/WyEoeMQeMQ'
717712149410238472,2016-04-06 13:54:45,b'halllooo gaiss.. ga ada yang bisa digoda po ini?'
717375026152865794,2016-04-05 15:35:09,"b'arep ora mumet mikir jodoku sesuk sopo, ben jodoku wae sing mumet mikir soal kui. :|'"
717340578594160641,2016-04-05 13:18:16,"b'nek pesanmu mung dibales \'hehe\' kui artine ""wes yo rasah bales meneh"" koe kudu paham sakdurunge soyo judes meneh balesane.'"
716997170272931840,2016-04-04 14:33:41,"b""bahagia kui sederhana. mimik kopi karo nyimak de'e padu ro pacare \xf0\x9f\x98\x8d"""
716989931659198464,2016-04-04 14:04:55,b'padahal aku randue kontakmu. hih pembohong \xf0\x9f\x98\x92 https://t.co/6FoLDdSmcy'
716692077782773761,2016-04-03 18:21:21,b'begadang nonton Moto GP! mugo mugo sesuk anakku dadi juara balap renang.'
716656608625864704,2016-04-03 16:00:24,"b'sak goblog gobloge aku mergo saking manute ro koe walaupun tok sio-sio, luwih goblog koe mergo koe nyio-nyio ketulusan iki!!'"
716653546108641281,2016-04-03 15:48:14,b'hah!! kmu panggilan?? \xf0\x9f\x98\xb2\xf0\x9f\x98\xb2 https://t.co/Wx3Zyg2dd4'
716651857469243392,2016-04-03 15:41:32,b'lagi ngopo mbak? \xf0\x9f\x98\xb3'
716636770910089216,2016-04-03 14:41:35,"b'sesuk UN njuk penghuni tuiter sepi, yowes semoga hasile memuaskan lan do lulus kabeh :))'"
716631917202771968,2016-04-03 14:22:18,b'teko udan terus wae rapopo ben soyo subur kenangane!!'
716296409847169024,2016-04-02 16:09:06,"b'sekali ngoyak yo kudu kecekel, nek wes kecekel yo ojo sampek ucul, tapi nek kebacut ucul yo ojo dioyak meneh!'"
715937649677078528,2016-04-01 16:23:31,b'asal pasti yo tetep tak enteni https://t.co/Um0EvG5aMm'
715925381040091136,2016-04-01 15:34:46,b'tak enteni yen tasih purun^^'
715905606725423105,2016-04-01 14:16:12,b'hanyalah sebuah kata rindu tanpa ada hasrat ingin bertemu :('
715879700258631680,2016-04-01 12:33:15,"b'gais, tulung mase iki diparingi kata kata penyemangat UN. aku gek raiso berkata kata e.. \xe2\x87\xa8\xe2\x87\xa8 https://t.co/sJ37KDZE2W'"
715583949431373824,2016-03-31 16:58:03,b'selamat tidur dan mimpi indah kamu yang dulu sering satu kasur bersamaku lalu mendesah^^'
715565569244672000,2016-03-31 15:45:00,"b'sing arep ngomong sayang gek ndang! aku arep turu, selak ngantuk!'"
715516373032546305,2016-03-31 12:29:31,b'tulung cangkeme dikondisikan!!'
715209680121802752,2016-03-30 16:10:50,b'cuma berharap saat ini aku bisa berhenti berharap :|'
715164379419783168,2016-03-30 13:10:49,b'mbok koe sekali-kali gomong kangen ben atiku ayem :('
714818272768569344,2016-03-29 14:15:31,"b'aku wes tau yakin karo opo sing tak anggep layak diperjuangke, tapi setelah opo sing tak lakokke ora diperhatikke, aku milih mundur wae..'"
714805844638982144,2016-03-29 13:26:08,"b'dicari! uwong sing rapoponan, arep tak antemi ndase nggo pelampiasan!!'"
714486128905093121,2016-03-28 16:15:42,"b'aku arep turu lho, yakin koe ora arep nglarang aku turu njuk ngajak aku begadang mesra??'"
714093537583693824,2016-03-27 14:15:41,b'mbahne sopo iki gaiss??? \xf0\x9f\x98\xb2\xf0\x9f\x98\xb2 https://t.co/NkGonIGcFl'
714071777882849281,2016-03-27 12:49:13,"b'kangenku saiki tak tabung sek, sesok nek wes mlumpuk akeh tak nggo tuku kebahagiaan. :|'"
714036508580155392,2016-03-27 10:29:04,"b'akan aku lawan rasa malas mandi ini dengan sekuat hati, sekuat aku melawan rasa cemburu yang tak pantas ini!! \xf0\x9f\x98\xa2'"
714035712190877696,2016-03-27 10:25:54,b'selamat sore gais! cuma mau ngasih tau ternyata 3 buah permen milkita sama dengan segelas susu murni.. woww!!'
713800858077515776,2016-03-26 18:52:41,b'wes turu?'
713739686787690500,2016-03-26 14:49:36,b'noto polah ben rasalah..'
713388858482647040,2016-03-25 15:35:32,b'kapan koe putus?? aku selak ngantuk!'
713379733803630592,2016-03-25 14:59:17,"b'kangen wae aku rapatut, oponeh cemburu..\nyowes tak meneng sakdurunge disuarani ""lha koe ki apaku?""'"
713367958605541376,2016-03-25 14:12:29,"b'tak putus, mergo aku luwih sayang koe :* https://t.co/pP1CmvMBZy'"
713365512864948224,2016-03-25 14:02:46,b'perbuatan mhue nenyakiti khue :( https://t.co/Pfun7Z8WqS'
713358372364357633,2016-03-25 13:34:24,b'dear mantan.. https://t.co/BP93766Bc9'
713035080638148608,2016-03-24 16:09:45,b'njuk bobok bareng pora?? https://t.co/1TExKgXKeI'
713026636313026561,2016-03-24 15:36:12,"b'ada rindu yang tak terungkap, semua hanya terhalang oleh sikap. gengsi!'"
713019645725265920,2016-03-24 15:08:25,"b""opo aku kudu ngene iki mbak??\njawab mbakkkk jawabbb!! :'( https://t.co/uLCMU4IzSz"""
713005834578432000,2016-03-24 14:13:32,"b""soyo mbengi udane soyo derasss.. soyo dikangeni de'e soyo ora nggagasss!!"""
713003776215371776,2016-03-24 14:05:21,b'hujan yang tak henti seiring dengan kangen yang tak terobati. haisss!! :v'
712648361103364097,2016-03-23 14:33:04,b'aku mundur ora mergo aku ki orang yang lemah. tapi aku mundur mergo aku sadar nek berjuang dewe kui ora mudah!'
712618158947848192,2016-03-23 12:33:03,"b'ojo gonta ganti dp, ndak baper ku soyo parah :3'"
712265097247219714,2016-03-22 13:10:07,b'wes bosen po durung karo sing saiki??'
711955614906224640,2016-03-21 16:40:20,b'selamat tidur kamu yang takpernah lagi mengucapkanku selamat tidur :|'
711929274081550336,2016-03-21 14:55:40,"b'menilai seseorang kui seko opo sing koe kenal, ojo seko ceritane wong liyo. kui podowae koe mangan opo sing wes dicerna wong liyo. #tai'"
711903481443946499,2016-03-21 13:13:11,b'koe koe pada jomblo ya?? hahahha... pada!'
711880203866234880,2016-03-21 11:40:41,"b'motor ready, bensin full, duit ono. tapi sing diapeli?? raono.. hahahahah!!!'"
711578597710925824,2016-03-20 15:42:12,b'begadang yuk \xf0\x9f\x98\x8d https://t.co/iG9lydblD9'
711577672002895873,2016-03-20 15:38:32,b'baguss.. tulung dikandani ben ora kemaluan.. eh.. memalukan https://t.co/3CX89E9Au1'
711575462749667328,2016-03-20 15:29:45,b'madango ndak selak modyar https://t.co/ZrAlQ1vzgK'
711575264468160512,2016-03-20 15:28:58,b'met bobo ndes :* https://t.co/8g82rTqMP9'
711575146654400512,2016-03-20 15:28:30,b'halah rasah baikan. golek meneh wae https://t.co/rCFvOyutqL'
711574833314660352,2016-03-20 15:27:15,"b'chat aku wae, mesti langsung tak balesi https://t.co/Aok2bLcMEm'"
711574771465527296,2016-03-20 15:27:00,b'kelingan aku kapan? https://t.co/oSLifFAwpl'
711574771335495681,2016-03-20 15:27:00,b'so https://t.co/C2U6Alh1zb'
711572753925541888,2016-03-20 15:18:59,b'rasah dipikir ndak kentir https://t.co/Wqpq7n2ZhZ'
711572604021157889,2016-03-20 15:18:23,b'oh koe LDR to..  selamat https://t.co/9kdRECx9Me'
711572479240577024,2016-03-20 15:17:54,b'add line ku to \xf0\x9f\x98\xb3 https://t.co/2PibP7H0NR'
711571557177405440,2016-03-20 15:14:14,"b'rasah digarap, turu wae penak kok https://t.co/ZJmN3oPN4T'"
711570038315048960,2016-03-20 15:08:12,b'kok rung turu?'
711497438327132161,2016-03-20 10:19:42,b'adus ben jomblone luntur..'
711181201877245952,2016-03-19 13:23:06,b'hpmu sepi?? jolke bebek wae ben rame :v'
710991612684271616,2016-03-19 00:49:44,"b'tetaplah maju walau sedikit ragu, jangan hanya berdiri karena waktu tak pernah berhenti. selamat pagi! :))'"
710839213067886592,2016-03-18 14:44:09,"b'pagar makan tanaman itu wajar, tapi kalau pacar dimakan teman itu kurang ajarr!!'"
710809502770012160,2016-03-18 12:46:06,b'#takTakon iki iwak opo gais?? https://t.co/K6WBBKtOQR'
710461534158323712,2016-03-17 13:43:24,b'mugo mugo koe sing terakhir. aku wes bosen ngrasakke paite pisahan \xf0\x9f\x99\x8f'
710448596408078337,2016-03-17 12:51:59,"b'aku kesel mbukak nutup ati, sing mlebu terus lungo mung do ninggali roso loro. pliss temokke aku karo sing terakhir gelem mbenahke atiku :('"
710362936888336384,2016-03-17 07:11:36,b'langite mendung ngabani arep udan. lha koe kapan ngabani arep pegatan??'
710308666126127106,2016-03-17 03:35:57,b'panganan sing berlapis lapis.. https://t.co/ddt1YHrgH9'
709776081381789696,2016-03-15 16:19:39,"b'yo ngono kui nek pas lagi seneng2e, opo2 soal kui, sitik2 tentang kui, dibanggakke rono rene, diwah wahke rono rene. berlebihan bgt pokokke!'"
709722249645805568,2016-03-15 12:45:44,"b""mereka hanya lupa kalau mereka pernah mengenalku :')"""
709710744439291904,2016-03-15 12:00:01,b'endi to sing jarene sayang tenan karo aku?? dobol kuro!!'
709586500975878144,2016-03-15 03:46:19,b'ngombe urat madu ben iso suwe.. https://t.co/XEjkF6f4nq'
709031986443079680,2016-03-13 15:02:53,"b'aku tak meneng ben koe seneng, nek koe seneng aku yo seneng. kurang goblog piye aku padamu?'"
709006595343028224,2016-03-13 13:21:59,"b'rasah mikir omongane wong liyo, wong liyo wae nek omong yo ra mikir.'"
708688312173666304,2016-03-12 16:17:15,b'rasah sambat https://t.co/ksP7HgDtlN'
708687553419808768,2016-03-12 16:14:14,b'yowis lupakan mantan.. ingatlah aku :* https://t.co/7ksCM8LS11'
708687215463759872,2016-03-12 16:12:53,"b'rapopo, pahalamu akeh https://t.co/mvkcCulsU2'"
708686168561307648,2016-03-12 16:08:43,b'berarti koe wes tau pacaran karo sejenis tai https://t.co/MiGpqXNfU2'
708685228340940800,2016-03-12 16:04:59,"b""RT @Tan_HDW: @lumayanwaras mambu udan,, angger udan kelingan mantan --''"""
708685215485399040,2016-03-12 16:04:56,b'RT @SelviraS99_: Mambu lemah https://t.co/wnqqomvacb'
708685209017843712,2016-03-12 16:04:55,"b'RT @sucianadwiL: Batang tikus""@LumayanWaras: #takTakon mantanmu mambu opo gais??""'"
708683260356796416,2016-03-12 15:57:10,b'#takTakon mantanmu mambu opo gais??'
708649986666266625,2016-03-12 13:44:57,b'ora sido malem mingguan! pacarku raoleh dolan karo bojone :('
708284254984114176,2016-03-11 13:31:40,"b'janjimu koyo welut, dicekel lupat luput!'"
708275090123689984,2016-03-11 12:55:15,b'penake ngetuit tentang opo iki gais?'
707942866878730241,2016-03-10 14:55:07,"b'rausah sing muluk muluk, oleh sing gelem opo anane lan bersyukur mergo ndueni aku, aku wes matursuwun banget.'"
707588079511404546,2016-03-09 15:25:19,"b'penuh bekas luka dikulit : preman ""kerep gelut""\npenuh bekas luka dihati : jomblo ""kerep diapusi"" :|'"
707568531215257600,2016-03-09 14:07:38,"b""daripada gocekan cagak mending gocekan tanganku wae mbak sambi sendehan ning pundakku. mumpung nganggur :')"""
707541547336617984,2016-03-09 12:20:25,b'kudu tak pek pacar! https://t.co/0l0munIhCT'
707537186145472513,2016-03-09 12:03:05,b'sementara tak ngene sek..'
707536990611243009,2016-03-09 12:02:18,b'wah kui ono sing ayu nang njero angkot. weruh ra? https://t.co/HsMSjiBVpC'
707214158161256449,2016-03-08 14:39:29,b'ojo lali gais! ( . Y . ) https://t.co/nkdOtUSdwh'
