id,created_at,text
446631159607615489,2014-03-20 12:55:41,b'bimsalabim PEKA-PEKA-PEKA-PEKA-PEKA :D *ngambungpotone'
446630426195800064,2014-03-20 12:52:46,b'Mbuh pie carane aku kudu kuat lan aku kudu sabar .'
446628621248397312,2014-03-20 12:45:35,"b""kok orenek seng ngucapne 'selamat malam' yo . duh"""
446627563142905857,2014-03-20 12:41:23,b'gatelan sih !'
446534057544122368,2014-03-20 06:29:50,b'golek liyo .  @erni_setyo: carane pie min? aku wes lelah PancalMatamu: seng tenang erni_setyo: RT PancalMatamu: Sing ngomonge ijek bertahan'
446526972953649152,2014-03-20 06:01:41,"b'seng tenang @erni_setyo: RT PancalMatamu: Sing ngomonge ijek bertahan , kuat nunggu , kui batine yo kesel lho'"
446517823901552640,2014-03-20 05:25:19,b'nggantung ? @Aditya_km: Alhamdulillah drg ana kepastian!!RT PancalMatamu: alhamdulilah pye ? @Aditya_km: Alhamdulillah!!!!'
446515345130803200,2014-03-20 05:15:28,b'Aku sabar kok karo situ :/'
446514486120579072,2014-03-20 05:12:03,"b'ngendy min ?  PancalMatamu: Ijek akeh ""@shity_ahh: neng po ijek enek min ? PancalMatamu: Ojo seneng karo wg sing ra tau sholat , ngarahke aw'"
446513348679462912,2014-03-20 05:07:32,"b'Ijek akeh ""@shity_ahh: neng po ijek enek min ? @PancalMatamu: Ojo seneng karo wg sing ra tau sholat , ngarahke awakedewe wae ora'"
446513143246626816,2014-03-20 05:06:43,"b'Koe kudu semangat , walaupun ora enek sing nyemangati {}'"
446512835393118208,2014-03-20 05:05:30,"b'Sing ngomonge ijek bertahan , kuat nunggu , kui batine yo kesel lho'"
446511998344261633,2014-03-20 05:02:10,"b'Sayangku ng koe ijek lumayan kentel kok , mulane ojo mbok gawe encer :)'"
446511784728346624,2014-03-20 05:01:19,"b'Ojo seneng karo wg sing ra tau sholat , ngarahke awakedewe wae ora iso opo mneh sok yen meh ngarahke calon keluargane .'"
446511230367191040,2014-03-20 04:59:07,"b'Kabeh kui mesti perlu modus , mesti perlu basa-basi . Dadi yen enek sing ngelokne koe modus , berarti de e kurang gaul !'"
446510830704553984,2014-03-20 04:57:32,"b'Kesekian kaline aku di kecewakne ro wong lanang , tapi sumpah aku rapopo'"
446510764829192193,2014-03-20 04:57:16,b'alhamdulilah pye ? @Aditya_km: Alhamdulillah!!!!RT PancalMatamu: Wes tanggal 20 maret opo yo jek do jomblo cah ? :D'
446510632179732480,2014-03-20 04:56:45,"b'Pacaran karo wong sabar kui otomatis akdewe melu sabar , yow ra'"
446510426939850752,2014-03-20 04:55:56,"b'Yen ujian sekolah iki iso tak takluk e kenopo koe ora iso tak takluk e yo ? (~,~)'"
446509324534579200,2014-03-20 04:51:33,b'Wes tanggal 20 maret opo yo jek do jomblo cah ? :D'
445776719803584512,2014-03-18 04:20:26,"b'seng tulisane ijek alay biasane uwonge yo alay hlo , hahaha'"
445776224028467200,2014-03-18 04:18:28,b'selamat siang PHP :)'
445690239844360193,2014-03-17 22:36:48,"b'Esok we wes kangen bgt , urung engko awan , sore , bengi . ameh dadi opo aku jal :\\'"
445543996870647808,2014-03-17 12:55:41,"b'aku kan sayang koe , berarti koe yo kudu sayang aku hlo ya . .'"
445527519291523072,2014-03-17 11:50:12,"b'ojo nggawe aku susah to , aku ki sayang koe !'"
445523370000801792,2014-03-17 11:33:43,"b'Saya butuh perhatian anda , mohon dimengerti ya :)'"
444849334350131200,2014-03-15 14:55:20,"b'Rsah mikirne aku ndak kpikiran ""@lintang_andamar: Mikirke koe je min:$""@PancalMatamu: Lha ijek do ngpo ""@lintang_andamar: Durung min:D'"
444849200455368704,2014-03-15 14:54:48,"b'Opo ? :o ""@AyuApril97: Ora isoh ek min -_- RT @PancalMatamu: Piye sing ora satnite an uwis do turu urung ?""'"
444848229394292736,2014-03-15 14:50:57,"b'Genah no , ora enek sing nandingi og ""@ManyunNya_Ardhi: @PancalMatamu sing unik paling ghur daerahmu paling min , :p""'"
444848037064474626,2014-03-15 14:50:11,"b'Haha enggak lah , cuma mau foto album aja kok disana :D ""@Yulinda_CR: Jam piro min? Mbayar ora? Nek mbayar aku wegah lho wkwk'"
444847760592760833,2014-03-15 14:49:05,"b'Lha ijek do ngpo ""@lintang_andamar: Durung min:D""@PancalMatamu: Piye sing ora satnite an uwis do turu urung ?""""'"
444847646931300352,2014-03-15 14:48:38,"b'Haha ,ng parkiran :D ""@Anindyaawsm: Jumpa fans jare :3 nng ngndi ne min :D""@PancalMatamu: Sesok admin e jumpa fans ng Balkam :D'"
444846758296686593,2014-03-15 14:45:06,"b'Sesok admine jumpa fans ng Balkam :D ""@Yulinda_CR: Akuuuu \\(^ \xe2\x8c\xa3^)/ ""@PancalMatamu: Pollowersku sing soko solo ngacung ?""""'"
444846616789266432,2014-03-15 14:44:32,"b'Sesok admin e jumpa fans ng Balkam :D ""@Anindyaawsm: Hadir \xd2\xa7 :D ;;)""@PancalMatamu: Pollowersku sing soko solo ngacung ?""""'"
444846482168897536,2014-03-15 14:44:00,"b'Di alam sana ? Haa ! ""@MalaLeria: @pancalmatamu sek min tak dongakne pacarku ben tenang di alam sana""'"
444846336915935232,2014-03-15 14:43:26,"b'Menowo unik ""@ManyunNya_Ardhi: @PancalMatamu sing panas ki koe kok min , mosok bengi"" kok panas min :o""'"
444846225959833600,2014-03-15 14:42:59,"b'Mending lgsg turu wae ""@JBXRL: @heyunet @PancalMatamu ayoh satnite an disek teros turu :D""'"
444839458261585920,2014-03-15 14:16:06,"b'Gek mantuk , udah malam ""@MalaLeria: @pancalmatamu durung min""'"
444839331362914304,2014-03-15 14:15:35,"b'Panas ? ""@ManyunNya_Ardhi: @PancalMatamu kene ora udan min ,""'"
444837733173698560,2014-03-15 14:09:14,b'Pollowersku sing soko solo ngacung ?'
444837494173880322,2014-03-15 14:08:17,"b'Lha kudanan ora ""@ManyunNya_Ardhi: @pancalmatamu wis muleh og min , :)""'"
444836151602335745,2014-03-15 14:02:57,b'Piye sing ora satnite an uwis do turu urung ?'
444836046706991106,2014-03-15 14:02:32,b'Piye sing satnite an wes do muleh urung ?'
444640940486316032,2014-03-15 01:07:15,b'RT @riya_ra: Khusus nggo cah racing. Nek koe uwes yakin milih urip neng dalan berarti koe yo wes rela nek nyawamu ilang neng dalan.'
444640103596834817,2014-03-15 01:03:56,"b'Ilmu sing akeh iso nggo ngentukne duit sing akeh, tapi duit sing akeh durung tentu iso nggo nuku il mu.'"
444639388992303104,2014-03-15 01:01:06,b'Duet sak yuto ijole gur kertu ijo nggo uas . Yws rapopo'
444397737660796928,2014-03-14 09:00:51,"b'Iyo no :p ""@BimaKoeswoyo: Lha iyo aku takok, opo kudu ngono min? RT @PancalMatamu: Lha piye lho ""BimaKoeswoyo: Opo kudu ngono min?'"
444348015797473280,2014-03-14 05:43:17,b'Lha po koe ki wes paling bener dewe kok kabeh tindakane wong mbok komeni .'
444346941896282112,2014-03-14 05:39:01,"b'Emoh ""@Nanazaar: @nanazaar @PancalMatamu tambah 2 2 nepo emoh =D @PancalMatamu Mugo sing jumatan tambah pahalane ora tambah baguse -_-""'"
444346746991165441,2014-03-14 05:38:14,"b'Lha piye lho ""@BimaKoeswoyo: Opo kudu ngono min? @pancalmatamu""'"
444345660104376320,2014-03-14 05:33:55,"b'Kepiye carane koe di percoyo wglio , wong kpercoyoane wglio wae mbok sia2ne terus .'"
444344941393633280,2014-03-14 05:31:04,"b'Ora sah ngenteni di ngerteni wglio , ngertenono awakmu dewe kui pngene kpiye'"
444344668159885312,2014-03-14 05:29:59,b'Seneng kui yen iso seneng bareng mbe koe .'
444344381969936385,2014-03-14 05:28:50,"b'Yen enek sing luwih sayang koe katimbang pacarmu , ojo lgsg ninggalne pacar . Menowo kui gur sayang sesaat'"
444343927412637696,2014-03-14 05:27:02,"b'Bagiku koe kui podo wae karo liya liyane , yen uwis ngroso bosen nglarani trus ninggalke . Wes apik tenan .'"
444343512394252288,2014-03-14 05:25:23,"b'Yen nyoto nyotone dee wes ora berharap karo mantan , kenopo dee iseh golek2 kabar ttg mantan. Tanda tanya besar lho kui bos'"
444342405412573184,2014-03-14 05:20:59,b'Mugo sing jumatan tambah pahalane ora tambah baguse -_-'
444053510616010752,2014-03-13 10:13:01,b'lambe-lambean !'
444052951234277376,2014-03-13 10:10:48,"b'orasahlah ngarani yen golek konco ojo milih-milih , ngomong wae yen asline koe ki ora duwe bolo kenthel !'"
444051784857047040,2014-03-13 10:06:10,"b'Mung siji penjalukku , ngertenono aku !'"
444050609277530112,2014-03-13 10:01:29,b'Yen dipikir-pikir aku mung nyikso awakku dewe .'
443928188742533120,2014-03-13 01:55:02,"b'Mergo koe , aku rela nunggu koe ampek sakiki. Mergo koe aku rela sakit hati .'"
443927655264845825,2014-03-13 01:52:55,b'pie koe wes siap ro aku urung ?'
443927233233977344,2014-03-13 01:51:14,"b'Galau mergo mikirne wajah , yaAllah yaAllah :D'"
443648786007461888,2014-03-12 07:24:47,"b'Peka kui ora soko wonglio sing gawe koe peka , peka kui soko kesadarane awakmu dewe .'"
443648203955511296,2014-03-12 07:22:29,b'Cuku meneng karo di sambi nyawang .'
443647973520465920,2014-03-12 07:21:34,b'Panase dino iki ora sebanding karo panase atiku .'
443386128029085696,2014-03-11 14:01:05,"b'Opone ? Jiwane mesti ""@LindaChe: @pancalmatamu jane yo kurang sehat sitik min""'"
443330838877335552,2014-03-11 10:21:23,b'Ngerti piye posisiku lan ngerti piye posisimu .'
443330677941874689,2014-03-11 10:20:44,b'Wis ora iso bertahan koyone .'
443330213296889856,2014-03-11 10:18:54,"b'Cemburu kui oleh , tapi opo yo kabeh wong mbok cemburuni ?'"
443329585069830144,2014-03-11 10:16:24,"b'Tenan e apik ?""@LindaChe: @pancalmatamu apik2 wae min :/""'"
443328878317015040,2014-03-11 10:13:35,b'Piye kabare sing seneng tapi blas urung nyobo ngungkapke ng wong sing di senengi ?'
442868759037239297,2014-03-10 03:45:14,"b""Cul no wae yen de'e wes wegah dipertahanke"""
442867499223490560,2014-03-10 03:40:14,"b'Cinta kok butuh perubahan, mbok kiro Nasdem ?'"
442865954775904256,2014-03-10 03:34:06,b'Cinta yo kudu saling memiliki. Ra memiliki yo ra komplit'
442865486490267648,2014-03-10 03:32:14,b'RT @LindaChe: Males tresno karo uwong sing ratau gagas roso tresnoku iki :/'
442865331829477376,2014-03-10 03:31:37,b'Sesuatu yang sangat menyenangkan kui yo ... Ngupil :D'
442864881835212800,2014-03-10 03:29:50,b'Percoyo kui ora segampang ngomong percoyo'
442864622656585728,2014-03-10 03:28:48,"b'Iyo2 rasah geger, cintaku mung nggo kowe :)'"
442864273803722753,2014-03-10 03:27:25,b'Wong sing biasane mbok sepelekne suk mben bakal e nyepelekne kowe genti !'
442863134605606912,2014-03-10 03:22:53,"b'rapopo kowe ora bales sayangku ora bales cintaku, kowe ngeki kabar ning aku wae wes cukup :)'"
442862162349154304,2014-03-10 03:19:02,b'Alhamdulillah admin e sukses kabeh :)'
442658792787152896,2014-03-09 13:50:55,"b'Bengi iki kangen koe , kelingan jaman semono.. seng yahmene gaene ngekon gek ndang bobok .'"
442654893955112960,2014-03-09 13:35:25,"b'wes bengi mblo , gek turu .'"
442591442087587840,2014-03-09 09:23:17,"b'RT @aprileamegga: Roso seneng kui bakal terus nambah pas koe ndue roso ikhlas lan tulus , mbuh kui piye keadaane .'"
442591370377584640,2014-03-09 09:23:00,b'RT @aprileamegga: Ijek eling ora pas pertama koe ngajak kenalan aku sampe akdwe jadian lan sampe akdewe pedotan ? Ijek ra!'
442591257987010560,2014-03-09 09:22:33,b'RT @aprileamegga: Sayang sih tapi pengen karo liyane (~_~)'
441906935361581056,2014-03-07 12:03:18,"b'Wes berlipat Gateli kui *eh ""@lintang_andamar: @PancalMatamu layo min, opo neh nek ngrebut yange uwong-_-""'"
441793113418264576,2014-03-07 04:31:01,"b'@KoniSBrotolaras Lugu to yow , lha yen ra lugu opo'"
441792990424879104,2014-03-07 04:30:31,b'@Missay14 Ra mudeng maksutmu :/'
441792774317162496,2014-03-07 04:29:40,"b'Kabeh ki wes ono sing ngatur , dadi tugasmu ki mung nglakoni , usaha lan ngibadah .'"
441792386599899136,2014-03-07 04:28:07,b'Wong sing bangga2ke awakedwe kui biasane ora enek sing mbanggakke .'
441792027047366656,2014-03-07 04:26:42,b'@KoniSBrotolaras Kok ngapusi'
441791498569269248,2014-03-07 04:24:36,b'Aku ki lho jek lugu :D'
441791339898732544,2014-03-07 04:23:58,b'Ngrakit cintaku ng atimu kui ora segampang ngrakit PC .'
441791138723147776,2014-03-07 04:23:10,b'Cari Muka kui yo termasuk Gateli lho ya .'
441790830521507840,2014-03-07 04:21:56,b'Pancen nelongso kui yo pas koe ora ngek i kabar ning aku . Mbok anggep opo ? :)'
441790427952209920,2014-03-07 04:20:20,b'@riya_ra Iyo leren terus kok'
441789984589115392,2014-03-07 04:18:35,b'Wong sing ngelengne sholat kalah karo wong sing ngejak sholat .'
441789753659117568,2014-03-07 04:17:39,"b'Iyo berhijab , iyo ayu , iyo sugih , tapi Gembede mu i lho .'"
441789387601223680,2014-03-07 04:16:12,"b'Kabeh kui mung nunggu wayah kok , wayahe koe seneng aku misale .'"
441789171376455682,2014-03-07 04:15:21,b'Ora usah koar-koar yen koe ki ayu we wonglio yo do iso nyawang kok ngger .'
441789008234831872,2014-03-07 04:14:42,"b'Ora usah ngekon wonglio dadi sosok sing Sempurna , tapi sadaro diri wae yen Uwong ki ora enek sing Sempurna .'"
441788647390474241,2014-03-07 04:13:16,b'Pas aku ijek koyo cah cilek kui tanggung jawabmu ngajari aku dewasa . Pas aku egois lan pngen menang dewe kui kwajibanmu ngajari aku ngalah'
441787969209237505,2014-03-07 04:10:34,b'Sing di pilih we wes kepilih wonglio .'
441787643001438208,2014-03-07 04:09:16,b'Iki lho admin e sing bar UKK Merakit PC @aprileamegga @aniiisaayu @Fadilarch Tetep mesem kok pize :)'
441787427024150528,2014-03-07 04:08:25,"b'Sengojo gawe cemburu pacar kui kadang perlu , nggo mbuktekke yen akdewe iki penting ora dinggo wonge .'"
441787189513293824,2014-03-07 04:07:28,"b'Pengen sih iso koyo liya-liyane , iso setia , iso sling perhatian , iso sling percoyo , iso manja2an . Tapi kui gur angan2ku ning koe .'"
441716595694399488,2014-03-06 23:26:57,b'@MalaLeria gDmorning too sayang. Nice day yak ({})'
441715736260526080,2014-03-06 23:23:32,"b'Pengen diucapne ""goodmorning"" seko followersku sing ayu-ayu lan sing bagus-bagus :)'"
441714692747055104,2014-03-06 23:19:24,b'RT @riya_ra: Ngomong kangen kui gampang banget cah SD yo iso. Yo gur bagi wektune nggo ketemuan kui lho sing angel ora kabeh uwong iso.'
441712855243431936,2014-03-06 23:12:05,b'Setia kui penting.Setia kui ora kudu nduwe yang luwih seko siji lho yo.Setia kui cukup koe njogo atine pasanganmu pas adoh seko koe.'
441712083386650624,2014-03-06 23:09:01,b'RT @riya_ra: Masalalu kui raperlu dilalekne. Seko masalalu awak e dewe iso belajar piye dadi uwong sing luwih apik ngger.'
441712063165890560,2014-03-06 23:08:57,b'RT @riya_ra: Sing mbiyen pas awal-awal pacaran ratau misuh-misuh bareng wes suwene pacaran ketok sing gaweane misuh-misuh. Enek!'
441712022502141954,2014-03-06 23:08:47,b'RT @riya_ra: Oposih gunane ngelok-ngelokne mantan neng sosmed. Pengen eksis? Pengen ketok wah? Opo malah pengen ngajak balen? hayo!'
441712000595275777,2014-03-06 23:08:42,"b'RT @riya_ra: Tuhan kui adil kok. Nek koe dadi uwong senengane sakpenak e dewe, Tuhan yo bakal sakpenak e dewe karo koe.'"
441478690266836992,2014-03-06 07:41:36,"b'Lha piye ""@lintang_andamar: weh yo ra ngono min:|""@PancalMatamu: Ora sah setia setia banget lah .""""'"
441473256453726208,2014-03-06 07:20:01,"b'Curhat ketok e""@pangessti: Bedo agama misale :\'( ""RT @pancalmatamu : Yo sori akdewe kan bedo , bedo selera misale""""'"
441469837257101312,2014-03-06 07:06:25,"b'Figthing nggo Republik TKJ , buktekno yen akdewe iso akdewe mampu :*'"
441469171348430848,2014-03-06 07:03:47,b'Ora sah setia setia banget lah .'
441468344458166275,2014-03-06 07:00:30,b'Sing di apik2 malah ngelek2 .'
441468251428499456,2014-03-06 07:00:07,"b'Dikek i elek yo emoh , wong sing apik we jek akeh kok'"
441467987002789888,2014-03-06 06:59:04,"b'Sing penting aku sayang e mung karo koe , yen menowo sayangmu ora gur ning aku . Aku rapopo'"
441467652922281985,2014-03-06 06:57:45,"b'Wg wedok sugih pngene karo wg lnang sugih , wg wdok mlarat pngene kr wg lnang sugih , lha trus wong lnang mlarat karo sopo ?'"
441467353893588992,2014-03-06 06:56:33,"b'Wong wedok milih2 ki jane ora popo , tapi yo sakwajare wae .'"
441467169260314624,2014-03-06 06:55:49,"b'Yo sori akdewe kan bedo , bedo selera misale'"
441466904473907200,2014-03-06 06:54:46,"b'Gelem no , geleman kok *eh'"
441451930615689216,2014-03-06 05:55:16,"b'Admin lagi di di sibukke karo UKK tgl 7,8,10 :/ semangat ndes!'"
441023442448441344,2014-03-05 01:32:37,b'Golek o cewek sing ayu mergo ayu seko turunan dudu ayu seko bedak lan dempulan.-Mario Teguh.'
440835830630711296,2014-03-04 13:07:07,"b'Miss yo miss , yen urung ketemu tetep miss !'"
440834549048557568,2014-03-04 13:02:01,b'Mbok yo ngoco awakmu ki kepiye ?'
440834419171917824,2014-03-04 13:01:30,"b'Yen genah genah koe ora arep ngapusi ngpo koe ndelik2 , hayo ?'"
440834204163506176,2014-03-04 13:00:39,b'Piye piye kok di lokne alay . Rumangsamu raimu kui ora alay ?'
439929712744206337,2014-03-02 01:06:31,"b'Nyepik ki gampang kok , cukup koe dadi awakmu dewe karo piye carane gawe nyaman gawe seneng .'"
439929335009390592,2014-03-02 01:05:01,b'Piye ? Kapan putus ? Ki lho aku ning kene nunggu koe putus .'
439929176758288384,2014-03-02 01:04:23,b'Terkesan norak .'
439929074186604544,2014-03-02 01:03:59,"b'Kabeh kui mau gur gari wong2ane sing njalani , mbuh kui lanang opo wedok we tetep do ndueni watak dewe-dewe .'"
439928812805967872,2014-03-02 01:02:57,"b'Tak kiro sok lungguhe ng pelaminan bareng aku , nyatane ? Yowes aku ikhlas .'"
439928485671227392,2014-03-02 01:01:39,b'Iyo ngerti yen iki minggu prei tapi aku ora pernah prei nggo kangen koe .'
439928313457299456,2014-03-02 01:00:58,"b'Karepe kok menang dewe , di kritik wonglio wegah geleme ngritik wong . Pagi cinta !'"
439733473033850880,2014-03-01 12:06:44,"b'iyoh , aku ngerti . . koe seng berkuasa , dadine opo"" aku seng dilampiaskan !'"
439732950742335488,2014-03-01 12:04:39,"b'aku ki yo duwe perasaan , ojo sakpenakmu dewe ! suk !'"
439388324424204288,2014-02-28 13:15:14,"b'Aku lagi galau , iki arep mlebu kamar mandi meh curhat karo ciduk'"
439387418559381504,2014-02-28 13:11:38,b'Ngno yo ngno ning ojo koyo ngno .'
439387117253181441,2014-02-28 13:10:26,"b'Inti soko pacaran ki mung saling ngenal , ora luwih .'"
438657320659087360,2014-02-26 12:50:29,"b'Bahagiaku mung karo koe , eh malah bahagiamu karo wonglio . Akupopo :('"
438644162355683328,2014-02-26 11:58:12,b'Urung sadar opo jan ora sadar yen koe ki asline Gateli banget *eh'
438643878346780673,2014-02-26 11:57:04,b'Opo blas ora enek sing ngek i perhatian koe to mbak ? Nganti kabeh coro di lakokne demi entok perhatian *angop*'
438643646703734784,2014-02-26 11:56:09,"b'Ndelalahe bribikanku iki koncone mantanku , yo orapopo . Malah iso reoninan kok :D'"
438643285850988544,2014-02-26 11:54:43,b'Sing pantes di pertahanke kui yo uwong sing mertahanke akdewe .'
438643146012889089,2014-02-26 11:54:10,b'Mungkin wae iki urung wayahe akdewe iso dadi sing akdewe karepke :)'
438642908866936833,2014-02-26 11:53:13,b'Sirikmu ki ketero banget yo mbak :p'
438638846490603520,2014-02-26 11:37:05,b'Piye kabare sing ijek etok-etok sayang karo pacare dewe-dewe ?'
438638571528781824,2014-02-26 11:35:59,"b'Nggo koe sing blas ora pernah gagas aku ning kene , ndang sholat + ndang maem yo :) Aku urung kesel bertahan nggo koe :)'"
438638162374426624,2014-02-26 11:34:22,"b""Saate mimin Sukoharjo 'Mig' meh curhat ning kene , sopo sing gelem ngancani ?"""
438628910520348673,2014-02-26 10:57:36,"b'Aku sadar ucapan maafku ora bakal iso nggantekne perjuanganmu , aku sayang koe !'"
438602564834439168,2014-02-26 09:12:54,"b""Penyanyi wong 2 jenenge 'duet' , yen wong 1 jenenge 'jomblo' , yen wong akeh jenenge 'tawuran' , :D"""
438587399296126976,2014-02-26 08:12:39,"b'RT @riya_ra: Tak pancing-pancing weh koe ora peka opomeneh tak pendem yo, meh dadi opo jal?'"
438587350730276864,2014-02-26 08:12:27,b'RT @riya_ra: Kadang pengen etok-etok ora nesu neng ngarepmu. Tapi aku durung iso.'
438587322284527617,2014-02-26 08:12:20,b'RT @riya_ra: Koe ora ngabari aku berarti podo wae koe ngek.i kesempatan aku nggo perlahan-lahan lungo seko uripmu.'
438586914057105408,2014-02-26 08:10:43,b'Sing biasane ngomong #AkuRopo terus ki malahan sing biasane atine kenek opo-opo terus.'
438248860285431808,2014-02-25 09:47:25,b'Selingkuhlah sebelum pacar anda selingkuh :p'
438237936715591680,2014-02-25 09:04:00,"b'Ojo koyo wong susah to , yen ditikung yo tikungen genti !'"
438236909513760768,2014-02-25 08:59:55,"b""Ealah wedok'an kok obral rono rene , murahan po ? sok e mong trimo gratisan :p"""
438236288433786880,2014-02-25 08:57:27,"b'Golek pacar ki ora mong gaco , kudu didelok sek njobo njerone ! kecuali kimcil hlo ya :D'"
437940027046510593,2014-02-24 13:20:13,"b'Mbayangne koe tok we , atiku wes ayem :*'"
437936753626726400,2014-02-24 13:07:13,"b'Sok reti! ""@acongkomenda: Aku reti perasaanmu bro @PancalMatamu: Ketok e sih ora ""@acongkomenda: Melek o, ngocono ndes , opo ono seng'"
437935181111242752,2014-02-24 13:00:58,"b'Aku seneng koe dudu mergo koe ganteng , tapi mergo koe lucu :)'"
437933698495692800,2014-02-24 12:55:04,"b'Ketok e sih ora ""@acongkomenda: Melek oo, ngocono ndes , opo ono seng gelem karo koe ? ""@PancalMatamu: ciye seng perhatian banget karo aku'"
437929854529724416,2014-02-24 12:39:48,"b'ciye seng perhatian banget karo aku , modus ora kuwi ?'"
437886771586936832,2014-02-24 09:48:36,"b'hay , aku seneng koe . . peka dong !'"
437885735098929152,2014-02-24 09:44:29,b'rupamu ngepas !'
437885517087375360,2014-02-24 09:43:37,b'hla kan koe gaene ngapusi @Fadilarch: yo tenan msok ngapusi PancalMatamu'
437873697932992512,2014-02-24 08:56:39,b'Ah tenane hloh yen koe sayang aku :D'
437863594286252032,2014-02-24 08:16:30,"b'Wong kok gur golek perhatian gen di perhatekke , blas ora enek sing merhateke to ? Duh ngenes'"
437862437576912896,2014-02-24 08:11:54,"b'Wong kok senengane drama , ojo-ojo uripmu mung drama slama iki ? Eh'"
437862191333535744,2014-02-24 08:10:56,b'Pacarku sabar banget tapi sekali gelo medeni . Hiii :D'
437861991370076160,2014-02-24 08:10:08,b'Sing wes gede ngelingne sing ijek cilek . Wajib!'
437861257698213888,2014-02-24 08:07:13,"b'Ora bermaksud nyakiti siji lan sijine , akdwe iso njogo prasaanmu kok cah *pelukerat*'"
437860806319804416,2014-02-24 08:05:25,b'Jenengan ten pundi ? Tesih kelingan kula to ? :('
437859960190271488,2014-02-24 08:02:04,"b'Mungkin urung wayahe , dadi lakoni sek wae ngko lak yo tekan .'"
437857962229379072,2014-02-24 07:54:07,"b'Ojo ngek i harapan ning aku , yen aku karo koe ora iso dadi awakdewe .'"
437857730879959040,2014-02-24 07:53:12,b'Aku ra penting og ya ? Sampe-sampe yen aku lungo ora tau mbok golek i :)'
437718703954989056,2014-02-23 22:40:46,"b'Pagi mblo , adus , sarapan , gek mencari ilmu yoh !'"
437576321229938688,2014-02-23 13:14:59,"b'opo kui @Aditya_km: Tambah sempeerr!!""PancalMatamu: Seng jenenge tresno i , krungu suarane we wes gembira + degdeg\'an .""'"
437575277259280384,2014-02-23 13:10:50,b'Sok ki do mudeng endi seng kenyataane blimbing seger karo blimbing BOSOK !'
437574567180390400,2014-02-23 13:08:01,"b'Nyantai wae sih yen aku , sakiki nikmatono posisimu seng lagi neng nduwur , lagi banggabanggane kok ya ? :D'"
437573562443235328,2014-02-23 13:04:01,"b'Nek guk soko cocotanmu we tak guyu tok no , karo mbaten ""ora ndue koco"" :D'"
437572832302997504,2014-02-23 13:01:07,"b'Nek gur soko cocotmu we tak guyu tok no , karo mbatin ""ora ndue koco"" :D'"
437571757642637312,2014-02-23 12:56:51,"b'Sakiki ngene wae , koe ngekon aku intropeksi seharuse koe barang intropeksi , ora mong cocotan seng digamblehne ! *suk !'"
437570782261444608,2014-02-23 12:52:58,"b""Seng jenenge tresno i , krungu suarane we wes gembira + degdeg'an ."""
437568734539288576,2014-02-23 12:44:50,"b'Aku wonge ora mulukmuluk sih , koe sms kosongan we aku wes seneng banget .'"
437568245743497216,2014-02-23 12:42:54,b'Ceritane lagi dilema :\\'
437395589463293954,2014-02-23 01:16:49,"b'Bila dia tertawa ingin rasanya aku menari , bila dia menangis ingin rasanya aku memeluknya .'"
437395207676776448,2014-02-23 01:15:18,"b'Aku mencintaimu , bukan hanya sekejab , bukan hanya sehari , tapi untuk selamanya :*'"
437394742788517888,2014-02-23 01:13:27,"b'Orasah nggagas cocotane wong liyo , penting aku padamu :*'"
437394334426873856,2014-02-23 01:11:50,b'Agenda yang salah !'
437374522245672960,2014-02-22 23:53:06,b'Intine saling njogo perasaan :) . Selamat pagi'
437208192708526081,2014-02-22 12:52:10,b'Enggak sesuai agenda !'
437132121568985088,2014-02-22 07:49:53,"b'dijail i genti noh @Anindyaawsm: Penak\'e di pieke min :D""PancalMatamu: wedok an jail . @Anindyaawsm: Min nek ganggu hub uwong kui artine wdo'"
436985698215006208,2014-02-21 22:08:03,b'Sopo seng yahmene ki wes enek seng nangekne kon sholat subuh ?'
436984709340741633,2014-02-21 22:04:08,"b""wedok an jail . @Anindyaawsm: Min nek ganggu hub uwong kui artine wdok'an opo ? :D PancalMatamu"""
436828863360806912,2014-02-21 11:44:51,"b'RT @aprileamegga: Aku ra mbok perhatekke , aku di perhatekke wonglio lho (~_~)'"
436828099833896960,2014-02-21 11:41:49,"b'RT @aprileamegga: Sabar mergo aku sayang , bertahan mergo aku cinta :D'"
436805470498861056,2014-02-21 10:11:54,b'kecewa saya !'
436805265569349632,2014-02-21 10:11:05,"b'hla pie hayo pie . @Anindyaawsm: Jare konco min ;( ah pie to ;(""PancalMatamu: mantan pacar jane . @Anindyaawsm: Konco po konco :$""PancalMata'"
436768000629555201,2014-02-21 07:43:00,"b'Pengen jajan Rnek seng dijak jajan , pengen curhat rnek seng dijak curhat , pengen dolan renek seng ngejak dolan , pengen nduwe kekancan nen'"
436741422000005120,2014-02-21 05:57:23,b'@Fadilarch Yo rapapa ben pinter :D'
436741198179348480,2014-02-21 05:56:30,"b'@Yulinda_CR Wkwk , GWS ya ndang mari mimik obat + maem e di atur . Kesehatanmu nomer siji lho ya :)'"
436740549907714048,2014-02-21 05:53:56,"b'@piiea_piieo Wegah mbok sawer kui , gelem e mbok kancani goyang :p'"
436740189541527552,2014-02-21 05:52:30,b'@Fadilarch PapahHamilPapah :D'
436739312311209984,2014-02-21 05:49:00,b'@Fadilarch Engko tak transfer'
436738944126836738,2014-02-21 05:47:33,"b'@LindaChe Oh , omahmu korea ? Korengan! yak e'"
436738791462559744,2014-02-21 05:46:56,b'@LindaChe Retimu ki opo ? Retimu kan gur aku'
436738692149829632,2014-02-21 05:46:33,"b'@Yulinda_CR Haha , ojo ndak seneng no ngko :p'"
436738432694382592,2014-02-21 05:45:31,b'@piiea_piieo Cobo takono karo rumput sing bergoyang wae :/'
