id,created_at,text
421920147436077057,2014-01-11 08:22:56,"b'Aku nyet gur koyo ngene , tapi aku bangga mergo aku dadi awakku dewe :)'"
421920136249868288,2014-01-11 08:22:54,"b'Malam mingguna mbi mimin wae :) ""@SaviraMegaOkta: aku always eleng B)""@PancalMatamu: Eleng koe ki jomblo rasah'"
421919767969034240,2014-01-11 08:21:26,"b'Kasian :D ""@SaviraMegaOkta: aku always eleng B)""@PancalMatamu: Eleng koe ki jomblo rasah sok sibuk malam mingguan mlam mingguan barang :p""""'"
421919501307748352,2014-01-11 08:20:22,"b'Kasih we ndue sayang , mosok koe ora ?'"
421919202467786752,2014-01-11 08:19:11,b'Eleng koe ki jomblo rasah sok sibuk malam mingguan mlam mingguan barang :p'
421918945084313600,2014-01-11 08:18:10,b'Oh iyo malam minggu og ya iki ? Mulane wes do sibuk dewe2 .'
421918676929884160,2014-01-11 08:17:06,"b'Yen pikir karo mlaku mesti nabrak , yowes tak pikir karo turu wae ben iso ngimpi . Menowo ketemu jodo :/'"
421917653435822080,2014-01-11 08:13:02,"b'Yen d ibaratke pelajaran , koe ki koyo rumus fisika simple tapi angel banget mahamine .'"
421917397021257728,2014-01-11 08:12:00,b'Tenan wes ra ngarep ? Yen jek terbukti koe nyestalk i TL ku piye ? *menungso'
421917063561506817,2014-01-11 08:10:41,"b'Ibarate njunjung sepur abote ra umum , hla iyo kui seabot nglalek e kenangane awakdewe .'"
421916620714295296,2014-01-11 08:08:55,b'Awan awan ngene iki penak e tuku es krim karo njejak ndase uwong ! Eh'
421916202043445248,2014-01-11 08:07:16,b'RT @LindaChe: Sekolah seprono seprene ora enek kemajuane blas. \nWes mending dodol2o cendol po opo kono lah !'
421915903240835072,2014-01-11 08:06:04,"b'Ojo nunggu sampe uwong percoyo karo koe , tp gawenen awakmu iso d percoyo karo uwong ))'"
421915857930166272,2014-01-11 08:05:54,"b'RT @LindaChe: Gagal pacaran truss mencari calon pacar baru, Tanpa takut gagal lagi. Biasa ? Biasa ! Banyak !'"
421914943231754241,2014-01-11 08:02:15,b'Yow sinau ojo ngecewak ne siji lan siji ne wae lah .'
421772129185431553,2014-01-10 22:34:46,"b'Pagi juga :) ""@LindaChe: Selamat pagiku dinggo admin @pancalmatamu wae lah :)""'"
421655220217593856,2014-01-10 14:50:13,"b'Tapi yowes ben ngno ngno yo koncoku , sak elek2e kono tetep konco ki ra iso d ubah .'"
421655007297929218,2014-01-10 14:49:22,b'Nyukupi kebutuhan sekolah we ra iso kok tapi yen kon nyukupi kebutuhan pribadi iso e nggo banget . Menungso kui !'
421654724144685056,2014-01-10 14:48:14,b'Aku alay yo mergo pengen ngimbangi konco2 ben rodo ketok eksis :D'
421654354265792513,2014-01-10 14:46:46,b'Sing di jogo we iso mrucut opo meneh sing ra dijogo .'
421654143380381697,2014-01-10 14:45:56,"b'Tresno kok di nggo dolanan , titenono sokben genti koe sing d nggo dolanan tresno .'"
421653775770603520,2014-01-10 14:44:28,"b'Yen wes ng cedakmu , ndemok tanganmu , natap matamu , aku wes ra iso ngelak nek asline aku yo sayang koe .'"
421653457414533120,2014-01-10 14:43:12,"b'Wongliyo yo iso nilai kok , endi sing apik lan endi sing mblusukke . Dadi yo ati2 o wae !'"
421653124281954304,2014-01-10 14:41:53,"b'Dari pada koe sibuk mikirne bribikan kono kene , mending ndang mikiro masa depanmu mulai saiki .'"
421652616536272896,2014-01-10 14:39:52,"b'Fokus , optimis , ngibadah , serius , nggo nempuh ujian2 sok . Eling koe wes meh lulus !'"
421652259169005569,2014-01-10 14:38:27,"b'Aku kok mbok padakke mereka2 , bedo !'"
421652004574736384,2014-01-10 14:37:26,"b'Mulai saiki atiku arep tak eman2 , wegah nrimo wong sing salah meneh ))'"
421651801486540800,2014-01-10 14:36:38,b'Bingung kui pas enek janji hangout mbe pacar karo dibutuhke konco curhat :/'
421651057177927680,2014-01-10 14:33:40,"b'Asik kok , tapi luwih asik koe dadi awakmu dewe :)'"
421650876155973632,2014-01-10 14:32:57,"b'Walaupun selama iki aku selalu ngalah , dudu berarti aku iso mbok apusi sak seneng atimu !'"
421650624858451968,2014-01-10 14:31:57,b'Mesti selalu enek kebaikan d balik kejujuran'
421648996013047808,2014-01-10 14:25:29,"b'Dadi bolo we iso sling perhatian , tapi yen wes dd pacar syo perhatian opo malah ora ya ?'"
421648569481711618,2014-01-10 14:23:47,"b'Mantanku di pek iki , bribikanku di pek kae , pacarku yo di pek kui . Kurang apik piye to aku ? :/'"
421644097762238464,2014-01-10 14:06:01,"b'Haha iyo yo :) ""@SaviraMegaOkta: waiyo.. karma iseh berlaku kok min:))""@PancalMatamu: Atine soko watu og yaa .. Haha :)'"
421620491128819712,2014-01-10 12:32:13,"b'Haha :) ""@aprilamaharani: yo wes ngaleo RT @PancalMatamu: Isohku yo gor ngene iki , yen kowe ora trimo yowis""'"
421620458266435584,2014-01-10 12:32:05,"b'Ora usah sok gemede kowe uduk sopo sopo , kowe urip nang donyo iki yo butuh wong liyo . Mudeng ra ?'"
421620389492424704,2014-01-10 12:31:48,"b'Haha :) ""@DewiDmurti: yo sory to min :D RT @PancalMatamu: Isohku yo gor ngene iki , yen kowe ora trimo yowis""'"
421620373927788544,2014-01-10 12:31:45,"b'Yo ojo mesakne :) ""@brinashabrinaa: Lha iyo to min, bacok wae bacook! RT @PancalMatamu Kowe kuwi gor ngei harapan terus . Pora kesel? Hah""'"
421617361615978496,2014-01-10 12:19:46,"b'Yaa bisa jadiii :) ""@IsmiNurulAzizah: Lak yo bener tho min :D""@PancalMatamu: Jamu kuat jare :) ""@IsmiNurulAzizah: Bar ngombe jamu'"
421617239930830848,2014-01-10 12:19:17,"b'Rausah sok manis nang ngarepku , nang mburiku we ngelek elek og , malah koyo ndasyee !! :)'"
421616798534864896,2014-01-10 12:17:32,b'Jare konco enek pas lagi dibutuhne? Hla ndi ? Ngapusi !!'
421616563775471616,2014-01-10 12:16:36,"b'Jamu kuat jare :) ""@IsmiNurulAzizah: Bar ngombe jamu kuat yo ra kesel:v""@PancalMatamu: Kowe kuwi gor ngei harapan terus . Pora kesel? Hah""""'"
421616492468113409,2014-01-10 12:16:19,"b'Atine soko watu og yaa .. Haha :) ""@SaviraMegaOkta: nyat ra due ati kok min""@PancalMatamu: Kowe kuwi gor ngei harapan terus . Pora kesel?'"
421614343801688064,2014-01-10 12:07:47,b'Kowe kuwi gor ngei harapan terus . Pora kesel? Hah'
421614226990329858,2014-01-10 12:07:19,"b'Isohku yo gor ngene iki , yen kowe ora trimo yowis'"
421611738551681024,2014-01-10 11:57:26,"b'Cielah seng lagi cemburu , sorry yaa uduk maksudku ngno kuwi ..'"
421284273451069442,2014-01-09 14:16:12,"b'Iya dongs :) ""@SaviraMegaOkta: eciyeh mimin gaul :D""@PancalMatamu: Yaa rapopolah mimin kan gaul mega :) ""@SaviraMegaOkta: sama'"
421281901010096128,2014-01-09 14:06:46,b'RT @aniiisaayu: I know i found you since the first time i saw you ~'
421281862321848320,2014-01-09 14:06:37,b'RT @aniiisaayu: Yaa tapi apa mau dikata jodoh emang bukan kita yang ngatur ~'
421281816616517633,2014-01-09 14:06:26,b'RT @aniiisaayu: Kita tidak pernah tau sampai kapan Tuhan memberi kesempatan pada kita untuk saling mencintai ~'
421281779027152897,2014-01-09 14:06:17,"b'RT @aniiisaayu: Saat kamu ingin melepaskan seseorang , ingatlah pada saat kamu ingin mendapatkannya ~'"
421281736442380288,2014-01-09 14:06:07,"b'RT @aniiisaayu: Saat kamu mulai tidak mencintainya , ingatlah saat pertama kamu jatuh cinta kepadanya ~'"
421281694922977280,2014-01-09 14:05:57,b'RT @aniiisaayu: Percintaan akan berakhir manis jika tetap mempunyai kepercayaan dan pengertian ~'
421281643278524416,2014-01-09 14:05:45,"b'RT @aniiisaayu: Saat kamu mulai bosan dengannya , ingatlah saat terindah bersamanya ~'"
421277836486258691,2014-01-09 13:50:37,b'Aku ijek isoh sabar kok ngadepi kowe kowe kuwi bro meskipun aku loro ati tapi ijek isoh tak emmpet :)'
421275823291633664,2014-01-09 13:42:37,"b'Iya makasih shinta :)  ""@Shintaa03_: Selamat malam min :) RT @PancalMatamu: Selamat malam guys , ucapin mimin selamat malam dongs :)""'"
421275436933324800,2014-01-09 13:41:05,"b'Yaa rapopolah mimin kan gaul mega :)  ""@SaviraMegaOkta: sama sama:)) tumben pke namaku min:D""@PancalMatamu: Makasih mega'"
421274478581014528,2014-01-09 13:37:17,"b'Iya makasih :) ""@wydlst: selamat malam :\')) RT @PancalMatamu: Selamat malam guys , ucapin mimin selamat malam dongs :)""'"
421274390332858368,2014-01-09 13:36:56,"b'Makasih :)  ""@lailatul_H: malam min :) ""@PancalMatamu: Selamat malam guys , ucapin mimin selamat malam dongs :)""""'"
421274305297534976,2014-01-09 13:36:35,"b'Makasih mega :) ""@SaviraMegaOkta: malam min:))))""@PancalMatamu: Selamat malam guys , ucapin mimin selamat malam dongs :)""""'"
421274191329910784,2014-01-09 13:36:08,"b'Makasih :) iyoiyo min perhatian banget :) haha ""@jareenok: bengi min. jok turu mbengi2 yo :))'"
421273500481896448,2014-01-09 13:33:24,b'Dadi uwong wi ojo lebay ojo alay ndak wong seng nang cedakmu malah gilo nametne kowe :)'
421271159733112833,2014-01-09 13:24:05,"b'Selamat malam guys , ucapin mimin selamat malam dongs :)'"
421261305517846528,2014-01-09 12:44:56,b'Aku mudeng kowe ayu kowe ganteng tapi percuma yen atimu ora seganteng ora se ayu rupamu ..'
421261288103104512,2014-01-09 12:44:52,"b'Aku ijek isoh ngguyu kok tenang wae , aku ora lemah koyo kowe kowe kuwi ~'"
421259027503271938,2014-01-09 12:35:53,"b'Aku yo gor wong biasa kok , saksakmu yen ameh ngelokne aku alay lebay karo opo kuwi aku ijek terimo yo gor tak kuatkuatne wae :)'"
421258704499920897,2014-01-09 12:34:36,"b'Yoben aku dilokne alay , lebay atao apapun kuwi , aku ijek tetep sabar kok ~'"
420823638586048512,2014-01-08 07:45:48,"b'RT @aprileamegga: Urung pengen serius sih , tapi sejauh iki niatku apik :)'"
420823579446366208,2014-01-08 07:45:34,"b'RT @aprileamegga: Ora perlu ngrungokke omongan uwong , wong sing njalani we awakdwe cah loro kok :)'"
420823462978928640,2014-01-08 07:45:06,"b'RT @aprileamegga: Mbuh sok endinge piye , sing penting saat iki aku nyaman :*'"
420506584922324992,2014-01-07 10:45:57,"b'Pengen sih koyo liya liyane , iso longlast mbe pasangane dewe2 . Tapi yen wes ra gatuk opo yo meh lanjut :/'"
420505073899171840,2014-01-07 10:39:56,b'Ojo berharap lebih ng wong sing ra pernah ngharap koe :))'
420504623351205889,2014-01-07 10:38:09,"b'Aku ngerti kok , koe koe kui lagi seneng2e lg kasmaran2e . Tapi yo eleng hubungan msti enek pait e . Sore {}'"
419647785508405248,2014-01-05 01:53:23,"b'Oleh ? ""@Bayuu_CM: @PancalMatamu Min oleh curhat ora ?""'"
419642059952107520,2014-01-05 01:30:38,"b'Sing penting aku ra ganggu hubunganmu , nek misale hubunganmu rusak yo dudu goro2 aku . Fak !'"
419641039469555713,2014-01-05 01:26:35,"b'Ra cfd an kok mimin , ndak eksis ngko bingung *angop'"
419640686535639040,2014-01-05 01:25:10,b'Selamat pagi haters :)'
419640685663248384,2014-01-05 01:25:10,b'Selamat pagi fans :)'
419474156493623296,2014-01-04 14:23:27,b'Ben rapopo loro ati tapi yo tetep ngguyu yoo ..'
419462073941114880,2014-01-04 13:35:26,"b'Tambane opo? :) ""@semprol_warwer: @pancalmatamu digowo ng puskemas wae ben di tambani :)""'"
419462015657066496,2014-01-04 13:35:12,"b'Sama dong kayak aku . Mimin juga dirumah kok :) ""@kholifah_nur58: Di rumah minn-___-'"
419461933708754944,2014-01-04 13:34:52,"b'Bener opo? ""@semprol_warwer: @pancalmatamu koe bener""'"
419461903560089600,2014-01-04 13:34:45,"b'Promo opo? ""@Sak_Isomu: @PancalMatamu nyok promo""'"
419459347500900352,2014-01-04 13:24:36,"b'Cemburu mbi spo min? ""@aniiisaayu: Huuu aku cemburrruuuu \xe2\x98\xb9""'"
419459218941280256,2014-01-04 13:24:05,b'Isohne yo gor sambat terus tapi raenek usahane . Huh dasar'
419458693797654528,2014-01-04 13:22:00,"b'Siap :) ""@topanPG7: oke nde RT @PancalMatamu: Kowe kudu isoh move on ojo gor galau terus iki uwis taun ayar seng mbiyen yo mbiyen . Oke !!""'"
419458630258139137,2014-01-04 13:21:45,"b'Berarti opo? ""@semprol_warwer: @pancalmatamu #waniperih berarti min :-D""'"
419458558237765632,2014-01-04 13:21:28,"b'Nah opo? ""@aprilamaharani: nah iki RT @PancalMatamu: Yo emang kowe ganteng tapi atimu ora seganteng rupamu""'"
419458487307874304,2014-01-04 13:21:11,"b'Haha iyo mudeng tp loro atine kuwi :( ""@semprol_warwer: @pancalmatamu seg sabar min jodoh wes ono sek ngatur :)""'"
419458010360995840,2014-01-04 13:19:17,"b'Selamat malam guys , malam minggu kemana nih? Temenin mimin yak ..'"
419457506633474048,2014-01-04 13:17:17,"b'Yen kowe emang seneng mbi de e rapopo kok , aku yo melu seneng meskipun akune loro ati .. :('"
419448018362826753,2014-01-04 12:39:35,b'Yo emang kowe ganteng tapi atimu ora seganteng rupamu'
419446777603837952,2014-01-04 12:34:39,b'Kowe gor ngei harapan terus opo kowe rakesel ngno kuwi?'
419445948146667521,2014-01-04 12:31:21,b'Kowe kudu isoh move on ojo gor galau terus iki uwis taun ayar seng mbiyen yo mbiyen . Oke !!'
419269467374239745,2014-01-04 00:50:05,"b'Nggak juga min :) yee  ""@LindaChe: @pancalmatamu baru bangun ya min :D""'"
419253507678433281,2014-01-03 23:46:40,"b'Gagas kok sing ra gagas , wong sing gagas we antri kok :/'"
419253274370260992,2014-01-03 23:45:44,"b'Yen urepmu gur sibuk golek sing sempurna , mending leren gek ngoco o disek . Menowo sadar :)'"
419252875538100224,2014-01-03 23:44:09,b'Ojo etok2 cinta mbe aku mergo cinta kui ra iso diapusi :)'
419252547073736704,2014-01-03 23:42:51,b'Yen kon mileh pileh dd penghibur po penyemangat ?'
419252248720338944,2014-01-03 23:41:40,"b'Rasah sok gembede lah nggo kabeh wae , ilingo bondo kui mung titipan .'"
419251848151695360,2014-01-03 23:40:04,"b'Pas aku urung ndue pacar we koe ra peka ra ngrespon aku , pas iki aku wes ndue ehh malah koe ngrespon aku *hlo lak yo labil to'"
419251528587702272,2014-01-03 23:38:48,"b'Mungken koe iso ngguyu ng ngarepku , tapi aku reti asline atimu ki perih e koyo piye :/'"
419251330243244032,2014-01-03 23:38:01,"b'Esok2 wes miker koe sing wingi tak sia2ne , yowes sori jenenge ati ra iso dipekso :('"
419251032678354944,2014-01-03 23:36:50,"b'Pagi jg ""@LindaChe: Selamat pagi :) @pancalmatamu""'"
419250654037544961,2014-01-03 23:35:19,b'Morning sing urung tangi :)'
419063228384022528,2014-01-03 11:10:34,"b'Jenenge ardiwardhana ga  ""@aprileamegga: Msok ? Haha sp ?""@aniiisaayu: Ga enek seng promote @PancalMatamu peng 25 nde .. Haha'"
419061698205478913,2014-01-03 11:04:29,b'Kono kono admine @PancalMatamu 3 rekaat sek .. Oke !!'
419060977435303937,2014-01-03 11:01:37,"b""RT @asusekalii: Enek sing ngomong aku elek , Enek\nsing ngomong aku pekok ,Tapi yoweslah penting 'AkuSihCuek!'  follow @PancalMatamu"""
419014451216392192,2014-01-03 07:56:44,"b'Hee ayo geg follow @asusekalii , geg ndang di follow yoo ..'"
419012368757039104,2014-01-03 07:48:28,"b'Kowe emang nduwe kelebihan tur kowe yo nduwe kekurangan , kekuranganmu gor 1 kowe randuwe ati seng apik koyo kelebihanmu kuwi ...'"
419011395544301568,2014-01-03 07:44:36,"b'Saiki karo mbiyen kuwi bedo , misale mbiyen kowe cedak mbi aku yen saiki ? Mbuh !!'"
418898319549546497,2014-01-03 00:15:16,"b""Pagi guys , semangat hari jum'at yaa :)"""
418786082734362624,2014-01-02 16:49:17,"b'Mange kudu isoh perih opo sih ?  ""@semprol_warwer: @pancalmatamu kudu biso po kudu perih min ?""'"
418785731171987456,2014-01-02 16:47:53,"b'Emang sih loro , tapi yo piye meneh kuwi emang uws akhire og'"
418785356662579200,2014-01-02 16:46:24,"b'Ati emang loro , tp yo kudu isoh ngilangne kabeh kuwi :) ""@thya_mrz: Ojo sedih hlo min :p""@PancalMatamu: Yen kowe emang'"
418785185979584512,2014-01-02 16:45:43,"b'Yo kudu :) ""@semprol_warwer: @pancalmatamu wani perih berarti min :-D""'"
418784678141636608,2014-01-02 16:43:42,"b'Aku yo nduwe perasaan , perasaanku yo isoh kesel mergo nunggu kowe nganti peka . Kesuwen'"
418783720120655873,2014-01-02 16:39:54,b'Aku emang wong biasa tapi atiku seng dinggo kowe luar biasa banget'
418783463257280512,2014-01-02 16:38:52,"b'Ojo ngampe nglarani atine uwong , yen isoh diempet wae ~'"
418783168028635136,2014-01-02 16:37:42,"b'Emang seng seneng kowe kuwi ora gor aku tok wong liyo yo isoh seneng mbi kowe , tapi peh kowene disenengi uwong yo ojo nyepelekne ..'"
418782769750110208,2014-01-02 16:36:07,"b'Yo yen kowe memang seneng kuwi hakmu tur kuwi yo perasaanmu , wes to ungkapno wae ndak selak di pek uwong loh . Oke'"
418782431005536256,2014-01-02 16:34:46,b'Yo ngno kuwilah kudu peka kudu paham ~'
418782271089287168,2014-01-02 16:34:08,b'Yen kowe emang seneng mbi de e yowislah rapopo kok aku ~'
418658833901187072,2014-01-02 08:23:38,"b'Kat mbiyen ""@aprileamegga: @PancalMatamu Admin.mu do edan @aniiisaayu @riya_ra""'"
418658678212792320,2014-01-02 08:23:01,"b'Wkwk , wait ""@Bayuu_CM: polbek now min , jare bolo ku :D @PancalMatamu @riya_ra""'"
418648275583905792,2014-01-02 07:41:41,"b'Di folbek ra ki :D ""@Bayuu_CM: @riya_ra @PancalMatamu kui sopo rii ??""'"
418433097273585665,2014-01-01 17:26:39,"b'Rausah seneng maksute ""@semprol_warwer: @pancalmatamu rausah opo min ?""'"
418432786563727360,2014-01-01 17:25:25,"b'Madang to yo :) ""@harii_mhukti: Aku lueeeeee ""@PancalMatamu: Sopo ki seng ijek tangi ? Mimin durung isoh turu :( ~""""'"
418430300855603200,2014-01-01 17:15:32,b'Tahun baru membuka lembaran baru yang baik semangat baru dan cinta yang baru . Jreeeng jreeng'
418429997003468800,2014-01-01 17:14:20,"b'Ternyata sifatmu seperti itu to baru tau aku , mendingan rausah waelah'"
418429619272822784,2014-01-01 17:12:49,"b'Nangndi ? ""@alifah_evida: Ngiyup min nek panas :D""@PancalMatamu: Niatku ameh manas manasi kowe ehh malah aku seng kepanasan . Siall \xe2\x98\xb9""""'"
418429436321492992,2014-01-01 17:12:06,b'Sopo ki seng ijek tangi ? Mimin durung isoh turu :( ~'
418426876168634368,2014-01-01 17:01:55,b'Selamat malam Januari ~'
418424724121595904,2014-01-01 16:53:22,b'Semangat baru menn ojo nglokrolah !!'
418424383695122433,2014-01-01 16:52:01,b'Niatku ameh manas manasi kowe ehh malah aku seng kepanasan . Siall \xe2\x98\xb9'
418417017322893312,2014-01-01 16:22:45,"b'Mulai soko Nol ""@thya_mrz: Pengenku yo ngno, tapi angel""@PancalMatamu: Mulai mundur secara teratur ~""""'"
418416900545064960,2014-01-01 16:22:17,"b'Makasih :) ""@SaviraMegaOkta: Good night kak:D""@PancalMatamu: *gdnight admin* ngucapke dewe we ya , salae ra enek sing ngucapke . Wkwk :/""""'"
418405624490119169,2014-01-01 15:37:29,"b'Kepekso we :D ""@alifah_evida: Gnight min, tak ucapke :) :D""@PancalMatamu: *gdnight admin* ngucapke dewe we ya , salae ra enek sing'"
418404660559347713,2014-01-01 15:33:39,"b'Wkwk , gdnight to ""@Garin_Nicosylva: @PancalMatamu gdnight min :))""'"
418404400936132608,2014-01-01 15:32:37,"b'Anu opo lho ""@AldonnaRP: Wong sing anuu\xe2\x99\xa5 hehe"" @PancalMatamu: Ning tahun sing anyar iki pengen ketemu sp ? *kepositik""'"
418404191405502466,2014-01-01 15:31:47,"b'Rasah kek.i rem naknu ""@waonedwi93: Pengen tak gaspol tp malah direm ""@PancalMatamu: Ning tahun sing anyar iki koe pengen opo ? *kepositik""""'"
418402635452919810,2014-01-01 15:25:36,"b'Kalo mau bobok jangan updet tapi berdoa , updet gak bisa jaga tidur kamu . Inget !'"
418402349665628160,2014-01-01 15:24:28,"b'*gdnight admin* ngucapke dewe we ya , salae ra enek sing ngucapke . Wkwk :/'"
418402106882551809,2014-01-01 15:23:30,b'Adminnya gak bisa bobok kalo gak di kelonin followers *eh'
418401592119799808,2014-01-01 15:21:27,b'Mungken de e wes entok sing luwih soko aku lan luwih gawe de e seneng :)'
418401274845868033,2014-01-01 15:20:12,"b'Ben ngerti piye rasane dicueki ki koyo ngopo , yowes renungono dewe :)'"
418400971245383680,2014-01-01 15:18:59,"b'Sing harapan palsu leren sek yo , harapan pasti ameh lewat .'"
418400770124292097,2014-01-01 15:18:11,"b'Aku sadar aku iki spmu , dadi aku ra pantes cemburu lan ra pantes nglarang2 :)'"
418400517174222848,2014-01-01 15:17:11,"b'Cintai aku seutuhnya , bukan sebutuhnya !'"
418400232431312896,2014-01-01 15:16:03,"b'Sing ngomongne tahun baru uwes wae yo , ngomongne hubungane awakdewe sek wae :D'"
418399984749256704,2014-01-01 15:15:04,b'Ning tahun sing anyar iki pengen ketemu sp ? *kepositik'
418399770273529856,2014-01-01 15:14:13,b'Ning tahun sing anyar iki koe pengen opo ? *kepositik'
418399630351536128,2014-01-01 15:13:40,"b'Ngewish ng TL rpp sih , tp luwih apik ngewish ng atine dewe2 .'"
418399344794927104,2014-01-01 15:12:31,"b'Yowes dinggo pelajaran wae lah , mugo ora ngulang mneh ning tahun sing anyar iki .'"
418399075013107714,2014-01-01 15:11:27,"b'Tahun baru yo kudu semangat baru , ora gur pacar baru wae sing dipikir :p'"
418398846830407681,2014-01-01 15:10:33,b'Selamat malam twips *ambungloroloro'
418083678497943552,2013-12-31 18:18:11,"b'Seng lagi galau , galaune dipending sek wae iki kan taun baru di gawe have fun yaa , lanjut galau yen bar taun baru ..'"
418082818825003008,2013-12-31 18:14:46,b'Happy new years admin @PancalMatamu cc : @riya_ra @aniiisaayu @aprileamegga @Fadilarch @LindaChe sukses buat kalian semua ... :)'
418082491249852416,2013-12-31 18:13:28,b'Kurang so sweet piye to aku ? Wes ngucapne selamat taun baru nhu :)'
418081500639137792,2013-12-31 18:09:31,b'Iki uwis taun anyar loh yaa seng ijek galau weslah ditinggalne wae .. Oke'
418069459749068801,2013-12-31 17:21:41,b'Biarpun nggak punya pacar kumpul kumpul sama teman jadii .. Haha'
418056631570530306,2013-12-31 16:30:42,"b'Taun baru rakudu karo pacar kok , karo konco utowo sedulur yo isoh ..'"
417933813495635968,2013-12-31 08:22:40,"b'Yaampun udah taun baru nih masih sedih aja , semangat dong menyambut taun yang baruu .. Yuhuuu ~'"
417933724156571650,2013-12-31 08:22:19,b'Wahai angin sampaikan salam rinduku kepada dia yaa . Aku tunggu :) ~'
417930586800398336,2013-12-31 08:09:51,b'Suatu saat para jomblo akan mempunyai pasangan . Wait yaa :)'
417930063884333056,2013-12-31 08:07:46,b'Emang seng oleh taun barunan gor seng nduwe pacar tok ? seng jomblo yo oleh kok tenang wae . Have fun yaa :)'
417928283578044416,2013-12-31 08:00:42,b'Malam tahun baru kalian sama siapa guys ? :)'
417904202136834049,2013-12-31 06:25:00,"b'RT @Kim666hails: Hasprekk""@PancalMatamu: Pengen jane iso ngrasakne malem tahun barunan mbi pacar, neng piye meneh koncoku ra enek sing gele\xe2\x80\xa6'"
417902668623802368,2013-12-31 06:18:55,"b'Pengen jane iso ngrasakne malem tahun barunan mbi pacar, neng piye meneh koncoku ra enek sing gelem njilehne pacare kok :('"
417902027134349312,2013-12-31 06:16:22,"b'RT @riya_ra: Lha nggo ngopo selama iki aku selalu lapor kabeh tentang aktivitasku yen nyatane aku ra mbok percoyo :""'"
417901980233650176,2013-12-31 06:16:11,"b'RT @riya_ra: Asline nduwe yang, tapi malem tahun baru ra iso diajak metu !'"
417901909614137344,2013-12-31 06:15:54,"b""RT @riya_ra: Orangnya cantik, berpendidikan, berhijab pula. Tapi sayang sering ngatain orang pake kata 'bang*at'. Percuma."""
417901842928914432,2013-12-31 06:15:38,b'RT @riya_ra: Aku emang ijek nduwe akeh banget kekurangan tapi sak orane aku ora terus-terusan menonjolkan kelebihanku.Catet!'
417901812234985474,2013-12-31 06:15:30,b'RT @riya_ra: Followersku mungkin ora seokeh followersmu mbak. Tapi sorry lho ya aku ra koyo koe. Aku ra pernah ngeunfoll uwong sing ngefoll\xe2\x80\xa6'
417898050929971200,2013-12-31 06:00:34,"b'Dosolah , berarti kuwi orang ketiga dong .. Tapi aku gag mudeng deng  ""@aprilamaharani: sak'"
417898022438043648,2013-12-31 06:00:27,"b'Aku sih , tapi aku ora butuh banget kok  ""@dheaanwari: Takono dewe, sing butuh sopo jal?:p""@PancalMatamu: Batman dong :)'"
417896090466533376,2013-12-31 05:52:46,"b'Engga , males banget ""@riya_ra: mau ikut engga? ban motorku masih kosong lho RT @PancalMatamu: Haha bagus bagus'"
417883613104185344,2013-12-31 05:03:11,"b'Boleh silahkan :) ""@wydlst: berti ak curhat oleh? RT @PancalMatamu: Seriusan ""@wydlst: tenane? RT @PancalMatamu:'"
417883418811441152,2013-12-31 05:02:25,"b'Batman dong :) ""@dheaanwari: Lha we takok aku, aku kon takok sopo?-_-""@PancalMatamu: Kenopo pas akune lagi'"
417883287592636416,2013-12-31 05:01:54,"b'Haha bagus bagus tingkatkan :) ""@riya_ra: rumput disana sudah panjang2 waktunya buat dicabutin RT @PancalMatamu: Ngapain?'"
417880164765159425,2013-12-31 04:49:29,b'Kenopo pas akune lagi sayang banget mbi kowe tapi kowene malah ngno kuwi ?'
417877187182993408,2013-12-31 04:37:39,"b'Ngapain? ""@riya_ra: Ayo besok ke Gantole :)""'"
417877107717316608,2013-12-31 04:37:20,b'Cewe kuwi rabutuh janji butuhe buktii menn !!'
417876986787135489,2013-12-31 04:36:52,b'Kowe ngmong isoh setia trus kowe ngomong isoh cinta tapi ndi buktine ? Syiit'
417815224624742400,2013-12-31 00:31:26,"b'Seriusan ""@wydlst: tenane? RT @PancalMatamu: Yen kowe lagi butuh konco curhat aku enek og nang sampingmu . Tenang wae""'"
417796844325208064,2013-12-30 23:18:24,"b'Sak polahpolahmu bro , gor tak tonton karo tak guyu tok .. Haha'"
417796473795780608,2013-12-30 23:16:56,"b'Kowe enek pas lagi seneng , trus pas lagi susahe kowe nangndi? Hah tipiss'"
417796177002647553,2013-12-30 23:15:45,b'Loh sorry ya aku yo nduwe kepentingan seng liyane ora gor ngagas kowe tok ..'
417795786554871809,2013-12-30 23:14:12,"b'Sitik sitik kudu laporan kowe , emang kowe komandan opo ? Males banget'"
417795586960945152,2013-12-30 23:13:24,b'Gdmorning guys siap beraktifitas lagi?'
417795400306020352,2013-12-30 23:12:40,b'Kowe dadi uwong wi biasa wae ora usah sok Istimewa malah kesane nggilani . Mudeng ra?'
417703984749486080,2013-12-30 17:09:25,b'Kowe peka oo sitik yen kowe kuwi lagi tak senengi . Mudeng ra?'
417701061344768001,2013-12-30 16:57:48,"b'Haha :) ""@SaviraMegaOkta: Well(y)""@PancalMatamu: Iya kalle aku suruh nungguin kamu . Males banget masih ada yang lain meennn""""'"
417700827512328192,2013-12-30 16:56:52,"b'Kowe cuek aku soyo cuek bro , kowe nduwe pacar aku yo isoh nduwe pacar !! Yora ?'"
417700477887733762,2013-12-30 16:55:29,b'Iya kalle aku suruh nungguin kamu . Males banget masih ada yang lain meennn'
417700320173494272,2013-12-30 16:54:51,b'Jare kowe berpendidikan men tapi kok omonganmu koyo wong ora berpendidikan . Dasar akamsoo'
417699988919971841,2013-12-30 16:53:32,b'Yen kowe lagi butuh konco curhat aku enek og nang sampingmu . Tenang wae'
417696620000444417,2013-12-30 16:40:09,b'Ya Allah dongoku seng dinggo sesok lancar kabeh . Amiin'
417696278261157888,2013-12-30 16:38:47,"b'Aku bingung aku kudu piye , ngene salah ngno salah padahal aku sayang mbi kowe ..'"
