id,created_at,text
559379416447328256,2015-01-25 15:57:00,"b'Panginten salira g\xc3\xa9 \xc3\xa9mut, waktos harita urang tepang munggaran di patamanan. Di papa\xc3\xa9s endahna malati nu karembangan. #Galura'"
559378939332681728,2015-01-25 15:55:06,"b'Salira jeung rasa tos lami ngancik dina ieu diri, rasa nu matak teu genah lamun kedah di sideum deui. #Galura'"
559378588877598722,2015-01-25 15:53:42,"b'Haturan salira, ratu nu ngancik dikaraton hate kuring. Bulan nyacas endah pisan nalika kuring ngedalkeun rasa dina ieu seratan. #Galura'"
558274039131561985,2015-01-22 14:44:37,"b'Horeng kieu ai micinta, mun pajauh batin sok rajeun kasiksa. Gening kieu ari misono, teu patepung karaos peurahna beuki nyoco. #Galura'"
558273427472015360,2015-01-22 14:42:11,"b'Bray beurang ngabarungsinang, reup peuting pikir parusing. Ukur bisa ngahariring, ngahaleungkeun lagu asih meh teu rarungsing. #Galura'"
558271808286109697,2015-01-22 14:35:45,"b'Waktos harita kuring keur anteng nyawang,imut salira nembongan mawa kamelang. Iraha atuh urang patepang? Nyinglarkeun rasa hariwang #Galura'"
558270968095719424,2015-01-22 14:32:25,"b'Najan teu kedal ieu hate moal beunang dibobodo, rasa sono ku teu weleh ngadodoho, keur salira panutan nu diantos tibareto. #Galura'"
557916952685842432,2015-01-21 15:05:41,"b'Mugi cinta urang nyangking kalanggengan, urang pupusti najan ukur dina impian. Bagea salira kembang harepan. #Galura'"
557914481712300033,2015-01-21 14:55:52,"b'Waktos silih simbeuh ku kadeudeuh, karaos nyaah beuki pageuh. urang duaan rerendengan, endah bagja sanajan ukur lamunan. #Galura'"
557913326970105856,2015-01-21 14:51:17,"b'Dina jemplingna peuting diri nyorangan ngumbar lamunan, mentang sawangan pinuh harepan, tur kagambar urang duaan papacangan #Galura'"
557771793130610688,2015-01-21 05:28:53,"b'RT @DulurBDG: Ieu mah di penta kejujuran na we, ulah ngabohong nya. Dosa, ai korek aing kamana @galura_rasa ? :('"
557771770879803392,2015-01-21 05:28:47,"b'Mening aa ameng we kadieu, aya kopi waemah ""@SEBAGAI_WEAR: Jang @galura_rasa mending nyeuri manah, atau mending titajong cingir suku'"
557588348366123009,2015-01-20 17:19:56,"b'Ieu bah kacandak, tapi bohong""@DulurBDG: Ieu mah di penta kejujuran na we, ulah ngabohong nya. Dosa, ai korek aing kamana @galura_rasa ? :(""'"
557586160390647811,2015-01-20 17:11:14,b'Naha kamana atuh jungjunan ? Piraku lali kanu lagu asih ti jayagiri. Nu sok ku urang dihariringkeun bari suka seuri. #Galura'
557585014120914944,2015-01-20 17:06:41,"b'Kiwari asih ngan kari ciri, lami ngahiji mawa kanyeri. Salira gening sulaya, megatkeun cinta nu nyesa ukur cimata. #Galura'"
557584902963490816,2015-01-20 17:06:14,"b'RT @ilhamsrhrynt: Sakantenan dikawihan ku @galura_rasa :( ""@SUPIRangkot420: Mun teu dikecapi suling ku wa @ALDO_ROJAX :(( RT@ilhamsrhrynt: \xe2\x80\xa6'"
557584783367086080,2015-01-20 17:05:46,"b'RT @arull_yansyah: Ya allah tolong ampuni temenku ini ""@SUPIRangkot420: Jang @galura_rasa si dia teh kan bidan~ trus di sekil ku anak mobil\xe2\x80\xa6'"
557584748122357761,2015-01-20 17:05:38,b'RT @ForumBsunda: #SundaMaju #NyundaSauyunan #NyundaSalawasna cc: @suling_koneng @BarayaSunda_ @SundaMaju @galura_rasa @NonomanSunda http://\xe2\x80\xa6'
557584727691902977,2015-01-20 17:05:33,"b'RT @BarayaSunda_: ""@ForumBsunda: #SundaMaju #NyundaSauyunan #NyundaSalawasna cc: @suling_koneng @BarayaSunda_ @SundaMaju @galura_rasa  http\xe2\x80\xa6'"
557584206109237248,2015-01-20 17:03:28,"b'Kamana, teuteup anjeun nu baheula. Biasana narembongan, biasa sok mapaesan. Nyanding bagja  lain ukur impian. #Galura'"
557583256464289793,2015-01-20 16:59:42,"b'Kamana, imut anjeun nu baheula. Biasa sok ngagupayan, biasa sok ngarangrangan anteng netep na lamunan. #Galura'"
557408888958357506,2015-01-20 05:26:49,"b'Horeng kieu ari misono, disideum kalah beuki nyoso. Rek balaka tapi teu wasa, sidik anjeun aya nu boga. #Galura'"
555772657858138112,2015-01-15 17:05:02,"b'Rumasa hate kagembang, ka salira hoyong tepang nganjang. Bongan harita ukur salangkung, tapi matak gandrung liwung ngalanglayung. #Galura'"
555772034999799808,2015-01-15 17:02:33,"b'Sorot soca salira lir inten permata, gurilapna nembus rasa. Jero dada ngagedur rasa kacinta, kieu gening ari keur kapentang asmara. #Galura'"
555770569921007616,2015-01-15 16:56:44,"b'Naha janten beda raraosan, hate ratug cacakan tepang munggaran. Sok sanajan imutna ngan saliwatan,tapi anteng minuhan alam pikiran #Galura'"
555769672910397440,2015-01-15 16:53:10,"b'Naha kunaon ieu hate bet kapaut. Padahal ku teu pira, harita salira nembongkeun imut. #Galura'"
555401149377806336,2015-01-14 16:28:47,"b'Sok sanajan tos saati, paheut jangji rek ngahiji. Lamun gusti teu maparin widi, tangtos hamo rek ngajadi. #Galura'"
555400417912188928,2015-01-14 16:25:53,"b'Ulah sok ngukut kabingung lamun jodo can patepung, anggur pasrah kanu agung ngarah diri teu ngalanglayung. #Galura'"
554693014992330752,2015-01-12 17:34:55,"b'Gening kieu ari micinta, teu saendah dinu carita. Sanajan di pusti - pusti, akhirna tetep nyanding kanyeri. #Galura'"
554692373163171840,2015-01-12 17:32:22,"b'Teu sangka bakal kieu jadina, salira nu salila ieu dipercaya. Tega cidra, nyocok kabagja nu meujeuhna mancaura. #Galura'"
554677222594736129,2015-01-12 16:32:09,"b'Salira, nu cenah rek mikadeudeuh, da ka asih karaos pageuh. Nyatana gening mungkir, medar polah nu teu kapikir. #Galura'"
554674993619939328,2015-01-12 16:23:18,"b'Salira, nu cenah rek micinta, bade satuhu satia. buktina gening sulaya, meunggaskeun dahan katresna. #Galura'"
553575315390205952,2015-01-09 15:33:34,"b'Gusti, mun seug anjeunna jodo abdi. Mugi tiasa patepung deui, niat panceg hoyong ngalaki rabi, nga ikrarkeun jangji anu suci. #Galura'"
553574590853566465,2015-01-09 15:30:42,"b'Urang padungdeng utang itung, keur patepung dibale nyungcung. #Galura'"
553574035150213120,2015-01-09 15:28:29,"b'Artos mah tiasa dipilari a, nu sesah dipilari mah batu ali *ehh ""@Ahnfn:  @Info_Mommy @SEBAGAI_WEAR @galura_rasa @BarayaSunda_ @DulurBDG""'"
553573768086310914,2015-01-09 15:27:25,"b'Mun seug jaga aya mangsa urang patepang, akang siap mun kudu guntreng. Keur ngararancang jodo langgeng #Galura'"
553573001468207105,2015-01-09 15:24:23,"b'Muhun mom, bagja pisan etamah. Disambel goang an tea gening ""@Info_Mommy: @SEBAGAI_WEAR @galura_rasa @Ahnfn @barayasunda_ @dulurbdg'"
553572802532364289,2015-01-09 15:23:35,"b'Ngantosan dibbm ah ""@SEBAGAI_WEAR: @galura_rasa @MaicihINDO @HeureuyLieur @Info_Mommy @BarayaSunda_ @DulurBDG'"
553572614581399552,2015-01-09 15:22:50,"b'Geulis, salira sampeureun akang jaga. tong hariwang najan ayeuna urang paanggang. Hiji waktos akang mulang, malidkeun rasa hariwang #Galura'"
553570217670877185,2015-01-09 15:13:19,"b'Najan pajauh kahalang gunung, rasa kanyaah tetep gumulung. Tapi sakapeung sok rajeun nguyung, nahan kasono hoyong patepung. #Galura'"
553569579796922369,2015-01-09 15:10:47,"b'Sok sanajan urang paanggang, batin tetep silih anjang. Harita urang kedal jangji, rek satia moal lanca linci #Galura'"
553566565732347906,2015-01-09 14:58:48,"b'Hatur nuhun pisan kang, ditampi pinuh ku rasa bagja""@eman_kuya: @jang_ebod @galura_rasa haturan wilujeng wengi.. http://t.co/IfCnZzCto3""'"
553230008362074114,2015-01-08 16:41:27,"b'Mun seug sagala harepan tinekanan, tangtu bagja mapaesan. Duhh panutan, naha teu kaabotan ? Upami akang nyimpen kaheman ? #Galura'"
553228373091041280,2015-01-08 16:34:57,"b'Dilak soca salira, ngarangkul kasono rasa. Rumasa diri kabungbulengan, aprak-aprakan nyorang lamunan. #Galura'"
553227140804521984,2015-01-08 16:30:03,"b'Sanajan bari geus lawas, rasa katresna hamo rek peunggas. Mantengna rasa kaheman, sumanding mawa harepan. #Galura'"
552746180422008832,2015-01-07 08:38:53,"b'Kedah sadar,tepung awal pipisahan. kedah nampi, jodo pati kagungan gusti. mugia kabagjaan lawas marengan, najan urang teu rendengan. #Galura'"
552745500256923649,2015-01-07 08:36:11,"b'Jep geulis ulah sedih, najan diri nandangan peurih. urang pasrah kanu agung, meh teu gering ngalanglayung. #Galura'"
552744796133945345,2015-01-07 08:33:23,"b'keun geulis cing nampi. najan harepan saukur ngimpi, najan impian ukur lamunan. da ieu gurat pangeran, nu ku urang kudu dilakonan. #Galura'"
552698493651800064,2015-01-07 05:29:24,b'RT @IsyeG: Waalaikumslm..pagi:) @jang_ebod @alfredy784yahoo @penjait_01 @Nickelmining @eman_kuya @mamunhanafi @galura_rasa @euweuhkaerabdg \xe2\x80\xa6'
552698465591914496,2015-01-07 05:29:17,b'RT @Penjait_01: @jang_ebod @IsyeG @alfredy784yahoo @Nickelmining @eman_kuya @mamunhanafi @galura_rasa @euweuhkaerabdg @yayihaidar wangalaik\xe2\x80\xa6'
552698434101067776,2015-01-07 05:29:09,"b'RT @Twetcapruk: Wilujeng enjing,sampurasun *sungkem* @sagalaedan @infokabbandung @DulurBDG @AkiSEBLING @PorengesKOPLOK @galura_rasa @SEBAGA\xe2\x80\xa6'"
552698275799654400,2015-01-07 05:28:32,b'RT @jang_ebod: Assalamualaikum ! @IsyeG  @alfredy784yahoo @penjait_01 @Nickelmining @eman_kuya @mamunhanafi \n@galura_rasa @euweuhkaerabdg @\xe2\x80\xa6'
552508740973658113,2015-01-06 16:55:23,"b'Singhoreng jangji ngan kari ciri, komo harepan ukur lamunan. Urang kudu pipisahan, ngambah kahirupan nu beda jalan. #Galura'"
552507606183710723,2015-01-06 16:50:53,"b'Tiharita urang kedal jangji, Neundeun harepan mugi ngajadi. Sugan gusti masihan widi, kacinta urang nepika pati #Galura'"
552505485682049024,2015-01-06 16:42:27,"b'Silih cepengan panangan, ngumbar harepan urang duaan. Silih tangkeup urang duaan, disaksian bulan nu narawangan. #Galura'"
552503688632496128,2015-01-06 16:35:19,"b'Kagambar atra dina lamunan, waktos harita keur rendengan. Bentang nu ngariceupan nambah endah kacinta urang duaan. #Galura'"
552502175621197824,2015-01-06 16:29:18,"b'Maturan bulan ngumbar harepan, bari ocon dina lamunan. Sajorelat imut anjeun ngalangkangan, mawa carita baheula keur duaan. #Galura'"
552495223616864256,2015-01-06 16:01:40,"b'Wallaikumsalam, linggih ang ""@AbimoXo: @galura_rasa #Galura asallamualaikum""'"
552495152120758275,2015-01-06 16:01:23,"b'Hatur nuhun ditampi ang, sae pisan.""@eman_kuya: @galura_rasa @jang_ebod haturan wilujeng sonten http://t.co/Zt2lgL8dFE""'"
552186844796825600,2015-01-05 19:36:17,"b'Unggal peuting ngahariring dina waktos keur sepi jempling. Pikiran kumalayang, mikiran kahayang nu can kasorang. #Galura'"
552186075225939968,2015-01-05 19:33:14,"b'Dalah kudu dikumaha, mungguh nu disebut rasa saurna anugerah tinu kawasa. Iwal kudu pasrah narima, najan sakapeung matak kasiksa #Galura'"
552185533875499008,2015-01-05 19:31:05,"b'Peureum kadeuleu, beunta karasa. Naha ieu teh asih saha bet nyiliwuri lain dina wanci ? Sakapeung aral subaha mun tresna gelar lain waktuna'"
551418473482432512,2015-01-03 16:43:03,"b'Najan kudu paanggang deui, omat ulah lanca linci. Hiji waktos mun akang mulih deui, urang sorang peuting sapertos nu tadi. #Galura'"
551417017345916929,2015-01-03 16:37:16,"b'Kadieu panutan gera deukeutan, hampura akang can bisa salawasna marengan. Akang kedah miang deui, margi pancen parantos nganti #Galura'"
551412772123078656,2015-01-03 16:20:24,"b'Nya wengi ieu pisan, karaos endah mapaesan. rasa nyaah beuki natrat, tur deudeuh beuki maneuh komo asih beuki matri .#Galura'"
551411629657559040,2015-01-03 16:15:51,"b'Tampi ku kasabaran, yakin hiji waktos tiasa rendengan kang ""@Shendy_SR: nojos pisan min RT""@galura_rasa: Sanajan paanggang, katresna'"
551411419728461824,2015-01-03 16:15:01,"b'Teu hade kitu ang, dibales mah kudu ngan ngacapruk weh. Bisi pajarkeun adigung. Hehehe ""@Ipey93: Tong dibales weh mang :( ""@galura_rasa: Bal'"
551411205709914112,2015-01-03 16:14:10,"b'Nuhun bah *sungkem* ""@DulurBDG:  yeuh @galura_rasa rerencangan ngaronda :"")""'"
551411014747439104,2015-01-03 16:13:25,"b'Wengi ieu jungjunan, kasono nembrak lir cihujan. Sono nu geus lila ditahan-tahan gening akhirna laksana tepang jeung salira, bagea #Galura'"
551408628360437760,2015-01-03 16:03:56,"b'Wengi ieu jungjunan, hujan marengan katresna urang duaan. Balaka cumarita paduduaan, ngabedah rasa dijero dada. #Galura'"
551027999617736704,2015-01-02 14:51:27,"b'Tresna mah moal rek sirna, komo deudeuh karaos pageuh. Mun sawengi rek dianti, najan saminggu pasti ditunggu. #Galura'"
551026465630740480,2015-01-02 14:45:21,"b'Rasa sono anteng nyoco, rasa melang anteng ngalanglang. Naha iraha atuh patepang, urang nyinglarkeun rasa hariwang #Galura'"
551025377166909440,2015-01-02 14:41:02,"b'Sanajan paanggang, katresna mah moal rek ilang. Sok sanajan keur patebih, angger matri rasa asih. #Galura'"
551025028716703744,2015-01-02 14:39:39,"b'Bales naon nya ? Bingung""@Ipey93: @galura_rasa Amin ya rabbal alamin O:)""'"
550693337867370497,2015-01-01 16:41:37,"b'Tampi ku kasabaran tur pasrah ka Pangeran. Yakin hiji waktos urang tiasa sasarengan, nyorang endah dunya moal aya nu ngahalangan. #Galura'"
550691304116473857,2015-01-01 16:33:32,"b'Sok sanajan urang paanggang, kitu diri keur patebih. Tapi nyaah moal honcewang, tetep manteng rasa kaasih. #Galura'"
550690260363911170,2015-01-01 16:29:24,"b'Mungguh ari paanggang, tangtos teu aneh mun aya rasa hariwang. Tapi salira ulah rek melang, da kacinta mah moal rek ilang. #Galura'"
550233869266350080,2014-12-31 10:15:51,"b'Najan taun geus rek ganti, tapi hate mah moal lanca linci. Mung tetep salira hiji, kembang harepan siang jeung wengi. #Galura'"
549935801153236992,2014-12-30 14:31:26,"b'Yap panutan, kadieu gera deukeutan. Urang rangkul bulan kuduaan, urang baseuhan ku hujan kaheman. #Galura'"
549934959838773250,2014-12-30 14:28:06,"b'Raga gulinggasahan marengan sukma nu keur kakalapakan. rumasa diri kataji, ku salira kembangna ati. #Galura'"
549933602515853312,2014-12-30 14:22:42,"b'Malem rebo, karaos sono beuki nyoso. Lir ngagupayan, gelenyu imut salira minuhan alam pipikiran. #Galura'"
549201846800089088,2014-12-28 13:54:58,"b'Keur anjeun angin, seja nitipkeun rasa kaasih nu kingkin. Hiliwirkeun kanu hatena, didieu kuring nganti manehna. #Galura'"
548548883484114944,2014-12-26 18:40:20,"b'Singhoreng angin ka kaler, ngan ukur matak kateter. Hate ngeleper lir can beger *ehh ""@banyolansunda: @galura_rasa @akireiy Jungjunan k'"
548547767186898944,2014-12-26 18:35:53,"b'Kanyaah ngan dipentangkeun, diapungkeun ku gelasan mambo ""@banyolansunda: @akireiy Cintaku kapakan lagih, dianyah dibandring'"
548539143311994880,2014-12-26 18:01:37,"b'RT @RMuhammadArdi: PINTER JANG :(((""@akireiy: Kadieu yap kalebet, aya kumbaheun waemah :( ""@galura_rasa: Duhh ang, sok janten isin ari kieu\xe2\x80\xa6'"
548539053285441537,2014-12-26 18:01:16,"b'RT @akireiy: Kadieu yap kalebet, aya kumbaheun waemah :( ""@galura_rasa: Duhh ang, sok janten isin ari kieu teh ""@akireiy: Euleuhh heureuy :'"
548486969194328064,2014-12-26 14:34:18,"b'Duhh ang, sok janten isin ari kieu teh ""@akireiy: Euleuhh heureuy :( ""@galura_rasa: Duh aya katresna,nu ngagalura keur salira. .Euh gening'"
548485306127618048,2014-12-26 14:27:42,"b'Duh aya katresna,nu ngagalura keur salira. Ah hanjakal salira gening aya nu boga.Euh gening peurih nukarasa,suku titajong kana juru meja *eh'"
548481892127744001,2014-12-26 14:14:08,"b""Najan kuring hamo bisa marengan,tangtu du'a mah moal rek lekasan. Bral miang jeung nu lian. Keun akang mah didieu anteng jeung bulan.#Galura"""
548481171093340160,2014-12-26 14:11:16,"b'Jeung anjeun bulan, urang saksian babarengan. Ningalikeun manehna nu keur nyawang impian, dina sagara kahirupan. #Galura'"
548479636896632833,2014-12-26 14:05:10,"b'Keur anjeun angin, pangharewoskeun ieu ati nu kingkin. Harewoskeun ka diri manehna, kuring keur ngideum rasa katresna #Galura'"
548478349304020992,2014-12-26 14:00:03,"b'ka anjeun bentang, sok hayang milu sidengdang. Nyaritakeun rasa hariwang, tur kahayang nu can kasorang. #Galura'"
547775550777872385,2014-12-24 15:27:23,"b'ah, tapi keun jungjunan. Meureun kedah kieu ngalalakon kahirupan, najan carita desember kari impian, poma ulah teuing dipikiran #Galura'"
547774610859491329,2014-12-24 15:23:39,"b'Desember taun kiwari, ngan ukur bisa nyawang na impian. Naha bisa urang babarengan, sapertos desember taun nu kamari. #Galura'"
547772754204692480,2014-12-24 15:16:16,"b'Kiwari, nu nyesa ngan kari ciri. Alatan jangji nu teu pasini, nu antukna mawa  kanyeri dina ati. #Galura'"
547771887145590784,2014-12-24 15:12:49,"b'Kiwari, masih natrat dina implengan, carita cinta urang duaan. Rasa sono nu marengan, nambah kapeurih dina katunggaraan. #Galura'"
547770908224409602,2014-12-24 15:08:56,"b'Nya desember taun kamari, kacipta pisan sagalana. Rasa endah, rasa nyaah, rasa tresna nu salawasna marengan ka ieu diri. #Galura'"
547769980033314818,2014-12-24 15:05:14,"b'Jungjunan, bulan desember taun kamari,urang masih bisa babarengan. Maheutkeun jangji dina ati, rek ngambah sagara kahirupan,kuduaan #Galura'"
547768878432931841,2014-12-24 15:00:52,"b'Jungjunan, bulan desember taun kamari. Hate kaebat ku hiji rasa. Rasa asih nu ngancik dina ieu diri, nu moal laas najan robah mangsa #G'"
546999179302555648,2014-12-22 12:02:21,"b'Rasa kaduhung ngagulung, matak gering ngalanglayung. Rasa tunggara nyaliara inggis salira tega meunggaskeun dahan katresna. #Galura'"
546997823804153858,2014-12-22 11:56:58,"b'Naha kunaon salira jungjunan, palangsiang ku tega bet bibilasan. Megatkeun duriat lir ilangna balebat. #Galura'"
546989562979831811,2014-12-22 11:24:09,"b'Gusti, nu kagungan abdi abdi sadaya. Mugi dulur-dulu abdi nu ka musibahan cing dijembarkeun hatena, dipaparin kasabaran tur ka tawakalan .'"
546988800497299457,2014-12-22 11:21:07,"b'RT @suling_koneng: Di ayun ambing ku samping di eyong ku karembong""@galura_rasa: Sok sanajan anak rungsing tapi indung tara ieuh pusing. ""@\xe2\x80\xa6'"
546900764849745921,2014-12-22 05:31:17,"b'Sok sanajan anak rungsing tapi indung tara ieuh pusing. ""@suling_koneng: Salapan bulan ngakandung,,pinuh rasa jeung rumasa,,'"
545600551543525377,2014-12-18 15:24:42,"b'Hanjakal, datangna rasa kapaneurian. Dina mangsa anjeun geus rimbitan. Kedah kasaha ieu hate diubaran, gening salira ukur lamunan #Galura'"
545599446965186560,2014-12-18 15:20:19,"b'Peurah asih mimiti nyaliara, rumasa diri kabengbat ku rindat salira. Meureun geus waktuna kuring nyarita, ka salira nu di picinta #Galura'"
545597477743652864,2014-12-18 15:12:30,"b'Mun seug maju ka peuting, pikiran ngalayang maturan jempling. Rasa asih ngahariring, naha iraha jeung anjeun nyanding #Galura'"
545596702124556288,2014-12-18 15:09:25,"b'Gelenyu imut salira minuhan alam pikiran. Nyawang hoyong rerendengan, najan saukur dina lamunan. #Galura'"
545595915898085377,2014-12-18 15:06:17,"b'RT @BarayaSunda_: Geulis kasep bageur,seug hidep miboga nu di cita-citakeun wayahna kedah kersa ihtiarna,sabar ngalakonan na,ihlas nampi ka\xe2\x80\xa6'"
544908433908981760,2014-12-16 17:34:29,"b'Nya tiharita, urang duaan teh ngajadi, niat babarengan sajiwa ngahiji. Duaan ngambah sagara cinta, moal bade lanca-linci #Galura'"
544907087533203456,2014-12-16 17:29:08,b'Gening ku teu disangka anjeun boga rasa nu sarua. Padahal akang henteu mamaksa. Duh aya ku bagja. #Galura'
544904259796344832,2014-12-16 17:17:54,"b'Nya tiharita, rumasa kapentang asmara. Rasa kaasih ngancik na ieu diri, matri. Hamo bisa ngabohong deui. #Galura'"
544903438614532097,2014-12-16 17:14:38,"b'Emut harita, waktos neuteup imut salira. Mangkak malekar kembang katresna, endah mapaesan guligahna rasa. #Galura'"
544902455289331712,2014-12-16 17:10:43,"b'Emut harita, basa salira pasang subaya. Ngadadak ngagedur dina jero dada, meureun kacinta geus mimiti nyalira. #Galura'"
544901724570284034,2014-12-16 17:07:49,"b'Caket teh tipalih mana, da upami ti yordania mah angger we tebih. Hehe""@Orox_ballap: Ouw ciwidey kang ?? Caket gening nya hehe""@galura_rasa:'"
544863288987615232,2014-12-16 14:35:05,"b'Upami ditinggal tinu atlas mah ieuteh ti wewengkon pasirjambu. Sateuacan ciwidey upami arah ti kota mah ""@Orox_ballap: Daerah mana namina'"
543822066521092098,2014-12-13 17:37:39,"b'Leukeunan bari ngeureuyeuh, sok sanajan bari riweuh. Berjuang ulah rek aral, mun maksud pinanggih gagal.'"
543821937835659264,2014-12-13 17:37:08,"b'Patekadan anu mulya, tangtu loba gogodana. Niat tetep kudu kebat, ku gogoda ulah ebat..'"
543821566371323904,2014-12-13 17:35:39,"b'Sanes ti subang abdi mah ang, ti gunung peuntaseun subang. ""@Orox_ballap: @galura_rasa akang ai akang linggih disubang na dimanten ?""'"
543442687542583296,2014-12-12 16:30:08,"b'Rasa,naha salira bet kudu nyaliara.  Seja micinta kanu geus aya nu boga, nu akhirna matak kasiksa alatan kanyaah nu hamo laksana #Galura'"
543441551263686656,2014-12-12 16:25:37,"b'Bongan salira sering ka impi, nu ngajadi asih na ati. Rumasa akang kataji, imut anjeun ngajadi kembang lamunan siang jeung wengi. #Galura'"
543440716441997312,2014-12-12 16:22:18,"b'Najan salira aya nu boga, naha salah mun akang seja micinta ? Najan salira teu bisa surti, naha lepat upami asih ngancik na diri ? #Galura'"
543439971160317952,2014-12-12 16:19:20,"b'Wilujeng wengi cep, ""@Orox_ballap: Wilujeung enjing kapara wargi sadayana @BarayaSunda_ @suling_koneng @galura_rasa""'"
543089910769393664,2014-12-11 17:08:19,"b'Najan kacinta, sok remen jadi cimata. Najan kaasih, nudatang jadi kapeurih. Nyaah, tresna saestuna mung ukur ka salira. #Galura'"
543084793512988672,2014-12-11 16:47:59,"b'Nitip asih ngan dinyenyeri, nunda kanyaah ukur dikakaya. Tega, panyateh rek maparin bagja. Buktina mawa tunggara. #Galura'"
543083948620775425,2014-12-11 16:44:38,"b'Gening teu disangka, cukup ku kecap hampura salura tega megatkeun tali kacinta. Naha naon nu janten alesan, salira ku luluasan. #Galura'"
543083192786235393,2014-12-11 16:41:37,"b'Cenah ceuk anjeun, cinta teh anugrah nu gelar na jero dada. Cenah ceuk anjeun deudeuh teh geus maneuh nu ku urang kudu di jaga. #Galura'"
542947048677310465,2014-12-11 07:40:38,"b'~manfaat keur kulawarga, dulur, jeung batur hirup abdi salila ngalalana di ieu marcapada.'"
542946994507898880,2014-12-11 07:40:25,"b'Tapi, upami Salira kersa masihan widi manjangkeun umur abdi. Mugia sagala tanaga, pikiran kesang abdi bisa jadi ~'"
542946451769159680,2014-12-11 07:38:16,"b'~Mugia sagala tanaga, pikiran, jeung kesang nu kaluar ti diri abdi bisa jadi pahala pikeun ngamuluskeun jalan ka sawarga.'"
542946348434075648,2014-12-11 07:37:51,"b'Gusti, kuring nampi sagala cocoba nu tumiba ka ieu diri. Mun seug isuk jaganing pageto datang mangsa raga abdi ditinggalkeun ku nyawana.~'"
542938446851883010,2014-12-11 07:06:27,"b'RT @Orox_ballap: Rumasa beurat mun kuring ngadekeutan dei anjeuna, kusabab geus boga cacad, ngan bsa nga doa kanu kawasa sing dijaga jiwa r\xe2\x80\xa6'"
541923415825715200,2014-12-08 11:53:05,"b'Hanjakal pisan ku deudeuhna, asihna, imutna, sorana jeung nyaahna. Ukur bisa maturan ti ka anggangan. #Galura'"
541923088112160770,2014-12-08 11:51:47,"b'Hayangmah jigah nu lian, dibaturan ku panutan nu jadi gunung pananggeuhan. Diusap ku kanyaah, diteuteup pinuh rasa kageugeut. #Galura'"
541922686390124544,2014-12-08 11:50:11,b'Naha rek dugika iraha ieu jempling marengan kuring unggal peuting ?? Naha kudu kasaha ieu rasa nu ngamuara malidkeunana ?? #Galura'
541921342786781184,2014-12-08 11:44:51,"b'Karasa seunggah mun wanci nganjog ka peuting. Sok aya kasusah numatak jauh kanu kabungah. Sedih, peurih, diri jauh tinu mikaasih. #Galura'"
540888059844112385,2014-12-05 15:18:57,"b'Gusti, mun ditampi ieu panghampura kuring nampi kanu sagala rupa nu tumiba. Kiatkeun diri abdi pikeun neang jati diri #Galura'"
540886957945913344,2014-12-05 15:14:34,"b'Meureun kedah kieu carana, ngarah kuring leuwih raket jeung mantenNa. Rumasa diri lamokot dosa, jauh tina karidhoan Salira. #Galura'"
540885146849652737,2014-12-05 15:07:22,"b'Umur keuna ku ngolotan, tanaga cekak ngahamposan. Sagala impian bet ngajarauhan, nu nyesa ukur harepan. #Galura'"
540884207476568064,2014-12-05 15:03:38,"b'Leumpang mawa harepan,mipir lamping mapay jungkrang. Teu sirikna sagara ge diojayan. Lain ku hayang dipuji, tapi rek neang jati diri #Galura'"
540524606495264768,2014-12-04 15:14:43,"b'Sok rajeun datang wanoja lian, rajeun gugupay ngaheureuyan. Tapi imut salira leuwih endah nembongan, minuhan alam pipikiran. #Galura'"
540523777243627522,2014-12-04 15:11:25,"b'Sae kang, lajengkeun atuh ""@Orox_ballap: Ibarat peuting, sanajan aya bulan anu nyaangan, anjeun jadi bentang'"
540523640928743424,2014-12-04 15:10:53,"b'RT @Orox_ballap: Ibarat peuting, sanajan aya bulan anu nyaangan, anjeun jadi bentang nu nambihan endahna @galura_rasa'"
540523187197341696,2014-12-04 15:09:04,"b'Deudeuh teu beunang di sieuh-sieuh, nyaah teu beunang dipenta, rasa sono beuki nyoso. Mung keur salira panutan jiwa #Galura'"
539465364912865281,2014-12-01 17:05:40,"b'Hatur nuhun teteh, wilujeng tepang. ""@NurazmiMe: Endah macana ^_^)) RT @galura_rasa: Neuteup raray salira, karaos endah nyaliara. Beuki'"
539464973496221696,2014-12-01 17:04:07,"b'Najan batin patebih, najan urang paanggang. Kangen manteng rasa cinta, ka salira. #Kasalira #YayanJatnika'"
539464839211405312,2014-12-01 17:03:35,"b'Pageuh kadeudeuh na ati moal arek lanca linci. Estu satuhu satia, ka salira. #Kasalira'"
539463886596866049,2014-12-01 16:59:47,"b'Ngan ukur anjeun nujadi harepan, ti wanci kiwari hayu urang sasarengan. #Kasalira'"
539463764962078720,2014-12-01 16:59:18,"b'Na implengan iraha bakal kasorang, hate cumantel emut bae kasalira. #Kasalira'"
539463377383194624,2014-12-01 16:57:46,"b'Hoyong patepang pasimpay tangan, hoyong patepung lawung sangkan asih teh gumulung. #Kasalira'"
539463218289070080,2014-12-01 16:57:08,"b'Upami paanggang batin tetep mikamelang, upami patebih na batin karaos lirih. #Kasalira'"
539027379696320512,2014-11-30 12:05:16,"b'Insyaalah baris dijaga, dipupusti na ati sanubari. Baris diteundeun dina jero hate nu dipiendah ku kadeudeuh kuring jeung anjeun. #Galura'"
