id,created_at,text
847122501138235392,2017-03-29 16:25:17,b'mangga di follow di Ig (at)galura_rasa . seungit keneh . urang ramekeun diditu didieu lah. https://t.co/4nausq74a8'
847094908993220610,2017-03-29 14:35:39,"b'Mhehehe, nembe kabuka deui Kang. Hilap nyimpen konci ""@eman_kuya: @galura_rasa bag\xc3\xa9a kang,, kamana wa\xc3\xa9 nemb\xc3\xa9 katingal twitna?,,""'"
847093719450857473,2017-03-29 14:30:55,"b'Sing kiat geulis, prak gera balaka naon nu aya dina jero dada. Ulah dugikeun nutupan rasa, kedalkeun ku salira, caturkeun ulah duginka nyesa'"
847092902807257089,2017-03-29 14:27:40,"b'Mun anjeun percaya kana papasten Gusti, rupina moal dugika ngajak paturay, nu matak nyieun panon cireumbay - RNK'"
847092646136889346,2017-03-29 14:26:39,"b'Mun anjeun percanten kana gurat takdir, rupina moal patos beurat nandangan lara nu unggal usik moekan urang duaan - RNK'"
847092106380271616,2017-03-29 14:24:31,"b'Geulis, sing tiasa nampi kanyeri, nu unggal usik datang ti ieu diri,mugi asih urang lana dugi dongkapna pati, abadi walagri saumur bumi -RNK'"
847091458653876224,2017-03-29 14:21:56,"b'Geulis, mugia sabar janten ubar, ikhlas mulas unggal ngahelas, hapunten tina samudaya kalepatan salami ngalakonan sagara urang duaan - RNK'"
774989046867070976,2016-09-11 15:12:42,"b'RT @badrawati309: @galura_rasa Katumbiri mere ciri ku warni, langit seungit ku wanci, sagara mere beja ku galura rasa \xc2\xa4 Aikusumah Ciamis'"
774989026830856192,2016-09-11 15:12:37,"b'RT @badrawati309: @galura_rasa. Dahaga rasa nu kungsi werat, lapar katresna nu ngalaman pegat, kiwari ngabukti ku prihatin nyata dina sugem\xe2\x80\xa6'"
728226709779025921,2016-05-05 14:15:52,"b'Mangga Jungjunan, najan hat\xc3\xa9 teu narima, najan nyaah mepekan rasa, da puguh kieu kuduna, Bagja dipungkas tunggara.'"
728226438982172673,2016-05-05 14:14:47,"b'Rumasa jungjunan, muwuh diri sarwa basajan, mitresna teu ngukur jajaran, lir miharep kalangkang bulan.'"
728226239681421313,2016-05-05 14:13:59,"b'Kunaon salira teu tuhu, kana jangji nu kaucap sa\xc3\xa9stu. Kapahung tresna baheula, nu ceuk Anjeun mawa tunggara.'"
728225666580111364,2016-05-05 14:11:43,"b'Teu sangka Jungjunan, gening rasa nu tumetep mask\xc3\xa9t, ayeuna bet diwewej\xc3\xa9t. Bersihna ati miasih bet diroroc\xc3\xa9t, bagja kamari ilang teu dir\xc3\xa9r\xc3\xa9t'"
728225029549228032,2016-05-05 14:09:11,"b'Sadrah dina galura cinta Salira, seja mitresna saparat mangsa.'"
728224826586894337,2016-05-05 14:08:23,"b'Teu karaos Jungjunan, kebekna rasa nu bumetah dina dada ngalantarankeun sukma ilang kawasana'"
728224013458100224,2016-05-05 14:05:09,"b'Haturan Jungjunan,gening lalakon t\xc3\xa9h geus sakieu jauhna.Ngembi alas mangsa nu dipapa\xc3\xa9s kacinta.Malipir mapay wanci nu pinuh ka asih. #Galura'"
722079586306011138,2016-04-18 15:09:23,"b'Sajak ""Black Sabbath"" karya ti Kang Godi Suwarna, medal taun 1992.'"
722079319867023360,2016-04-18 15:08:20,"b'Hiji mangsa: sar\xc3\xa9r\xc3\xa9a tingkol\xc3\xa9ang naringgang leutak naraka,\xe2\x80\x9ds\xc3\xa9tan! Duh, s\xc3\xa9tan! kuring utusan salira!\xe2\x80\x9d ceuk anjeun binarung imut.'"
722079115914792961,2016-04-18 15:07:31,b'Ting salemprung bari t\xc3\xa9mbong silih t\xc3\xa9mprang mun pareng pasilang l\xc3\xa9ngkah.'
722078969487446017,2016-04-18 15:06:56,"b'Haseup ganja ngebekan dada rumaja. Haseup n\xc3\xa9r\xc3\xa9k\xc3\xa9lan uteuk. Br\xc3\xa9h, pirang-pirang panyileukan warna-warni. Bring, sar\xc3\xa9r\xc3\xa9a ngarudag fatamorgana.'"
722078615278465026,2016-04-18 15:05:32,b'Anjeun ngahaja ngebulkeun h\xc3\xa9ktaran mariyuana sangkan haseup ngeput jagat pararumaja nyiluman.'
722078010313060353,2016-04-18 15:03:07,"b'\xe2\x80\x9cMajuuuuuuu! Maju di jalan s\xc3\xa9taaan!\xe2\x80\x9d opat oktap anjeun nyorowokkeun kecap. Breng, mangpirang-pirang rumaja tingbelesat ngawang-ngawang;'"
722077754343067648,2016-04-18 15:02:06,"b'Basa gumuruh dram ngendag-ngendag saban l\xc3\xa9ngkah, mangpirang-pirang rumaja t\xc3\xa9mbong kukuna rangg\xc3\xa9t\xc3\xa9ng, t\xc3\xa9mbong sihungna nyangg\xc3\xa9r\xc3\xa9ng,'"
722077574734581760,2016-04-18 15:01:24,"b'Wah, rumaja nyarihung dajal, ngincer kolot s\xc3\xa9wang-s\xc3\xa9wang.'"
722077310061383682,2016-04-18 15:00:20,b'Laju mangpirang-pirang rumaja ngageremkeun sabda dajal ka dunya nu nganaraka. Sihung anjeun sihung dajal ngincer saban wening batin.'
722076910654586881,2016-04-18 14:58:45,b'Kapan anjeun nu nyorowokeun sora dajal saban wanci. Sora sora\nJerit gitar pamapas saban mamaras.'
719929875365138432,2016-04-12 16:47:12,"b'Hiji raga pangupa jiwa nu ayeuna paanggang. Panutan, hampura mun kaasih teu tamplok sakumaha kuduna. #Galura'"
719929269493739520,2016-04-12 16:44:48,"b'Aya tapak, aya lacak, nu kiwari kari nineungna. Aya kaasih nu pegat jeung beubeulahan hate. Nu remen datang maturan dina lamunan. #Galura'"
719928929864187905,2016-04-12 16:43:27,"b'Nganteur lamunan mapayan tapak nu geus kaliwat. Amis-amis na hirup geus kasorang, pait peuheur lalakon geus liwat di pilampah. #Galura'"
719541883555356672,2016-04-11 15:05:28,"b'Bag\xc3\xa9a panutan,bener ceuk b\xc3\xa9ja cenah jodo mah moal kamana. Kabuktian gening ayeuna, nyaah mah teu ingkah najan harita pareng papisah. #Galura'"
719541410697846784,2016-04-11 15:03:35,"b'Peuting ieu Nung, laksana urang tepang deui. Nyarita sagala nu tumiba bari suka seuri, nyinglar sono nu geus lawas disideum na ati. #Galura'"
719540603214635009,2016-04-11 15:00:22,"b'Peuting ieu Nung, cahya bulan deui n\xc3\xa9mbongan. Bijil semu \xc3\xa9ra disatukangeun m\xc3\xa9ga. Cigah nu m\xc3\xa9r\xc3\xa9 harepan y\xc3\xa9n katresna bakal tinekanan. #Galura'"
719539251717623808,2016-04-11 14:55:00,"b'Lila urang kudu paanggang, dibarengan ukur ku kalangkang. Nu karasa g\xc3\xa9 ukur tapak cidra jeung rasa nyaah nu h\xc3\xa9s\xc3\xa9 pikeun leungitna. #Galura'"
719538280153264128,2016-04-11 14:51:09,"b'Lawas urang pipisahan, dipaksa megatkeun duriat alatan ku teu sajalan. Ngaliwatan rebuan carita, mapay mangsa nu jauh ti bagja. #Galura'"
668112218001530880,2015-11-21 17:02:20,"b'Cing sabar jungjunan Akang, ulah melang ulah honcewang. Hiji waktu guratan nu bakal midang, midangkeun bungah pangbeberah rasa hariwang.'"
668111189038108672,2015-11-21 16:58:15,"b'Hampura akang can sanggup balaka, meureun manah nu tacan sugema. Keun urang nganti waktos anu waluya, pikeun urang duaan midangkeun rasa.'"
668110113366872064,2015-11-21 16:53:58,"b'Najan gogoda teu weleh natrat, akang teu niat meunggaskeun duriat. Sabab antara urang teu aya nu lepat, Akang mah mah tetep tibelat.'"
668109188250255360,2015-11-21 16:50:18,"b'Geulis, nu ngancik dina ati. Akang moal arek sulaya jangji. Najan wanci nu datang acan pasti, tapi deudeuh bakal tetep maneuh nepika pati.'"
657206745962450944,2015-10-22 14:47:53,"b'Deudeuh teuing Panutan, gening mayapada mah samar katinggalna. Pangharepan ukur tiasa palid dina hal\xc3\xa9ongna gelik suling nu nyuatan ati.'"
657206372870696960,2015-10-22 14:46:24,"b'Jeung deuih, tong ngarasa aral subaha nalika nandangan kapeurih diri. Margi Insha Allah dijauhna, bakal aya kabagjaan nu nganti nganti.'"
657205925787234305,2015-10-22 14:44:37,"b'Ulah sot\xc3\xa9h aya cimata nalika kedal ucap pileuleuyan, sabab masih panjang lalakon di kahirupan .'"
657205550095032320,2015-10-22 14:43:08,"b'Heug jungjunan, bral gera miang ! Gera papag balebat pangharepan ku imut nu marahmay.'"
657194410803793920,2015-10-22 13:58:52,b'maca kulhu geni bah kareueung mah @DulurBDG'
657194272265908225,2015-10-22 13:58:19,"b'Panggeuing di reka impian,basa tresna mulas lamunan.Galura pangharepan\nmimiti ngajauhan. Gera sadar jungjunan, Gera cengkat tina lamunan.'"
657193587822559232,2015-10-22 13:55:36,"b'Hate kahieuman parende, ngebatna harepan gening ukur mepende. Kalangkang asih nu paantay antay,\nteu ngajirim ngan samet gugupay.'"
657193117481766913,2015-10-22 13:53:43,"b'kiwari tresna geus kari bangkarak, perlaya ku reka pangwakca. kiwari geus kieu buktina, sakabeh jangji ukur dipungkas ku sulaya.'"
657190397911830528,2015-10-22 13:42:55,"b'Sakeclak sakeclak ibun cimata murag kana lahunan. Naha bet kieu ? Hiji hiji harepan ngajauhan, mancal ka alak paul nu hamo bakal kadongkang.'"
657189992708509697,2015-10-22 13:41:18,"b'Nunggeulis na tepis wanci, diparende ukur ku simpe. Ngarampa leuwangna rasa.\nKasedih jeung kaasih,kasono jeung kapeurih minuhan rohang hate.'"
654678328951963649,2015-10-15 15:20:51,"b'Diri bakal tetep nganti, manjangkeun asih nu bihari.\nNyambungkeun tali katresna, pikeun\nNaratas jalan kabagja.'"
654676259478212610,2015-10-15 15:12:38,"b'nyengcelang nyaangan ti ka anggangan, teu kasilih ku poekna peuting. nambih nambih rasa asih, sok sanaos keur patebih.'"
654675654688935936,2015-10-15 15:10:14,"b'Haturan wilujeng wengi Panutan. Najan bulan teu kat\xc3\xa9mbong mapa\xc3\xa9san, tapi raray salira ngahias marengan b\xc3\xa9ntang.'"
650144546735583233,2015-10-03 03:05:13,"b'Katumbiri di langit Jayanti siga nu surti. Aya nu ngancik na ati sanubari, nu pasrah jeung sumerah, mawa guligah namperkeun kabungah.'"
650144290119639040,2015-10-03 03:04:12,"b'Sabot reureuh di sisi basisir, raga ngol\xc3\xa9ang asa honc\xc3\xa9wang. Guligahna ombak nu motah, ngal\xc3\xa9nd\xc3\xa9an kanu implengan.'"
650144022112026624,2015-10-03 03:03:08,"b'Sabot reureuh di sisi basisir, basisir laut jayanti, asri. Kat\xc3\xa9mbong katumbiri warna-warni, melengkung asa nutug jajantung.'"
649516414542479360,2015-10-01 09:29:15,"b'hujan binarung guludug, nyipta gumuruh dina kalbu. nu satia migandrung, tresna gumulung.'"
649515987587301376,2015-10-01 09:27:33,"b'RT @edi_KRND: Peuting ieu, katineung urang ngalalakon dina implengan. Imut salira mepeka dina mangsa emutan ngalayang nganjang. ~ @galura_r\xe2\x80\xa6'"
649515877872758784,2015-10-01 09:27:07,"b'Hujan, lir ngajadi guligah rasa. nu teu kabendung muguranna. dina unggal keclakna, aya rasa nu sawirahma.'"
648865642666332160,2015-09-29 14:23:19,"b'Urang gigihkeun tali nu agung ku harti, urang asakkeun tali nu weruh ku aj\xc3\xa9n, tali silaturahmi.'"
648865422700232704,2015-09-29 14:22:26,"b'Keun panutan, da moal r\xc3\xa9k miceun asih, moal ar\xc3\xa9k nyinglar rasa.'"
648864752295260160,2015-09-29 14:19:46,"b'Hampura akang, Nung. Lain r\xc3\xa9k nyapirakeun luhungna cinta katukang. Da gening lalampahan urang katungtung waktu.'"
648864302695186432,2015-09-29 14:17:59,"b'Kiwari anjeun gugupay ngumbar katineung, ng\xc3\xa9nt\xc3\xa9p deudeuh nyulam katresna. Ngintun eunteung paniir wanci, ngagudir ati ngendagkeun rasa.'"
648863694957383681,2015-09-29 14:15:34,"b'Najan ukur saliwat, tapi ning sukma ngaraos tibelat. Najan ukur sar\xc3\xa9r\xc3\xa9t, gening sukma t\xc3\xa9h geus pacant\xc3\xa9l.'"
648862926233714688,2015-09-29 14:12:31,"b'Tresna jeung cinta t\xc3\xa9h gening lain banding lain baya. Sabab cinta leuwih ti cinta, sabab deudeuh leuwih ti deudeuh.'"
648862502147624960,2015-09-29 14:10:50,"b'Nung, jungjunan. Aya rasa ngamuara, nu hamo kabeuli ku banda sajagat. Rasa nu cadu tilem najan ka keueum jerona sagara.'"
648688825187725312,2015-09-29 02:40:42,"b'Hat\xc3\xa9 nu kamari keur guligah ku kabungah, kiwari ripuh ku sagara bangbaluh. Teu jauh jeung samagaha, nu po\xc3\xa9k mongkleng kacida.'"
648686396228530176,2015-09-29 02:31:03,"b'Cinta t\xc3\xa9h \xc3\xa9ndah, sok sanajan kuring jeung anjeun mung ukur tumpak sap\xc3\xa9dah .. Tapi sakapeung matak nyeri hat\xc3\xa9, mun \xc3\xa9ta sap\xc3\xa9dah pegat rant\xc3\xa9 .'"
643836416598798336,2015-09-15 17:18:58,"b'Ieu diri tatanggahan ngulayaban ka ampahna langit, naha\nkunaon salira janten ngaleungit ?'"
643824158279733248,2015-09-15 16:30:15,"b'Sedeng sono kiwari keur meujeuhna ngagalura dina sajeroeun dada, naha kedah kumaha mangpal\xc3\xa9rkeunana, Nung ?'"
643812683477684225,2015-09-15 15:44:39,"b'Diri lumengis leungiteun bentang sabada girimis maseuhan pras pris. Naha kedah kamana nyusulna, Nung ?'"
641457994408943616,2015-09-09 03:47:58,"b'Hayangmah ulah paturay, bisa bagja waluya sapaneja. Dipika asih kunu Maha Asih, bisa patepung lawung patepang pangant\xc3\xa9nan. #Galura'"
641457447190663169,2015-09-09 03:45:47,"b'Rasa hariwang jeung salempang, ngalanglang dina panyawang. Melang hamo panggih deui, nyaah pindah ka lain ati #Galura'"
641447914615627776,2015-09-09 03:07:55,"b'RT @DulurBDG: Meureun diri kurang sumerah, sumujud kurang raket ka Salira. Tamada, pasrah, sumerah Gusti. - @galura_rasa'"
640729381065768960,2015-09-07 03:32:43,"b'Abdi yakin alam kab\xc3\xa9h papasangan, bada nyorang peteng hideung mangsa beurang pasti datang mawa caang. Padang narawangan, mugia.'"
640729169999978496,2015-09-07 03:31:52,"b'Meureun diri kurang sumerah, sumujud kurang raket ka Salira. Tamada, pasrah, sumerah Gusti.'"
640729009827897344,2015-09-07 03:31:14,"b'Bada nanjak pasti mudun, bada susah pasti pinanggih jeung bungah. Rumaos gusti, abdi rumaos. Hirup t\xc3\xa9h mung ukur diharudum ku napsu.'"
640728711508025344,2015-09-07 03:30:03,"b'Duh, puguh g\xc3\xa9 lalakon dunya, geulis. Antara l\xc3\xa9ngkah jeung karep sakapeung kapan sok tara saimbang sarua.'"
640728418514944004,2015-09-07 03:28:53,"b'Kanggo naon gusti, abdi kedah gumelar ka ieu dunya, lamun bagja lain hancengan pikeun kuring, cenah.'"
640728246338764800,2015-09-07 03:28:12,"b'Karep l\xc3\xa9ngkahna dina pateuh, nyasar lampah asa angger dina salah. Hat\xc3\xa9na asa mindeng jumerit lumengis tumanya dina rasa anu aral.'"
640726959299784704,2015-09-07 03:23:05,"b'Tinimbang ieu diri kedah raj\xc3\xa9t disasaak ku kanalangsa, teu kiat Geulis, akang teu kiat. Ceuk gerentesna.'"
640726795981996033,2015-09-07 03:22:26,"b'Karepna, lamun wasa bisa diwenangkeun ku meunang, asa mending k\xc3\xa9n\xc3\xa9h ditelasan pati, Geulis.'"
640726088922959872,2015-09-07 03:19:38,"b'Batina kingkin ku kapeurih, liwung ngaheruk dina sumegruk. Deudeuh teuing, kas\xc3\xa9p ..'"
640725889236398080,2015-09-07 03:18:50,b'Basa longk\xc3\xa9wang ngadeukeutan leuwang. Cisoca hiji jajaka nyalangkrung dina t\xc3\xa9t\xc3\xa9larna kawaas.'
640716998595379200,2015-09-07 02:43:31,b'Bongan rasa keur rumasa halabhab hanaang butuh ku cai kanyaah.\nSugan cinta teu nogencang masih kuat ajeg teu ambon sorangan. #Galura'
640716723021213696,2015-09-07 02:42:25,"b'Poe ieu, dina jempling\nkuring nganteurkeun tanggeuyan kadeudeuh.\nNgetrok panto kinasihan rumampes di gapura lawang harepan. #Galura'"
640716437913387008,2015-09-07 02:41:17,b'kaci keun bah lah @DulurBDG'
636329779898138624,2015-08-26 00:10:16,"b'Gera teuneung gera ludeung, gera nyoara cing pert\xc3\xa9ntang. Anjeun mah lain bagejid, jalu. | Sunda Tandang - Kang Yayat Hendayana'"
636329409343942656,2015-08-26 00:08:48,"b'Ayeuna mangsana tandang, nu cicing wayahna nyisi.'"
636329281023438848,2015-08-26 00:08:17,"b'Gera tabeuh goong man\xc3\xa9h, jalu. Geus meujeuhna nepak dada, baheula dicar\xc3\xa9k sot\xc3\xa9h keur jaman silih \xc3\xa9l\xc3\xa9dan.'"
636328909567475712,2015-08-26 00:06:49,"b'H\xc3\xa9s\xc3\xa9 incah h\xc3\xa9s\xc3\xa9 l\xc3\xa9ngkah, dicangreud ku sarua ulah. Akon akon adiluhung.'"
636328597154762752,2015-08-26 00:05:34,"b'Tong katalikung ku tukang, mangsa dicangcang ku tambang. Beunang ngarara sorangan, beunang mapa\xc3\xa9s nu h\xc3\xa9ngker.'"
636328257223176192,2015-08-26 00:04:13,"b'Lain mangsana, urang ngadedempes h\xc3\xa9\xc3\xa9s. Lain wayah urang l\xc3\xa9ah. Balap mandeurikeun man\xc3\xa9h, majar t\xc3\xa9h da lain \xc3\xa9l\xc3\xa9h.'"
636327941194956800,2015-08-26 00:02:58,"b'Gera tabeuh goong man\xc3\xa9h, jalu. Ngadu handaru jeung sora goong anu lian. Malar batur nyarahoeun, gening anjeun t\xc3\xa9h teu pireu.'"
634748506259988480,2015-08-21 15:26:51,"b'Tapi, \xc3\xa9tamah ukur carita. Da bongan urang kungsi nyungsi pasini. Ari rasa mah tetep panceg henteu bisa dirob\xc3\xa9da.'"
634748181373452289,2015-08-21 15:25:34,b'Carita anu lawas nungtut laas dina lambaran-lambaran bol\xc3\xa9as. Ngol\xc3\xa9ab kapangp\xc3\xa9ngkeun sungapan mangsa.'
628766944791937024,2015-08-05 03:18:16,"b'Ulah talangk\xc3\xa9 komo deui harar\xc3\xa9s\xc3\xa9, \xc3\xa9l\xc3\xa9k\xc3\xa9s\xc3\xa9k\xc3\xa9ng \xc3\xa9l\xc3\xa9h ku nyeri cangk\xc3\xa9ng. Gera cagap pakasabanana, rancag\xc3\xa9 soson soson kana gaw\xc3\xa9. #Galura'"
628766364426108929,2015-08-05 03:15:57,"b'Sangkan ngancik jadi getih, lain ukur ngalajur loba pamrih. Singkil bukti mucekil, gandang waktuna tandang. #Galura'"
628766072854843397,2015-08-05 03:14:48,"b'Mun loba l\xc3\xa9l\xc3\xa9tah kudu da\xc3\xa9k bari milampah, sangkan nerap jadi peurah ulah ngan saukur jadi geutah. #Galura'"
626772050489683968,2015-07-30 15:11:16,"b'Tanjakan atawa pudunan, mangrupa seni dina lalampahan. R\xc3\xa9nghap ranjugna nafas ku kasudaan, mugi jadi barokah dina kahirupan.'"
626771488410988544,2015-07-30 15:09:02,"b""Dina lampah aya tar\xc3\xa9kah, dina do'a aya usaha. Saha makhluk nu hirup di alam dunya, ulah loba ngarasula."""
626365816448024576,2015-07-29 12:17:02,b'RT @CimahiCity: Abadikan moment terbaik anda di @RhanakaPhoto ~Photography -Videography ~ Dokumentasi\n\xe2\x98\x8e 081221888324 - PIN 57FC378B http://\xe2\x80\xa6'
626059906110525440,2015-07-28 16:01:27,"b'Jauh dina panyawangan, ngalanglangan alam pangimpian. Neuleuman alam nu can kasorang, kingkilaban ku jalan nu ka tukang. #Galura'"
626059482691301376,2015-07-28 15:59:46,"b'Eh kang, mangga kalebet.. Hehehe ""@eman_kuya: @galura_rasa @akireiy duaan wa\xc3\xa9 ngawangkong t\xc3\xa9h nya!!hee""'"
626048057696632836,2015-07-28 15:14:23,"b'Rasa tagiwur, padahal hirup loba k\xc3\xa9n\xc3\xa9h batur. Tetep ngarasa tugenah, sanajan hirup t\xc3\xa9h cenah tumaninah. #Galura'"
626047733208461313,2015-07-28 15:13:05,"b'Diri ngarasa cuang cieung, sok sanajan lain di leuweung. Salempang, sanajan kuring teu midang. #Galura'"
625879156702576640,2015-07-28 04:03:13,"b'RT @akireiy: Heh PEUTING jang, lain pauting ""@galura_rasa: Lamun wanci datang pauting, ulah elat kudu nyaring. Sok sanajan awak keur gering\xe2\x80\xa6'"
625879127057264640,2015-07-28 04:03:06,"b'Muhun kakang punten lepat ngetik. Hehe ""@akireiy: Heh PEUTING jang, lain pauting ""@galura_rasa: Lamun wanci datang pauting, ulah elat kudu'"
625877938794164224,2015-07-28 03:58:23,"b'Sabab manusa loba rencana, kahayang g\xc3\xa9 sagala aya. Tangtu kudu deukeut kanu Kawasa, sangkan barokah ku pakaya. #Galura'"
625877499969310724,2015-07-28 03:56:38,"b'Lamun wanci datang pauting, ulah elat kudu nyaring. Sok sanajan awak keur gering, munajat mah kudu beurang jeung peuting. #Galura'"
625876826863177728,2015-07-28 03:53:58,"b""Hempak merbayaksa di alam dunya, makaya keur bekel jaga. Dibarengan ku usaha anu nyata, kad\xc3\xa9 tong poho ngadu'a kanu Kawasa. #Galura"""
625876342102364160,2015-07-28 03:52:02,"b'Lamun datang mangsa beurang, loba jalma nu kumelendang. Keur nyukupan sagala kahayang, nu kabayang jeung nu can kasorang. #Galura'"
625694635596222465,2015-07-27 15:50:00,"b'Najan kahayang saged\xc3\xa9 gunung, sok hayang nanjeur jeung nanjung. Loba harepan nu ngaberung. Cing sadar, papast\xc3\xa9n mah aya di nu Maha Agung'"
625694207840116736,2015-07-27 15:48:18,"b'Kahayang lega ngalapang, teu wel\xc3\xa9h nyawang ti nu anggang. Susuganan aya nu datang, m\xc3\xa9r\xc3\xa9 kabarokahan pikeun urang.'"
625692283912847360,2015-07-27 15:40:39,"b'Teu sakab\xc3\xa9h harepan bakal jadi kanyataan, jeung teu sakab\xc3\xa9h kanyataan nu datang saluyu jeung pangharepan.'"
624987456912293888,2015-07-25 16:59:56,"b'Sakab\xc3\xa9h rasa moal bisa katampa ku raga. Rasa asih nu kapatri, moal bisa langsung ditampi. Kuring teu bisa, sabab ayeuna geus b\xc3\xa9da #Galura'"
624986598019481600,2015-07-25 16:56:31,"b'Harita salira wakca balaka, cumarita nepikeun anu di seja. Ngabudalkeun eusi dina jero dada, rasa nyaah jeung katresna. #Galura'"
624985711062593536,2015-07-25 16:52:59,"b'Lain teu surti, lain teu ngarti. Rindat anjeun, sorot soca anjeun \xc3\xa9stuning aya nu diteundeun. #Galura'"
624985244525989888,2015-07-25 16:51:08,"b'Mungguhing jalma, dipaparin rasa katresna. Nu nyangkaruk dina jero dada, ngagalura, ngawirahma. #Galura'"
624114913376473088,2015-07-23 07:12:45,"b'Duh mang ridwan. Nuju dipalih mana mang ? ""@RidwanNK: Beuteungaingmangaing :( http://t.co/ihdLqFngMI""'"
624114797101998080,2015-07-23 07:12:17,"b'Cumarita loba di r\xc3\xa9ka, sangkan loba jalma nu percaya. Teu mikir lamun sulaya, jalma r\xc3\xa9a moal miros\xc3\xa9a.'"
624113311819272193,2015-07-23 07:06:23,"b'Biwir teu diwengku l\xc3\xa9tah teu tulangan. Bisa sakahayang bari ucang-ucangan. Terus noyod pinuh ku kabungahan, teu inget batur keur kokos\xc3\xa9han.'"
624112933400805376,2015-07-23 07:04:53,"b'Po\xc3\xa9 ayeuna bisa suka, can tangtu isukmah naon nu bakal tumiba. Kiwari urang bisa seuri, boa isuk pinanggih jeung kanyeri.'"
624112584015282176,2015-07-23 07:03:30,"b'Sok loba anu poho, tapi diri anteng terus manco. Teu inget aya nu ngadodoho, tibatan \xc3\xa9ling kalahka mindo.'"
624112249863434240,2015-07-23 07:02:10,"b'Bukti nyata di hiji jalma y\xc3\xa9n ucap jeung lampah sok loba pasalia. Teu ka ukur ku namina yuswa, budak kolot ukur ngajadi cangkangna.'"
623904053395718144,2015-07-22 17:14:52,"b'Bongan anjeun t\xc3\xa9ga ngulinkeun rasa kacinta. Asih nu mimiti, pukah teu puguh salah, pegat beurat duriat, anjeun mah jongjon mih\xc3\xa9man. #Pukah'"
623903950249443329,2015-07-22 17:14:27,"b'Anjeun datang deui sanggeus meunang kanyeri, tapi hat\xc3\xa9 teu narima, kanyeri asa can bari. #Pukah'"
623903703775350784,2015-07-22 17:13:29,"b'Batin ceurik duh nyeri kaliwat saking, peurih, asa diturih ku hinis, asa ditiruk jajantung, ngalanglayung. #Pukah'"
623903306964844544,2015-07-22 17:11:54,"b'Diri kuring ibarat cukang wahangan, dipak\xc3\xa9 meuntas pikeun nyorang paniatan. #Pukah'"
623903135174496256,2015-07-22 17:11:13,"b'Gening, asih t\xc3\xa9h lain nu kuring, katresna gancang luncatna, milih nu lian. #Pukah'"
623902821612564480,2015-07-22 17:09:58,"b'Satadina sugan t\xc3\xa9h moal r\xc3\xa9k cidra. Boro betah mikanyaah, mikacinta. Kaman\xc3\xa9hna kuring geus asa miboga. #Pukah'"
623895404430516224,2015-07-22 16:40:30,"b'Bieu, basa diri anteb mentangkeun lamunan. Imut anjeun asa n\xc3\xa9mbongan, ngalangkang m\xc3\xa9r\xc3\xa9 harepan, najan ukur sakedapan. #Galura'"
623894809015554048,2015-07-22 16:38:08,"b'Haleuang sora gaang, hariring dalingding peuting. Ngajadi panganteur lelembutan, pikeun nganjang ka alam imp\xc3\xa9nan. #Galura'"
623889801993781248,2015-07-22 16:18:14,b'RT @Info_Mommy: @UwaUken @MC_Ocon @AkiSEBLING @DulurBDG @BarayaSunda_ @galura_rasa wilujeng siang pasukan hudAng beurang \xf0\x9f\x98\x80'
623700107469271041,2015-07-22 03:44:28,"b'Nit\xc3\xa9nan nataan teuteup nu meumeut, teuteup pinuh ku kanyaah nu ny\xc3\xa9boran taman kah\xc3\xa9man. Iraha atuh urang tepang ? Tepung patar\xc3\xa9ma panangan'"
623699689204912128,2015-07-22 03:42:48,"b'Aya kasono anu maneuh, nu ngalir teu da\xc3\xa9k reureuh. Lir p\xc3\xa9p\xc3\xa9ling nu ngageuing kanu rasa nu keur dilimpudan ku sifat melang. #Galura'"
623694812110196736,2015-07-22 03:23:25,b'Anu tipalih mana ieu @UwaUken teh ? Salam pangbaktos ti ujang di ciwidey .'
623694098889703424,2015-07-22 03:20:35,"b'Atos kasep ""@UwaUken: @galura_rasa mang rada dipolsek heula ah eh salah dipolbek maksudna th :((""'"
623693536903335936,2015-07-22 03:18:21,"b'Wilujeng enjing uwa ""@MC_Ocon: Wilujeng enjing @AkiSEBLING @Info_Mommy @UwaUken @DulurBDG @BarayaSunda_ @galura_rasa'"
622327172489854976,2015-07-18 08:48:54,b'Pileuleuyan Syahrul Romdhon ti Kang H. Sambas ...'
622327077908316160,2015-07-18 08:48:32,"b'Pileuleuyan syahrul romdon, pileuleuyan syahrul syiam, pileuleuyan syahrul gufron. Taun hareup muga ditepungkeun deui.'"
622326510418989056,2015-07-18 08:46:17,"b'Asa cik\xc3\xa9n\xc3\xa9h anjeun n\xc3\xa9mbongan, asa can lila reureujeungan babarengan, kiwari anjeun geus mangkat mulang.'"
622326060118507524,2015-07-18 08:44:29,"b'Malem salikur nepi ka malem takbiran, anjeun nyingraykeun l\xc3\xa9ntabna seuneu naraka anu ngabebela, pikeun manusa anu pasrah sumerah kanu Kawasa'"
622325778592612352,2015-07-18 08:43:22,"b'Peuting ka sawelas nepi peuting kaduapuluh, anjeun ngucurkeun cai hujan pangampura pikeun jalma anu hanaang ku ampunan.'"
622325471464689664,2015-07-18 08:42:09,"b'Peuting kahiji nepi ka peuting kasapuluh, anjeun ngocorkeun pancuran rahmat pikeun jalma anu halabhab nu ibadah.'"
622325128408383488,2015-07-18 08:40:47,"b'Anjeun anu pinuh ku g\xc3\xa9mbolan magfiroh, anjeun anu pinuh ku aisan pangampura keur manusa anu taat.'"
622324912573657089,2015-07-18 08:39:56,"b'Anjeun jadi sabab ngantengna tali silaturahim. Antara mahluk jeung khalikna, antara mahluk jeung ciptaan-Na .'"
622324697615593472,2015-07-18 08:39:04,"b'Hayang paamprok jonghok paduduaan, nyacapkeun kasuka jeung kabungah hat\xc3\xa9.'"
622324372099837952,2015-07-18 08:37:47,"b'Asa cik\xc3\xa9n\xc3\xa9h anjeun datang, jungjunan. Asa cik\xc3\xa9n\xc3\xa9h anjeun dibag\xc3\xa9akeun, panutan. Nahonan kahayang ti bar\xc3\xa9to, nedunan kahayang ti baheula.'"
622323901347934208,2015-07-18 08:35:54,"b'Sami sami kang ""@eman_kuya: @galura_rasa nyuhunkeun dihapunten sagala kalepatan simkuring kang!!""'"
621806686332825600,2015-07-16 22:20:41,b'Wilujeng boboran shiam 1 Syawal 1436 Hijriah. Taqqobalallahu minna wa minkum Shiyamana wa shiyamakum'
621806207259406336,2015-07-16 22:18:47,"b'Sa\xc3\xa9stuna, ukur weninggalih nu dipamrih, jembar panalar nu diteda, kana laku nu teu luyu, kana lampah nu sulaya.'"
621805881076813824,2015-07-16 22:17:29,"b'Ku \xc3\xa9ndah ieu rasa sumirat rahmat Mantenna. Urang rampak hayu, minal aidin walfaidzin. Urang ukir hayu, sampalan \xc3\xa9ndah na beungeut batin.'"
621805469351325700,2015-07-16 22:15:51,"b'Urang palidkeun kapeurih ka laut asih. Meungpeung po\xc3\xa9 ieu ngagulidag cai caah cihampura, sanggeus girimis bulan kamari nyerep na aci bumi.'"
