id,created_at,text
486247251862233088,2014-07-07 20:35:53,b'Imsyaaaaak imsyaaaaak imsyaaaak. :('
486079244359847936,2014-07-07 09:28:17,b'Keur dp bbm tah dak :) pek bae ketang dek dipake nyingsieunan beurit ge bebas! Haratis :( http://t.co/RNlrAnWviE'
486077023941455872,2014-07-07 09:19:28,b'RT @Faisalz27: tah anjir si ieu @KALUMAAAN jng si @bangsat_hate bancah :( @satengahELING: #mention ka babaturan maneh batur mah puasa maneh\xe2\x80\xa6'
486076787735007233,2014-07-07 09:18:31,"b'#Arielslalusalah :( ""@selowingkeun: Si @satengahELING""@rizkynataatmaja: si @satengahELING :( RT @satengahELING: #mention ka babaturan mane'"
486076323362660352,2014-07-07 09:16:41,b'RT @rizkynataatmaja: si @satengahELING :( RT @satengahELING: #mention ka babaturan maneh batur mah puasa maneh na mah (cont) http://t.co/tK\xe2\x80\xa6'
486075791763984386,2014-07-07 09:14:34,b'RT @Intansrinovian: Tah ieu mang --&gt; @aderyulianti RT @satengahELING: #mention ka babaturan maneh batur mah puasa maneh na mah (cont) http:\xe2\x80\xa6'
486075731600891904,2014-07-07 09:14:19,b'RT @GifarArdiansyah: @kkhindra @satengahELING: #mention ka babaturan maneh batur mah puasa maneh na mah kalakah ucing sumput diwarteg! :( #\xe2\x80\xa6'
486074155503079424,2014-07-07 09:08:04,b'#mention ka babaturan maneh batur mah puasa maneh na mah kalakah ucing sumput diwarteg! :( #aisia #mentionteueling'
486072216883187712,2014-07-07 09:00:21,"b'Eta mah biwir deukeut teuing ka irung :( ""@FauziUjoo: Didieu mah ngahiliwir bau sungut satengahELING: Jam segini th jam-jam nya ngahiliwir s'"
486071919410565120,2014-07-07 08:59:11,"b'Duh seungit parfum ghana kieu :( ""@Faisalz27: untung lain bau sungut mneh :( RT satengahELING: Jam segini th jam-jam nya ngahiliwir seungit'"
486070435168022528,2014-07-07 08:53:17,"b'Ijin mencintaimu weh :* ""@Rina_khoerunisa: izin cicipi gituh! :(((RT @satengahELING: Jam segini th jam-jam nya ngahiliwir seungit masakan ta'"
486067717594550272,2014-07-07 08:42:29,"b'Jam segini th jam-jam nya ngahiliwir seungit masakan tatangga faak, faaku asbes! :('"
486061723342749696,2014-07-07 08:18:40,b'*wilujeung netepan ashar kanggo wilayah bandung jeung sakurilingna*'
486061079240273921,2014-07-07 08:16:06,b'Polow \xc2\xbb @FRONTALdeblo_ akun frontal tapi rada deblo SAEUTIK :( #Recommended'
486060530184888320,2014-07-07 08:13:55,b'RT @FRONTALdeblo_: Mun maneh satia aing ge bakal satia! Mun maneh luar-leor mangga we moal nurutan beda sih ai jelema murahan mah!! #Frontd\xe2\x80\xa6'
486060336768757760,2014-07-07 08:13:09,"b'RT @FRONTALdeblo_: ""Cinta mah aing jeung sia. Lain sia jeung si itu!!"" #tinufilm'"
486060203482578944,2014-07-07 08:12:37,"b'RT @FRONTALdeblo_: Kadang masa lalu teh bisa jadi ujian kana hubungan nu ayeuna ekeur di lakonan. Emang sih dadas, tp kudu sabar meh teu ka\xe2\x80\xa6'"
486060143432323072,2014-07-07 08:12:23,b'RT @FRONTALdeblo_: Mun bener nyaah mah moal ngarespons nu sejen mereun. Gede omong hungkul. PALSU #Frontdeb'
485737238181859328,2014-07-06 10:49:16,b'*Wilujeung berbuka puasa keur umat muslim nu ngajalanan ibadah puasa*'
485735934772531200,2014-07-06 10:44:06,"b'Jaitan heula popoean sateh :( ""@rajalalaybadot: satengahELING Kealam kaabadian.... bisa ngelay sapuasna...""'"
485733960186478592,2014-07-06 10:36:15,"b'Ah ngomong we rek macul sateh (\xcb\x98\xcc\xaf\xcb\x98 ) ""@bangsat_hate: Ka imah na bapana si tristan GGS dek bukber ,auuuuuuuuu :((satengahELING: Ngabuburit na'"
485732980090867712,2014-07-06 10:32:21,"b'Naek beca? Balap lumpat? :( ""@Faisalz27: ka arab nganter ma ijah naek haji? :( satengaheling""'"
485731562210611200,2014-07-06 10:26:43,"b'Kalakah curhat samah samid :( ""@Maalik_06: Ka hati si dia yg tak mau mnerimaku :( #Eaa ""@satengaheling Ngabuburit na kamana dak? #tunyatanya'"
485731355150405632,2014-07-06 10:25:54,"b'Miluu akod :( ""@amoii09: Di sekre @Viking_Pagarsih bareng @LadsVRPagarsih LING :D RT satengahELING: Ngabuburit na kamana dak? #tunyatanya""'"
485731126489526272,2014-07-06 10:24:59,"b'Nigeuleuh, rek hees we kituh sateh :( ""@irawan_eriyana: satengaheling k pulau kasur w""'"
485730547079983105,2014-07-06 10:22:41,"b'Hih jalu deui wae nu nyekilan th :( ""@FauziUjoo: Kehatimu ajalah biasa ;;)""satengahELING: Ngabuburit na kamana dak? #tunyatanya""""'"
485729818751664128,2014-07-06 10:19:47,"b'Ya sallaam disekill jalu :( ""@kholic_ghotic:satengaheling ka hati muuuuuuuuu""'"
485729341553123329,2014-07-06 10:17:54,"b'Kamu lg ngendekan angkot? :( ""@ghina_zv: Kalapa""satengahLIG: Ngabuburit na kamana dak? #tunyatanya""""'"
485728989080612865,2014-07-06 10:16:30,"b'Mending nonton adu bagong aja yu :( ""@bait_rassa: Kasusukan mang.. Ek ningali adu bereunyit.. ""satengah Ngabuburit na kamana da#tunyatanya""""'"
485728497751433216,2014-07-06 10:14:32,"b'aaaaa aku disekill :* ""@FadiyahMaghfira: kamana we asal sama kamu hahaha satengahELING Ngabuburit na kamana dak? #tunyatanya""'"
485726944906846208,2014-07-06 10:08:22,b'Ngabuburit na kamana dak? #tunyatanya'
485677276718067712,2014-07-06 06:51:00,b':| http://t.co/5ekDI9IBkF'
485652329312428032,2014-07-06 05:11:52,b'Wilujeung buka puasa kanggo murangkalih nu buka puasa stengah hari :) http://t.co/OzkvZwFtau'
484792130397675522,2014-07-03 20:13:45,b'Sahur lah dengan seadanya ada gehu huapkeun ada rendang huapkeun ada tai ucing kop jang maneh weh mere :|'
484444352056274944,2014-07-02 21:11:48,"b'Kita?? Maneh weh jeung sendal pegat! :( ""@bangsat_hate: @satengahELING siapa kita ?""'"
484441210228973569,2014-07-02 20:59:19,"b'Aisia! *bata :( ""@infocapruk: Aaaaaaaaaaaaa sendok nya ketelen :((((((((""'"
484440008711868418,2014-07-02 20:54:33,b'Keur DP tah dak sedoot haratis!! :)) http://t.co/SUsz18rvWZ'
484438728887128064,2014-07-02 20:49:28,b'Saur heula neng  @nabilahJKT48 :* bisi diadukeun jeung suarez ku aing! Silih gorogot kaditu pusing!! :(('
484428785748434945,2014-07-02 20:09:57,b'Selamat sahur :) makan sahur lah secukupnya cukup lah dua keduk pacul. :|'
484016227610673152,2014-07-01 16:50:35,b'Argentina maena goreng lah siga gehu! HIDUP GHANAA!! :(('
483998331606016000,2014-07-01 15:39:29,b'Oh hari ini POLRI th ulang taun? ai polisi tidur iraha ulang taun na?  :('
483886287946907649,2014-07-01 08:14:15,b'Bulan puasa mah jelema ngadadak sarakti bisa ngaleungit suku na hungkul we nu ktinggali th :|'
483606588268113920,2014-06-30 13:42:50,b'Keur dp tah dak sedoot! Haratis! :p http://t.co/rGymJ1Zhyz'
483604082511212546,2014-06-30 13:32:52,b'Inget keur leutik balik tarawehan nyeuneut petasan digang ngabeuleudag pas ibu-ibu ngaliwat nepi ka pingsan na untung teu isdet :('
483558466309455872,2014-06-30 10:31:37,b'Gogoleran bisa ngababatalkeun puasa eta oge mun gogoleran na di kamar pamajikan batur *eh :|'
483554648607830017,2014-06-30 10:16:26,b'Tah :(( http://t.co/5VGz1hbL79'
483553282376232960,2014-06-30 10:11:01,b'Keur dp tah dak :)) http://t.co/Ucx9fyhiz6'
482500979619672064,2014-06-27 12:29:32,"b'Mata mah bisa ninggali rupa tapi mata mah moal bisa ninggali  hate, wilujeung wengi daks :)'"
481830353368141824,2014-06-25 16:04:42,b'*mention yang anda tuju sedang nundutan mohon dicoba isuk deui aisia yah* #opralor'
481820727608221696,2014-06-25 15:26:27,b'Sinyal aing luplep kieu curiga opratorna nundutan ieu mah ajig lah :( #teuingatuh'
481818336871723008,2014-06-25 15:16:57,b'Ari ayeuna piala dunia tim mana lawan mana dak? Cenah gang haji bardan lawan cidahu :O'
481811898518609920,2014-06-25 14:51:22,b'Asa hayang ditato dina bujur gambar keran cai :( jadi mun ombeh tinggal ciwit bujur sorangan :('
480391180186689536,2014-06-21 16:45:57,b'Kasian hakim garis :( lari-lari disisi tapi teu dibere umpan terobosan :( #pialabusiat2014'
480318098172416000,2014-06-21 11:55:33,b'Jug we maralem mingguan aing mah dek ninyuh lagu bari ngadengekeun indomi :( #nawn'
480252915198607361,2014-06-21 07:36:32,"b'""SEPIIIIII.!"" ~ yaiya atuh ya da kalo mau rame mah baledok kaca imah tatangga :( #nawn'"
480017093593530368,2014-06-20 15:59:28,"b'Mun aing jadi presiden, jomblo dibere kabogoh hiji ewang, ngan nu kabogohna lewih ti hiji abuskeun ka kandang domba, atas tuduhan koropsi :|'"
480016408420446208,2014-06-20 15:56:44,"b'@kholic_ghotic naha pedah naon? -,-'"
480009759156736000,2014-06-20 15:30:19,b'Sabageur-bageurna presiden nu kapilih engke pasti ngadat  mun keur ngaliwat diledot sukuna! Catet!'
479913882228510720,2014-06-20 09:09:20,"b'Menunggu itu menyebalkan, apalagi yang ditunggunya ga datang rasanya ingin ngawut-ngawut popoean :( #curhatanLDR #lainaing #tuhbatur'"
479893159527190528,2014-06-20 07:46:59,b'Keur tunduh kieu th sok ngadadak hayang hitut na irung barack obama anying th lah :('
478527167903449089,2014-06-16 13:19:02,"b""RT @FRONTALdeblo_: sia wani nganyerihatekeun aing? Dagoan siah si 'karma' keur OTW ka hirup maneh :( #Frontdeb"""
478523906307788800,2014-06-16 13:06:04,"b'Semut yang baik, tidak sombong, suka maling popoean, dan rajin menabung kunaon sih ngojay na kopi aing wae? :( disantolo jug :( #nawn'"
478517362660880385,2014-06-16 12:40:04,b'Ngopi heula dak ah ( \xcb\x98\xd0\xb7\xcb\x98)y\xe2\x94\x81\xef\xbd\xa5~~~ http://t.co/gpIuDcHCYi'
478210498475745280,2014-06-15 16:20:42,b'*mention yang anda tuju sedang hees mohon dicoba isuk deui aisia yah* #oprator'
478206181840658432,2014-06-15 16:03:33,"b'Bbm lemot, twitter lemot sigana mah oprator na kasarean ieu mah ajig lah apal aing ge :( #teuingatuh'"
478204194076098560,2014-06-15 15:55:39,"b'RT @FRONTALdeblo_: Hidup itu emang keras bro, jalani aja :) hayang nu hipu mah gorogot tuh pingping aurel hermansyah! Hehe aisia :(( #Front\xe2\x80\xa6'"
478204085271678976,2014-06-15 15:55:13,"b'(\xc2\xac_ \xc2\xac!!)\xc2\xa0""@FRONTALdeblo_: Putus cinta teh teu kudu jadi musuh oge meureun lur :) unggal panggih ngabalieur siga nu nyeri beuheung! :))'"
478194988551901184,2014-06-15 15:19:04,b'Kalem Mblo jodo mah moal katukeur da nu sok katukeur mah sendal nu di mesjid :| #twit #episodeyglalu'
477804822712680450,2014-06-14 13:28:41,b'malem minggu kieu th sok ngadadak hayang popotoan jeung bio paulin anying teh lah :('
477757240317706241,2014-06-14 10:19:37,"b'Tah dak :p \xe2\x98\x9e  ""@Rina_khoerunisa: aslina duh :((RT @satengahELING: Percaya lah mblo semuanya akan bobogohan pada WAKTUnya calm sabar weh nga'"
477753959214358528,2014-06-14 10:06:34,"b'gera siap-siap mblo malem minggu lain keur nu bobogohan hungkul, ulinkeun! Naon cicing di imah wae sendal peugat?? enya :('"
477750858331877376,2014-06-14 09:54:15,"b'Bagja na hubungan mah lain sakumaha kandel na duit :)  kumaha maneh na we, bagja ku materi atawa bagja ku kanyamanan :|'"
475171906929168385,2014-06-07 07:06:25,b'Wajah anda kusam? berminyak? Sering tumbuh jerawat? Makanya kalo udah makan gehu ulah diusapkeun kanu beungeut aisia :( #iklangagal'
475143517417648129,2014-06-07 05:13:36,"b'Wilujeung netepan lohor dak :)  omat mun rek shalat tapi na lapar, mending dahar heula bisi keur shalat inget asin can didahar aduh  :('"
475135559652753408,2014-06-07 04:41:59,b'@KanyaahAing @AwasHarkos @Bodorkeun @bacotaingnya @caprukBDG @Cileupeungsiah @_ceukaingoge @DUDULURAN_ @cungurbarokah @OyagTeam #RFF'
474821280449843200,2014-06-06 07:53:09,b'Iya gitu soptek anti kerut dan anti bochoor? Cik ah ke mah aing nyobain nambal kenteng make soptek :|'
474486511509831680,2014-06-05 09:42:54,b'Percaya lah mblo semuanya akan bobogohan pada WAKTUnya calm sabar weh ngan teuing iraha :('
474485161388539904,2014-06-05 09:37:32,b'Kenapa lagi tunduh gini th ngedadak hayang panco jeung amin rais? Entahlah :(('
471857486631157760,2014-05-29 03:36:06,b'Moal ngetwit deui #nowplay ah tara disada aingah :('
471853372467732480,2014-05-29 03:19:45,b'Selamat pagi :) hari yang cerah untuk popoean :|'
471123205667581952,2014-05-27 02:58:19,"b""RT @salmagustiani: Wilujeung isra mi'raj 1435 H oge EL ;) RT @satengahELING: Wilujeung enjing :) NARKOBA heula dak NAsi goReng KOpi BAla-ba\xe2\x80\xa6"""
471115104574906368,2014-05-27 02:26:08,b'Wilujeung enjing :) NARKOBA heula dak NAsi goReng KOpi BAla-bala ;)'
469453464636891136,2014-05-22 12:23:22,"b'Hirup mah ngalengkah na ka hareup lain ka tukang,jeung tong ninggali wae nu ditukang bisi nyeri beuheung:(  #nawncenah'"
464242022690222080,2014-05-08 03:14:58,"b'Wilujeung enjing ka beurang dak, wilujeung #PersibDay KEEP CALM MAUNG WANIEUN!! :)'"
464041227478769664,2014-05-07 13:57:04,b'Ngelupain mantan itu ga berat ko :) kecuali mun mantan na ku sia dipanggul :( #historytwit'
464035846790733826,2014-05-07 13:35:41,b'Asa hayang twiteran :|'
456086994725404672,2014-04-15 15:09:47,"b'jorang RT @FRONTALdeblo_: CINTA MAH KETULUSAN, LAIN KARNA KEMULUSAN! *eh aku jorang gak yah :( #FronDeb'"
456085723490557952,2014-04-15 15:04:44,"b'Lalaki mah tong minder, najan teu boga nanaon asal boga niat tulus, tapi mun awewena teu daekeun?? Neangan deui awewe nu tulus ka maneh :)'"
456081747365863424,2014-04-15 14:48:56,"b'@bren_steven18 hayang boga kabogoh mah kudu neangan ath, lalaki nu mulai, lain awewe , lalaki nu nyatakeun awewe nu ngarespon :)'"
456069375569952768,2014-04-15 13:59:47,"b'@Ramdan_badunk maneh nyaah ka siitu, siitu teu nyaah ka maneh? ulah maksakeun, dina ditarima na ge maneh bakal dimanfaatkeun! :)'"
456068267409678336,2014-04-15 13:55:22,"b'Jika kamu gak tau sekuat apa cintaku, coba kau gorogot tihang listrik! :( #puisi'"
455370333273735168,2014-04-13 15:42:02,"b'yat lalajo dimana? oh nu jd hakim garis :( RT @Bodorkeun: KEUN WAE AINGMAH TEU BOGA KABOGOH OGE, NUPENTING PERSIBKU MENANG LAGI!!!!'"
455365820739489792,2014-04-13 15:24:06,b'Tadi nu ka stadion lalajo persib aya nu ditimur teu dak? :| #tunyatanya'
455362694460084224,2014-04-13 15:11:41,"b'Nu keur UN gera ngapalkeun meh UN na lancar :) emang ngapalkeun mah hoream, tapi yg lebih hoream mah ngelupain dia :( #nawnatuh'"
454272935491284992,2014-04-10 15:01:22,"b'Mun kabogoh maneh ngomong ""aku gak bisa hidup tanpa kamu"" cobaan pura\xc2\xb2 ngomong putus, modhyar teu? Lamun henteu berarti nya ngawadul :-O :D'"
453884873573285888,2014-04-09 13:19:21,"b'#DoaLDR Ya tuhan semoga dia slalu dalam lindunganmu, dan jangan biarkan dia berpaling dariku, kalo dia leor kutuk aja dia jadi oray kadut :('"
453054482788528129,2014-04-07 06:19:40,"b'Lamun kabogoh teu bisa narimakeun kaayaan maneh atau lamun kabogoh maneh loba ngatur\xc2\xb2 simpel kieukeun weh, ""IEU AING! "" :)'"
453027703633887232,2014-04-07 04:33:16,"b'Orang baik itu hitut aja dibagi-bagi sama orang disekitarnya, termasuk hitut bari pura-pura nundutan dijero angkot keur pinuh :( #nawn'"
453025863672811520,2014-04-07 04:25:57,"b'disakola teh sok aya rajia buuk tara dak? aing mah pernah aya rajia kitu teh nyumput na kolong bangku awewe, tp teu noong da :('"
453021878819758081,2014-04-07 04:10:07,b'haha okey (\xe2\x97\xa6^\xe2\x8c\xa3^\xe2\x97\xa6)/(\xe2\x97\xa6^\xe2\x8c\xa3^\xe2\x97\xa6) RT @Ilhamstreetwear: @satengahELING http://t.co/b3ONaC9v03'
453021439248306176,2014-04-07 04:08:22,b'nu sakola keneh cing bener nuntut elmu teh tong sampai STAB Sakola Tamat Angger Belegug :('
449189750583218176,2014-03-27 14:22:36,"b'Awewe mah kabeh ge geulis, ngan prilaku na nu bisa ngajieun awewe leuwih geulis, lalaki ge sarua prilaku nu ngajieun leuwih kasep! :)'"
449183136086118400,2014-03-27 13:56:19,b'Hidup kamu bakal serasa pabeulit ketika kamu loba teuing nguruskeun hirup jelema nu teu peduli ka maneh! :|'
449177084863062017,2014-03-27 13:32:17,b'Aya nu dek #TTS  #TunyaTanyaSikeling teu?  Mun henteu aing rek mandi bola heula :('
449172536064888834,2014-03-27 13:14:12,"b'Cewe\xc2\xb2 lagi ngefans banget sama si AL yah? iyah bener dia mah ganteng, tp kalian ga tau aja kalo sebenernya hitut nya bau cubluk :('"
449169546977374210,2014-03-27 13:02:19,b'@MhammadLutfi_ maksudna regepkeun heula omongan sorangan saacan kadenge ku batur! ngerti ga kamu teh tihang anteneu? :('
449166951588196352,2014-03-27 12:52:01,"b'Lamun maneh ngomong, maneh ge kudu bisa ngadengekeun omongan maneh saacan kadenge ku batur! :) #twitnuenggeus wilujeung wengi :)'"
448119882916188161,2014-03-24 15:31:20,"b'RT @FRONTALdeblo_: Jeung babaturan mah kudu silih tulung, laina silih tikung, aisia surawung! :( #Frontdeb'"
448119166386458624,2014-03-24 15:28:29,"b'Bobogohan mah ngan ukur sementara jadi ulah bebeakan teuing, geus putus nepak tarang siah da sagala beak :p #nawnath :('"
447992404914622464,2014-03-24 07:04:47,"b'Garalau wae atuh lur, kapanggih hitut na jero angkot siateh? entahlah :('"
446669537396535296,2014-03-20 15:28:11,"b'Ulah mikiran mantan weyah kieu mah dak, bisi mantan na keur sare :( nanaonan mikiran nu keur sare? Eweuh gadag aisia :('"
445187508125433857,2014-03-16 13:19:07,b'Naon lah sisirik ka batur irung pesek atau irung mancung oge da sarua jero irung na mah asin :('
444829093607919616,2014-03-15 13:34:55,b'aneh da ninggali nu gering naha berobat ka dokter padahal dokter mah belegug nu nyeri na sirah nu disuntikna bujuy :('
444825745580249089,2014-03-15 13:21:36,b'gpp lah daripada  nelen anteneu susah :( \xe2\x80\x9c@AlanisArini: Lagi nelen bb :p RT @satengahELING: Yang ga malem (cont) http://t.co/PCVygzYbxq'
444822321665044480,2014-03-15 13:08:00,b'Yang ga malem mingguan keur naraon dak? :|  #tunyatanya'
444815745088643073,2014-03-15 12:41:52,b'Lagi bobogohan nih sama..... *maaf sebagian teks hilang aya nu maling*'
442220548102160384,2014-03-08 08:49:29,"b'tanyakaeun kusia! :( \xe2\x80\x9c@FRONTALdeblo_: Awewe mah gampang ngahampura, tapi hese mopohokeun kanyeri.! Teu (cont) http://t.co/VzQKGiaj9u'"
442218678461796352,2014-03-08 08:42:03,b'ah kamu mah udah mandi langsung balap karung :( RT @restususanti1: @satengahELING aku mah make karung goni'
442218022527184896,2014-03-08 08:39:27,b'sabari mandi disimutna nya :| RT @ImanudinRizky: Aing mah make selimut mang :D RT @satengahELING: Tong loba gaya lah sakirana mandi make and'
442216748884832256,2014-03-08 08:34:23,"b'#Cowokeren :( RT @dzulfischaar: Aing mah gaya make terpal ""@satengahELING: Tong loba gaya lah sakirana mandi make anduk keneh mah :| #nawnat'"
442215194303815680,2014-03-08 08:28:12,b'Tong loba gaya lah sakirana mandi make anduk keneh mah :| #nawnatuheuy :('
441951954277642240,2014-03-07 15:02:11,"b'Cewek tuh segala dipendem kecewa dipendem, sakit hati dipendem, nyeri bujur ge dipendem busiat we tungtungna teh :( *eh #teuingketang'"
441941153202458624,2014-03-07 14:19:16,b'Eta si virzha asa jiga si undertaker anjir serem :( #lalajotipi'
441940077946470400,2014-03-07 14:15:00,b'Polow\xe2\x86\x92 @FRONTALdeblo_ akun frontal tapi rada deblo SAEUTIK :('
441939514043289600,2014-03-07 14:12:45,"b'RT @FRONTALdeblo_: Sakirana lalaki mah tong loba ngomongkeun tukangeun bisi disangka jangkrik, sora weh tarik barijeung tara nembongkeun be\xe2\x80\xa6'"
441939402751614976,2014-03-07 14:12:19,"b'RT @FRONTALdeblo_: Mun hayang nu sempurna mah salah lain ka aing, tapi kawarung!! :( #FrontDeb'"
441586811454750721,2014-03-06 14:51:14,"b'ieu sinyal naha luplep wae, ari sinyal aing tunduheun kitu? :( #teuingatuh'"
441580774597226496,2014-03-06 14:27:15,"b'Duh euy hujan, tiris gini euy ada yang mau diduruk biar anget? :-('"
439787215460130816,2014-03-01 15:40:17,"b'Teu boga kabogoh mah lain teupayu, tp soal waktu, mun geus waktuna mah insyaallah ;)'"
439783652465967104,2014-03-01 15:26:08,b'Maenya ayeuna malem minggu kitu? Sabtu mreun :-O'
439030688780525569,2014-02-27 13:34:07,"b'Today stats: 109 followers, 500 unfollower and followed 5 people via http://t.co/poPVJosBaV'"
439024632025206784,2014-02-27 13:10:03,"b'Ayeuna sayang-sayangan dicium, ditangkeup, geus putus unjang-anjing unggal panggih ngabalieur siga nu nyeri beuheung, orang yg aneh :('"
439021070834606080,2014-02-27 12:55:54,"b'Ulah maksakeun batur cenah bogoh ka maneh, dina ditarima na oge bakal dimanfaatkeun, paribasa kanyaah nuturkeun, mun henteu? Nya Peugat :('"
439002327328894977,2014-02-27 11:41:25,"b'Nyari yang mulus itu banyak, tapi yang tulus itu jarang.!  #quotesby ~ somad 32thn atlet olahraga angkat semen :('"
437948032806445057,2014-02-24 13:52:02,"b'Sakirana mantan maneh ngajak balikan tapi gara\xc2\xb2 dinyenyeri ku kabogohna kieu keun we ""itu sih DESI, DErita SIa"" okey? Teu? *degungkeun* :('"
437939079859036161,2014-02-24 13:16:27,b'Jangan pernah malu untuk sebuah kejujuran :) malu mah ngaliwat hareupeun nu dipikabogoh pek teh sendal pegat atuh anying :('
435823028656562177,2014-02-18 17:08:01,b'Limbad: aing keur nyeri huntu gablaag! :( RT @Mahasiswa_Suram: Burung limbad : ieu s limbad mong naon ath da gegerenyeman teu puguh teu kaha'
435821581290328064,2014-02-18 17:02:16,b'RT @Holiholighenji: Jam segini masih ada yang beberebetan pacaran di TL anjir ngeri sigana mah pasangan hansip romantis :('
435809594317611008,2014-02-18 16:14:38,"b'Kebetulan tatangga fans city, ke mun geus maen oyag-oyag ah anteneu na meh tipi na runyem hehe :('"
435808532009476096,2014-02-18 16:10:25,b'Follower aing aya fans barca?? Ah eweuh cenah aing hungkul :('
435580500954996736,2014-02-18 01:04:18,"b'dituang didieu, atanapi diawurkeun? \xe2\x80\x9c@apriwM: Tilu rebueun RT @satengahELING: Wilujeung enjing dak, (cont) http://t.co/T0CLGK6mpO'"
435579125739560960,2014-02-18 00:58:50,"b'Wilujeung enjing dak, NARKOBA dulu ath biar cenghar NAsi goReng KOpi BAla-bala~ :-) :-p'"
435438565279813632,2014-02-17 15:40:18,b'*mention yang anda tuju sedang hees mohon dicoba isuk deui aisia yah* #oprator'
435434026162081793,2014-02-17 15:22:16,"b'Ajig tadi aing asa typo, tytus ponay :('"
435432191707725824,2014-02-17 15:14:59,"b'Ayeu teu dak nu bobogohan na siga sticker damri ""cinta bersemi saat dompet berisi"" ? :('"
435428573759823873,2014-02-17 15:00:36,"b'tempelkeun na tarang, keur hiasan :( \xe2\x80\x9c@kholic_ghotic: @satengaheling korong cepel yeuh ling\xe2\x80\x9d'"
435422144407670785,2014-02-17 14:35:03,b'Yang disms/bbm nya sayang-sayangan tapi pas ketemu kalakah diem-dieman babuk pundukna bisi keur kabeureuyan taraje :('
435419515107549184,2014-02-17 14:24:36,b'ai LDR-an mun kangen sok kumaha dak? dikirimkeun wae via JNE? :| :('
434356511725191169,2014-02-14 16:00:37,b'RT @FRONTALdeblo_: SAGURU SAELMU ULAH SILIH TIKUNG.!! :( #hurufnyaBARADAG #FrontDeb'
434353193250594818,2014-02-14 15:47:25,"b'lalakina mikeun sagalana, awewe na mikeun awakna, ulah sagala dibikeun dak bobogohan mah bisi teu jodo/putus nepak tarang kaduhung :-p'"
434342774469435392,2014-02-14 15:06:01,b'RT @halantikatiara: Harusnya aing teh sadar kalo sia teh manusia. Lain CAT TEMBOK nu bisa ngawarnai hari.hari aing. @satengahELING'
434335528960286720,2014-02-14 14:37:14,"b'Orang sopan itu kalo ada polisi tidur teu dilengkahan, ngan jalanna kasisi bari nyebut ""punten ngiring ngalangkung"" :('"
434333944612270080,2014-02-14 14:30:56,"b'Mugi nu keur keuna ku bencana sing ditabahkeun, da kitu musibah mah moal kaukur ku akal manusa :) #PrayForKelud'"
434333187196477440,2014-02-14 14:27:56,"b'heeh ustad teh benclung :( \xe2\x80\x9c@sanystersans: Ling hariri nyeumekdon tukang sound siah :(( ""@satengahELING: (cont) http://t.co/whX5Nc6k84'"
434331856830349312,2014-02-14 14:22:38,"b'Lalajo timnas U19 ayeuna mah teu pati rame ah, lawana make strategi parkir bus :( caricing we bekna hareupeun kiper :('"
434007677237071872,2014-02-13 16:54:28,b'*mention yang anda tuju sedang tunduh mohon dicoba isuk deui aisia yah* #opralor #opratormolor'
434001703516401664,2014-02-13 16:30:44,"b'apal dak video ustad nu nincek sirah tukang sound system? maenya nya ustad kitu ,ieu nyirikeun yen manusa mah can puguh bener hareupeun.!'"
433997564057116673,2014-02-13 16:14:17,b'tah dak hari valentine versi islam.! :) http://t.co/W9mkN8jEhw'
433993751287963648,2014-02-13 15:59:08,"b'... :| \xe2\x80\x9c@ajjenkagustiian: Nah ieu RT""@satengahELING: Yang tampak terlihat indah belum tentu nya\'ah~ :) #catet #nakelek :(""\xe2\x80\x9d'"
433991439790256129,2014-02-13 15:49:57,b'untung nya twitter eweuh soraan mun aya mah sigana rarecok teu puguh dedengean jaba geus peuting :('
433989601363906560,2014-02-13 15:42:38,"b'untungnya aing jadi lalaki, mun jadi awewe mah geus gede ge angger we sok make popok :('"
433983854072700928,2014-02-13 15:19:48,"b'mending keneh teu boga kabogoh dihari valentine, daripada teu boga indung dihari ibu.! #renungkeun dak.! :)'"
433600950435991553,2014-02-12 13:58:17,"b'Kumargi #PERSIB meunang, #PERSIB nerekel naek ngadegungkeun arema dipuncak klasemen, kade sib make jeket dipuncak tiris.! :)'"
433596392364187649,2014-02-12 13:40:10,b'Djibril :-O'
433588809523945473,2014-02-12 13:10:02,b'firman utina najongna asa kaluhur sigana mah make sapatu hak tinggi :('
433579561972822016,2014-02-12 12:33:17,"b'Kedudukan masih 0-0 sang maung bandung belum bangun,  mungkin  lagi nundutan maung nya  :('"
433574948829794304,2014-02-12 12:14:57,b'karunya hakim garis lulumpatan we di sisi bari jeung tara dibawaan mengbal :('
433574454073896961,2014-02-12 12:12:59,b'mang janur rada keren ayeuna mah make kameja sigana mah balik ti ondangan langsung ngalatih :-O'
433572750746058753,2014-02-12 12:06:13,b'Poho aing persib maen :-O'
432870432291557377,2014-02-10 13:35:28,"b'aya nu LDR-an? LDR mah ngalatih kasabaran, mun teu bisa sabar?? Tong LDR-an bobogohan we jeung tihang popoean hehe mongnawn aisia :('"
432868162237775874,2014-02-10 13:26:26,"b'Bogoh keneh ka mantan mah teu salah, ngan mantan na daekeun teu? Mun teu daekeun mah ulah bisi disangka maneh teu payu deui kanu lain :('"
428157888813473792,2014-01-28 13:29:30,b'Lawan persib ayeuna mah siga ulen hipu :|'
428156751058198529,2014-01-28 13:24:58,b'Beungeut sia pabeulit.!  \xe2\x80\x9c@BolaBanget: Arema ikon sepak bola nasional http://t.co/JQljSBFdn6\xe2\x80\x9d'
428155137723351040,2014-01-28 13:18:34,b'HARIONO WANIEUN JEUNG AWAKNA.!'
428145229565149185,2014-01-28 12:39:11,b'Aing mun ninggali foto ieu sok hayang niup piriwit njirr :( http://t.co/lJ8mLAf96s'
